InvoiceNo,StockCode,Description,Quantity,InvoiceDate,UnitPrice,CustomerID,Country,Date,Total_cost
559055,22228,BUNNY WOODEN PAINTED WITH BIRD ,2,05-07-2011 17:09,0.83,,United Kingdom,2011-05-07,1.66
567507,20711,JUMBO BAG TOYS ,9,20-09-2011 14:46,4.13,,United Kingdom,2011-09-20,37.17
566721,22560,TRADITIONAL MODELLING CLAY,24,14-09-2011 12:50,1.25,12921.0,United Kingdom,2011-09-14,30.0
548612,21456,2 PICTURE BOOK EGGS EASTER CHICKS,3,01-04-2011 11:34,1.25,13137.0,United Kingdom,2011-01-04,3.75
559488,DOT,DOTCOM POSTAGE,1,08-07-2011 13:52,191.67,,United Kingdom,2011-08-07,191.67
559866,47566,PARTY BUNTING,4,13-07-2011 10:43,4.95,15795.0,United Kingdom,2011-07-13,19.8
539245,22652,TRAVEL SEWING KIT,1,16-12-2010 13:25,1.65,,United Kingdom,2010-12-16,1.65
572743,22381,TOY TIDY PINK POLKADOT,5,25-10-2011 16:13,2.1,14482.0,United Kingdom,2011-10-25,10.5
574726,23264,SET OF 3 WOODEN SLEIGH DECORATIONS,12,06-11-2011 14:56,1.25,14664.0,United Kingdom,2011-06-11,15.0
542881,22297,HEART IVORY TRELLIS SMALL,4,01-02-2011 12:54,1.25,14587.0,United Kingdom,2011-01-02,5.0
580136,23275,SET OF 3 HANGING OWLS OLLIE BEAK,2,01-12-2011 19:42,1.25,17841.0,United Kingdom,2011-01-12,2.5
547822,22895,SET OF 2 TEA TOWELS APPLE AND PEARS,6,25-03-2011 14:53,2.95,12668.0,Germany,2011-03-25,17.700000000000003
551616,22516,CHILDS GARDEN RAKE BLUE,1,03-05-2011 11:40,2.1,15048.0,United Kingdom,2011-03-05,2.1
538566,21391,FRENCH LAVENDER SCENT HEART,1,13-12-2010 11:21,4.21,,United Kingdom,2010-12-13,4.21
569898,22181,SNOWSTORM PHOTO FRAME FRIDGE MAGNET,1,06-10-2011 16:08,1.63,,United Kingdom,2011-06-10,1.63
555554,82484,WOOD BLACK BOARD ANT WHITE FINISH,4,05-06-2011 13:46,7.95,13742.0,United Kingdom,2011-05-06,31.8
565396,23634,SET 10 CARDS XMAS CHOIR 17068,1,02-09-2011 16:39,2.91,,United Kingdom,2011-02-09,2.91
546091,22690,DOORMAT HOME SWEET HOME BLUE ,2,09-03-2011 11:53,7.95,14936.0,Channel Islands,2011-09-03,15.9
561600,21034,REX CASH+CARRY JUMBO SHOPPER,2,28-07-2011 11:29,0.95,15861.0,United Kingdom,2011-07-28,1.9
576082,22385,JUMBO BAG SPACEBOY DESIGN,10,14-11-2011 08:22,2.08,12428.0,Finland,2011-11-14,20.8
543631,22965,3 TRADITIONAl BISCUIT CUTTERS  SET,3,10-02-2011 16:17,2.1,14081.0,United Kingdom,2011-10-02,6.300000000000001
562593,23270,SET OF 2 CERAMIC PAINTED HEARTS ,6,07-08-2011 15:43,1.45,16549.0,United Kingdom,2011-07-08,8.7
556778,23049,RECYCLED ACAPULCO MAT RED,3,14-06-2011 12:41,8.25,16712.0,United Kingdom,2011-06-14,24.75
546888,85093,CANDY SPOT EGG WARMER HARE,2,17-03-2011 18:15,0.83,,United Kingdom,2011-03-17,1.66
581492,22495,SET OF 2 ROUND TINS CAMEMBERT ,1,09-12-2011 10:03,5.79,,United Kingdom,2011-09-12,5.79
577173,21975,PACK OF 60 DINOSAUR CAKE CASES,48,18-11-2011 10:57,0.55,14849.0,United Kingdom,2011-11-18,26.400000000000002
566602,22035,VINTAGE CARAVAN GREETING CARD ,1,13-09-2011 16:05,0.83,,United Kingdom,2011-09-13,0.83
553718,20978,36 PENCILS TUBE SKULLS,12,18-05-2011 16:14,2.46,,United Kingdom,2011-05-18,29.52
569580,23348,CHILDRENS TOY COOKING UTENSIL SET,4,05-10-2011 11:16,2.08,15039.0,United Kingdom,2011-05-10,8.32
537405,22839,3 TIER CAKE TIN GREEN AND CREAM,1,06-12-2010 14:51,14.95,17841.0,United Kingdom,2010-06-12,14.95
578836,23188,VINTAGE  2 METRE FOLDING RULER,1,25-11-2011 15:47,1.65,13069.0,United Kingdom,2011-11-25,1.65
559686,84032B,CHARLIE + LOLA RED HOT WATER BOTTLE,1,11-07-2011 15:26,2.95,17966.0,United Kingdom,2011-11-07,2.95
571441,22579,WOODEN TREE CHRISTMAS SCANDINAVIAN,3,17-10-2011 13:31,1.63,14096.0,United Kingdom,2011-10-17,4.89
581220,21408,SPOTTY PINK DUCK DOORSTOP,8,08-12-2011 09:39,1.95,13924.0,United Kingdom,2011-08-12,15.6
550210,22212,FOUR HOOK  WHITE LOVEBIRDS,1,15-04-2011 10:40,4.13,,United Kingdom,2011-04-15,4.13
549564,21875,KINGS CHOICE MUG,6,10-04-2011 14:16,1.25,18129.0,United Kingdom,2011-10-04,7.5
537163,22331,WOODLAND PARTY BAG + STICKER SET,8,05-12-2010 13:21,1.65,17863.0,United Kingdom,2010-05-12,13.2
543188,22938,CUPCAKE LACE PAPER SET 6,12,04-02-2011 11:45,1.95,12567.0,France,2011-04-02,23.4
569028,21833,CAMOUFLAGE LED TORCH,12,30-09-2011 10:20,1.69,14911.0,EIRE,2011-09-30,20.28
553471,37449,CERAMIC CAKE STAND + HANGING CAKES,32,17-05-2011 11:28,6.79,18102.0,United Kingdom,2011-05-17,217.28
544434,22212,FOUR HOOK  WHITE LOVEBIRDS,1,18-02-2011 16:12,4.13,,United Kingdom,2011-02-18,4.13
566595,22950,36 DOILIES VINTAGE CHRISTMAS,288,13-09-2011 15:03,1.25,18251.0,United Kingdom,2011-09-13,360.0
555738,22676,FRENCH BLUE METAL DOOR SIGN 1,10,07-06-2011 09:44,1.25,16825.0,United Kingdom,2011-07-06,12.5
552304,22614,PACK OF 12 SPACEBOY TISSUES,12,08-05-2011 15:15,0.29,12748.0,United Kingdom,2011-08-05,3.4799999999999995
580640,22955,36 FOIL STAR CAKE CASES ,2,05-12-2011 12:51,0.79,16910.0,United Kingdom,2011-05-12,1.58
566913,20936,FORKED CACTUS CANDLE,2,15-09-2011 14:07,2.95,17602.0,United Kingdom,2011-09-15,5.9
569246,23172,REGENCY TEA PLATE PINK,1,03-10-2011 09:57,3.29,14096.0,United Kingdom,2011-03-10,3.29
565150,20665,RED RETROSPOT PURSE ,12,01-09-2011 14:26,2.55,14298.0,United Kingdom,2011-01-09,30.599999999999998
580635,23439,HAND WARMER RED LOVE HEART,1,05-12-2011 12:30,2.1,14649.0,United Kingdom,2011-05-12,2.1
546542,22652,TRAVEL SEWING KIT,2,14-03-2011 15:13,1.65,13263.0,United Kingdom,2011-03-14,3.3
567102,21985,PACK OF 12 HEARTS DESIGN TISSUES ,72,16-09-2011 13:32,0.39,14124.0,United Kingdom,2011-09-16,28.080000000000002
561870,22608,PENS ASSORTED FUNKY JEWELED ,36,31-07-2011 11:45,0.19,14911.0,EIRE,2011-07-31,6.84
572103,79160,HEART SHAPE WIRELESS DOORBELL,1,20-10-2011 15:57,2.1,17571.0,United Kingdom,2011-10-20,2.1
556912,84508C,BLUE CIRCLES DESIGN TEDDY,2,15-06-2011 13:26,2.55,15005.0,United Kingdom,2011-06-15,5.1
550149,22090,PAPER BUNTING RETROSPOT,10,14-04-2011 14:37,2.95,13069.0,United Kingdom,2011-04-14,29.5
580865,23068,ALUMINIUM STAMPED HEART,5,06-12-2011 11:58,2.49,17914.0,United Kingdom,2011-06-12,12.450000000000001
545060,72807C,SET/3 VANILLA SCENTED CANDLE IN BOX,2,27-02-2011 13:47,4.25,15547.0,United Kingdom,2011-02-27,8.5
545105,22659,LUNCH BOX I LOVE LONDON,24,28-02-2011 11:58,1.95,12598.0,France,2011-02-28,46.8
575607,22581,WOOD STOCKING CHRISTMAS SCANDISPOT,1,10-11-2011 12:37,1.63,14096.0,United Kingdom,2011-10-11,1.63
579508,22814,CARD PARTY GAMES ,1,29-11-2011 16:33,0.42,,United Kingdom,2011-11-29,0.42
577536,23395,BELLE JARDINIERE CUSHION COVER,1,20-11-2011 14:14,3.75,15850.0,United Kingdom,2011-11-20,3.75
578922,23343,JUMBO BAG VINTAGE CHRISTMAS ,1,27-11-2011 12:00,2.08,17236.0,United Kingdom,2011-11-27,2.08
540183,84077,WORLD WAR 2 GLIDERS ASSTD DESIGNS,288,05-01-2011 13:37,0.21,15093.0,United Kingdom,2011-05-01,60.48
537434,22310,IVORY KNITTED MUG COSY ,1,06-12-2010 16:57,3.36,,United Kingdom,2010-06-12,3.36
547867,21165,BEWARE OF THE CAT METAL SIGN ,3,27-03-2011 13:56,1.69,13357.0,United Kingdom,2011-03-27,5.07
574561,21822,GLITTER CHRISTMAS TREE WITH BELLS,2,04-11-2011 15:52,1.63,,United Kingdom,2011-04-11,3.26
577785,23319,BOX OF 6 MINI 50'S CRACKERS,5,21-11-2011 16:25,2.49,16369.0,United Kingdom,2011-11-21,12.450000000000001
572065,21977,PACK OF 60 PINK PAISLEY CAKE CASES,6,20-10-2011 13:06,0.55,12556.0,Spain,2011-10-20,3.3000000000000003
555400,22822,CREAM WALL PLANTER HEART SHAPED,1,02-06-2011 17:50,4.95,14088.0,United Kingdom,2011-02-06,4.95
543909,21577,SAVE THE PLANET COTTON TOTE BAG,1,14-02-2011 12:32,4.96,,United Kingdom,2011-02-14,4.96
547042,82599,FANNY'S REST STOPMETAL SIGN,1,20-03-2011 11:00,4.13,,United Kingdom,2011-03-20,4.13
566600,23403,LETTER HOLDER HOME SWEET HOME,8,13-09-2011 15:41,3.75,13704.0,United Kingdom,2011-09-13,30.0
549302,22568,FELTCRAFT CUSHION OWL,4,08-04-2011 08:25,3.75,14246.0,United Kingdom,2011-08-04,15.0
574481,21559,STRAWBERRY LUNCH BOX WITH CUTLERY,1,04-11-2011 12:45,2.55,18022.0,United Kingdom,2011-04-11,2.55
546896,22260,FELT EGG COSY BLUE RABBIT ,5,17-03-2011 18:24,1.63,,United Kingdom,2011-03-17,8.149999999999999
572553,21175,GIN + TONIC DIET METAL SIGN,3,24-10-2011 17:09,4.96,,United Kingdom,2011-10-24,14.879999999999999
544150,22120,WELCOME  WOODEN BLOCK LETTERS,3,16-02-2011 11:59,9.95,14180.0,United Kingdom,2011-02-16,29.849999999999998
563216,21629,SQUARE FLOOR CUSHION VINTAGE RED,1,14-08-2011 13:14,7.95,17841.0,United Kingdom,2011-08-14,7.95
570688,22646,CERAMIC STRAWBERRY CAKE MONEY BANK,1,11-10-2011 16:29,3.29,,United Kingdom,2011-11-10,3.29
557748,22795,SWEETHEART RECIPE BOOK STAND,2,22-06-2011 12:32,6.75,14527.0,United Kingdom,2011-06-22,13.5
561900,22716,CARD CIRCUS PARADE,12,31-07-2011 15:31,0.42,16655.0,United Kingdom,2011-07-31,5.04
575739,23493,VINTAGE DOILY TRAVEL SEWING KIT,1,11-11-2011 09:05,3.29,,United Kingdom,2011-11-11,3.29
564727,22631,CIRCUS PARADE LUNCH BOX ,2,28-08-2011 12:31,1.95,16686.0,United Kingdom,2011-08-28,3.9
566293,22574,HEART WOODEN CHRISTMAS DECORATION,12,11-09-2011 15:35,0.85,14533.0,United Kingdom,2011-11-09,10.2
545460,16020C,CLEAR STATIONERY BOX SET ,2,02-03-2011 17:33,0.85,13230.0,United Kingdom,2011-02-03,1.7
536987,90196B,BLACK GEMSTONE NECKLACE 45CM,1,03-12-2010 14:54,12.75,17198.0,United Kingdom,2010-03-12,12.75
580053,23029,DRAWER KNOB CRACKLE GLAZE GREEN,16,01-12-2011 13:03,1.65,12912.0,United Kingdom,2011-01-12,26.4
547249,20727,LUNCH BAG  BLACK SKULL.,1,22-03-2011 09:27,4.13,,United Kingdom,2011-03-22,4.13
572549,21922,UNION STRIPE WITH FRINGE  HAMMOCK,1,24-10-2011 17:03,16.63,,United Kingdom,2011-10-24,16.63
576213,22098,BOUDOIR SQUARE TISSUE BOX,1,14-11-2011 12:47,0.39,18117.0,United Kingdom,2011-11-14,0.39
546237,23181,BULL DOG BOTTLE TOP WALL CLOCK,2,10-03-2011 12:50,8.25,16625.0,United Kingdom,2011-10-03,16.5
540395,22963,JAM JAR WITH GREEN LID,6,06-01-2011 18:24,0.85,14702.0,United Kingdom,2011-06-01,5.1
560538,22273,FELTCRAFT DOLL MOLLY,6,19-07-2011 12:19,2.95,16128.0,United Kingdom,2011-07-19,17.700000000000003
556475,22692,DOORMAT WELCOME TO OUR HOME,1,12-06-2011 12:03,7.95,18109.0,United Kingdom,2011-12-06,7.95
549123,21035,SET/2 RED RETROSPOT TEA TOWELS ,6,06-04-2011 14:02,3.25,15201.0,United Kingdom,2011-06-04,19.5
567796,23549,WRAP BIRD GARDEN ,25,22-09-2011 11:46,0.42,16395.0,United Kingdom,2011-09-22,10.5
577800,22535,MAGIC DRAWING SLATE BUNNIES ,24,21-11-2011 17:00,0.42,15484.0,United Kingdom,2011-11-21,10.08
543096,22243,5 HOOK HANGER RED MAGIC TOADSTOOL,1,03-02-2011 11:39,1.65,14044.0,United Kingdom,2011-03-02,1.65
568159,22627,MINT KITCHEN SCALES,2,25-09-2011 12:22,8.5,17719.0,United Kingdom,2011-09-25,17.0
573585,90161D,ANT COPPER PINK BOUDICCA BRACELET,2,31-10-2011 14:41,4.98,,United Kingdom,2011-10-31,9.96
545715,22161,HEART DECORATION RUSTIC HANGING ,1,07-03-2011 10:13,1.63,,United Kingdom,2011-07-03,1.63
575618,21175,GIN + TONIC DIET METAL SIGN,12,10-11-2011 12:57,2.55,15463.0,United Kingdom,2011-10-11,30.599999999999998
579508,22365,DOORMAT RESPECTABLE HOUSE,1,29-11-2011 16:33,15.79,,United Kingdom,2011-11-29,15.79
574076,23376,PACK OF 12 VINTAGE CHRISTMAS TISSUE,8,02-11-2011 15:38,0.83,,United Kingdom,2011-02-11,6.64
560606,21993,FLORAL FOLK STATIONERY SET,12,20-07-2011 10:08,1.25,17422.0,United Kingdom,2011-07-20,15.0
556501,23209,LUNCH BAG DOILEY PATTERN ,20,13-06-2011 08:40,1.65,16700.0,United Kingdom,2011-06-13,33.0
571360,85179C,PINK BITTY LIGHT CHAIN,24,17-10-2011 11:51,1.25,16563.0,United Kingdom,2011-10-17,30.0
557938,23119,PACK OF 6 LARGE FRUIT STRAWS ,2,23-06-2011 15:35,1.25,,United Kingdom,2011-06-23,2.5
540098,85123A,WHITE HANGING HEART T-LIGHT HOLDER,2,04-01-2011 15:50,2.95,16241.0,United Kingdom,2011-04-01,5.9
549291,37342,POLKADOT COFFEE CUP & SAUCER PINK,8,07-04-2011 19:05,0.79,16261.0,United Kingdom,2011-07-04,6.32
572549,21408,SPOTTY PINK DUCK DOORSTOP,1,24-10-2011 17:03,8.29,,United Kingdom,2011-10-24,8.29
554013,23109,LED TEA LIGHTS,8,20-05-2011 13:13,2.89,13308.0,United Kingdom,2011-05-20,23.12
564043,51014A,"FEATHER PEN,HOT PINK",24,22-08-2011 12:55,0.39,14414.0,United Kingdom,2011-08-22,9.36
557067,22045,SPACEBOY GIFT WRAP,25,16-06-2011 15:12,0.42,13098.0,United Kingdom,2011-06-16,10.5
540977,90134,OLD ROSE COMBO BEAD NECKLACE,1,12-01-2011 15:01,2.96,,United Kingdom,2011-12-01,2.96
559202,21210,SET OF 72 RETROSPOT PAPER  DOILIES,12,07-07-2011 10:40,1.45,13583.0,United Kingdom,2011-07-07,17.4
544943,22084,PAPER CHAIN KIT EMPIRE,12,25-02-2011 10:39,2.95,15845.0,United Kingdom,2011-02-25,35.400000000000006
555856,84792,ENCHANTED BIRD COATHANGER 5 HOOK,1,07-06-2011 14:02,4.65,17124.0,United Kingdom,2011-07-06,4.65
576837,15036,ASSORTED COLOURS SILK FAN,1,16-11-2011 15:16,1.63,,United Kingdom,2011-11-16,1.63
553657,84596F,SMALL MARSHMALLOWS PINK BOWL,4,18-05-2011 11:28,0.42,14583.0,United Kingdom,2011-05-18,1.68
570672,22636,CHILDS BREAKFAST SET CIRCUS PARADE,2,11-10-2011 14:52,8.5,12536.0,France,2011-11-10,17.0
543533,21121,SET/10 RED POLKADOT PARTY CANDLES,1,09-02-2011 13:00,2.46,,United Kingdom,2011-09-02,2.46
581246,23400,SHELF WITH 4 HOOKS HOME SWEET HOME,1,08-12-2011 10:59,6.25,15453.0,United Kingdom,2011-08-12,6.25
553503,48187,DOORMAT NEW ENGLAND,1,17-05-2011 13:20,7.95,14606.0,United Kingdom,2011-05-17,7.95
559125,23207,LUNCH BAG ALPHABET DESIGN,10,06-07-2011 12:32,1.65,13985.0,United Kingdom,2011-06-07,16.5
553162,82583,HOT BATHS METAL SIGN,1,13-05-2011 15:53,4.13,,United Kingdom,2011-05-13,4.13
546428,22967,SET 3 SONG BIRD PAPER EGGS ASSORTED,6,13-03-2011 14:55,2.95,12681.0,France,2011-03-13,17.700000000000003
579555,23365,SET 12 COLOUR PENCILS LOVE LONDON,5,30-11-2011 11:08,0.65,16241.0,United Kingdom,2011-11-30,3.25
574662,23252,VINTAGE RED ENAMEL TRIM JUG ,4,06-11-2011 12:01,3.75,16676.0,United Kingdom,2011-06-11,15.0
541592,22666,RECIPE BOX PANTRY YELLOW DESIGN,1,19-01-2011 15:08,5.79,,United Kingdom,2011-01-19,5.79
540471,82494L,WOODEN FRAME ANTIQUE WHITE ,6,07-01-2011 14:21,2.95,15601.0,United Kingdom,2011-07-01,17.700000000000003
574275,22178,VICTORIAN GLASS HANGING T-LIGHT,6,03-11-2011 14:37,1.95,12352.0,Norway,2011-03-11,11.7
546984,22865,HAND WARMER OWL DESIGN,2,18-03-2011 12:35,2.1,15019.0,United Kingdom,2011-03-18,4.2
561874,20914,SET/5 RED RETROSPOT LID GLASS BOWLS,6,31-07-2011 12:02,2.95,16255.0,United Kingdom,2011-07-31,17.700000000000003
579403,22411,JUMBO SHOPPER VINTAGE RED PAISLEY,20,29-11-2011 12:15,2.08,14503.0,United Kingdom,2011-11-29,41.6
553205,23170,REGENCY TEA PLATE ROSES ,48,16-05-2011 08:13,1.45,15813.0,United Kingdom,2011-05-16,69.6
565478,22386,JUMBO BAG PINK POLKADOT,1,05-09-2011 11:18,2.08,15005.0,United Kingdom,2011-05-09,2.08
560778,21218,RED SPOTTY BISCUIT TIN,1,21-07-2011 09:30,8.29,,United Kingdom,2011-07-21,8.29
570807,23513,EMBROIDERED RIBBON REEL SUSIE ,6,12-10-2011 12:44,2.08,13704.0,United Kingdom,2011-12-10,12.48
575929,23084,RABBIT NIGHT LIGHT,6,11-11-2011 17:23,2.08,13310.0,United Kingdom,2011-11-11,12.48
564304,21115,ROSE CARAVAN DOORSTOP,1,24-08-2011 12:11,6.75,14527.0,United Kingdom,2011-08-24,6.75
578702,23192,BUNDLE OF 3 ALPHABET EXERCISE BOOKS,12,25-11-2011 10:58,1.65,15382.0,United Kingdom,2011-11-25,19.799999999999997
566720,84970S,HANGING HEART ZINC T-LIGHT HOLDER,12,14-09-2011 12:42,0.85,13634.0,United Kingdom,2011-09-14,10.2
568950,23076,ICE CREAM SUNDAE LIP GLOSS,24,29-09-2011 15:25,1.25,12458.0,Switzerland,2011-09-29,30.0
578630,23483,HANGING  BUTTERFLY T-LIGHT HOLDER,36,24-11-2011 16:06,1.25,12748.0,United Kingdom,2011-11-24,45.0
545690,84968C,SET OF 16 VINTAGE PISTACHIO CUTLERY,1,06-03-2011 12:46,12.75,13263.0,United Kingdom,2011-06-03,12.75
550496,21381,MINI WOODEN HAPPY BIRTHDAY GARLAND,1,18-04-2011 15:05,3.29,,United Kingdom,2011-04-18,3.29
570287,21485,RETROSPOT HEART HOT WATER BOTTLE,3,10-10-2011 11:37,4.95,17425.0,United Kingdom,2011-10-10,14.850000000000001
555408,22411,JUMBO SHOPPER VINTAGE RED PAISLEY,10,03-06-2011 08:54,2.08,13294.0,United Kingdom,2011-03-06,20.8
550796,84507C,BLUE CIRCLES DESIGN MONKEY DOLL,2,20-04-2011 14:38,2.55,17211.0,United Kingdom,2011-04-20,5.1
553158,22779,WOODEN OWLS LIGHT GARLAND ,4,13-05-2011 15:24,4.25,14194.0,United Kingdom,2011-05-13,17.0
549714,21830,ASSORTED CREEPY CRAWLIES,24,11-04-2011 14:13,0.42,,United Kingdom,2011-11-04,10.08
568204,22086,PAPER CHAIN KIT 50'S CHRISTMAS ,6,25-09-2011 15:25,2.95,13670.0,United Kingdom,2011-09-25,17.700000000000003
580672,21224,SET/4 SKULL BADGES,3,05-12-2011 14:29,1.25,17920.0,United Kingdom,2011-05-12,3.75
538658,75131,METAL TUBE CHIME ON BAMBOO,60,13-12-2010 15:34,1.25,17969.0,United Kingdom,2010-12-13,75.0
578277,21731,RED TOADSTOOL LED NIGHT LIGHT,3,23-11-2011 13:51,1.65,12723.0,France,2011-11-23,4.949999999999999
568912,22975,SPACEBOY CHILDRENS EGG CUP,4,29-09-2011 13:45,1.25,17528.0,United Kingdom,2011-09-29,5.0
575851,23296,SET OF 6 TEA TIME BAKING CASES,1,11-11-2011 12:13,1.25,14662.0,United Kingdom,2011-11-11,1.25
572897,23103,JINGLE BELL HEART DECORATION,1,26-10-2011 14:42,3.29,,United Kingdom,2011-10-26,3.29
558042,22303,COFFEE MUG APPLES DESIGN,6,24-06-2011 13:26,2.55,13870.0,United Kingdom,2011-06-24,15.299999999999999
546892,79030G,"TUMBLER, NEW ENGLAND",2,17-03-2011 18:20,12.46,,United Kingdom,2011-03-17,24.92
559494,21916,SET 12 RETRO WHITE CHALK STICKS,1,08-07-2011 13:54,0.79,,United Kingdom,2011-08-07,0.79
556484,23149,ANTIQUE IVORY WIRE BOWL SMALL,3,12-06-2011 13:17,2.49,16938.0,United Kingdom,2011-12-06,7.470000000000001
545232,22716,CARD CIRCUS PARADE,12,01-03-2011 10:19,0.42,15676.0,United Kingdom,2011-01-03,5.04
547867,21174,POTTERING IN THE SHED METAL SIGN,1,27-03-2011 13:56,2.08,13357.0,United Kingdom,2011-03-27,2.08
540526,20750,RED RETROSPOT MINI CASES,1,09-01-2011 13:41,7.95,14606.0,United Kingdom,2011-09-01,7.95
578941,22715,CARD WEDDING DAY,6,27-11-2011 13:26,0.42,16024.0,United Kingdom,2011-11-27,2.52
562839,22974,CHILDRENS DOLLY GIRL MUG,2,09-08-2011 16:17,1.65,14056.0,United Kingdom,2011-09-08,3.3
537681,84946,ANTIQUE SILVER TEA GLASS ETCHED,24,08-12-2010 10:11,1.25,13329.0,United Kingdom,2010-08-12,30.0
577530,22577,WOODEN HEART CHRISTMAS SCANDINAVIAN,24,20-11-2011 13:48,0.29,14950.0,United Kingdom,2011-11-20,6.959999999999999
572513,85032B,BLOSSOM IMAGES GIFT WRAP SET,2,24-10-2011 14:36,0.65,16728.0,United Kingdom,2011-10-24,1.3
564754,20934,SET/3 POT PLANT CANDLES,1,30-08-2011 10:29,10.79,,United Kingdom,2011-08-30,10.79
561904,85049E,SCANDINAVIAN REDS RIBBONS,156,01-08-2011 08:30,1.06,17941.0,United Kingdom,2011-01-08,165.36
551869,21721,CANDY SHOP  STICKER SHEET,10,04-05-2011 16:36,0.85,16767.0,United Kingdom,2011-04-05,8.5
538514,22688,DOORMAT PEACE ON EARTH BLUE,1,12-12-2010 14:27,7.95,15044.0,United Kingdom,2010-12-12,7.95
552000,22116,METAL SIGN HIS DINNER IS SERVED,1,05-05-2011 15:56,1.63,,United Kingdom,2011-05-05,1.63
536523,21485,RETROSPOT HEART HOT WATER BOTTLE,3,01-12-2010 12:50,4.95,12868.0,United Kingdom,2010-01-12,14.850000000000001
560926,20768,GREEN FERN JOURNAL ,9,22-07-2011 09:20,2.46,,United Kingdom,2011-07-22,22.14
580730,21907,I'M ON HOLIDAY METAL SIGN,1,05-12-2011 17:28,4.13,,United Kingdom,2011-05-12,4.13
575975,22617,BAKING SET SPACEBOY DESIGN,3,13-11-2011 13:18,4.95,13536.0,United Kingdom,2011-11-13,14.850000000000001
553182,23171,REGENCY TEA PLATE GREEN ,6,15-05-2011 12:21,1.65,17107.0,United Kingdom,2011-05-15,9.899999999999999
566585,22584,PACK OF 6 PANNETONE GIFT BOXES,6,13-09-2011 14:06,2.55,16409.0,United Kingdom,2011-09-13,15.299999999999999
536597,22220,CAKE STAND LOVEBIRD 2 TIER WHITE,1,01-12-2010 17:35,9.95,18011.0,United Kingdom,2010-01-12,9.95
560090,85099B,JUMBO BAG RED RETROSPOT,1,14-07-2011 16:46,4.13,,United Kingdom,2011-07-14,4.13
564330,23321,SMALL WHITE HEART OF WICKER,4,24-08-2011 13:57,1.65,13411.0,United Kingdom,2011-08-24,6.6
565434,22150,3 STRIPEY MICE FELTCRAFT,3,04-09-2011 13:35,1.95,12867.0,United Kingdom,2011-04-09,5.85
556263,23241,TREASURE TIN GYMKHANA DESIGN,2,09-06-2011 18:41,2.08,13969.0,United Kingdom,2011-09-06,4.16
543097,21989,PACK OF 20 SKULL PAPER NAPKINS,1,03-02-2011 11:41,1.63,,United Kingdom,2011-03-02,1.63
554283,21124,SET/10 BLUE POLKADOT PARTY CANDLES,24,23-05-2011 14:11,1.25,17686.0,United Kingdom,2011-05-23,30.0
545464,84946,ANTIQUE SILVER TEA GLASS ETCHED,4,03-03-2011 09:10,2.46,,United Kingdom,2011-03-03,9.84
567076,85130C,BEADED CRYSTAL HEART BLUE  LARGE,24,16-09-2011 12:27,0.79,15505.0,United Kingdom,2011-09-16,18.96
578479,23081,GREEN METAL BOX ARMY SUPPLIES,1,24-11-2011 12:48,8.25,15858.0,United Kingdom,2011-11-24,8.25
580675,84692,BOX OF 24 COCKTAIL PARASOLS,50,05-12-2011 14:35,0.42,15640.0,United Kingdom,2011-05-12,21.0
542265,22365,DOORMAT RESPECTABLE HOUSE,1,26-01-2011 17:27,7.95,15867.0,United Kingdom,2011-01-26,7.95
545544,22616,PACK OF 12 LONDON TISSUES ,48,03-03-2011 14:56,0.29,14057.0,United Kingdom,2011-03-03,13.919999999999998
572321,22964,3 PIECE SPACEBOY COOKIE CUTTER SET,6,24-10-2011 08:59,2.1,15592.0,United Kingdom,2011-10-24,12.600000000000001
546189,21137,BLACK RECORD COVER FRAME,4,10-03-2011 10:56,3.75,13102.0,United Kingdom,2011-10-03,15.0
551885,21937,STRAWBERRY   PICNIC BAG,5,05-05-2011 09:18,2.95,16700.0,United Kingdom,2011-05-05,14.75
560991,22630,DOLLY GIRL LUNCH BOX,12,22-07-2011 13:29,1.95,12438.0,Norway,2011-07-22,23.4
571063,23531,WALL ART BIG LOVE ,3,13-10-2011 14:47,6.95,16430.0,United Kingdom,2011-10-13,20.85
564974,22383,LUNCH BAG SUKI DESIGN ,3,31-08-2011 15:32,4.13,,United Kingdom,2011-08-31,12.39
571441,47590A,BLUE HAPPY BIRTHDAY BUNTING,1,17-10-2011 13:31,10.79,14096.0,United Kingdom,2011-10-17,10.79
580527,22199,FRYING PAN RED RETROSPOT,3,04-12-2011 15:19,1.25,13736.0,United Kingdom,2011-04-12,3.75
566421,23559,WOODLAND BUNNIES LOLLY MAKERS,1,12-09-2011 13:55,2.08,12924.0,United Kingdom,2011-12-09,2.08
552694,23173,REGENCY TEAPOT ROSES ,3,10-05-2011 15:25,9.95,12749.0,United Kingdom,2011-10-05,29.849999999999998
575075,21891,TRADITIONAL WOODEN SKIPPING ROPE,3,08-11-2011 13:19,1.45,13975.0,United Kingdom,2011-08-11,4.35
560102,22798,ANTIQUE GLASS DRESSING TABLE POT,8,14-07-2011 18:28,2.95,13994.0,United Kingdom,2011-07-14,23.6
537823,71143,SILVER BOOK MARK WITH BEADS,1,08-12-2010 14:25,2.51,,United Kingdom,2010-08-12,2.51
560209,21841,BABY MOUSE RED GINGHAM DRESS,2,15-07-2011 14:05,4.25,15004.0,United Kingdom,2011-07-15,8.5
566292,84029E,RED WOOLLY HOTTIE WHITE HEART.,8,11-09-2011 15:35,4.25,13381.0,United Kingdom,2011-11-09,34.0
563193,22098,BOUDOIR SQUARE TISSUE BOX,1,12-08-2011 16:30,2.46,,United Kingdom,2011-12-08,2.46
543910,84596F,SMALL MARSHMALLOWS PINK BOWL,8,14-02-2011 12:36,1.25,13475.0,United Kingdom,2011-02-14,10.0
541972,21500,PINK POLKADOT WRAP ,25,24-01-2011 13:58,0.42,12935.0,United Kingdom,2011-01-24,10.5
580527,22847,BREAD BIN DINER STYLE IVORY,1,04-12-2011 15:19,16.95,13736.0,United Kingdom,2011-04-12,16.95
574852,22698,PINK REGENCY TEACUP AND SAUCER,3,07-11-2011 12:04,2.95,15493.0,United Kingdom,2011-07-11,8.850000000000001
546007,22423,REGENCY CAKESTAND 3 TIER,2,08-03-2011 15:34,12.75,,United Kingdom,2011-08-03,25.5
579258,22566,FELTCRAFT HAIRBAND PINK AND PURPLE,12,29-11-2011 08:21,0.85,15148.0,United Kingdom,2011-11-29,10.2
548203,22148,EASTER CRAFT 4 CHICKS ,81,29-03-2011 16:40,4.95,,United Kingdom,2011-03-29,400.95
554906,20728,LUNCH BAG CARS BLUE,10,27-05-2011 11:41,1.65,14194.0,United Kingdom,2011-05-27,16.5
541711,20752,BLUE POLKADOT WASHING UP GLOVES,18,21-01-2011 11:18,2.1,14646.0,Netherlands,2011-01-21,37.800000000000004
557333,47566,PARTY BUNTING,150,20-06-2011 10:25,4.15,17723.0,United Kingdom,2011-06-20,622.5
543546,85066,CREAM SWEETHEART MINI CHEST,1,09-02-2011 16:52,24.96,,United Kingdom,2011-09-02,24.96
545717,22844,VINTAGE CREAM DOG FOOD CONTAINER,1,07-03-2011 10:15,16.63,,United Kingdom,2011-07-03,16.63
554980,22271,FELTCRAFT DOLL ROSIE,1,29-05-2011 11:59,2.95,17613.0,United Kingdom,2011-05-29,2.95
552648,22826,LOVE SEAT ANTIQUE WHITE METAL,1,10-05-2011 13:40,195.0,17581.0,United Kingdom,2011-10-05,195.0
558475,22065,CHRISTMAS PUDDING TRINKET POT ,1,29-06-2011 15:58,3.29,,United Kingdom,2011-06-29,3.29
563216,22174,PHOTO CUBE,1,14-08-2011 13:14,1.65,17841.0,United Kingdom,2011-08-14,1.65
540153,22685,FRENCH BLUE METAL DOOR SIGN 0,10,05-01-2011 11:25,1.25,15841.0,United Kingdom,2011-05-01,12.5
543099,22988,SOLDIERS EGG CUP ,144,03-02-2011 12:00,1.06,16684.0,United Kingdom,2011-03-02,152.64000000000001
548516,85178,VICTORIAN SEWING KIT,1,31-03-2011 16:28,2.46,,United Kingdom,2011-03-31,2.46
541696,21620,SET OF 4 ROSE BOTANICAL CANDLES,2,20-01-2011 18:08,2.46,,United Kingdom,2011-01-20,4.92
548708,79190B,RETRO PLASTIC POLKA TRAY,9,03-04-2011 12:41,0.42,13269.0,United Kingdom,2011-03-04,3.78
570488,23301,GARDENERS KNEELING PAD KEEP CALM ,7,10-10-2011 17:12,3.29,14096.0,United Kingdom,2011-10-10,23.03
545216,22429,ENAMEL MEASURING JUG CREAM,1,28-02-2011 16:50,8.29,,United Kingdom,2011-02-28,8.29
557644,22193,RED DINER WALL CLOCK,1,21-06-2011 17:06,16.63,,United Kingdom,2011-06-21,16.63
558388,22433,WATERING CAN GREEN DINOSAUR,6,29-06-2011 10:00,1.95,,EIRE,2011-06-29,11.7
572758,90200D,PINK SWEETHEART BRACELET,2,25-10-2011 18:39,4.15,,United Kingdom,2011-10-25,8.3
554112,15044C,PURPLE PAPER PARASOL,1,22-05-2011 14:44,2.95,17611.0,United Kingdom,2011-05-22,2.95
580509,21892,TRADITIONAL WOODEN CATCH CUP GAME ,12,04-12-2011 13:45,1.25,12719.0,France,2011-04-12,15.0
545217,22994,TRAVEL CARD WALLET RETROSPOT,1,28-02-2011 16:59,0.83,,United Kingdom,2011-02-28,0.83
548212,22426,ENAMEL WASH BOWL CREAM,4,30-03-2011 09:12,3.75,12456.0,Switzerland,2011-03-30,15.0
541104,85099B,JUMBO BAG RED RETROSPOT,8,13-01-2011 14:29,4.13,,United Kingdom,2011-01-13,33.04
566446,23070,EDWARDIAN HEART PHOTO FRAME,1,12-09-2011 15:40,8.29,,United Kingdom,2011-12-09,8.29
541883,22767,TRIPLE PHOTO FRAME CORNICE ,2,24-01-2011 10:56,9.95,13408.0,United Kingdom,2011-01-24,19.9
560434,21458,2 PICTURE BOOK EGGS EASTER BUNNY,2,18-07-2011 15:56,2.46,,United Kingdom,2011-07-18,4.92
544574,21651,HANGING GLASS ETCHED TEALIGHT,6,21-02-2011 13:51,1.65,12365.0,Cyprus,2011-02-21,9.899999999999999
573269,23345, DOLLY GIRL BEAKER,3,28-10-2011 13:00,1.25,16764.0,United Kingdom,2011-10-28,3.75
540526,20985,HEART CALCULATOR,1,09-01-2011 13:41,1.25,14606.0,United Kingdom,2011-09-01,1.25
568206,23550,WRAP ALPHABET POSTER  ,50,25-09-2011 15:32,0.42,14806.0,United Kingdom,2011-09-25,21.0
541854,22666,RECIPE BOX PANTRY YELLOW DESIGN,1,23-01-2011 14:58,2.95,18283.0,United Kingdom,2011-01-23,2.95
571270,23131,MISTLETOE HEART WREATH CREAM,2,16-10-2011 12:09,4.15,12940.0,United Kingdom,2011-10-16,8.3
538511,20724,RED RETROSPOT CHARLOTTE BAG,10,12-12-2010 13:56,0.85,13959.0,United Kingdom,2010-12-12,8.5
580612,23566,EGG CUP MILKMAID HEIDI,1,05-12-2011 11:58,2.46,,United Kingdom,2011-05-12,2.46
562156,85230G,ORANGE VOTIVE CANDLE,24,03-08-2011 11:35,0.29,14401.0,United Kingdom,2011-03-08,6.959999999999999
541813,85123A,WHITE HANGING HEART T-LIGHT HOLDER,12,21-01-2011 15:36,2.95,18239.0,United Kingdom,2011-01-21,35.400000000000006
575193,22556,PLASTERS IN TIN CIRCUS PARADE ,12,09-11-2011 09:34,1.65,12681.0,France,2011-09-11,19.799999999999997
557027,22666,RECIPE BOX PANTRY YELLOW DESIGN,6,16-06-2011 13:24,2.95,12816.0,Poland,2011-06-16,17.700000000000003
540821,22984,CARD GINGHAM ROSE ,2,11-01-2011 13:16,0.85,,United Kingdom,2011-11-01,1.7
568780,23367,SET 12 COLOUR PENCILS SPACEBOY ,32,29-09-2011 08:27,0.65,18235.0,United Kingdom,2011-09-29,20.8
580730,23083,SET 6 PAPER TABLE LANTERN STARS ,2,05-12-2011 17:28,7.46,,United Kingdom,2011-05-12,14.92
557892,84673B,BLUE FLY SWAT,2,23-06-2011 14:11,0.65,14534.0,United Kingdom,2011-06-23,1.3
568949,23199,JUMBO BAG APPLES,2,29-09-2011 15:13,4.13,,United Kingdom,2011-09-29,8.26
572309,22151,PLACE SETTING WHITE HEART,4,23-10-2011 15:29,0.42,14432.0,United Kingdom,2011-10-23,1.68
575767,22970,LONDON BUS COFFEE MUG,3,11-11-2011 11:11,2.55,17348.0,United Kingdom,2011-11-11,7.6499999999999995
543541,POST,POSTAGE,6,09-02-2011 14:44,28.0,12462.0,Spain,2011-09-02,168.0
577077,21034,REX CASH+CARRY JUMBO SHOPPER,2,17-11-2011 15:16,0.95,17799.0,United Kingdom,2011-11-17,1.9
576326,35819B,"ACRYLIC HANGING JEWEL,BLUE",3,14-11-2011 15:18,0.38,16504.0,United Kingdom,2011-11-14,1.1400000000000001
543000,21507,"ELEPHANT, BIRTHDAY CARD, ",2,02-02-2011 12:17,0.83,,United Kingdom,2011-02-02,1.66
537374,22943,CHRISTMAS LIGHTS 10 VINTAGE BAUBLES,2,06-12-2010 12:55,4.95,17259.0,United Kingdom,2010-06-12,9.9
570516,22029,SPACEBOY BIRTHDAY CARD,12,11-10-2011 10:39,0.42,14121.0,United Kingdom,2011-11-10,5.04
579516,22110,BIRD HOUSE HOT WATER BOTTLE,1,29-11-2011 17:52,2.55,17841.0,United Kingdom,2011-11-29,2.55
548612,22613,PACK OF 20 SPACEBOY NAPKINS,3,01-04-2011 11:34,0.85,13137.0,United Kingdom,2011-01-04,2.55
578699,21430,SET/3 RED GINGHAM ROSE STORAGE BOX,24,25-11-2011 10:22,3.39,13113.0,United Kingdom,2011-11-25,81.36
544833,22863,SOAP DISH BROCANTE,8,24-02-2011 10:10,2.95,15974.0,United Kingdom,2011-02-24,23.6
539281,21114,LAVENDER SCENTED FABRIC HEART,10,16-12-2010 15:45,1.25,18176.0,United Kingdom,2010-12-16,12.5
539718,21243,PINK  POLKADOT PLATE ,4,21-12-2010 13:06,3.36,,United Kingdom,2010-12-21,13.44
549525,22196,SMALL HEART MEASURING SPOONS,1,08-04-2011 15:44,1.63,,United Kingdom,2011-08-04,1.63
537365,21166,COOK WITH WINE METAL SIGN ,12,06-12-2010 12:38,1.95,15078.0,United Kingdom,2010-06-12,23.4
541971,82551,LAUNDRY 15C METAL SIGN,2,24-01-2011 13:48,2.46,,United Kingdom,2011-01-24,4.92
580469,20725,LUNCH BAG RED RETROSPOT,1,04-12-2011 12:32,1.65,14583.0,United Kingdom,2011-04-12,1.65
580146,23205,CHARLOTTE BAG VINTAGE ALPHABET ,20,02-12-2011 10:07,2.46,,United Kingdom,2011-02-12,49.2
567085,21993,FLORAL FOLK STATIONERY SET,12,16-09-2011 12:38,1.25,12434.0,Australia,2011-09-16,15.0
577396,23300,GARDENERS KNEELING PAD CUP OF TEA ,12,18-11-2011 17:11,1.65,17621.0,United Kingdom,2011-11-18,19.799999999999997
571462,82482,WOODEN PICTURE FRAME WHITE FINISH,12,17-10-2011 14:14,2.95,16363.0,United Kingdom,2011-10-17,35.400000000000006
557233,20723,STRAWBERRY CHARLOTTE BAG,5,17-06-2011 14:44,0.85,15356.0,United Kingdom,2011-06-17,4.25
561507,23007, SPACEBOY BABY GIFT SET,2,27-07-2011 14:21,16.95,12397.0,Belgium,2011-07-27,33.9
573019,84997B,CHILDRENS CUTLERY RETROSPOT RED ,4,27-10-2011 12:33,4.15,15145.0,United Kingdom,2011-10-27,16.6
539586,84818,DANISH ROSE PHOTO FRAME,24,20-12-2010 13:08,0.85,14298.0,United Kingdom,2010-12-20,20.4
548358,21035,SET/2 RED RETROSPOT TEA TOWELS ,6,30-03-2011 15:29,3.25,15832.0,United Kingdom,2011-03-30,19.5
542622,22427,ENAMEL FLOWER JUG CREAM,1,31-01-2011 09:09,11.63,,United Kingdom,2011-01-31,11.63
541104,22214,CANDLE PLATE LACE WHITE,5,13-01-2011 14:29,1.63,,United Kingdom,2011-01-13,8.149999999999999
550496,22027,TEA PARTY BIRTHDAY CARD,2,18-04-2011 15:05,0.42,,United Kingdom,2011-04-18,0.84
550740,21934,SKULL SHOULDER BAG,1,20-04-2011 11:33,3.29,,United Kingdom,2011-04-20,3.29
575739,23108,SET OF 10 LED DOLLY LIGHTS,1,11-11-2011 09:05,12.46,,United Kingdom,2011-11-11,12.46
549563,23180,MUM'S KITCHEN CLOCK,1,10-04-2011 14:02,4.95,14030.0,United Kingdom,2011-10-04,4.95
574684,20725,LUNCH BAG RED RETROSPOT,10,06-11-2011 12:56,1.65,17581.0,United Kingdom,2011-06-11,16.5
564716,21935,SUKI  SHOULDER BAG,2,28-08-2011 11:02,1.65,14810.0,United Kingdom,2011-08-28,3.3
541223,21985,PACK OF 12 HEARTS DESIGN TISSUES ,12,14-01-2011 14:39,0.29,17954.0,United Kingdom,2011-01-14,3.4799999999999995
550986,35961,FOLKART ZINC HEART CHRISTMAS DEC,3,21-04-2011 18:06,1.63,,United Kingdom,2011-04-21,4.89
558043,22430,ENAMEL WATERING CAN CREAM,4,24-06-2011 13:28,4.95,13425.0,United Kingdom,2011-06-24,19.8
552232,22227,HANGING HEART MIRROR DECORATION ,3,06-05-2011 15:54,1.25,,United Kingdom,2011-06-05,3.75
555201,20974,12 PENCILS SMALL TUBE SKULL,24,01-06-2011 12:10,0.65,16969.0,United Kingdom,2011-01-06,15.600000000000001
580729,22477,WATERING CAN GARDEN MARKER,1,05-12-2011 17:24,2.46,,United Kingdom,2011-05-12,2.46
581219,23571,TRADITIONAL NAUGHTS & CROSSES,8,08-12-2011 09:28,3.29,,United Kingdom,2011-08-12,26.32
553202,22551,PLASTERS IN TIN SPACEBOY,1,15-05-2011 16:02,1.65,15854.0,United Kingdom,2011-05-15,1.65
562716,22750,FELTCRAFT PRINCESS LOLA DOLL,20,08-08-2011 15:35,3.75,14257.0,United Kingdom,2011-08-08,75.0
576838,22333,RETROSPOT PARTY BAG + STICKER SET,8,16-11-2011 15:21,1.65,18075.0,United Kingdom,2011-11-16,13.2
540187,21726,MULTI HEARTS  STICKERS,12,05-01-2011 13:53,0.85,15358.0,United Kingdom,2011-05-01,10.2
557213,23264,SET OF 3 WOODEN SLEIGH DECORATIONS,1,17-06-2011 12:16,1.25,15021.0,United Kingdom,2011-06-17,1.25
561519,23284,DOORMAT KEEP CALM AND COME IN,1,27-07-2011 17:01,7.95,17870.0,United Kingdom,2011-07-27,7.95
548148,21192,WHITE BELL HONEYCOMB PAPER ,5,29-03-2011 12:31,1.65,17931.0,United Kingdom,2011-03-29,8.25
570342,85123A,WHITE HANGING HEART T-LIGHT HOLDER,12,10-10-2011 12:26,2.95,17706.0,United Kingdom,2011-10-10,35.400000000000006
555413,20726,LUNCH BAG WOODLAND,1,03-06-2011 09:50,1.65,17994.0,United Kingdom,2011-03-06,1.65
562933,22268,DECORATION SITTING BUNNY,2,10-08-2011 16:51,0.63,,United Kingdom,2011-10-08,1.26
560090,22377,BOTTLE BAG RETROSPOT ,1,14-07-2011 16:46,1.63,,United Kingdom,2011-07-14,1.63
576061,17021,NAMASTE SWAGAT INCENSE,6,13-11-2011 15:29,0.3,13146.0,United Kingdom,2011-11-13,1.7999999999999998
579689,82494L,WOODEN FRAME ANTIQUE WHITE ,1,30-11-2011 14:00,2.95,14606.0,United Kingdom,2011-11-30,2.95
571281,22468,BABUSHKA LIGHTS STRING OF 10,14,16-10-2011 13:23,5.95,14088.0,United Kingdom,2011-10-16,83.3
550470,90214F,"LETTER ""F"" BLING KEY RING",2,18-04-2011 13:49,0.83,,United Kingdom,2011-04-18,1.66
557995,22693,GROW A FLYTRAP OR SUNFLOWER IN TIN,24,24-06-2011 10:44,1.25,17979.0,United Kingdom,2011-06-24,30.0
580141,21181,PLEASE ONE PERSON METAL SIGN,12,02-12-2011 09:22,2.1,14895.0,United Kingdom,2011-02-12,25.200000000000003
573130,20971,PINK BLUE FELT CRAFT TRINKET BOX,12,27-10-2011 16:41,1.25,13969.0,United Kingdom,2011-10-27,15.0
581494,22326,ROUND SNACK BOXES SET OF4 WOODLAND ,6,09-12-2011 10:13,2.95,12518.0,Germany,2011-09-12,17.700000000000003
578120,22083,PAPER CHAIN KIT RETROSPOT,6,23-11-2011 10:21,2.95,14493.0,United Kingdom,2011-11-23,17.700000000000003
567797,22274,FELTCRAFT DOLL EMILY,6,22-09-2011 11:49,2.95,16735.0,United Kingdom,2011-09-22,17.700000000000003
541827,22930,BAKING MOULD HEART MILK CHOCOLATE,1,21-01-2011 17:05,4.96,,United Kingdom,2011-01-21,4.96
567668,21003,ROSE DU SUD CUSHION COVER,2,21-09-2011 15:29,5.79,,United Kingdom,2011-09-21,11.58
577128,21894,POTTING SHED SEED ENVELOPES,2,17-11-2011 19:48,1.25,14508.0,United Kingdom,2011-11-17,2.5
568659,23518,EMBROIDERED RIBBON REEL RACHEL ,6,28-09-2011 12:28,2.89,13516.0,United Kingdom,2011-09-28,17.34
570843,22334,DINOSAUR PARTY BAG + STICKER SET,2,12-10-2011 14:22,1.65,17293.0,United Kingdom,2011-12-10,3.3
563913,23237,SET OF 4 KNICK KNACK TINS LEAF,6,21-08-2011 13:11,4.15,14911.0,EIRE,2011-08-21,24.900000000000002
578153,21034,REX CASH+CARRY JUMBO SHOPPER,2,23-11-2011 11:22,0.95,12748.0,United Kingdom,2011-11-23,1.9
578347,90200D,PINK SWEETHEART BRACELET,4,24-11-2011 09:26,4.15,,United Kingdom,2011-11-24,16.6
570872,22163,HEART STRING MEMO HOLDER HANGING,1,12-10-2011 16:40,1.63,,United Kingdom,2011-12-10,1.63
564729,22208,WOOD STAMP SET THANK YOU,2,28-08-2011 12:44,0.83,13137.0,United Kingdom,2011-08-28,1.66
563029,22141,CHRISTMAS CRAFT TREE TOP ANGEL,48,11-08-2011 14:34,1.85,18093.0,United Kingdom,2011-11-08,88.80000000000001
541423,21535,RED RETROSPOT SMALL MILK JUG,1,17-01-2011 17:54,4.96,,United Kingdom,2011-01-17,4.96
573267,22835,HOT WATER BOTTLE I AM SO POORLY,1,28-10-2011 12:44,4.95,,United Kingdom,2011-10-28,4.95
563567,22175,PINK OWL SOFT TOY,6,17-08-2011 14:44,2.95,13004.0,United Kingdom,2011-08-17,17.700000000000003
571054,22044,CHRISTMAS CARD STACK OF PRESENTS,12,13-10-2011 13:58,0.19,14234.0,United Kingdom,2011-10-13,2.2800000000000002
579512,22800,ANTIQUE TALL SWIRLGLASS TRINKET POT,1,29-11-2011 16:47,7.46,,United Kingdom,2011-11-29,7.46
553229,22951,60 CAKE CASES DOLLY GIRL DESIGN,2,16-05-2011 10:50,0.55,15039.0,United Kingdom,2011-05-16,1.1
573945,22592,CARDHOLDER HOLLY WREATH METAL,8,02-11-2011 10:44,3.75,17663.0,United Kingdom,2011-02-11,30.0
574034,22579,WOODEN TREE CHRISTMAS SCANDINAVIAN,5,02-11-2011 12:45,0.29,17841.0,United Kingdom,2011-02-11,1.45
577783,22960,JAM MAKING SET WITH JARS,12,21-11-2011 16:20,3.75,18139.0,United Kingdom,2011-11-21,45.0
565617,23215,JINGLE BELL HEART ANTIQUE SILVER,1,05-09-2011 15:30,4.13,,United Kingdom,2011-05-09,4.13
539455,20967,GREY FLORAL FELTCRAFT SHOULDER BAG,1,17-12-2010 17:17,3.75,12748.0,United Kingdom,2010-12-17,3.75
541002,22418,10 COLOUR SPACEBOY PEN,24,13-01-2011 10:33,0.85,12951.0,United Kingdom,2011-01-13,20.4
573195,21508,VINTAGE KID DOLLY CARD ,12,28-10-2011 11:40,0.42,12432.0,Norway,2011-10-28,5.04
543832,22966,GINGERBREAD MAN COOKIE CUTTER,12,14-02-2011 10:10,1.25,13381.0,United Kingdom,2011-02-14,15.0
566952,22379,RECYCLING BAG RETROSPOT ,1,15-09-2011 16:37,4.13,,United Kingdom,2011-09-15,4.13
564137,21174,POTTERING IN THE SHED METAL SIGN,10,23-08-2011 11:30,2.08,15722.0,United Kingdom,2011-08-23,20.8
553178,21390,FILIGRIS HEART WITH BUTTERFLY,1,15-05-2011 11:29,1.25,17302.0,United Kingdom,2011-05-15,1.25
552232,22355,CHARLOTTE BAG SUKI DESIGN,1,06-05-2011 15:54,1.63,,United Kingdom,2011-06-05,1.63
578790,51014A,"FEATHER PEN,HOT PINK",24,25-11-2011 12:20,0.39,14966.0,United Kingdom,2011-11-25,9.36
537233,22652,TRAVEL SEWING KIT,20,06-12-2010 09:37,1.65,17428.0,United Kingdom,2010-06-12,33.0
577358,22222,CAKE PLATE LOVEBIRD WHITE,1,18-11-2011 15:59,9.96,,United Kingdom,2011-11-18,9.96
541239,21080,SET/20 RED RETROSPOT PAPER NAPKINS ,8,16-01-2011 10:56,0.85,16401.0,United Kingdom,2011-01-16,6.8
565665,85150,LADIES & GENTLEMEN METAL SIGN,12,05-09-2011 17:44,2.55,15856.0,United Kingdom,2011-05-09,30.599999999999998
547911,48185,DOORMAT FAIRY CAKE,2,28-03-2011 12:25,7.95,14127.0,United Kingdom,2011-03-28,15.9
566625,35819B,"ACRYLIC HANGING JEWEL,BLUE",36,14-09-2011 09:38,0.38,14911.0,EIRE,2011-09-14,13.68
573070,21755,LOVE BUILDING BLOCK WORD,1,27-10-2011 13:59,6.25,13263.0,United Kingdom,2011-10-27,6.25
575176,23271,CHRISTMAS TABLE SILVER CANDLE SPIKE,7,08-11-2011 18:29,1.63,,United Kingdom,2011-08-11,11.41
545154,22727,ALARM CLOCK BAKELIKE RED ,4,28-02-2011 13:09,3.75,12921.0,United Kingdom,2011-02-28,15.0
572282,22720,SET OF 3 CAKE TINS PANTRY DESIGN ,1,23-10-2011 11:39,4.95,17634.0,United Kingdom,2011-10-23,4.95
579472,22428,ENAMEL FIRE BUCKET CREAM,1,29-11-2011 15:09,6.95,13521.0,United Kingdom,2011-11-29,6.95
579152,22215,CAKE STAND WHITE TWO TIER LACE,2,28-11-2011 13:26,8.5,12479.0,Germany,2011-11-28,17.0
549023,22469,HEART OF WICKER SMALL,2,05-04-2011 16:27,3.29,,United Kingdom,2011-05-04,6.58
540247,22094,RED RETROSPOT TISSUE BOX,1,05-01-2011 15:56,1.25,15464.0,United Kingdom,2011-05-01,1.25
543180,22624,IVORY KITCHEN SCALES,2,04-02-2011 10:38,8.5,12410.0,Switzerland,2011-04-02,17.0
549755,22629,SPACEBOY LUNCH BOX ,24,12-04-2011 11:34,1.95,16843.0,United Kingdom,2011-12-04,46.8
542520,21677,HEARTS  STICKERS,12,28-01-2011 12:21,0.85,15547.0,United Kingdom,2011-01-28,10.2
541094,22294,HEART FILIGREE DOVE  SMALL,6,13-01-2011 13:36,1.25,13246.0,United Kingdom,2011-01-13,7.5
550320,84459A,PINK METAL CHICKEN HEART ,1,17-04-2011 12:37,1.49,12748.0,United Kingdom,2011-04-17,1.49
545895,21905,MORE BUTTER METAL SIGN ,1,07-03-2011 17:14,1.63,,United Kingdom,2011-07-03,1.63
575687,23126,FELTCRAFT GIRL AMELIE KIT,8,10-11-2011 16:03,4.95,16126.0,United Kingdom,2011-10-11,39.6
557222,21080,SET/20 RED RETROSPOT PAPER NAPKINS ,24,17-06-2011 13:14,0.85,14936.0,Channel Islands,2011-06-17,20.4
539437,22728,ALARM CLOCK BAKELIKE PINK,1,17-12-2010 14:54,7.62,,United Kingdom,2010-12-17,7.62
566731,21206,STRAWBERRY HONEYCOMB  GARLAND ,1,14-09-2011 13:37,1.65,17883.0,United Kingdom,2011-09-14,1.65
563213,20972,PINK CREAM FELT CRAFT TRINKET BOX ,5,14-08-2011 12:55,1.25,16115.0,United Kingdom,2011-08-14,6.25
556821,48185,DOORMAT FAIRY CAKE,1,15-06-2011 10:22,14.13,,United Kingdom,2011-06-15,14.13
543518,22087,PAPER BUNTING WHITE LACE,40,09-02-2011 11:21,2.55,12753.0,Japan,2011-09-02,102.0
572037,22970,LONDON BUS COFFEE MUG,2,20-10-2011 12:07,2.55,17365.0,United Kingdom,2011-10-20,5.1
561079,21563,RED HEART SHAPE LOVE BUCKET ,1,24-07-2011 16:12,2.95,13956.0,United Kingdom,2011-07-24,2.95
569887,84946,ANTIQUE SILVER T-LIGHT GLASS,12,06-10-2011 15:28,1.25,13882.0,United Kingdom,2011-06-10,15.0
577057,22372,AIRLINE BAG VINTAGE WORLD CHAMPION ,1,17-11-2011 14:26,4.25,12748.0,United Kingdom,2011-11-17,4.25
572087,21989,PACK OF 20 SKULL PAPER NAPKINS,12,20-10-2011 14:30,0.85,12683.0,France,2011-10-20,10.2
549059,84086C,PINK/PURPLE RETRO RADIO,2,06-04-2011 10:46,2.95,15529.0,United Kingdom,2011-06-04,5.9
550740,22423,REGENCY CAKESTAND 3 TIER,14,20-04-2011 11:33,24.96,,United Kingdom,2011-04-20,349.44
567375,20725,LUNCH BAG RED RETROSPOT,10,20-09-2011 09:45,1.65,14766.0,United Kingdom,2011-09-20,16.5
563808,22175,PINK OWL SOFT TOY,6,19-08-2011 11:46,2.95,12626.0,Germany,2011-08-19,17.700000000000003
569332,23268,SET OF 2 CERAMIC CHRISTMAS REINDEER,6,03-10-2011 13:46,1.45,12637.0,France,2011-03-10,8.7
573340,20726,LUNCH BAG WOODLAND,3,30-10-2011 11:55,1.65,14159.0,United Kingdom,2011-10-30,4.949999999999999
578067,22163,HEART STRING MEMO HOLDER HANGING,9,22-11-2011 15:43,1.63,,United Kingdom,2011-11-22,14.669999999999998
541424,21494,ROTATING LEAVES T-LIGHT HOLDER,2,17-01-2011 17:57,1.63,,United Kingdom,2011-01-17,3.26
561893,21136,PAINTED METAL PEARS ASSORTED,8,31-07-2011 14:39,1.69,12942.0,United Kingdom,2011-07-31,13.52
568346,21733,RED HANGING HEART T-LIGHT HOLDER,2,26-09-2011 15:28,5.79,14096.0,United Kingdom,2011-09-26,11.58
549308,72760B,VINTAGE CREAM 3 BASKET CAKE STAND,2,08-04-2011 09:13,9.95,13767.0,United Kingdom,2011-08-04,19.9
537823,22164,STRING OF STARS CARD HOLDER,1,08-12-2010 14:25,5.91,,United Kingdom,2010-08-12,5.91
539201,22059,CERAMIC STRAWBERRY DESIGN MUG,12,16-12-2010 12:11,1.49,14878.0,United Kingdom,2010-12-16,17.88
548670,84849D,HOT BATHS SOAP HOLDER,3,01-04-2011 15:37,1.69,15356.0,United Kingdom,2011-01-04,5.07
576224,84859A,SILVER DISCO HANDBAG,12,14-11-2011 13:08,1.95,15458.0,United Kingdom,2011-11-14,23.4
550542,22292,HANGING CHICK  YELLOW DECORATION,1,19-04-2011 11:37,2.92,,United Kingdom,2011-04-19,2.92
547063,22924,FRIDGE MAGNETS LA VIE EN ROSE,12,20-03-2011 13:33,0.85,14769.0,United Kingdom,2011-03-20,10.2
580727,22472,TV DINNER TRAY DOLLY GIRL,1,05-12-2011 17:17,10.79,14096.0,United Kingdom,2011-05-12,10.79
565432,21621,VINTAGE UNION JACK BUNTING,2,04-09-2011 13:16,8.5,16241.0,United Kingdom,2011-04-09,17.0
564857,22381,TOY TIDY PINK POLKADOT,2,31-08-2011 09:23,4.96,,United Kingdom,2011-08-31,9.92
565067,22713,CARD I LOVE LONDON ,12,31-08-2011 17:16,0.42,15856.0,United Kingdom,2011-08-31,5.04
542601,21071,VINTAGE BILLBOARD DRINK ME MUG,6,30-01-2011 11:52,1.25,16897.0,United Kingdom,2011-01-30,7.5
546896,22722,SET OF 6 SPICE TINS PANTRY DESIGN,2,17-03-2011 18:24,8.29,,United Kingdom,2011-03-17,16.58
560926,22811,SET OF 6 T-LIGHTS CACTI ,11,22-07-2011 09:20,2.46,,United Kingdom,2011-07-22,27.06
549118,22367,CHILDRENS APRON SPACEBOY DESIGN,8,06-04-2011 13:18,1.95,14911.0,EIRE,2011-06-04,15.6
577331,85066,CREAM SWEETHEART MINI CHEST,2,18-11-2011 14:23,12.75,14667.0,United Kingdom,2011-11-18,25.5
553387,22969,HOMEMADE JAM SCENTED CANDLES,1,16-05-2011 16:33,3.29,,United Kingdom,2011-05-16,3.29
578019,47422,ASSORTED MONKEY SUCTION CUP HOOK,2,22-11-2011 13:11,0.42,17360.0,United Kingdom,2011-11-22,0.84
562377,23548,WRAP MAGIC FOREST ,25,04-08-2011 15:04,0.42,14535.0,United Kingdom,2011-04-08,10.5
574587,23337,EGG FRYING PAN MINT ,6,06-11-2011 10:29,2.08,14936.0,Channel Islands,2011-06-11,12.48
579671,23503,PLAYING CARDS KEEP CALM & CARRY ON,12,30-11-2011 12:38,1.25,12966.0,United Kingdom,2011-11-30,15.0
550496,21791,VINTAGE HEADS AND TAILS CARD GAME ,6,18-04-2011 15:05,2.46,,United Kingdom,2011-04-18,14.76
547650,85099B,JUMBO BAG RED RETROSPOT,3,24-03-2011 12:08,1.95,17059.0,United Kingdom,2011-03-24,5.85
548732,22380,TOY TIDY SPACEBOY  ,5,04-04-2011 10:16,2.1,16142.0,United Kingdom,2011-04-04,10.5
581445,22509,SEWING BOX RETROSPOT DESIGN ,4,08-12-2011 17:12,3.95,17405.0,United Kingdom,2011-08-12,15.8
581571,21755,LOVE BUILDING BLOCK WORD,1,09-12-2011 12:00,6.25,15311.0,United Kingdom,2011-09-12,6.25
560434,21329,DINOSAURS  WRITING SET ,4,18-07-2011 15:56,0.83,,United Kingdom,2011-07-18,3.32
577855,22399,MAGNETS PACK OF 4 CHILDHOOD MEMORY,1,22-11-2011 11:18,1.25,15877.0,United Kingdom,2011-11-22,1.25
573094,22635,CHILDS BREAKFAST SET DOLLY GIRL ,1,27-10-2011 14:39,9.95,15707.0,United Kingdom,2011-10-27,9.95
559551,22855,FINE WICKER HEART ,1,10-07-2011 16:18,1.25,16877.0,United Kingdom,2011-10-07,1.25
552867,22729,ALARM CLOCK BAKELIKE ORANGE,4,12-05-2011 08:36,3.75,15513.0,United Kingdom,2011-12-05,15.0
560580,22057,CERAMIC PLATE STRAWBERRY DESIGN,60,19-07-2011 15:23,1.25,14088.0,United Kingdom,2011-07-19,75.0
560580,22505,MEMO BOARD COTTAGE DESIGN,28,19-07-2011 15:23,4.25,14088.0,United Kingdom,2011-07-19,119.0
578833,22867,HAND WARMER BIRD DESIGN,1,25-11-2011 15:23,4.96,,United Kingdom,2011-11-25,4.96
537219,22144,CHRISTMAS CRAFT LITTLE FRIENDS,2,05-12-2010 15:47,2.1,14081.0,United Kingdom,2010-05-12,4.2
537646,22837,HOT WATER BOTTLE BABUSHKA ,1,07-12-2010 15:39,4.65,17591.0,United Kingdom,2010-07-12,4.65
559424,84946,ANTIQUE SILVER T-LIGHT GLASS,30,08-07-2011 12:14,1.25,18121.0,United Kingdom,2011-08-07,37.5
549813,84687,BEACH HUT SHELF W 3 DRAWERS,1,12-04-2011 12:16,5.95,17972.0,United Kingdom,2011-12-04,5.95
570872,90120B,BLUE MURANO TWIST BRACELET,1,12-10-2011 16:40,4.15,,United Kingdom,2011-12-10,4.15
571909,72818,CHRISTMAS DECOUPAGE CANDLE,4,19-10-2011 15:08,0.39,15006.0,United Kingdom,2011-10-19,1.56
547490,21459,YELLOW EASTER EGG HUNT START POST,1,23-03-2011 11:48,1.95,17507.0,United Kingdom,2011-03-23,1.95
556932,20749,ASSORTED COLOUR MINI CASES,1,15-06-2011 15:41,16.63,,United Kingdom,2011-06-15,16.63
553013,47559B,TEA TIME OVEN GLOVE,1,12-05-2011 18:19,2.46,,United Kingdom,2011-12-05,2.46
578017,21213,PACK OF 72 SKULL CAKE CASES,1,22-11-2011 13:07,0.55,13569.0,United Kingdom,2011-11-22,0.55
547892,22328,ROUND SNACK BOXES SET OF 4 FRUITS ,6,28-03-2011 10:15,2.95,12669.0,France,2011-03-28,17.700000000000003
578811,22650,CERAMIC PIRATE CHEST MONEY BANK,24,25-11-2011 13:28,1.45,12438.0,Norway,2011-11-25,34.8
556425,22629,SPACEBOY LUNCH BOX ,6,10-06-2011 12:51,1.95,14178.0,United Kingdom,2011-10-06,11.7
559807,22227,HANGING HEART MIRROR DECORATION ,15,12-07-2011 14:48,0.65,17841.0,United Kingdom,2011-12-07,9.75
575739,23272,TREE T-LIGHT HOLDER WILLIE WINKIE,1,11-11-2011 09:05,3.29,,United Kingdom,2011-11-11,3.29
546388,21232,STRAWBERRY CERAMIC TRINKET BOX,15,11-03-2011 13:43,3.29,,United Kingdom,2011-11-03,49.35
558904,85214,TUB 24 PINK FLOWER PEGS,4,04-07-2011 16:18,1.63,,United Kingdom,2011-04-07,6.52
545568,21621,VINTAGE UNION JACK BUNTING,1,03-03-2011 16:22,8.5,,United Kingdom,2011-03-03,8.5
577783,22666,RECIPE BOX PANTRY YELLOW DESIGN,12,21-11-2011 16:20,2.95,18139.0,United Kingdom,2011-11-21,35.400000000000006
556882,82483,WOOD 2 DRAWER CABINET WHITE FINISH,2,15-06-2011 12:21,6.95,14395.0,United Kingdom,2011-06-15,13.9
544087,22835,HOT WATER BOTTLE I AM SO POORLY,2,15-02-2011 17:02,4.65,17530.0,United Kingdom,2011-02-15,9.3
578270,85129D,BEADED CRYSTAL HEART PINK SMALL,1,23-11-2011 13:39,2.46,14096.0,United Kingdom,2011-11-23,2.46
562717,22419,LIPSTICK PEN RED,1,08-08-2011 15:42,0.83,,United Kingdom,2011-08-08,0.83
566221,22488,NATURAL SLATE RECTANGLE CHALKBOARD,1,09-09-2011 16:13,3.29,,United Kingdom,2011-09-09,3.29
566726,22601,CHRISTMAS RETROSPOT ANGEL WOOD,2,14-09-2011 13:12,0.85,15021.0,United Kingdom,2011-09-14,1.7
556428,48185,DOORMAT FAIRY CAKE,1,10-06-2011 13:23,14.13,,United Kingdom,2011-10-06,14.13
547832,21947,SET OF 6 HEART CHOPSTICKS,12,25-03-2011 16:25,1.25,17511.0,United Kingdom,2011-03-25,15.0
562551,22907,PACK OF 20 NAPKINS PANTRY DESIGN,4,05-08-2011 16:19,0.85,17231.0,United Kingdom,2011-05-08,3.4
567672,85123A,WHITE HANGING HEART T-LIGHT HOLDER,6,21-09-2011 15:39,2.95,16085.0,United Kingdom,2011-09-21,17.700000000000003
560024,37450,CERAMIC CAKE BOWL + HANGING CAKES,2,14-07-2011 13:00,2.95,15005.0,United Kingdom,2011-07-14,5.9
538437,20682,RED RETROSPOT CHILDRENS UMBRELLA,1,12-12-2010 12:18,3.25,16010.0,United Kingdom,2010-12-12,3.25
543005,22621,TRADITIONAL KNITTING NANCY,12,02-02-2011 12:42,1.45,16378.0,United Kingdom,2011-02-02,17.4
556237,22659,LUNCH BOX I LOVE LONDON,1,09-06-2011 15:34,4.13,,United Kingdom,2011-09-06,4.13
546778,21161,KEEP OUT BOYS DOOR HANGER ,3,16-03-2011 16:38,1.45,14572.0,United Kingdom,2011-03-16,4.35
550630,17013D,ORIGAMI ROSE INCENSE IN TUBE,96,19-04-2011 14:49,0.42,14298.0,United Kingdom,2011-04-19,40.32
550828,22896,PEG BAG APPLES DESIGN,1,21-04-2011 10:19,2.55,17315.0,United Kingdom,2011-04-21,2.55
542303,22107,PIZZA PLATE IN BOX,4,27-01-2011 11:05,3.75,12539.0,Spain,2011-01-27,15.0
568800,22141,CHRISTMAS CRAFT TREE TOP ANGEL,12,29-09-2011 10:45,2.1,14868.0,United Kingdom,2011-09-29,25.200000000000003
562113,23346,SPACEBOY BEAKER,2,02-08-2011 16:11,2.46,,United Kingdom,2011-02-08,4.92
573585,22984,CARD GINGHAM ROSE ,1,31-10-2011 14:41,0.83,,United Kingdom,2011-10-31,0.83
552329,23206,LUNCH BAG APPLE DESIGN,10,09-05-2011 10:06,1.65,13492.0,Switzerland,2011-09-05,16.5
574074,22571,ROCKING HORSE RED CHRISTMAS ,5,02-11-2011 15:33,1.63,,United Kingdom,2011-02-11,8.149999999999999
574950,23360,SET 8 CANDLES VINTAGE DOILY,1,08-11-2011 09:29,4.13,,United Kingdom,2011-08-11,4.13
550471,21080,SET/20 RED RETROSPOT PAPER NAPKINS ,2,18-04-2011 13:52,1.63,,United Kingdom,2011-04-18,3.26
552677,21773,DECORATIVE ROSE BATHROOM BOTTLE,1,10-05-2011 15:07,2.46,,United Kingdom,2011-10-05,2.46
570862,46000M,POLYESTER FILLER PAD 45x45cm,12,12-10-2011 15:35,1.55,17528.0,United Kingdom,2011-12-10,18.6
564337,16259,PIECE OF CAMO STATIONERY SET,108,24-08-2011 14:40,0.08,12649.0,Germany,2011-08-24,8.64
569372,23357,HOT WATER BOTTLE SEX BOMB,1,03-10-2011 16:04,10.79,,United Kingdom,2011-03-10,10.79
541497,21509,COWBOYS AND INDIANS BIRTHDAY CARD ,2,18-01-2011 15:19,0.83,,United Kingdom,2011-01-18,1.66
539436,84596B,SMALL DOLLY MIX DESIGN ORANGE BOWL,1,17-12-2010 14:49,2.51,,United Kingdom,2010-12-17,2.51
538524,85131B,BEADED CRYSTAL HEART GREEN ON STICK,1,13-12-2010 09:35,0.85,,United Kingdom,2010-12-13,0.85
564312,84997A,CHILDRENS CUTLERY POLKADOT GREEN ,72,24-08-2011 12:52,3.75,15769.0,United Kingdom,2011-08-24,270.0
561195,21382,SET/4 SPRING FLOWER DECORATION,4,25-07-2011 13:57,0.75,14796.0,United Kingdom,2011-07-25,3.0
538849,22073,RED RETROSPOT STORAGE JAR,1,14-12-2010 13:31,3.75,14415.0,United Kingdom,2010-12-14,3.75
567622,23424,GINGHAM RECIPE BOOK BOX,1,21-09-2011 12:46,4.95,14527.0,United Kingdom,2011-09-21,4.95
560368,85170D,SET/6 PINK BIRD T-LIGHT CANDLES,1,18-07-2011 12:25,2.1,17841.0,United Kingdom,2011-07-18,2.1
573548,23144,ZINC T-LIGHT HOLDER STARS SMALL,3,31-10-2011 13:22,0.83,13680.0,United Kingdom,2011-10-31,2.4899999999999998
542633,84031A,CHARLIE+LOLA RED HOT WATER BOTTLE ,1,31-01-2011 10:31,9.13,,United Kingdom,2011-01-31,9.13
557278,22026,BANQUET BIRTHDAY  CARD  ,12,19-06-2011 12:08,0.42,13089.0,United Kingdom,2011-06-19,5.04
558388,22413,METAL SIGN TAKE IT OR LEAVE IT ,6,29-06-2011 10:00,2.95,,EIRE,2011-06-29,17.700000000000003
577711,23352,ROLL WRAP 50'S RED CHRISTMAS ,2,21-11-2011 12:17,1.25,15527.0,United Kingdom,2011-11-21,2.5
563626,22384,LUNCH BAG PINK POLKADOT,10,18-08-2011 10:31,1.65,16187.0,United Kingdom,2011-08-18,16.5
571229,22577,WOODEN HEART CHRISTMAS SCANDINAVIAN,7,14-10-2011 14:04,0.29,15453.0,United Kingdom,2011-10-14,2.03
537130,21539,RED RETROSPOT BUTTER DISH,1,05-12-2010 12:23,4.95,17796.0,United Kingdom,2010-05-12,4.95
539475,22197,SMALL POPCORN HOLDER,1,19-12-2010 14:41,0.85,16686.0,United Kingdom,2010-12-19,0.85
572037,23192,BUNDLE OF 3 ALPHABET EXERCISE BOOKS,6,20-10-2011 12:07,1.65,17365.0,United Kingdom,2011-10-20,9.899999999999999
550636,22297,HEART IVORY TRELLIS SMALL,1,19-04-2011 15:37,2.46,,United Kingdom,2011-04-19,2.46
541873,22349,DOG BOWL CHASING BALL DESIGN,6,24-01-2011 09:52,3.75,14368.0,United Kingdom,2011-01-24,22.5
551351,21171,BATHROOM METAL SIGN ,24,28-04-2011 10:20,1.25,14298.0,United Kingdom,2011-04-28,30.0
553718,85087,CANDY SPOT CUSHION COVER,1,18-05-2011 16:14,3.29,,United Kingdom,2011-05-18,3.29
549590,21213,PACK OF 72 SKULL CAKE CASES,120,11-04-2011 10:09,0.42,13324.0,United Kingdom,2011-11-04,50.4
571247,23404,HOME SWEET HOME BLACKBOARD,6,14-10-2011 16:04,4.95,15826.0,United Kingdom,2011-10-14,29.700000000000003
580520,21912,VINTAGE SNAKES & LADDERS,1,04-12-2011 14:55,3.75,13521.0,United Kingdom,2011-04-12,3.75
536612,82486,WOOD S/3 CABINET ANT WHITE FINISH,2,02-12-2010 09:44,6.95,17850.0,United Kingdom,2010-02-12,13.9
560224,21754,HOME BUILDING BLOCK WORD,2,15-07-2011 16:06,5.95,14572.0,United Kingdom,2011-07-15,11.9
558608,90204,PAIR OF ENAMEL BUTTERFLY HAIRCLIP,4,30-06-2011 15:30,3.35,12524.0,Germany,2011-06-30,13.4
560555,22098,BOUDOIR SQUARE TISSUE BOX,1,19-07-2011 13:01,0.39,14178.0,United Kingdom,2011-07-19,0.39
545661,21975,PACK OF 60 DINOSAUR CAKE CASES,24,04-03-2011 14:41,0.55,15358.0,United Kingdom,2011-04-03,13.200000000000001
548712,22666,RECIPE BOX PANTRY YELLOW DESIGN,3,03-04-2011 14:42,2.95,17050.0,United Kingdom,2011-03-04,8.850000000000001
547498,22248,DECORATION  PINK CHICK MAGIC GARDEN,1,23-03-2011 12:24,0.85,15021.0,United Kingdom,2011-03-23,0.85
577078,21884,CAKES AND BOWS GIFT  TAPE,1,17-11-2011 15:17,1.63,,United Kingdom,2011-11-17,1.63
540473,21977,PACK OF 60 PINK PAISLEY CAKE CASES,2,07-01-2011 14:31,0.55,17284.0,United Kingdom,2011-07-01,1.1
558643,22663,JUMBO BAG DOLLY GIRL DESIGN,10,01-07-2011 09:51,2.08,13534.0,United Kingdom,2011-01-07,20.8
550214,22659,LUNCH BOX I LOVE LONDON,3,15-04-2011 10:43,2.46,,United Kingdom,2011-04-15,7.38
554348,21754,HOME BUILDING BLOCK WORD,3,24-05-2011 08:49,5.95,13523.0,United Kingdom,2011-05-24,17.85
553657,22060,LARGE CAKE STAND HANGING HEARTS,1,18-05-2011 11:28,3.95,14583.0,United Kingdom,2011-05-18,3.95
579505,22197,POPCORN HOLDER,300,29-11-2011 16:31,0.72,13078.0,United Kingdom,2011-11-29,216.0
553202,21733,RED HANGING HEART T-LIGHT HOLDER,6,15-05-2011 16:02,2.95,15854.0,United Kingdom,2011-05-15,17.700000000000003
572853,23436,VINTAGE CHRISTMAS GIFT BAG LARGE ,12,26-10-2011 12:28,1.25,17712.0,United Kingdom,2011-10-26,15.0
545037,48187,DOORMAT NEW ENGLAND,2,27-02-2011 10:02,7.95,14532.0,United Kingdom,2011-02-27,15.9
564221,22623,BOX OF VINTAGE JIGSAW BLOCKS ,2,24-08-2011 09:36,10.79,,United Kingdom,2011-08-24,21.58
540813,22662,LUNCH BAG DOLLY GIRL DESIGN,3,11-01-2011 12:41,1.65,14669.0,United Kingdom,2011-11-01,4.949999999999999
569105,85099B,JUMBO BAG RED RETROSPOT,2,30-09-2011 12:35,2.08,16729.0,United Kingdom,2011-09-30,4.16
571445,22629,SPACEBOY LUNCH BOX ,12,17-10-2011 13:44,1.95,12463.0,Belgium,2011-10-17,23.4
555149,85131D,BEADED CRYSTAL HEART PINK ON STICK,27,31-05-2011 15:49,0.83,,United Kingdom,2011-05-31,22.41
539933,85230F,JASMINE VOTIVE CANDLE,24,23-12-2010 11:24,0.29,15235.0,United Kingdom,2010-12-23,6.959999999999999
550997,21933,PINK VINTAGE PAISLEY PICNIC BAG,10,26-04-2011 09:04,1.65,17735.0,United Kingdom,2011-04-26,16.5
541848,22175,PINK OWL SOFT TOY,2,23-01-2011 13:31,2.95,17611.0,United Kingdom,2011-01-23,5.9
576245,20725,LUNCH BAG RED RETROSPOT,10,14-11-2011 13:40,1.65,12553.0,France,2011-11-14,16.5
551148,22197,SMALL POPCORN HOLDER,12,26-04-2011 14:12,0.85,15939.0,United Kingdom,2011-04-26,10.2
538635,84985A,SET OF 72 GREEN PAPER DOILIES,1,13-12-2010 13:32,1.45,17303.0,United Kingdom,2010-12-13,1.45
567474,21874,GIN AND TONIC MUG,6,20-09-2011 12:53,1.65,13448.0,United Kingdom,2011-09-20,9.899999999999999
579297,82600,N0 SINGING METAL SIGN,2,29-11-2011 11:23,4.13,,United Kingdom,2011-11-29,8.26
536947,21210,SET OF 72 RETROSPOT PAPER  DOILIES,12,03-12-2010 12:29,1.45,13013.0,United Kingdom,2010-03-12,17.4
540397,22862,LOVE HEART NAPKIN BOX ,1,06-01-2011 18:57,4.25,13187.0,United Kingdom,2011-06-01,4.25
537153,21703,BAG 125g SWIRLY MARBLES,10,05-12-2010 13:03,0.42,16718.0,United Kingdom,2010-05-12,4.2
580727,22662,LUNCH BAG DOLLY GIRL DESIGN,1,05-12-2011 17:17,4.13,14096.0,United Kingdom,2011-05-12,4.13
572030,21770,OPEN CLOSED METAL SIGN,4,20-10-2011 11:51,4.95,14923.0,United Kingdom,2011-10-20,19.8
556732,23203,JUMBO BAG DOILEY PATTERNS,10,14-06-2011 11:47,2.08,15039.0,United Kingdom,2011-06-14,20.8
566976,23188,VINTAGE  2 METER FOLDING RULER,12,16-09-2011 09:27,1.65,15382.0,United Kingdom,2011-09-16,19.799999999999997
550900,20723,STRAWBERRY CHARLOTTE BAG,40,21-04-2011 12:11,0.85,16553.0,United Kingdom,2011-04-21,34.0
553191,22927,GREEN GIANT GARDEN THERMOMETER,4,15-05-2011 13:22,5.95,13118.0,United Kingdom,2011-05-15,23.8
578006,23494,VINTAGE DOILY DELUXE SEWING KIT ,3,22-11-2011 12:40,5.95,13363.0,United Kingdom,2011-11-22,17.85
539745,22352,LUNCH BOX WITH CUTLERY RETROSPOT ,1,21-12-2010 15:21,5.06,,United Kingdom,2010-12-21,5.06
569691,21165,BEWARE OF THE CAT METAL SIGN ,12,05-10-2011 15:09,1.69,18223.0,United Kingdom,2011-05-10,20.28
537759,22575,METAL MERRY CHRISTMAS WREATH,8,08-12-2010 11:42,1.95,13126.0,United Kingdom,2010-08-12,15.6
556776,21058,PARTY INVITES WOODLAND,2,14-06-2011 12:24,0.85,14730.0,United Kingdom,2011-06-14,1.7
561773,22854,CREAM SWEETHEART EGG HOLDER,1,29-07-2011 12:41,4.95,17841.0,United Kingdom,2011-07-29,4.95
580160,22661,CHARLOTTE BAG DOLLY GIRL DESIGN,10,02-12-2011 10:47,0.85,12700.0,France,2011-02-12,8.5
576236,22751,FELTCRAFT PRINCESS OLIVIA DOLL,1,14-11-2011 13:31,3.75,13755.0,United Kingdom,2011-11-14,3.75
562769,20725,LUNCH BAG RED RETROSPOT,10,09-08-2011 10:52,1.65,14409.0,United Kingdom,2011-09-08,16.5
567475,84692,BOX OF 24 COCKTAIL PARASOLS,4,20-09-2011 13:11,0.42,16360.0,United Kingdom,2011-09-20,1.68
561241,23307,SET OF 60 PANTRY DESIGN CAKE CASES ,24,26-07-2011 11:00,0.55,13930.0,United Kingdom,2011-07-26,13.200000000000001
561330,22969,HOMEMADE JAM SCENTED CANDLES,12,26-07-2011 14:03,1.45,16019.0,United Kingdom,2011-07-26,17.4
548739,72130,COLUMBIAN CANDLE ROUND,4,04-04-2011 11:28,0.65,15493.0,United Kingdom,2011-04-04,2.6
556905,21269,ANTIQUE CREAM CUTLERY SHELF ,1,15-06-2011 13:05,8.5,16904.0,United Kingdom,2011-06-15,8.5
550000,22427,ENAMEL FLOWER JUG CREAM,3,14-04-2011 09:18,5.95,17058.0,United Kingdom,2011-04-14,17.85
542664,84969,BOX OF 6 ASSORTED COLOUR TEASPOONS,1,31-01-2011 12:14,3.29,,United Kingdom,2011-01-31,3.29
560079,21790,VINTAGE SNAP CARDS,12,14-07-2011 16:12,0.85,15521.0,United Kingdom,2011-07-14,10.2
567509,21975,PACK OF 60 DINOSAUR CAKE CASES,24,20-09-2011 14:51,0.42,14298.0,United Kingdom,2011-09-20,10.08
572703,23266,SET OF 3 WOODEN STOCKING DECORATION,2,25-10-2011 14:35,1.25,16110.0,United Kingdom,2011-10-25,2.5
543777,90180A,BLACK+WHITE NECKLACE W TASSEL,1,11-02-2011 16:20,9.95,15406.0,United Kingdom,2011-11-02,9.95
564065,23077,DOUGHNUT LIP GLOSS ,20,22-08-2011 15:05,1.25,15150.0,United Kingdom,2011-08-22,25.0
564757,17012D,ORIGAMI ROSE INCENSE/CANDLE SET ,1,30-08-2011 10:36,2.46,,United Kingdom,2011-08-30,2.46
560368,22551,PLASTERS IN TIN SPACEBOY,7,18-07-2011 12:25,1.65,17841.0,United Kingdom,2011-07-18,11.549999999999999
571289,20682,RED RETROSPOT CHILDRENS UMBRELLA,24,16-10-2011 15:27,3.25,15113.0,United Kingdom,2011-10-16,78.0
537208,84558A,3D DOG PICTURE PLAYING CARDS,1,05-12-2010 15:12,2.95,15889.0,United Kingdom,2010-05-12,2.95
544202,20712,JUMBO BAG WOODLAND ANIMALS,2,17-02-2011 10:29,4.13,,United Kingdom,2011-02-17,8.26
544634,20674,GREEN POLKADOT BOWL,3,22-02-2011 11:02,1.25,17994.0,United Kingdom,2011-02-22,3.75
571257,22818,CARD CHRISTMAS VILLAGE,2,14-10-2011 17:17,0.42,,United Kingdom,2011-10-14,0.84
568141,22141,CHRISTMAS CRAFT TREE TOP ANGEL,1,25-09-2011 11:21,2.1,16326.0,United Kingdom,2011-09-25,2.1
539676,22396,MAGNETS PACK OF 4 RETRO PHOTO,24,21-12-2010 10:54,0.42,12423.0,Belgium,2010-12-21,10.08
561034,82567,"AIRLINE LOUNGE,METAL SIGN",3,24-07-2011 11:45,2.1,15506.0,United Kingdom,2011-07-24,6.300000000000001
579196,22593,CHRISTMAS GINGHAM STAR,7,28-11-2011 15:54,1.63,14096.0,United Kingdom,2011-11-28,11.41
558475,20667,CHERRY BLOSSOM PURSE,2,29-06-2011 15:58,2.46,,United Kingdom,2011-06-29,4.92
580505,85150,LADIES & GENTLEMEN METAL SIGN,2,04-12-2011 13:32,2.55,15867.0,United Kingdom,2011-04-12,5.1
556486,23210,WHITE ROCKING HORSE HAND PAINTED,24,12-06-2011 13:22,1.25,17422.0,United Kingdom,2011-12-06,30.0
557848,21373,MIRRORED WALL ART SNOWFLAKES,12,23-06-2011 10:52,0.75,15220.0,United Kingdom,2011-06-23,9.0
572195,23426,METAL SIGN DROP YOUR PANTS,2,21-10-2011 11:49,2.89,14562.0,United Kingdom,2011-10-21,5.78
580320,85099F,JUMBO BAG STRAWBERRY,10,02-12-2011 15:40,2.08,15078.0,United Kingdom,2011-02-12,20.8
544200,21936,RED RETROSPOT PICNIC BAG,5,17-02-2011 10:08,2.95,12494.0,France,2011-02-17,14.75
563732,23203,JUMBO BAG VINTAGE DOILY ,100,18-08-2011 17:50,1.79,15125.0,United Kingdom,2011-08-18,179.0
570002,21535,RED RETROSPOT SMALL MILK JUG,6,07-10-2011 09:16,2.55,12477.0,Germany,2011-07-10,15.299999999999999
555525,22088,PAPER BUNTING COLOURED LACE,6,05-06-2011 11:40,2.95,14709.0,United Kingdom,2011-05-06,17.700000000000003
549250,20674,GREEN POLKADOT BOWL,1,07-04-2011 12:10,1.25,14446.0,United Kingdom,2011-07-04,1.25
576394,22384,LUNCH BAG PINK POLKADOT,100,15-11-2011 10:32,1.45,12415.0,Australia,2011-11-15,145.0
561388,23198,PANTRY MAGNETIC  SHOPPING LIST,96,27-07-2011 09:32,1.25,12753.0,Japan,2011-07-27,120.0
539094,85099B,JUMBO BAG RED RETROSPOT,10,16-12-2010 10:12,1.95,13021.0,United Kingdom,2010-12-16,19.5
559125,22329,ROUND CONTAINER SET OF 5 RETROSPOT,12,06-07-2011 12:32,1.65,13985.0,United Kingdom,2011-06-07,19.799999999999997
539039,22291,HANGING CHICK CREAM DECORATION,24,15-12-2010 15:00,1.45,13124.0,United Kingdom,2010-12-15,34.8
572058,23052,RECYCLED ACAPULCO MAT TURQUOISE,1,20-10-2011 12:43,8.25,18252.0,United Kingdom,2011-10-20,8.25
573780,22727,ALARM CLOCK BAKELIKE RED ,4,01-11-2011 11:12,3.75,17503.0,United Kingdom,2011-01-11,15.0
572318,23210,WHITE ROCKING HORSE HAND PAINTED,3,23-10-2011 16:19,1.25,15436.0,United Kingdom,2011-10-23,3.75
542255,35923,CANDY HEART HANGING DECORATION,1,26-01-2011 16:43,2.46,,United Kingdom,2011-01-26,2.46
574891,22196,SMALL HEART MEASURING SPOONS,1,07-11-2011 14:28,0.85,14606.0,United Kingdom,2011-07-11,0.85
576618,22419,LIPSTICK PEN RED,9,15-11-2011 17:00,0.83,,United Kingdom,2011-11-15,7.47
581378,21172,PARTY METAL SIGN ,3,08-12-2011 12:50,1.45,17673.0,United Kingdom,2011-08-12,4.35
553198,21791,VINTAGE HEADS AND TAILS CARD GAME ,12,15-05-2011 14:48,1.25,13752.0,United Kingdom,2011-05-15,15.0
572889,22078,RIBBON REEL LACE DESIGN ,5,26-10-2011 13:56,2.1,12748.0,United Kingdom,2011-10-26,10.5
538071,22170,PICTURE FRAME WOOD TRIPLE PORTRAIT,1,09-12-2010 14:09,13.57,,United Kingdom,2010-09-12,13.57
553718,22502,PICNIC BASKET WICKER SMALL,1,18-05-2011 16:14,10.79,,United Kingdom,2011-05-18,10.79
578666,85059,FRENCH ENAMEL WATER BASIN,4,24-11-2011 17:06,3.75,17727.0,United Kingdom,2011-11-24,15.0
565466,23200,JUMBO BAG PEARS,10,05-09-2011 09:48,2.08,12422.0,Australia,2011-05-09,20.8
550471,22029,SPACEBOY BIRTHDAY CARD,2,18-04-2011 13:52,0.83,,United Kingdom,2011-04-18,1.66
539002,82484,WOOD BLACK BOARD ANT WHITE FINISH,2,15-12-2010 12:30,6.45,14527.0,United Kingdom,2010-12-15,12.9
577058,20983,12 PENCILS TALL TUBE RED RETROSPOT,2,17-11-2011 14:29,0.85,18122.0,United Kingdom,2011-11-17,1.7
567474,21172,PARTY METAL SIGN ,6,20-09-2011 12:53,1.45,13448.0,United Kingdom,2011-09-20,8.7
577078,23300,GARDENERS KNEELING PAD CUP OF TEA ,1,17-11-2011 15:17,3.29,,United Kingdom,2011-11-17,3.29
538349,21428,SET3 BOOK BOX GREEN GINGHAM FLOWER ,1,10-12-2010 14:59,8.47,,United Kingdom,2010-10-12,8.47
562843,23168,CLASSIC CAFE SUGAR DISPENSER,1,09-08-2011 17:37,2.46,,United Kingdom,2011-09-08,2.46
552687,20718,RED RETROSPOT SHOPPER BAG,1,10-05-2011 15:09,3.29,,United Kingdom,2011-10-05,3.29
544791,21285,RETROSPOT CANDLE  MEDIUM,12,23-02-2011 12:33,2.1,14289.0,United Kingdom,2011-02-23,25.200000000000003
558484,22423,REGENCY CAKESTAND 3 TIER,6,30-06-2011 10:09,12.75,14267.0,United Kingdom,2011-06-30,76.5
556093,21430,SET/3 RED GINGHAM ROSE STORAGE BOX,2,08-06-2011 15:26,7.46,,United Kingdom,2011-08-06,14.92
561218,85099B,JUMBO BAG RED RETROSPOT,1,25-07-2011 17:11,4.13,,United Kingdom,2011-07-25,4.13
575698,23307,SET OF 60 PANTRY DESIGN CAKE CASES ,24,10-11-2011 16:51,0.55,16094.0,United Kingdom,2011-10-11,13.200000000000001
537240,22321,BIRD DECORATION RED RETROSPOT,1,06-12-2010 10:08,1.66,,United Kingdom,2010-06-12,1.66
571190,22959,WRAP CHRISTMAS VILLAGE,25,14-10-2011 11:43,0.42,17771.0,United Kingdom,2011-10-14,10.5
542890,47422,ASSORTED MONKEY SUCTION CUP HOOK,120,01-02-2011 13:25,0.36,15311.0,United Kingdom,2011-01-02,43.199999999999996
547200,48111,DOORMAT 3 SMILEY CATS,1,21-03-2011 13:01,7.95,16036.0,United Kingdom,2011-03-21,7.95
578844,22726,ALARM CLOCK BAKELIKE GREEN,1,25-11-2011 16:14,7.46,,United Kingdom,2011-11-25,7.46
562031,23146,TRIPLE HOOK ANTIQUE IVORY ROSE,4,01-08-2011 17:37,3.29,16984.0,United Kingdom,2011-01-08,13.16
578275,84029G,KNITTED UNION FLAG HOT WATER BOTTLE,1,23-11-2011 13:46,4.25,15916.0,United Kingdom,2011-11-23,4.25
572213,21503,TOYBOX  WRAP ,25,21-10-2011 12:44,0.42,15358.0,United Kingdom,2011-10-21,10.5
572741,23583,LUNCH BAG PAISLEY PARK  ,10,25-10-2011 15:47,1.65,14341.0,United Kingdom,2011-10-25,16.5
573137,22099,CARAVAN SQUARE TISSUE BOX,1,27-10-2011 17:15,2.46,,United Kingdom,2011-10-27,2.46
575137,22138,BAKING SET 9 PIECE RETROSPOT ,48,08-11-2011 15:13,4.25,13090.0,United Kingdom,2011-08-11,204.0
561868,20727,LUNCH BAG  BLACK SKULL.,3,31-07-2011 11:26,1.65,16813.0,United Kingdom,2011-07-31,4.949999999999999
546892,22348,TEA BAG PLATE RED RETROSPOT,2,17-03-2011 18:20,1.63,,United Kingdom,2011-03-17,3.26
552669,22989,SET 2 PANTRY DESIGN TEA TOWELS,4,10-05-2011 15:05,3.25,16710.0,United Kingdom,2011-10-05,13.0
566872,23238,SET OF 4 KNICK KNACK TINS LONDON ,1,15-09-2011 13:28,4.15,16729.0,United Kingdom,2011-09-15,4.15
550447,23176,ABC TREASURE BOOK BOX ,1,18-04-2011 12:36,2.25,16033.0,United Kingdom,2011-04-18,2.25
574477,22595,GINGHAM HEART DECORATION,8,04-11-2011 12:21,0.85,15453.0,United Kingdom,2011-04-11,6.8
580612,20961,STRAWBERRY BATH SPONGE ,1,05-12-2011 11:58,2.46,,United Kingdom,2011-05-12,2.46
569231,84247E,PACK OF 12 CHRISTMAS FUN CARDS,1,02-10-2011 15:18,2.95,13379.0,United Kingdom,2011-02-10,2.95
538040,20961,STRAWBERRY BATH SPONGE ,2,09-12-2010 13:08,1.25,16520.0,United Kingdom,2010-09-12,2.5
573385,22633,HAND WARMER UNION JACK,24,30-10-2011 14:21,2.1,13421.0,United Kingdom,2011-10-30,50.400000000000006
576787,21238,RED RETROSPOT CUP,16,16-11-2011 13:54,0.85,13815.0,Germany,2011-11-16,13.6
546250,22499,WOODEN UNION JACK BUNTING,3,10-03-2011 14:14,5.95,14350.0,United Kingdom,2011-10-03,17.85
550638,84992,72 SWEETHEART FAIRY CAKE CASES,1,19-04-2011 15:44,1.25,,United Kingdom,2011-04-19,1.25
549874,22136,LOVE HEART SOCK HANGER,4,12-04-2011 15:23,1.65,16919.0,United Kingdom,2011-12-04,6.6
547134,22887,NUMBER TILE VINTAGE FONT 8,2,21-03-2011 11:57,1.95,15996.0,United Kingdom,2011-03-21,3.9
557621,23172,REGENCY TEA PLATE PINK,12,21-06-2011 14:00,1.65,12444.0,Norway,2011-06-21,19.799999999999997
553189,21124,SET/10 BLUE POLKADOT PARTY CANDLES,2,15-05-2011 13:14,1.25,15033.0,United Kingdom,2011-05-15,2.5
558066,21189,WHITE HONEYCOMB PAPER GARLAND ,4,24-06-2011 15:45,3.29,,United Kingdom,2011-06-24,13.16
579694,21452,TOADSTOOL MONEY BOX,1,30-11-2011 14:11,4.96,,United Kingdom,2011-11-30,4.96
537638,22121,NOEL WOODEN BLOCK LETTERS ,1,07-12-2010 15:28,11.87,,United Kingdom,2010-07-12,11.87
581237,23552,BICYCLE PUNCTURE REPAIR KIT ,1,08-12-2011 10:40,2.08,15443.0,United Kingdom,2011-08-12,2.08
557626,22672,FRENCH BATHROOM SIGN BLUE METAL,12,21-06-2011 14:29,1.65,14175.0,United Kingdom,2011-06-21,19.799999999999997
551008,DOT,DOTCOM POSTAGE,1,26-04-2011 09:50,122.5,,United Kingdom,2011-04-26,122.5
547850,22266,EASTER DECORATION HANGING BUNNY,4,27-03-2011 12:06,0.65,14472.0,United Kingdom,2011-03-27,2.6
565845,23200,JUMBO BAG PEARS,30,07-09-2011 12:21,2.08,14709.0,United Kingdom,2011-07-09,62.400000000000006
551966,82567,"AIRLINE LOUNGE,METAL SIGN",2,05-05-2011 13:14,2.1,15356.0,United Kingdom,2011-05-05,4.2
546928,20886,BOX OF 9 PEBBLE CANDLES,24,18-03-2011 10:16,1.95,17685.0,United Kingdom,2011-03-18,46.8
543358,21002,ROSE DU SUD DRAWSTRING BAG,5,07-02-2011 14:04,3.29,,United Kingdom,2011-07-02,16.45
541497,22250,DECORATION  BUTTERFLY  MAGIC GARDEN,2,18-01-2011 15:19,0.79,,United Kingdom,2011-01-18,1.58
577016,75049L,LARGE CIRCULAR MIRROR MOBILE,6,17-11-2011 12:21,1.25,17095.0,United Kingdom,2011-11-17,7.5
539958,90013D,PURPLE VINTAGE EARRINGS,3,23-12-2010 13:26,4.24,,United Kingdom,2010-12-23,12.72
573119,21207,SKULL AND CROSSBONES  GARLAND ,12,27-10-2011 16:21,1.65,15498.0,United Kingdom,2011-10-27,19.799999999999997
540026,22342,HOME GARLAND PAINTED ZINC ,6,04-01-2011 13:25,1.66,,United Kingdom,2011-04-01,9.959999999999999
548191,22087,PAPER BUNTING WHITE LACE,1,29-03-2011 15:20,5.79,,United Kingdom,2011-03-29,5.79
573035,47503A,ASS FLORAL PRINT MULTI SCREWDRIVER,24,27-10-2011 13:43,0.42,12433.0,Norway,2011-10-27,10.08
541811,21700,BIG DOUGHNUT FRIDGE MAGNETS,1,21-01-2011 15:01,8.29,,United Kingdom,2011-01-21,8.29
569536,79321,CHILLI LIGHTS,4,04-10-2011 15:44,5.75,13269.0,United Kingdom,2011-04-10,23.0
579287,22791,T-LIGHT GLASS FLUTED ANTIQUE,12,29-11-2011 10:58,1.25,13496.0,United Kingdom,2011-11-29,15.0
547367,22265,EASTER DECORATION NATURAL CHICK,2,22-03-2011 13:11,0.65,15437.0,United Kingdom,2011-03-22,1.3
557644,21948,SET OF 6 CAKE CHOPSTICKS,1,21-06-2011 17:06,2.46,,United Kingdom,2011-06-21,2.46
549844,21385,IVORY HANGING DECORATION  HEART,6,12-04-2011 14:17,0.85,12854.0,United Kingdom,2011-12-04,5.1
542265,22109,FULL ENGLISH BREAKFAST PLATE,2,26-01-2011 17:27,3.75,15867.0,United Kingdom,2011-01-26,7.5
559168,23301,GARDENERS KNEELING PAD KEEP CALM ,2,06-07-2011 17:05,1.65,13263.0,United Kingdom,2011-06-07,3.3
561371,21790,VINTAGE SNAP CARDS,1,26-07-2011 16:25,1.63,,United Kingdom,2011-07-26,1.63
553406,46000M,POLYESTER FILLER PAD 45x45cm,50,17-05-2011 08:38,1.55,14952.0,United Kingdom,2011-05-17,77.5
545978,47590A,BLUE HAPPY BIRTHDAY BUNTING,1,08-03-2011 12:19,5.45,13975.0,United Kingdom,2011-08-03,5.45
536876,20970,PINK FLORAL FELTCRAFT SHOULDER BAG,1,03-12-2010 11:36,7.62,,United Kingdom,2010-03-12,7.62
547367,21812,GARLAND WITH HEARTS AND BELLS,1,22-03-2011 13:11,4.95,15437.0,United Kingdom,2011-03-22,4.95
563935,82600,NO SINGING METAL SIGN,2,21-08-2011 16:24,2.1,15547.0,United Kingdom,2011-08-21,4.2
569415,22812,PACK 3 BOXES CHRISTMAS PANNETONE,1,04-10-2011 10:14,4.96,,United Kingdom,2011-04-10,4.96
580727,21098,CHRISTMAS TOILET ROLL,16,05-12-2011 17:17,2.46,14096.0,United Kingdom,2011-05-12,39.36
569803,84879,ASSORTED COLOUR BIRD ORNAMENT,8,06-10-2011 11:48,1.69,13090.0,United Kingdom,2011-06-10,13.52
569122,22669,RED BABY BUNTING ,10,30-09-2011 13:06,2.95,12694.0,France,2011-09-30,29.5
537262,22114,HOT WATER BOTTLE TEA AND SYMPATHY,1,06-12-2010 11:26,3.95,15039.0,United Kingdom,2010-06-12,3.95
543808,22557,PLASTERS IN TIN VINTAGE PAISLEY ,1,13-02-2011 13:22,1.65,17454.0,United Kingdom,2011-02-13,1.65
570000,23299,FOOD COVER WITH BEADS SET 2 ,6,07-10-2011 08:55,3.75,12420.0,Cyprus,2011-07-10,22.5
578429,85099B,JUMBO BAG RED RETROSPOT,10,24-11-2011 12:12,2.08,16271.0,United Kingdom,2011-11-24,20.8
568650,23388,WOODLAND MINI BACKPACK,4,28-09-2011 11:56,4.15,13505.0,Switzerland,2011-09-28,16.6
570116,23114,VINTAGE LEAF CHOPPING BOARD  ,2,07-10-2011 12:38,4.95,12856.0,United Kingdom,2011-07-10,9.9
548709,85019C,CURIOUS  IMAGES NOTEBOOK SET,48,03-04-2011 12:46,1.25,17744.0,United Kingdom,2011-03-04,60.0
568709,23354,6 GIFT TAGS 50'S CHRISTMAS ,4,28-09-2011 15:42,0.83,15036.0,United Kingdom,2011-09-28,3.32
555406,82582,AREA PATROLLED METAL SIGN,2,02-06-2011 19:50,2.1,17231.0,United Kingdom,2011-02-06,4.2
578305,21707,FOLDING UMBRELLA BLACKBLUE POLKADOT,4,23-11-2011 15:44,4.25,14088.0,United Kingdom,2011-11-23,17.0
574734,23583,LUNCH BAG PAISLEY PARK  ,1,06-11-2011 15:20,1.65,15025.0,United Kingdom,2011-06-11,1.65
536667,22086,PAPER CHAIN KIT 50'S CHRISTMAS ,12,02-12-2010 12:09,2.95,15260.0,United Kingdom,2010-02-12,35.400000000000006
578211,23374,RED SPOT PAPER GIFT BAG,20,23-11-2011 11:47,0.82,12748.0,United Kingdom,2011-11-23,16.4
553129,22662,LUNCH BAG DOLLY GIRL DESIGN,1,13-05-2011 12:34,1.65,17765.0,United Kingdom,2011-05-13,1.65
575875,23571,TRADITIONAL NAUGHTS & CROSSES,3,11-11-2011 13:06,3.29,,United Kingdom,2011-11-11,9.870000000000001
565460,85071A,BLUE CHARLIE+LOLA PERSONAL DOORSIGN,24,05-09-2011 09:24,0.39,16843.0,United Kingdom,2011-05-09,9.36
559658,21232,STRAWBERRY CERAMIC TRINKET BOX,24,11-07-2011 13:06,1.25,13003.0,United Kingdom,2011-11-07,30.0
555277,82486,WOOD S/3 CABINET ANT WHITE FINISH,1,01-06-2011 17:30,16.63,,United Kingdom,2011-01-06,16.63
561094,22707,WRAP MONSTER FUN ,25,25-07-2011 10:04,0.42,12474.0,Germany,2011-07-25,10.5
573311,22383,LUNCH BAG SUKI DESIGN ,2,28-10-2011 16:45,1.65,14071.0,United Kingdom,2011-10-28,3.3
570842,84030E,ENGLISH ROSE HOT WATER BOTTLE,4,12-10-2011 14:21,4.25,17676.0,United Kingdom,2011-12-10,17.0
544286,20685,DOORMAT RED RETROSPOT,2,17-02-2011 12:29,7.95,13151.0,United Kingdom,2011-02-17,15.9
545148,22294,HEART FILIGREE DOVE  SMALL,24,28-02-2011 12:14,1.25,13675.0,United Kingdom,2011-02-28,30.0
539030,85123A,WHITE HANGING HEART T-LIGHT HOLDER,24,15-12-2010 14:25,2.95,13089.0,United Kingdom,2010-12-15,70.80000000000001
538146,20676,RED RETROSPOT BOWL,8,09-12-2010 16:10,1.25,15596.0,United Kingdom,2010-09-12,10.0
546891,22264,FELT FARM ANIMAL WHITE BUNNY ,1,17-03-2011 18:18,1.63,,United Kingdom,2011-03-17,1.63
570488,85049C,ROMANTIC PINKS RIBBONS ,1,10-10-2011 17:12,2.46,14096.0,United Kingdom,2011-10-10,2.46
541292,22139,RETROSPOT TEA SET CERAMIC 11 PC ,3,17-01-2011 13:30,4.95,15596.0,United Kingdom,2011-01-17,14.850000000000001
538307,22082,RIBBON REEL STRIPES DESIGN ,5,10-12-2010 13:27,1.65,14667.0,United Kingdom,2010-10-12,8.25
568327,23318,BOX OF 6 MINI VINTAGE CRACKERS,6,26-09-2011 14:02,2.49,15492.0,United Kingdom,2011-09-26,14.940000000000001
564863,21519,GIN & TONIC DIET GREETING CARD ,24,31-08-2011 10:30,0.42,15491.0,United Kingdom,2011-08-31,10.08
565806,23245,SET OF 3 REGENCY CAKE TINS,4,07-09-2011 10:51,4.95,15594.0,United Kingdom,2011-07-09,19.8
565796,22663,JUMBO BAG DOLLY GIRL DESIGN,10,07-09-2011 10:07,2.08,14916.0,United Kingdom,2011-07-09,20.8
539434,21874,GIN AND TONIC MUG,3,17-12-2010 14:41,3.36,,United Kingdom,2010-12-17,10.08
575908,22064,PINK DOUGHNUT TRINKET POT ,24,11-11-2011 15:54,1.65,13091.0,United Kingdom,2011-11-11,39.599999999999994
556239,22457,NATURAL SLATE HEART CHALKBOARD ,6,09-06-2011 15:48,2.95,15712.0,United Kingdom,2011-09-06,17.700000000000003
567665,84378,SET OF 3 HEART COOKIE CUTTERS,1,21-09-2011 15:22,2.46,,United Kingdom,2011-09-21,2.46
575486,23250,VINTAGE RED TRIM ENAMEL BOWL ,24,09-11-2011 17:07,1.25,14911.0,EIRE,2011-09-11,30.0
569564,22605,WOODEN CROQUET GARDEN SET,1,05-10-2011 09:47,14.95,13989.0,United Kingdom,2011-05-10,14.95
540371,85123A,WHITE HANGING HEART T-LIGHT HOLDER,12,06-01-2011 16:35,2.95,14312.0,United Kingdom,2011-06-01,35.400000000000006
544205,85099B,JUMBO BAG RED RETROSPOT,1,17-02-2011 10:31,4.13,,United Kingdom,2011-02-17,4.13
541424,85179A,GREEN BITTY LIGHT CHAIN,1,17-01-2011 17:57,2.46,,United Kingdom,2011-01-17,2.46
571257,21739,COSY SLIPPER SHOES SMALL GREEN,1,14-10-2011 17:17,2.46,,United Kingdom,2011-10-14,2.46
544599,21212,PACK OF 72 RETROSPOT CAKE CASES,1,21-02-2011 18:15,1.25,,United Kingdom,2011-02-21,1.25
548502,22328,ROUND SNACK BOXES SET OF 4 FRUITS ,3,31-03-2011 14:17,4.13,,United Kingdom,2011-03-31,12.39
569523,23065,LARGE DECO JEWELLERY STAND,1,04-10-2011 14:41,12.5,16033.0,United Kingdom,2011-04-10,12.5
562933,DCGSSGIRL,GIRLS PARTY BAG,5,10-08-2011 16:51,3.29,,United Kingdom,2011-10-08,16.45
538351,20727,LUNCH BAG  BLACK SKULL.,18,10-12-2010 15:17,5.06,,United Kingdom,2010-10-12,91.08
569257,21181,PLEASE ONE PERSON METAL SIGN,96,03-10-2011 11:24,1.49,18102.0,United Kingdom,2011-03-10,143.04
536945,22551,PLASTERS IN TIN SPACEBOY,1,03-12-2010 12:24,1.65,14083.0,United Kingdom,2010-03-12,1.65
544106,22185,SLATE TILE NATURAL HANGING,36,16-02-2011 10:47,1.45,14530.0,United Kingdom,2011-02-16,52.199999999999996
539088,22629,SPACEBOY LUNCH BOX ,24,16-12-2010 09:45,1.95,13093.0,United Kingdom,2010-12-16,46.8
577053,82494L,WOODEN FRAME ANTIQUE WHITE ,6,17-11-2011 14:17,2.95,13001.0,United Kingdom,2011-11-17,17.700000000000003
545660,85124C,GREEN JUICY FRUIT PHOTO FRAME,2,04-03-2011 14:28,2.55,17191.0,United Kingdom,2011-04-03,5.1
556641,22924,FRIDGE MAGNETS LA VIE EN ROSE,12,13-06-2011 15:44,0.85,13663.0,United Kingdom,2011-06-13,10.2
552826,23066,SMALL DECO JEWELLERY STAND,4,11-05-2011 13:20,8.25,14277.0,France,2011-11-05,33.0
581492,21200,MULTICOLOUR HONEYCOMB PAPER GARLAND,6,09-12-2011 10:03,3.29,,United Kingdom,2011-09-12,19.740000000000002
561889,22568,FELTCRAFT CUSHION OWL,4,31-07-2011 13:37,3.75,15804.0,United Kingdom,2011-07-31,15.0
556876,16254,TRANSPARENT ACRYLIC TAPE DISPENSER,1,15-06-2011 11:56,0.85,16241.0,United Kingdom,2011-06-15,0.85
543022,20961,STRAWBERRY BATH SPONGE ,10,02-02-2011 14:37,1.25,16771.0,United Kingdom,2011-02-02,12.5
539496,85038,6 CHOCOLATE LOVE HEART T-LIGHTS,6,20-12-2010 10:38,2.1,13050.0,United Kingdom,2010-12-20,12.600000000000001
547786,21974,SET OF 36 PAISLEY FLOWER DOILIES,3,25-03-2011 11:44,1.45,14587.0,United Kingdom,2011-03-25,4.35
568675,20712,JUMBO BAG WOODLAND ANIMALS,20,28-09-2011 13:32,1.79,14298.0,United Kingdom,2011-09-28,35.8
556473,23147,SINGLE ANTIQUE ROSE HOOK IVORY,2,12-06-2011 12:00,1.45,17265.0,United Kingdom,2011-12-06,2.9
546891,82580,BATHROOM METAL SIGN,1,17-03-2011 18:18,1.25,,United Kingdom,2011-03-17,1.25
580536,23203,JUMBO BAG VINTAGE DOILY ,10,04-12-2011 16:07,2.08,12490.0,France,2011-04-12,20.8
565847,22663,JUMBO BAG DOLLY GIRL DESIGN,4,07-09-2011 12:44,4.13,,United Kingdom,2011-07-09,16.52
580981,22383,LUNCH BAG SUKI DESIGN ,10,06-12-2011 16:02,1.65,16201.0,United Kingdom,2011-06-12,16.5
537059,22837,HOT WATER BOTTLE BABUSHKA ,1,05-12-2010 11:54,4.65,14813.0,United Kingdom,2010-05-12,4.65
537201,22595,CHRISTMAS GINGHAM HEART,12,05-12-2010 14:19,0.85,12472.0,Germany,2010-05-12,10.2
547387,22400,MAGNETS PACK OF 4 HOME SWEET HOME,12,22-03-2011 16:00,1.25,12539.0,Spain,2011-03-22,15.0
539437,22862,LOVE HEART NAPKIN BOX ,1,17-12-2010 14:54,8.47,,United Kingdom,2010-12-17,8.47
550638,22488,NATURAL SLATE RECTANGLE CHALKBOARD,1,19-04-2011 15:44,3.29,,United Kingdom,2011-04-19,3.29
580367,35953,FOLKART STAR CHRISTMAS DECORATIONS,4,02-12-2011 16:39,0.61,,United Kingdom,2011-02-12,2.44
565234,22743,MAKE YOUR OWN FLOWERPOWER CARD KIT,1,02-09-2011 09:38,5.79,,United Kingdom,2011-02-09,5.79
563103,23118,PARISIENNE JEWELLERY DRAWER ,2,12-08-2011 10:08,7.5,13873.0,United Kingdom,2011-12-08,15.0
578067,22494,EMERGENCY FIRST AID TIN ,2,22-11-2011 15:43,2.46,,United Kingdom,2011-11-22,4.92
577060,22178,VICTORIAN GLASS HANGING T-LIGHT,24,17-11-2011 14:36,1.95,14397.0,United Kingdom,2011-11-17,46.8
572703,23264,SET OF 3 WOODEN SLEIGH DECORATIONS,2,25-10-2011 14:35,1.25,16110.0,United Kingdom,2011-10-25,2.5
548192,22492,MINI PAINT SET VINTAGE ,36,29-03-2011 15:22,0.65,17364.0,United Kingdom,2011-03-29,23.400000000000002
562720,23206,LUNCH BAG APPLE DESIGN,1,08-08-2011 16:18,1.65,15033.0,United Kingdom,2011-08-08,1.65
538311,21114,LAVENDER SCENTED FABRIC HEART,10,10-12-2010 13:48,1.25,12785.0,Portugal,2010-10-12,12.5
547358,22433,WATERING CAN GREEN DINOSAUR,2,22-03-2011 12:25,1.95,15998.0,United Kingdom,2011-03-22,3.9
538449,22109,FULL ENGLISH BREAKFAST PLATE,8,12-12-2010 12:24,3.75,17085.0,United Kingdom,2010-12-12,30.0
567935,21770,OPEN CLOSED METAL SIGN,2,22-09-2011 18:07,4.95,13320.0,United Kingdom,2011-09-22,9.9
569555,22429,ENAMEL MEASURING JUG CREAM,4,05-10-2011 08:17,4.25,17728.0,United Kingdom,2011-05-10,17.0
563709,84836,ZINC METAL HEART DECORATION,2,18-08-2011 15:17,1.25,15472.0,United Kingdom,2011-08-18,2.5
553838,20726,LUNCH BAG WOODLAND,10,19-05-2011 12:10,1.65,12620.0,France,2011-05-19,16.5
538354,21733,RED HANGING HEART T-LIGHT HOLDER,12,10-12-2010 15:45,2.95,16873.0,United Kingdom,2010-10-12,35.400000000000006
566163,22303,COFFEE MUG APPLES DESIGN,6,09-09-2011 11:48,2.55,12637.0,France,2011-09-09,15.299999999999999
578266,21206,STRAWBERRY HONEYCOMB  GARLAND ,2,23-11-2011 13:34,1.65,12748.0,United Kingdom,2011-11-23,3.3
578017,22274,FELTCRAFT DOLL EMILY,1,22-11-2011 13:07,2.95,13569.0,United Kingdom,2011-11-22,2.95
579546,22386,JUMBO BAG PINK POLKADOT,5,30-11-2011 10:37,2.08,,United Kingdom,2011-11-30,10.4
563241,23201,JUMBO BAG ALPHABET,30,15-08-2011 10:22,2.08,12758.0,Portugal,2011-08-15,62.400000000000006
547658,84692,BOX OF 24 COCKTAIL PARASOLS,3,24-03-2011 13:04,0.42,13736.0,United Kingdom,2011-03-24,1.26
564835,90000D,COPPER/OLIVE GREEN FLOWER NECKLACE,1,30-08-2011 12:31,6.23,,United Kingdom,2011-08-30,6.23
538358,21928,JUMBO BAG SCANDINAVIAN PAISLEY,1,10-12-2010 16:09,1.95,,United Kingdom,2010-10-12,1.95
559163,22961,JAM MAKING SET PRINTED,1,06-07-2011 16:33,3.29,,United Kingdom,2011-06-07,3.29
566060,85032A,ROMANTIC IMAGES GIFT WRAP SET,1,08-09-2011 15:27,1.63,,United Kingdom,2011-08-09,1.63
541086,21056,DOCTOR'S BAG SOFT TOY,2,13-01-2011 12:32,8.95,16503.0,United Kingdom,2011-01-13,17.9
567473,47481,50CM METAL STRING WITH  7 CLIPS,2,20-09-2011 12:50,0.85,17841.0,United Kingdom,2011-09-20,1.7
556474,21902,"KEY FOB , FRONT  DOOR ",2,12-06-2011 12:01,0.65,16007.0,United Kingdom,2011-12-06,1.3
550607,47591D,PINK FAIRY CAKE CHILDRENS APRON,2,19-04-2011 12:17,1.95,16919.0,United Kingdom,2011-04-19,3.9
566219,21507,ELEPHANT BIRTHDAY CARD ,12,09-09-2011 15:51,0.42,17426.0,United Kingdom,2011-09-09,5.04
568953,84086C,PINK/PURPLE RETRO RADIO,6,29-09-2011 15:31,2.95,12728.0,France,2011-09-29,17.700000000000003
541280,17090A,LAVENDER INCENSE 40 CONES IN TIN,6,17-01-2011 11:57,1.25,15296.0,United Kingdom,2011-01-17,7.5
564305,22728,ALARM CLOCK BAKELIKE PINK,4,24-08-2011 12:20,3.75,14875.0,United Kingdom,2011-08-24,15.0
554293,15056n,EDWARDIAN PARASOL NATURAL,1,23-05-2011 14:19,12.46,,United Kingdom,2011-05-23,12.46
548516,84637,KITCHEN FLOWER POTS WALL PLAQUE,1,31-03-2011 16:28,4.96,,United Kingdom,2011-03-31,4.96
568207,85048,15CM CHRISTMAS GLASS BALL 20 LIGHTS,2,25-09-2011 15:34,7.95,15150.0,United Kingdom,2011-09-25,15.9
555736,22469,HEART OF WICKER SMALL,24,07-06-2011 09:13,1.65,17730.0,United Kingdom,2011-07-06,39.599999999999994
573277,21408,SPOTTY PINK DUCK DOORSTOP,1,28-10-2011 13:18,4.25,14606.0,United Kingdom,2011-10-28,4.25
549730,23230,WRAP ALPHABET DESIGN,25,11-04-2011 16:35,0.42,15867.0,United Kingdom,2011-11-04,10.5
576840,21065,BOOM BOX SPEAKER GIRLS,2,16-11-2011 15:23,4.13,,United Kingdom,2011-11-16,8.26
548870,71053,WHITE METAL LANTERN,1,04-04-2011 14:41,3.75,14606.0,United Kingdom,2011-04-04,3.75
567483,23243,SET OF TEA COFFEE SUGAR TINS PANTRY,4,20-09-2011 13:45,4.95,16584.0,United Kingdom,2011-09-20,19.8
564754,21746,SMALL RED RETROSPOT WINDMILL,5,30-08-2011 10:29,2.46,,United Kingdom,2011-08-30,12.3
576519,22553,PLASTERS IN TIN SKULLS,12,15-11-2011 12:25,1.65,12676.0,Sweden,2011-11-15,19.799999999999997
554557,84970L,SINGLE HEART ZINC T-LIGHT HOLDER,12,25-05-2011 10:12,0.95,15804.0,United Kingdom,2011-05-25,11.399999999999999
581437,22867,HAND WARMER BIRD DESIGN,12,08-12-2011 16:22,2.1,14621.0,United Kingdom,2011-08-12,25.200000000000003
566249,22469,HEART OF WICKER SMALL,6,11-09-2011 12:09,1.65,13527.0,United Kingdom,2011-11-09,9.899999999999999
536821,21080,SET/20 RED RETROSPOT PAPER NAPKINS ,3,02-12-2010 17:17,0.85,17757.0,United Kingdom,2010-02-12,2.55
549586,21243,PINK  POLKADOT PLATE ,2,11-04-2011 10:00,3.29,,United Kingdom,2011-11-04,6.58
580909,21928,JUMBO BAG SCANDINAVIAN BLUE PAISLEY,10,06-12-2011 13:27,2.08,18225.0,United Kingdom,2011-06-12,20.8
546986,22780,LIGHT GARLAND BUTTERFILES PINK,4,18-03-2011 12:55,4.25,14194.0,United Kingdom,2011-03-18,17.0
555847,21877,HOME SWEET HOME MUG,12,07-06-2011 13:27,1.25,14880.0,United Kingdom,2011-07-06,15.0
568147,82483,WOOD 2 DRAWER CABINET WHITE FINISH,6,25-09-2011 11:34,6.95,15044.0,United Kingdom,2011-09-25,41.7
566864,47503A,ASS FLORAL PRINT MULTI SCREWDRIVER,36,15-09-2011 12:51,0.42,17786.0,United Kingdom,2011-09-15,15.12
568154,22578,WOODEN STAR CHRISTMAS SCANDINAVIAN,6,25-09-2011 12:06,0.29,13787.0,United Kingdom,2011-09-25,1.7399999999999998
547365,POST,POSTAGE,1,22-03-2011 12:36,15.0,12775.0,Netherlands,2011-03-22,15.0
581217,23510,MINI PLAYING CARDS GYMKHANA,1,08-12-2011 09:20,0.83,,United Kingdom,2011-08-12,0.83
536409,21823,PAINTED METAL HEART WITH HOLLY BELL,3,01-12-2010 11:45,1.45,17908.0,United Kingdom,2010-01-12,4.35
579560,84997A,CHILDRENS CUTLERY POLKADOT GREEN ,1,30-11-2011 11:31,4.15,15039.0,United Kingdom,2011-11-30,4.15
542347,22045,SPACEBOY GIFT WRAP,25,27-01-2011 12:06,0.42,12826.0,United Kingdom,2011-01-27,10.5
557026,85177,BASKET OF FLOWERS SEWING KIT,12,16-06-2011 13:14,0.85,16571.0,United Kingdom,2011-06-16,10.2
541426,22823,CHEST NATURAL WOOD 20 DRAWERS,4,18-01-2011 08:44,110.0,18233.0,United Kingdom,2011-01-18,440.0
565239,23206,LUNCH BAG APPLE DESIGN,10,02-09-2011 09:51,1.65,12670.0,France,2011-02-09,16.5
567804,23312,VINTAGE CHRISTMAS GIFT SACK,2,22-09-2011 12:13,4.15,17920.0,United Kingdom,2011-09-22,8.3
553718,22161,HEART DECORATION RUSTIC HANGING ,7,18-05-2011 16:14,0.79,,United Kingdom,2011-05-18,5.53
561678,22278,OVERNIGHT BAG VINTAGE ROSE PAISLEY,1,28-07-2011 18:33,4.95,17931.0,United Kingdom,2011-07-28,4.95
573274,21670,BLUE SPOT CERAMIC DRAWER KNOB,2,28-10-2011 13:10,3.29,,United Kingdom,2011-10-28,6.58
570232,20971,PINK BLUE FELT CRAFT TRINKET BOX,12,09-10-2011 13:58,1.25,14040.0,United Kingdom,2011-09-10,15.0
545218,21936,RED RETROSPOT PICNIC BAG,5,28-02-2011 17:01,2.95,17462.0,United Kingdom,2011-02-28,14.75
549129,47566,PARTY BUNTING,8,06-04-2011 14:53,4.95,17042.0,United Kingdom,2011-06-04,39.6
557311,20676,RED RETROSPOT BOWL,6,19-06-2011 15:36,1.25,15700.0,United Kingdom,2011-06-19,7.5
580983,21084,SET/6 COLLAGE PAPER CUPS,6,06-12-2011 16:26,0.83,,United Kingdom,2011-06-12,4.9799999999999995
540821,90129A,PINK GLASS TASSLE BAG CHARM ,1,11-01-2011 13:16,1.66,,United Kingdom,2011-11-01,1.66
573999,22057,CERAMIC PLATE STRAWBERRY DESIGN,12,02-11-2011 11:43,1.49,12779.0,Poland,2011-02-11,17.88
556733,48116,DOORMAT MULTICOLOUR STRIPE,2,14-06-2011 11:53,7.95,16919.0,United Kingdom,2011-06-14,15.9
548191,20914,SET/5 RED RETROSPOT LID GLASS BOWLS,1,29-03-2011 15:20,5.79,,United Kingdom,2011-03-29,5.79
545338,22173,METAL 4 HOOK HANGER FRENCH CHATEAU,3,01-03-2011 17:32,2.95,17449.0,United Kingdom,2011-01-03,8.850000000000001
564837,90003E,GREEN PAIR HEART HAIR SLIDES,1,30-08-2011 12:40,3.73,,United Kingdom,2011-08-30,3.73
573564,22483,RED GINGHAM TEDDY BEAR ,6,31-10-2011 13:58,2.95,16127.0,United Kingdom,2011-10-31,17.700000000000003
559923,90179C,BLACK FINE BEAD NECKLACE W TASSEL,1,13-07-2011 16:07,5.82,,United Kingdom,2011-07-13,5.82
569327,21915,RED  HARMONICA IN BOX ,12,03-10-2011 12:47,1.25,15091.0,United Kingdom,2011-03-10,15.0
561653,16219,HOUSE SHAPE PENCIL SHARPENER,48,28-07-2011 15:55,0.06,14002.0,United Kingdom,2011-07-28,2.88
562445,23245,SET OF 3 REGENCY CAKE TINS,4,04-08-2011 18:51,4.95,12417.0,Belgium,2011-04-08,19.8
559989,23256,CHILDRENS CUTLERY SPACEBOY ,4,14-07-2011 12:21,4.15,13319.0,United Kingdom,2011-07-14,16.6
553937,22191,IVORY DINER WALL CLOCK,2,20-05-2011 10:33,8.5,14056.0,United Kingdom,2011-05-20,17.0
572680,85014B,RED RETROSPOT UMBRELLA,4,25-10-2011 13:48,5.95,,Portugal,2011-10-25,23.8
568494,22291,HANGING CHICK CREAM DECORATION,6,27-09-2011 12:08,1.45,16266.0,United Kingdom,2011-09-27,8.7
550209,21770,OPEN CLOSED METAL SIGN,3,15-04-2011 10:39,9.96,,United Kingdom,2011-04-15,29.880000000000003
564144,22093,MOTORING TISSUE BOX,36,23-08-2011 11:53,0.39,13939.0,United Kingdom,2011-08-23,14.040000000000001
580982,23350,ROLL WRAP VINTAGE SPOT ,6,06-12-2011 16:21,1.25,17861.0,United Kingdom,2011-06-12,7.5
550638,46126A,ELVIS WALLHANGING / CURTAIN,1,19-04-2011 15:44,2.46,,United Kingdom,2011-04-19,2.46
569898,23245,SET OF 3 REGENCY CAKE TINS,2,06-10-2011 16:08,10.79,,United Kingdom,2011-06-10,21.58
542622,20679,EDWARDIAN PARASOL RED,1,31-01-2011 09:09,12.46,,United Kingdom,2011-01-31,12.46
564670,21086,SET/6 RED SPOTTY PAPER CUPS,12,26-08-2011 15:44,0.65,12683.0,France,2011-08-26,7.800000000000001
574328,21212,PACK OF 72 RETROSPOT CAKE CASES,24,04-11-2011 09:05,0.55,13081.0,United Kingdom,2011-04-11,13.200000000000001
577504,23328,SET 6 SCHOOL MILK BOTTLES IN CRATE,2,20-11-2011 12:36,3.75,14159.0,United Kingdom,2011-11-20,7.5
555284,22440,BALLOON WATER BOMB PACK OF 35,40,02-06-2011 09:37,0.36,14298.0,United Kingdom,2011-02-06,14.399999999999999
545333,20713,JUMBO BAG OWLS,2,01-03-2011 16:22,4.13,,United Kingdom,2011-01-03,8.26
538371,21809,CHRISTMAS HANGING TREE WITH BELL,3,12-12-2010 11:07,1.25,15570.0,United Kingdom,2010-12-12,3.75
537253,22747,POPPY'S PLAYHOUSE BATHROOM,6,06-12-2010 10:53,2.1,,United Kingdom,2010-06-12,12.600000000000001
575610,48194,DOORMAT HEARTS,4,10-11-2011 12:45,8.25,16628.0,United Kingdom,2011-10-11,33.0
545445,22858,EASTER TIN KEEPSAKE,6,02-03-2011 16:26,1.65,17738.0,United Kingdom,2011-02-03,9.899999999999999
552336,85132C,CHARLIE AND LOLA FIGURES TINS,12,09-05-2011 11:26,1.95,15159.0,United Kingdom,2011-09-05,23.4
545714,21658,GLASS  BEURRE DISH,1,07-03-2011 10:12,8.29,,United Kingdom,2011-07-03,8.29
558864,21080,SET/20 RED RETROSPOT PAPER NAPKINS ,12,04-07-2011 12:38,0.85,,EIRE,2011-04-07,10.2
566976,23209,LUNCH BAG VINTAGE DOILY ,10,16-09-2011 09:27,1.65,15382.0,United Kingdom,2011-09-16,16.5
551850,47566,PARTY BUNTING,4,04-05-2011 14:33,4.95,13731.0,United Kingdom,2011-04-05,19.8
573083,21901,"KEY FOB , BACK DOOR ",4,27-10-2011 14:22,0.65,13735.0,United Kingdom,2011-10-27,2.6
578666,84946,ANTIQUE SILVER T-LIGHT GLASS,12,24-11-2011 17:06,1.25,17727.0,United Kingdom,2011-11-24,15.0
549100,22079,RIBBON REEL HEARTS DESIGN ,3,06-04-2011 11:14,2.46,,United Kingdom,2011-06-04,7.38
576339,22385,JUMBO BAG SPACEBOY DESIGN,1,14-11-2011 15:27,4.13,14096.0,United Kingdom,2011-11-14,4.13
578074,22070,SMALL RED RETROSPOT MUG IN BOX ,1,22-11-2011 16:06,3.75,17590.0,United Kingdom,2011-11-22,3.75
564754,20707,CRAZY DAISY HEART DECORATION,5,30-08-2011 10:29,0.83,,United Kingdom,2011-08-30,4.1499999999999995
561528,21506,"FANCY FONT BIRTHDAY CARD, ",12,28-07-2011 08:55,0.42,13098.0,United Kingdom,2011-07-28,5.04
545658,85017C,ENVELOPE 50 CURIOUS IMAGES,2,04-03-2011 14:13,0.85,14670.0,United Kingdom,2011-04-03,1.7
564818,21803,CHRISTMAS TREE STAR DECORATION,7,30-08-2011 12:10,0.42,,United Kingdom,2011-08-30,2.94
537237,21650,ASSORTED TUTTI FRUTTI BRACELET,1,06-12-2010 09:58,1.66,,United Kingdom,2010-06-12,1.66
565994,23249,VINTAGE RED ENAMEL TRIM PLATE,2,08-09-2011 11:46,1.65,13244.0,United Kingdom,2011-08-09,3.3
574589,22114,HOT WATER BOTTLE TEA AND SYMPATHY,1,06-11-2011 10:33,4.25,15017.0,United Kingdom,2011-06-11,4.25
581142,90129F,RED GLASS TASSLE BAG CHARM,1,07-12-2011 13:38,2.95,14204.0,United Kingdom,2011-07-12,2.95
574354,23350,ROLL WRAP VINTAGE SPOT ,1,04-11-2011 10:47,1.25,17203.0,United Kingdom,2011-04-11,1.25
567303,23130,MISTLETOE HEART WREATH GREEN,4,19-09-2011 13:20,4.15,17613.0,United Kingdom,2011-09-19,16.6
546635,21498,RED RETROSPOT WRAP ,10,15-03-2011 12:11,0.42,16392.0,United Kingdom,2011-03-15,4.2
554098,23089,GLASS BON BON JAR,6,22-05-2011 13:01,1.65,14769.0,United Kingdom,2011-05-22,9.899999999999999
563206,22411,JUMBO SHOPPER VINTAGE RED PAISLEY,2,14-08-2011 12:08,2.08,17613.0,United Kingdom,2011-08-14,4.16
541115,21260,FIRST AID TIN,6,13-01-2011 15:34,3.25,12578.0,Italy,2011-01-13,19.5
556780,22301,COFFEE MUG CAT + BIRD DESIGN,6,14-06-2011 12:46,2.55,14524.0,United Kingdom,2011-06-14,15.299999999999999
567183,23423,PANTRY 3 HOOK ROLLING PIN HANGER,3,18-09-2011 15:32,3.75,14769.0,United Kingdom,2011-09-18,11.25
547870,82613B,"METAL SIGN,CUPCAKE SINGLE HOOK",4,27-03-2011 14:18,1.25,13668.0,United Kingdom,2011-03-27,5.0
574547,22488,NATURAL SLATE RECTANGLE CHALKBOARD,4,04-11-2011 15:08,1.65,17841.0,United Kingdom,2011-04-11,6.6
559055,21719,LOVELY BONBON STICKER SHEET,1,05-07-2011 17:09,0.79,,United Kingdom,2011-05-07,0.79
572846,23319,BOX OF 6 MINI 50'S CRACKERS,6,26-10-2011 12:14,2.49,14550.0,United Kingdom,2011-10-26,14.940000000000001
579350,85123A,WHITE HANGING HEART T-LIGHT HOLDER,32,29-11-2011 11:48,2.55,15218.0,United Kingdom,2011-11-29,81.6
575086,23515,EMBROIDERED RIBBON REEL DAISY ,6,08-11-2011 13:52,2.08,16618.0,United Kingdom,2011-08-11,12.48
558442,23299,FOOD COVER WITH BEADS SET 2 ,1,29-06-2011 13:10,3.75,15537.0,United Kingdom,2011-06-29,3.75
558355,22670,FRENCH WC SIGN BLUE METAL,1,28-06-2011 14:58,1.25,13614.0,United Kingdom,2011-06-28,1.25
542720,22644,CERAMIC CHERRY CAKE MONEY BANK,12,31-01-2011 14:35,1.45,12778.0,Netherlands,2011-01-31,17.4
544495,22649,STRAWBERRY FAIRY CAKE TEAPOT,8,21-02-2011 11:42,4.95,12766.0,Portugal,2011-02-21,39.6
569136,79191B,RETRO PLASTIC POLKA TRAY,2,30-09-2011 14:41,0.85,15834.0,United Kingdom,2011-09-30,1.7
573904,23422,PANTRY HOOK BALLOON WHISK ,2,01-11-2011 14:54,2.08,14505.0,United Kingdom,2011-01-11,4.16
557471,46000S,POLYESTER FILLER PAD 40x40cm,40,20-06-2011 13:27,1.45,15825.0,United Kingdom,2011-06-20,58.0
572552,51014A,"FEATHER PEN,HOT PINK",20,24-10-2011 17:07,0.83,14096.0,United Kingdom,2011-10-24,16.599999999999998
560233,20725,LUNCH BAG RED RETROSPOT,2,17-07-2011 11:10,1.65,16813.0,United Kingdom,2011-07-17,3.3
571185,23025,DRAWER KNOB VINTAGE GLASS BALL,6,14-10-2011 11:15,2.08,13047.0,United Kingdom,2011-10-14,12.48
538071,90128B,BLUE LEAVES AND BEADS PHONE CHARM,1,09-12-2010 14:09,2.51,,United Kingdom,2010-09-12,2.51
573585,84970L,SINGLE HEART ZINC T-LIGHT HOLDER,6,31-10-2011 14:41,2.08,,United Kingdom,2011-10-31,12.48
540821,21901,"KEY FOB , BACK DOOR ",1,11-01-2011 13:16,1.66,,United Kingdom,2011-11-01,1.66
537638,21327,SKULLS WRITING SET ,1,07-12-2010 15:28,3.36,,United Kingdom,2010-07-12,3.36
557033,22138,BAKING SET 9 PIECE RETROSPOT ,6,16-06-2011 13:48,4.95,13826.0,United Kingdom,2011-06-16,29.700000000000003
550496,21731,RED TOADSTOOL LED NIGHT LIGHT,1,18-04-2011 15:05,3.29,,United Kingdom,2011-04-18,3.29
578351,85123A,WHITE HANGING HEART T-LIGHT HOLDER,32,24-11-2011 09:59,2.55,14987.0,United Kingdom,2011-11-24,81.6
580673,22909,SET OF 20 VINTAGE CHRISTMAS NAPKINS,24,05-12-2011 14:30,0.85,13089.0,United Kingdom,2011-05-12,20.4
545156,21122,SET/10 PINK POLKADOT PARTY CANDLES,24,28-02-2011 13:27,1.25,13509.0,United Kingdom,2011-02-28,30.0
548728,21425,SKULLS STORAGE BOX LARGE,6,04-04-2011 09:55,2.95,13198.0,United Kingdom,2011-04-04,17.700000000000003
576609,46000S,POLYESTER FILLER PAD 40x40cm,8,15-11-2011 16:08,1.45,15556.0,United Kingdom,2011-11-15,11.6
543097,20978,36 PENCILS TUBE SKULLS,1,03-02-2011 11:41,2.46,,United Kingdom,2011-03-02,2.46
565915,21801,CHRISTMAS TREE DECORATION WITH BELL,10,07-09-2011 15:52,0.42,15752.0,United Kingdom,2011-07-09,4.2
556953,21216,"SET 3 RETROSPOT TEA,COFFEE,SUGAR",4,16-06-2011 08:16,4.95,14911.0,EIRE,2011-06-16,19.8
538625,22556,PLASTERS IN TIN CIRCUS PARADE ,4,13-12-2010 12:50,1.65,14544.0,United Kingdom,2010-12-13,6.6
567675,22491,PACK OF 12 COLOURED PENCILS,1,21-09-2011 15:54,0.85,15351.0,United Kingdom,2011-09-21,0.85
569524,23127,FELTCRAFT GIRL NICOLE KIT,1,04-10-2011 14:42,4.95,14506.0,United Kingdom,2011-04-10,4.95
547358,21908,CHOCOLATE THIS WAY METAL SIGN,2,22-03-2011 12:25,2.1,15998.0,United Kingdom,2011-03-22,4.2
579629,23208,LUNCH BAG VINTAGE LEAF DESIGN,1,30-11-2011 12:16,1.65,14963.0,United Kingdom,2011-11-30,1.65
569943,22966,GINGERBREAD MAN COOKIE CUTTER,1,06-10-2011 18:08,1.25,14592.0,United Kingdom,2011-06-10,1.25
538354,85230E,STRAWBRY SCENTED VOTIVE CANDLE,24,10-12-2010 15:45,0.29,16873.0,United Kingdom,2010-10-12,6.959999999999999
546648,21213,PACK OF 72 SKULL CAKE CASES,5,15-03-2011 14:15,2.08,,United Kingdom,2011-03-15,10.4
538378,21137,BLACK RECORD COVER FRAME,3,12-12-2010 11:26,3.75,14577.0,United Kingdom,2010-12-12,11.25
552318,84692,BOX OF 24 COCKTAIL PARASOLS,4,08-05-2011 16:13,0.42,17231.0,United Kingdom,2011-08-05,1.68
571054,20770,ABSTRACT CIRCLE JOURNAL ,1,13-10-2011 13:58,2.55,14234.0,United Kingdom,2011-10-13,2.55
557324,84905,PINK BUTTERFLY CUSHION COVER ,1,20-06-2011 09:41,4.96,,United Kingdom,2011-06-20,4.96
567701,21823,PAINTED METAL HEART WITH HOLLY BELL,24,22-09-2011 09:36,0.39,17172.0,United Kingdom,2011-09-22,9.36
576326,23267,SET OF 4 SANTA PLACE SETTINGS,4,14-11-2011 15:18,1.25,16504.0,United Kingdom,2011-11-14,5.0
536632,21875,KINGS CHOICE MUG,12,02-12-2010 11:02,1.25,14388.0,United Kingdom,2010-02-12,15.0
571294,23503,PLAYING CARDS KEEP CALM & CARRY ON,4,16-10-2011 16:09,1.25,16987.0,United Kingdom,2011-10-16,5.0
539551,85135C,RED DRAGONFLY HELICOPTER,2,20-12-2010 11:38,7.95,12721.0,France,2010-12-20,15.9
559055,21882,SKULLS TAPE,1,05-07-2011 17:09,1.63,,United Kingdom,2011-05-07,1.63
574260,71038,WHITE HANGING BEADS CANDLE HOLDER,4,03-11-2011 13:58,5.45,13014.0,United Kingdom,2011-03-11,21.8
557496,DOT,DOTCOM POSTAGE,1,20-06-2011 15:19,101.17,,United Kingdom,2011-06-20,101.17
577476,21908,CHOCOLATE THIS WAY METAL SIGN,12,20-11-2011 11:31,2.1,12540.0,Spain,2011-11-20,25.200000000000003
571498,23228,FILIGREE HEART BIRD WHITE ,1,17-10-2011 15:06,1.25,17841.0,United Kingdom,2011-10-17,1.25
536763,22813,PACK 3 BOXES BIRD PANNETONE ,12,02-12-2010 14:42,1.95,17685.0,United Kingdom,2010-02-12,23.4
545897,22647,CERAMIC LOVE HEART MONEY BANK,1,07-03-2011 17:22,3.29,,United Kingdom,2011-07-03,3.29
574074,23323,WHITE WICKER STAR ,2,02-11-2011 15:33,4.13,,United Kingdom,2011-02-11,8.26
545475,22617,BAKING SET SPACEBOY DESIGN,48,03-03-2011 10:59,4.25,12415.0,Australia,2011-03-03,204.0
564755,23010,CIRCUS PARADE BABY GIFT SET,1,30-08-2011 10:31,24.96,,United Kingdom,2011-08-30,24.96
580514,84879,ASSORTED COLOUR BIRD ORNAMENT,8,04-12-2011 14:01,1.69,16905.0,United Kingdom,2011-04-12,13.52
536837,21755,LOVE BUILDING BLOCK WORD,3,02-12-2010 18:15,5.95,14395.0,United Kingdom,2010-02-12,17.85
575687,23494,VINTAGE DOILY DELUXE SEWING KIT ,9,10-11-2011 16:03,5.95,16126.0,United Kingdom,2011-10-11,53.550000000000004
557213,21733,RED HANGING HEART T-LIGHT HOLDER,1,17-06-2011 12:16,2.95,15021.0,United Kingdom,2011-06-17,2.95
577126,70006,LOVE HEART POCKET WARMER,24,17-11-2011 19:22,1.65,12406.0,Denmark,2011-11-17,39.599999999999994
571006,22196,SMALL HEART MEASURING SPOONS,12,13-10-2011 12:06,0.85,17063.0,United Kingdom,2011-10-13,10.2
575854,23434,3 RAFFIA RIBBONS 50'S CHRISTMAS ,10,11-11-2011 12:20,0.79,14125.0,United Kingdom,2011-11-11,7.9
544340,21977,PACK OF 60 PINK PAISLEY CAKE CASES,24,18-02-2011 09:41,0.55,12527.0,Germany,2011-02-18,13.200000000000001
561091,21931,JUMBO STORAGE BAG SUKI,2,25-07-2011 09:55,4.13,,United Kingdom,2011-07-25,8.26
574093,84378,SET OF 3 HEART COOKIE CUTTERS,12,03-11-2011 09:43,1.45,12437.0,France,2011-03-11,17.4
540556,22721,SET OF 3 CAKE TINS SKETCHBOOK,6,10-01-2011 09:58,4.95,,Israel,2011-10-01,29.700000000000003
561605,22952,60 CAKE CASES VINTAGE CHRISTMAS,24,28-07-2011 12:09,0.55,13925.0,United Kingdom,2011-07-28,13.200000000000001
562934,23245,SET OF 3 REGENCY CAKE TINS,16,10-08-2011 16:56,5.79,,United Kingdom,2011-10-08,92.64
537434,21914,BLUE HARMONICA IN BOX ,6,06-12-2010 16:57,2.51,,United Kingdom,2010-06-12,15.059999999999999
578266,22374,AIRLINE BAG VINTAGE JET SET RED,1,23-11-2011 13:34,4.25,12748.0,United Kingdom,2011-11-23,4.25
563720,22592,CARDHOLDER HOLLY WREATH METAL,2,18-08-2011 16:24,3.75,15867.0,United Kingdom,2011-08-18,7.5
570116,23229,VINTAGE DONKEY TAIL GAME ,2,07-10-2011 12:38,3.75,12856.0,United Kingdom,2011-07-10,7.5
560845,23191,BUNDLE OF 3 RETRO NOTE BOOKS,12,21-07-2011 12:29,1.65,15570.0,United Kingdom,2011-07-21,19.799999999999997
568666,17003,BROCADE RING PURSE ,720,28-09-2011 12:54,0.16,14609.0,United Kingdom,2011-09-28,115.2
562902,22846,BREAD BIN DINER STYLE RED ,1,10-08-2011 12:41,16.95,13925.0,United Kingdom,2011-10-08,16.95
571508,85049E,SCANDINAVIAN REDS RIBBONS,1,17-10-2011 15:27,2.46,,United Kingdom,2011-10-17,2.46
571240,22728,ALARM CLOCK BAKELIKE PINK,4,14-10-2011 14:55,3.75,12562.0,France,2011-10-14,15.0
557860,22687,DOORMAT CHRISTMAS VILLAGE,4,23-06-2011 11:58,7.95,17630.0,United Kingdom,2011-06-23,31.8
571441,22565,FELTCRAFT HAIRBANDS PINK AND WHITE ,3,17-10-2011 13:31,1.63,14096.0,United Kingdom,2011-10-17,4.89
537638,22963,JAM JAR WITH GREEN LID,1,07-12-2010 15:28,1.66,,United Kingdom,2010-07-12,1.66
541497,47594A,CAROUSEL DESIGN WASHBAG,1,18-01-2011 15:19,1.63,,United Kingdom,2011-01-18,1.63
565431,22665,RECIPE BOX BLUE SKETCHBOOK DESIGN,1,04-09-2011 13:15,2.95,14965.0,United Kingdom,2011-04-09,2.95
553162,22293,HANGING CHICK GREEN DECORATION,1,13-05-2011 15:53,2.92,,United Kingdom,2011-05-13,2.92
538524,22534,MAGIC DRAWING SLATE SPACEBOY ,2,13-12-2010 09:35,0.85,,United Kingdom,2010-12-13,1.7
541796,21915,RED  HARMONICA IN BOX ,12,21-01-2011 13:55,1.25,14092.0,United Kingdom,2011-01-21,15.0
571560,23534,WALL ART STOP FOR TEA ,3,18-10-2011 09:54,5.95,14897.0,United Kingdom,2011-10-18,17.85
562688,22988,SOLDIERS EGG CUP ,12,08-08-2011 13:53,1.25,13869.0,United Kingdom,2011-08-08,15.0
571257,22446,PIN CUSHION BABUSHKA PINK,4,14-10-2011 17:17,2.46,,United Kingdom,2011-10-14,9.84
574619,21755,LOVE BUILDING BLOCK WORD,2,06-11-2011 11:18,6.25,15952.0,United Kingdom,2011-06-11,12.5
557671,22215,CAKE STAND WHITE TWO TIER LACE,2,22-06-2011 10:11,8.5,13849.0,United Kingdom,2011-06-22,17.0
551420,21792,CLASSIC FRENCH STYLE BASKET GREEN ,8,28-04-2011 14:00,3.95,17068.0,United Kingdom,2011-04-28,31.6
571244,22907,PACK OF 20 NAPKINS PANTRY DESIGN,2,14-10-2011 15:46,0.85,17180.0,United Kingdom,2011-10-14,1.7
538880,22308,TEA COSY BLUE STRIPE,1,14-12-2010 15:52,5.06,,United Kingdom,2010-12-14,5.06
550204,22668,PINK BABY BUNTING,1,15-04-2011 10:37,5.79,,United Kingdom,2011-04-15,5.79
538382,22729,ALARM CLOCK BAKELIKE ORANGE,1,12-12-2010 11:37,3.75,17218.0,United Kingdom,2010-12-12,3.75
549425,22055,MINI CAKE STAND  HANGING STRAWBERY,3,08-04-2011 11:54,1.65,14030.0,United Kingdom,2011-08-04,4.949999999999999
543822,22893,MINI CAKE STAND T-LIGHT HOLDER,48,14-02-2011 09:24,0.42,12507.0,Spain,2011-02-14,20.16
575683,22311,OFFICE MUG WARMER BLACK+SILVER ,144,10-11-2011 15:51,2.55,17389.0,United Kingdom,2011-10-11,367.2
540412,82494L,WOODEN FRAME ANTIQUE WHITE ,6,07-01-2011 10:27,2.95,13842.0,United Kingdom,2011-07-01,17.700000000000003
540418,90214S,"LETTER ""S"" BLING KEY RING",2,07-01-2011 11:04,0.85,,United Kingdom,2011-07-01,1.7
536544,21231,SWEETHEART CERAMIC TRINKET BOX,4,01-12-2010 14:32,2.51,,United Kingdom,2010-01-12,10.04
551719,22379,RECYCLING BAG RETROSPOT ,1,03-05-2011 16:09,4.13,,United Kingdom,2011-03-05,4.13
559043,23168,CLASSIC CAFE SUGAR DISPENSER,1,05-07-2011 15:35,2.46,,United Kingdom,2011-05-07,2.46
580295,21929,JUMBO BAG PINK VINTAGE PAISLEY,1,02-12-2011 13:49,2.08,17841.0,United Kingdom,2011-02-12,2.08
544770,22362,GLASS JAR PEACOCK BATH SALTS,1,23-02-2011 11:11,5.79,,United Kingdom,2011-02-23,5.79
574080,22835,HOT WATER BOTTLE I AM SO POORLY,2,02-11-2011 16:29,4.95,16348.0,United Kingdom,2011-02-11,9.9
580716,22045,SPACEBOY GIFT WRAP,25,05-12-2011 16:48,0.42,12367.0,Denmark,2011-05-12,10.5
559548,44236,PINK/PURPLE CIRCLE CURTAIN,6,10-07-2011 15:17,0.79,17997.0,United Kingdom,2011-10-07,4.74
561704,21912,VINTAGE SNAKES & LADDERS,1,29-07-2011 11:07,3.75,14606.0,United Kingdom,2011-07-29,3.75
580915,20725,LUNCH BAG RED RETROSPOT,10,06-12-2011 13:45,1.65,17705.0,United Kingdom,2011-06-12,16.5
572225,21731,RED TOADSTOOL LED NIGHT LIGHT,12,21-10-2011 13:50,1.65,13157.0,United Kingdom,2011-10-21,19.799999999999997
555853,22470,HEART OF WICKER LARGE,5,07-06-2011 13:44,2.95,14375.0,United Kingdom,2011-07-06,14.75
571054,22141,CHRISTMAS CRAFT TREE TOP ANGEL,2,13-10-2011 13:58,2.1,14234.0,United Kingdom,2011-10-13,4.2
559492,22193,RED DINER WALL CLOCK,1,08-07-2011 13:53,16.63,,United Kingdom,2011-08-07,16.63
575652,21624,VINTAGE UNION JACK DOORSTOP,4,10-11-2011 14:28,5.95,12748.0,United Kingdom,2011-10-11,23.8
561119,21669,BLUE STRIPE CERAMIC DRAWER KNOB,12,25-07-2011 12:34,1.25,17719.0,United Kingdom,2011-07-25,15.0
543345,85194S,HANGING SPRING FLOWER EGG SMALL,1,07-02-2011 12:29,1.63,,United Kingdom,2011-07-02,1.63
541568,22728,ALARM CLOCK BAKELIKE PINK,4,19-01-2011 12:07,3.75,15606.0,United Kingdom,2011-01-19,15.0
552631,POST,POSTAGE,2,10-05-2011 12:55,18.0,12684.0,France,2011-10-05,36.0
549578,22915,ASSORTED BOTTLE TOP  MAGNETS ,12,11-04-2011 08:49,0.42,17340.0,United Kingdom,2011-11-04,5.04
536973,48138,DOORMAT UNION FLAG,10,03-12-2010 13:43,6.75,17787.0,United Kingdom,2010-03-12,67.5
544790,21671,RED SPOT CERAMIC DRAWER KNOB,24,23-02-2011 12:27,1.25,16940.0,United Kingdom,2011-02-23,30.0
559629,22480,RED TEA TOWEL CLASSIC DESIGN,1,11-07-2011 11:58,1.25,14690.0,United Kingdom,2011-11-07,1.25
574076,22597,MUSICAL ZINC HEART DECORATION ,1,02-11-2011 15:38,0.83,,United Kingdom,2011-02-11,0.83
572695,23319,BOX OF 6 MINI 50'S CRACKERS,6,25-10-2011 14:23,2.49,12610.0,Italy,2011-10-25,14.940000000000001
576202,84879,ASSORTED COLOUR BIRD ORNAMENT,160,14-11-2011 12:22,1.45,13767.0,United Kingdom,2011-11-14,232.0
542147,22355,CHARLOTTE BAG SUKI DESIGN,10,26-01-2011 10:02,0.85,12782.0,Portugal,2011-01-26,8.5
579387,23299,FOOD COVER WITH BEADS SET 2 ,2,29-11-2011 12:06,3.75,14452.0,United Kingdom,2011-11-29,7.5
549262,20969,RED FLORAL FELTCRAFT SHOULDER BAG,1,07-04-2011 12:38,3.75,14465.0,United Kingdom,2011-07-04,3.75
571288,23536,WALL ART VILLAGE SHOW ,2,16-10-2011 15:13,5.95,16052.0,United Kingdom,2011-10-16,11.9
551994,84755,COLOUR GLASS T-LIGHT HOLDER HANGING,16,05-05-2011 15:42,0.65,12868.0,United Kingdom,2011-05-05,10.4
562844,22847,BREAD BIN DINER STYLE IVORY,3,10-08-2011 08:41,16.95,12444.0,Norway,2011-10-08,50.849999999999994
565807,48194,DOORMAT HEARTS,2,07-09-2011 10:55,8.25,14334.0,United Kingdom,2011-07-09,16.5
553221,23298,SPOTTY BUNTING,3,16-05-2011 09:58,4.95,16607.0,United Kingdom,2011-05-16,14.850000000000001
566092,22674,FRENCH TOILET SIGN BLUE METAL,12,09-09-2011 10:42,1.25,13823.0,United Kingdom,2011-09-09,15.0
579949,84879,ASSORTED COLOUR BIRD ORNAMENT,16,01-12-2011 11:00,1.69,16700.0,United Kingdom,2011-01-12,27.04
577121,23342,MINT DINER WALL CLOCK,4,17-11-2011 18:29,8.5,12681.0,France,2011-11-17,34.0
577402,22507,MEMO BOARD RETROSPOT  DESIGN,3,20-11-2011 10:11,4.95,15465.0,United Kingdom,2011-11-20,14.850000000000001
553228,21231,SWEETHEART CERAMIC TRINKET BOX,12,16-05-2011 10:48,1.25,16496.0,United Kingdom,2011-05-16,15.0
580632,22195,LARGE HEART MEASURING SPOONS,3,05-12-2011 12:16,1.65,16360.0,United Kingdom,2011-05-12,4.949999999999999
541696,84870C,GREEN GEISHA GIRL ,2,20-01-2011 18:08,2.46,,United Kingdom,2011-01-20,4.92
550274,22749,FELTCRAFT PRINCESS CHARLOTTE DOLL,4,15-04-2011 12:23,3.75,15498.0,United Kingdom,2011-04-15,15.0
537042,22118,JOY WOODEN BLOCK LETTERS,1,05-12-2010 10:45,4.95,13838.0,United Kingdom,2010-05-12,4.95
550542,22227,HANGING HEART MIRROR DECORATION ,6,19-04-2011 11:37,1.25,,United Kingdom,2011-04-19,7.5
580146,23208,LUNCH BAG VINTAGE LEAF DESIGN,2,02-12-2011 10:07,4.96,,United Kingdom,2011-02-12,9.92
572540,22386,JUMBO BAG PINK POLKADOT,10,24-10-2011 16:17,4.13,,United Kingdom,2011-10-24,41.3
536638,47566B,TEA TIME PARTY BUNTING,5,02-12-2010 11:41,4.65,16244.0,United Kingdom,2010-02-12,23.25
556041,22139,RETROSPOT TEA SET CERAMIC 11 PC ,1,08-06-2011 12:44,4.95,17954.0,United Kingdom,2011-08-06,4.95
557938,23298,SPOTTY BUNTING,7,23-06-2011 15:35,4.95,,United Kingdom,2011-06-23,34.65
553202,22977,DOLLY GIRL CHILDRENS EGG CUP,1,15-05-2011 16:02,1.25,15854.0,United Kingdom,2011-05-15,1.25
559816,21012,ANTIQUE ALL GLASS CANDLESTICK,2,12-07-2011 16:11,2.46,,United Kingdom,2011-12-07,4.92
560648,22171,3 HOOK PHOTO SHELF ANTIQUE WHITE,25,20-07-2011 11:33,5.88,18102.0,United Kingdom,2011-07-20,147.0
548969,22630,DOLLY GIRL LUNCH BOX,64,05-04-2011 11:01,1.65,14646.0,Netherlands,2011-05-04,105.6
564820,22361,GLASS JAR DAISY FRESH COTTON WOOL,2,30-08-2011 12:16,5.79,,United Kingdom,2011-08-30,11.58
578686,23321,SMALL WHITE HEART OF WICKER,12,25-11-2011 09:18,1.65,13050.0,United Kingdom,2011-11-25,19.799999999999997
559676,84997C,CHILDRENS CUTLERY POLKADOT BLUE,4,11-07-2011 14:40,4.15,17340.0,United Kingdom,2011-11-07,16.6
570824,21889,WOODEN BOX OF DOMINOES,24,12-10-2011 12:58,1.25,14299.0,United Kingdom,2011-12-10,30.0
559535,22960,JAM MAKING SET WITH JARS,2,10-07-2011 12:16,4.25,17841.0,United Kingdom,2011-10-07,8.5
544894,22957,SET 3 PAPER VINTAGE CHICK PAPER EGG,6,24-02-2011 12:09,2.95,15805.0,United Kingdom,2011-02-24,17.700000000000003
542727,22988,SOLDIERS EGG CUP ,6,31-01-2011 15:09,1.25,17604.0,United Kingdom,2011-01-31,7.5
548664,22967,SET 3 SONG BIRD PAPER EGGS ASSORTED,6,01-04-2011 14:45,2.95,14911.0,EIRE,2011-01-04,17.700000000000003
554617,22640,SET OF 4 NAPKIN CHARMS 3 KEYS ,1,25-05-2011 11:21,2.55,14593.0,United Kingdom,2011-05-25,2.55
542109,21215,IVORY PAPER CUP CAKE CASES ,10,25-01-2011 13:44,1.25,,United Kingdom,2011-01-25,12.5
541508,47566,PARTY BUNTING,2,18-01-2011 16:06,10.79,,United Kingdom,2011-01-18,21.58
580907,22217,T-LIGHT HOLDER HANGING LACE,12,06-12-2011 13:13,0.39,13507.0,United Kingdom,2011-06-12,4.68
553316,23172,REGENCY TEA PLATE PINK,12,16-05-2011 12:04,1.65,12682.0,France,2011-05-16,19.799999999999997
554509,85099C,JUMBO  BAG BAROQUE BLACK WHITE,1,24-05-2011 15:45,2.08,17375.0,United Kingdom,2011-05-24,2.08
537823,47566,PARTY BUNTING,4,08-12-2010 14:25,8.47,,United Kingdom,2010-08-12,33.88
566061,23032,DRAWER KNOB CRACKLE GLAZE IVORY,6,08-09-2011 15:36,1.65,13267.0,United Kingdom,2011-08-09,9.899999999999999
576573,20972,PINK CREAM FELT CRAFT TRINKET BOX ,12,15-11-2011 13:52,1.25,16600.0,United Kingdom,2011-11-15,15.0
568198,22796,PHOTO FRAME 3 CLASSIC HANGING,2,25-09-2011 14:52,9.95,16771.0,United Kingdom,2011-09-25,19.9
550470,21448,12 DAISY PEGS IN WOOD BOX,1,18-04-2011 13:49,3.29,,United Kingdom,2011-04-18,3.29
550987,22241,GARLAND WOODEN HAPPY EASTER,6,21-04-2011 18:10,2.46,,United Kingdom,2011-04-21,14.76
563195,22025,RING OF ROSES BIRTHDAY CARD,1,12-08-2011 16:36,0.83,,United Kingdom,2011-12-08,0.83
568954,20829,GLITTER HANGING BUTTERFLY STRING,8,29-09-2011 15:32,2.1,13576.0,United Kingdom,2011-09-29,16.8
546542,21755,LOVE BUILDING BLOCK WORD,1,14-03-2011 15:13,5.95,13263.0,United Kingdom,2011-03-14,5.95
541226,85014B,RED RETROSPOT UMBRELLA,6,14-01-2011 15:04,5.95,15854.0,United Kingdom,2011-01-14,35.7
580064,22567,20 DOLLY PEGS RETROSPOT,6,01-12-2011 13:32,1.45,18077.0,United Kingdom,2011-01-12,8.7
568346,22197,POPCORN HOLDER,7,26-09-2011 15:28,1.63,14096.0,United Kingdom,2011-09-26,11.41
576910,84029E,RED WOOLLY HOTTIE WHITE HEART.,24,17-11-2011 09:51,3.75,12477.0,Germany,2011-11-17,90.0
538186,22837,HOT WATER BOTTLE BABUSHKA ,4,10-12-2010 10:26,4.65,13000.0,United Kingdom,2010-10-12,18.6
572550,22579,WOODEN TREE CHRISTMAS SCANDINAVIAN,4,24-10-2011 17:06,0.83,,United Kingdom,2011-10-24,3.32
578852,22995,TRAVEL CARD WALLET SUKI,1,27-11-2011 11:12,0.42,17841.0,United Kingdom,2011-11-27,0.42
544568,10135,COLOURING PENCILS BROWN TUBE,10,21-02-2011 12:54,1.25,15065.0,United Kingdom,2011-02-21,12.5
552695,22707,WRAP MONSTER FUN ,25,10-05-2011 15:31,0.42,16320.0,Unspecified,2011-10-05,10.5
555397,22773,GREEN DRAWER KNOB ACRYLIC EDWARDIAN,1,02-06-2011 17:26,2.46,,United Kingdom,2011-02-06,2.46
579559,22621,TRADITIONAL KNITTING NANCY,2,30-11-2011 11:30,1.65,16764.0,United Kingdom,2011-11-30,3.3
565593,22355,CHARLOTTE BAG SUKI DESIGN,10,05-09-2011 14:07,0.85,17612.0,United Kingdom,2011-05-09,8.5
559107,22212,FOUR HOOK  WHITE LOVEBIRDS,1,06-07-2011 11:22,2.1,15334.0,United Kingdom,2011-06-07,2.1
575875,22539,MINI JIGSAW DOLLY GIRL,2,11-11-2011 13:06,0.83,,United Kingdom,2011-11-11,1.66
537199,22810,SET OF 6 T-LIGHTS SNOWMEN,6,05-12-2010 14:06,2.95,15894.0,United Kingdom,2010-05-12,17.700000000000003
573924,23296,SET OF 6 TEA TIME BAKING CASES,8,02-11-2011 09:45,1.25,15065.0,United Kingdom,2011-02-11,10.0
579141,22086,PAPER CHAIN KIT 50'S CHRISTMAS ,1,28-11-2011 13:06,2.95,17019.0,United Kingdom,2011-11-28,2.95
564137,21770,OPEN CLOSED METAL SIGN,4,23-08-2011 11:30,4.95,15722.0,United Kingdom,2011-08-23,19.8
577057,22825,DECORATIVE PLANT POT WITH FRIEZE,1,17-11-2011 14:26,7.95,12748.0,United Kingdom,2011-11-17,7.95
576147,23207,LUNCH BAG ALPHABET DESIGN,10,14-11-2011 10:49,1.65,16303.0,United Kingdom,2011-11-14,16.5
564095,23080,RED METAL BOX TOP SECRET,2,23-08-2011 10:31,8.25,14930.0,Channel Islands,2011-08-23,16.5
567668,21680,WOODLAND  STICKERS,1,21-09-2011 15:29,1.63,,United Kingdom,2011-09-21,1.63
537126,21245,GREEN POLKADOT PLATE ,1,05-12-2010 12:13,1.69,18118.0,United Kingdom,2010-05-12,1.69
559310,82616B,FRAPPUCINO SCARF KNITTING KIT,12,07-07-2011 13:33,1.25,15505.0,United Kingdom,2011-07-07,15.0
578844,23350,ROLL WRAP VINTAGE SPOT ,2,25-11-2011 16:14,2.46,,United Kingdom,2011-11-25,4.92
544094,22381,TOY TIDY PINK POLKADOT,5,16-02-2011 09:11,2.1,15810.0,United Kingdom,2011-02-16,10.5
576589,23301,GARDENERS KNEELING PAD KEEP CALM ,12,15-11-2011 14:29,1.65,17659.0,United Kingdom,2011-11-15,19.799999999999997
556365,22333,RETROSPOT PARTY BAG + STICKER SET,3,10-06-2011 11:44,1.65,16370.0,United Kingdom,2011-10-06,4.949999999999999
571508,90089,PINK CRYSTAL SKULL PHONE CHARM,1,17-10-2011 15:27,1.63,,United Kingdom,2011-10-17,1.63
550331,75049L,LARGE CIRCULAR MIRROR MOBILE,2,17-04-2011 13:43,1.25,15555.0,United Kingdom,2011-04-17,2.5
557296,23321,SMALL WHITE HEART OF WICKER,2,19-06-2011 13:51,1.65,15334.0,United Kingdom,2011-06-19,3.3
561627,22138,BAKING SET 9 PIECE RETROSPOT ,3,28-07-2011 14:08,4.95,12453.0,Austria,2011-07-28,14.850000000000001
566602,23289,DOLLY GIRL CHILDRENS BOWL,1,13-09-2011 16:05,2.46,,United Kingdom,2011-09-13,2.46
570187,23334,IVORY WICKER HEART SMALL,4,07-10-2011 15:09,1.25,,United Kingdom,2011-07-10,5.0
560412,21936,RED RETROSPOT PICNIC BAG,2,18-07-2011 14:32,2.95,12748.0,United Kingdom,2011-07-18,5.9
557263,21507,"ELEPHANT, BIRTHDAY CARD, ",72,19-06-2011 11:08,0.36,14646.0,Netherlands,2011-06-19,25.919999999999998
573323,21754,HOME BUILDING BLOCK WORD,2,30-10-2011 10:54,6.25,15708.0,United Kingdom,2011-10-30,12.5
560590,22326,ROUND SNACK BOXES SET OF4 WOODLAND ,6,19-07-2011 15:55,2.95,12560.0,Germany,2011-07-19,17.700000000000003
553190,23130,MISTLETOE HEART WREATH GREEN,2,15-05-2011 13:14,4.15,15164.0,United Kingdom,2011-05-15,8.3
556504,35923,CANDY HEART HANGING DECORATION,12,13-06-2011 08:47,0.39,13936.0,United Kingdom,2011-06-13,4.68
541285,22386,JUMBO BAG PINK POLKADOT,10,17-01-2011 12:45,1.95,13001.0,United Kingdom,2011-01-17,19.5
568567,85032C,CURIOUS IMAGES GIFT WRAP SET,2,27-09-2011 18:41,1.63,,United Kingdom,2011-09-27,3.26
538349,22738,RIBBON REEL SNOWY VILLAGE,1,10-12-2010 14:59,3.36,,United Kingdom,2010-10-12,3.36
537769,20828,GLITTER BUTTERFLY CLIPS,1,08-12-2010 12:17,2.55,15021.0,United Kingdom,2010-08-12,2.55
547888,21790,VINTAGE SNAP CARDS,12,28-03-2011 09:59,0.85,13368.0,United Kingdom,2011-03-28,10.2
555731,21114,LAVENDER SCENTED FABRIC HEART,10,07-06-2011 07:49,1.25,16655.0,United Kingdom,2011-07-06,12.5
554630,84536B,FAIRY CAKES NOTEBOOK A7 SIZE,8,25-05-2011 11:34,0.42,13268.0,United Kingdom,2011-05-25,3.36
564141,22479,DAISY GARDEN MARKER,3,23-08-2011 11:47,1.25,17841.0,United Kingdom,2011-08-23,3.75
563613,20676,RED RETROSPOT BOWL,24,18-08-2011 08:49,1.25,12688.0,Israel,2011-08-18,30.0
547871,20711,JUMBO BAG TOYS ,3,27-03-2011 14:28,1.95,16931.0,United Kingdom,2011-03-27,5.85
543828,22673,FRENCH GARDEN SIGN BLUE METAL,12,14-02-2011 09:45,1.25,14156.0,EIRE,2011-02-14,15.0
556263,85099F,JUMBO BAG STRAWBERRY,10,09-06-2011 18:41,2.08,13969.0,United Kingdom,2011-09-06,20.8
580808,22966,GINGERBREAD MAN COOKIE CUTTER,12,06-12-2011 11:24,1.25,16133.0,United Kingdom,2011-06-12,15.0
562218,20676,RED RETROSPOT BOWL,8,03-08-2011 14:07,1.25,13851.0,United Kingdom,2011-03-08,10.0
541207,85123A,WHITE HANGING HEART T-LIGHT HOLDER,12,14-01-2011 12:27,2.95,17685.0,United Kingdom,2011-01-14,35.400000000000006
541219,21913,VINTAGE SEASIDE JIGSAW PUZZLES,1,14-01-2011 14:06,3.29,,United Kingdom,2011-01-14,3.29
546899,85099B,JUMBO BAG RED RETROSPOT,30,17-03-2011 18:27,1.65,14298.0,United Kingdom,2011-03-17,49.5
569383,85071A,BLUE CHARLIE+LOLA PERSONAL DOORSIGN,24,03-10-2011 16:46,0.39,15159.0,United Kingdom,2011-03-10,9.36
550900,22502,PICNIC BASKET WICKER SMALL,12,21-04-2011 12:11,5.95,16553.0,United Kingdom,2011-04-21,71.4
571305,22385,JUMBO BAG SPACEBOY DESIGN,2,17-10-2011 09:55,4.13,,United Kingdom,2011-10-17,8.26
578924,23355,HOT WATER BOTTLE KEEP CALM,2,27-11-2011 12:10,4.95,16983.0,United Kingdom,2011-11-27,9.9
568949,85123A,WHITE HANGING HEART T-LIGHT HOLDER,2,29-09-2011 15:13,5.79,,United Kingdom,2011-09-29,11.58
560360,23212,HEART WREATH DECORATION WITH BELL,48,18-07-2011 11:55,1.25,12744.0,Singapore,2011-07-18,60.0
563941,47599A,PINK PARTY BAGS,30,22-08-2011 09:51,2.1,15738.0,United Kingdom,2011-08-22,63.0
540906,21212,PACK OF 72 RETROSPOT CAKE CASES,120,12-01-2011 11:51,0.42,16701.0,United Kingdom,2011-12-01,50.4
578344,85099F,JUMBO BAG STRAWBERRY,2,24-11-2011 09:21,4.13,,United Kingdom,2011-11-24,8.26
552059,85132C,CHARLIE AND LOLA FIGURES TINS,12,06-05-2011 10:37,1.95,17470.0,United Kingdom,2011-06-05,23.4
578211,37475,SET/4 COLOURFUL MIXING BOWLS,1,23-11-2011 11:47,9.95,12748.0,United Kingdom,2011-11-23,9.95
553576,20752,BLUE POLKADOT WASHING UP GLOVES,6,18-05-2011 10:29,2.1,14282.0,United Kingdom,2011-05-18,12.600000000000001
549667,22666,RECIPE BOX PANTRY YELLOW DESIGN,6,11-04-2011 12:20,2.95,14911.0,EIRE,2011-11-04,17.700000000000003
540026,85040A,S/4 PINK FLOWER CANDLES IN BOWL,4,04-01-2011 13:25,3.36,,United Kingdom,2011-04-01,13.44
554275,22796,PHOTO FRAME 3 CLASSIC HANGING,2,23-05-2011 13:17,9.95,14903.0,United Kingdom,2011-05-23,19.9
576339,22341,LOVE GARLAND PAINTED ZINC ,5,14-11-2011 15:27,3.29,14096.0,United Kingdom,2011-11-14,16.45
557211,22697,GREEN REGENCY TEACUP AND SAUCER,12,17-06-2011 11:49,2.95,15513.0,United Kingdom,2011-06-17,35.400000000000006
556520,37449,CERAMIC CAKE STAND + HANGING CAKES,1,13-06-2011 11:10,9.95,14177.0,United Kingdom,2011-06-13,9.95
577358,21894,POTTING SHED SEED ENVELOPES,1,18-11-2011 15:59,2.46,,United Kingdom,2011-11-18,2.46
550208,22133,PINK LOVE HEART SHAPE CUP,1,15-04-2011 10:39,1.63,,United Kingdom,2011-04-15,1.63
546406,20707,CRAZY DAISY HEART DECORATION,1,11-03-2011 16:21,0.83,,United Kingdom,2011-11-03,0.83
561355,23010,CIRCUS PARADE BABY GIFT SET,6,26-07-2011 14:51,14.95,13090.0,United Kingdom,2011-07-26,89.69999999999999
547063,22897,OVEN MITT APPLES DESIGN,3,20-03-2011 13:33,1.45,14769.0,United Kingdom,2011-03-20,4.35
543279,82580,BATHROOM METAL SIGN,6,06-02-2011 14:46,0.55,17105.0,United Kingdom,2011-06-02,3.3000000000000003
563917,21621,VINTAGE UNION JACK BUNTING,1,21-08-2011 13:46,8.5,14572.0,United Kingdom,2011-08-21,8.5
566345,22908,PACK OF 20 NAPKINS RED APPLES,10,12-09-2011 12:27,0.85,17685.0,United Kingdom,2011-12-09,8.5
543989,21977,PACK OF 60 PINK PAISLEY CAKE CASES,120,15-02-2011 09:52,0.42,12415.0,Australia,2011-02-15,50.4
545830,22844,VINTAGE CREAM DOG FOOD CONTAINER,1,07-03-2011 13:10,8.5,17634.0,United Kingdom,2011-07-03,8.5
538967,22112,CHOCOLATE HOT WATER BOTTLE,24,15-12-2010 11:32,4.25,13495.0,United Kingdom,2010-12-15,102.0
555925,51014C,"FEATHER PEN,COAL BLACK",1,07-06-2011 17:13,0.83,,United Kingdom,2011-07-06,0.83
544434,20724,RED RETROSPOT CHARLOTTE BAG,1,18-02-2011 16:12,1.63,,United Kingdom,2011-02-18,1.63
553387,21718,RED METAL BEACH SPADE ,1,16-05-2011 16:33,2.46,,United Kingdom,2011-05-16,2.46
574920,23256,CHILDRENS CUTLERY SPACEBOY ,4,07-11-2011 16:34,4.15,13985.0,United Kingdom,2011-07-11,16.6
544779,22077,6 RIBBONS RUSTIC CHARM,12,23-02-2011 12:04,1.65,13865.0,United Kingdom,2011-02-23,19.799999999999997
565332,23332,IVORY WICKER HEART LARGE,24,02-09-2011 14:09,1.65,13695.0,United Kingdom,2011-02-09,39.599999999999994
541421,22775,PURPLE DRAWERKNOB ACRYLIC EDWARDIAN,2,17-01-2011 17:44,2.46,,United Kingdom,2011-01-17,4.92
580757,21012,ANTIQUE ALL GLASS CANDLESTICK,6,06-12-2011 10:27,2.1,13709.0,United Kingdom,2011-06-12,12.600000000000001
539075,47559B,TEA TIME OVEN GLOVE,1,15-12-2010 17:28,1.25,17189.0,United Kingdom,2010-12-15,1.25
555589,21934,SKULL SHOULDER BAG,10,06-06-2011 09:36,1.65,12802.0,Netherlands,2011-06-06,16.5
541489,70006,LOVE HEART POCKET WARMER,3,18-01-2011 13:38,1.65,15023.0,United Kingdom,2011-01-18,4.949999999999999
540551,85215,ASSORTED CHEESE FRIDGE MAGNETS,6,10-01-2011 09:43,1.27,,United Kingdom,2011-10-01,7.62
580545,23398,HANGING HEART BONHEUR,12,05-12-2011 09:16,0.85,12782.0,Portugal,2011-05-12,10.2
579508,90013B,BLACK VINTAGE EARRINGS,1,29-11-2011 16:33,4.15,,United Kingdom,2011-11-29,4.15
566302,23080,RED METAL BOX TOP SECRET,1,11-09-2011 16:09,8.25,16474.0,United Kingdom,2011-11-09,8.25
548780,37475,SET/4 COLOURFUL MIXING BOWLS,1,04-04-2011 12:37,9.95,13294.0,United Kingdom,2011-04-04,9.95
581434,90210C,RED   ACRYLIC FACETED BANGLE,10,08-12-2011 16:10,1.0,13599.0,United Kingdom,2011-08-12,10.0
565239,20725,LUNCH BAG RED RETROSPOT,10,02-09-2011 09:51,1.65,12670.0,France,2011-02-09,16.5
573348,84876B,GREEN HEART COMPACT MIRROR,2,30-10-2011 12:27,1.25,14487.0,United Kingdom,2011-10-30,2.5
550496,22308,TEA COSY BLUE STRIPE,1,18-04-2011 15:05,4.96,,United Kingdom,2011-04-18,4.96
567899,23431,NATURAL HANGING QUILTED HEARTS ,12,22-09-2011 16:26,0.83,14911.0,EIRE,2011-09-22,9.959999999999999
543377,22851,SET 20 NAPKINS FAIRY CAKES DESIGN ,12,07-02-2011 15:14,0.85,13725.0,United Kingdom,2011-07-02,10.2
565725,16219,HOUSE SHAPE PENCIL SHARPENER,48,06-09-2011 11:55,0.06,13949.0,United Kingdom,2011-06-09,2.88
566206,21485,RETROSPOT HEART HOT WATER BOTTLE,2,09-09-2011 15:00,4.95,16362.0,United Kingdom,2011-09-09,9.9
581125,22545,MINI JIGSAW BUNNIES,11,07-12-2011 12:41,0.19,14087.0,United Kingdom,2011-07-12,2.09
578211,21080,SET/20 RED RETROSPOT PAPER NAPKINS ,1,23-11-2011 11:47,0.85,12748.0,United Kingdom,2011-11-23,0.85
566720,48138,DOORMAT UNION FLAG,1,14-09-2011 12:42,8.25,13634.0,United Kingdom,2011-09-14,8.25
559806,23007, SPACEBOY BABY GIFT SET,1,12-07-2011 14:26,16.95,13311.0,United Kingdom,2011-12-07,16.95
544201,22166,WALL MIRROR RECTANGLE DIAMANTE PINK,1,17-02-2011 10:11,15.79,,United Kingdom,2011-02-17,15.79
577078,23633,SET 10 CARDS WORLD CHILDREN 17067,1,17-11-2011 15:17,2.49,,United Kingdom,2011-11-17,2.49
558388,22723,SET OF 6 HERB TINS SKETCHBOOK,4,29-06-2011 10:00,3.95,,EIRE,2011-06-29,15.8
540458,22709,WRAP WEDDING DAY,25,07-01-2011 12:28,0.42,12501.0,Germany,2011-07-01,10.5
565083,23146,TRIPLE HOOK ANTIQUE IVORY ROSE,16,01-09-2011 09:19,3.29,16187.0,United Kingdom,2011-01-09,52.64
539453,22296,HEART IVORY TRELLIS LARGE,1,17-12-2010 17:08,3.36,,United Kingdom,2010-12-17,3.36
555025,22070,SMALL RED RETROSPOT MUG IN BOX ,6,31-05-2011 11:21,3.75,17648.0,United Kingdom,2011-05-31,22.5
563613,21933,PINK VINTAGE PAISLEY PICNIC BAG,20,18-08-2011 08:49,1.65,12688.0,Israel,2011-08-18,33.0
559817,22371,AIRLINE BAG VINTAGE TOKYO 78,2,12-07-2011 16:20,4.13,,United Kingdom,2011-12-07,8.26
560445,22558,CLOTHES PEGS RETROSPOT PACK 24 ,144,19-07-2011 09:08,1.45,14156.0,EIRE,2011-07-19,208.79999999999998
546247,21213,PACK OF 72 SKULL CAKE CASES,24,10-03-2011 13:34,0.55,18086.0,United Kingdom,2011-10-03,13.200000000000001
574826,22745,POPPY'S PLAYHOUSE BEDROOM ,1,07-11-2011 10:58,2.1,15870.0,United Kingdom,2011-07-11,2.1
575336,21034,REX CASH+CARRY JUMBO SHOPPER,2,09-11-2011 13:58,0.95,14968.0,United Kingdom,2011-09-11,1.9
544928,22616,PACK OF 12 LONDON TISSUES ,1,24-02-2011 18:07,0.83,,United Kingdom,2011-02-24,0.83
580149,47590A,BLUE HAPPY BIRTHDAY BUNTING,1,02-12-2011 10:15,5.45,12748.0,United Kingdom,2011-02-12,5.45
572063,22208,WOOD STAMP SET THANK YOU,2,20-10-2011 12:57,0.83,14606.0,United Kingdom,2011-10-20,1.66
565315,22185,SLATE TILE NATURAL HANGING,12,02-09-2011 12:51,1.65,14019.0,United Kingdom,2011-02-09,19.799999999999997
539082,21844,RED RETROSPOT MUG,6,16-12-2010 09:22,2.95,13317.0,United Kingdom,2010-12-16,17.700000000000003
578017,20764,ABSTRACT CIRCLES SKETCHBOOK ,1,22-11-2011 13:07,3.75,13569.0,United Kingdom,2011-11-22,3.75
580884,22024,RAINY LADIES BIRTHDAY CARD,12,06-12-2011 12:21,0.42,15907.0,United Kingdom,2011-06-12,5.04
573137,23435,3 RAFFIA RIBBONS VINTAGE CHRISTMAS,4,27-10-2011 17:15,0.83,,United Kingdom,2011-10-27,3.32
546658,85185B,PINK HORSE SOCK PUPPET,6,15-03-2011 14:21,2.95,15150.0,United Kingdom,2011-03-15,17.700000000000003
559052,22210,WOOD STAMP SET BEST WISHES,3,05-07-2011 16:53,0.83,,United Kingdom,2011-05-07,2.4899999999999998
554668,22469,HEART OF WICKER SMALL,24,25-05-2011 15:19,1.65,18226.0,United Kingdom,2011-05-25,39.599999999999994
546732,85123A,WHITE HANGING HEART T-LIGHT HOLDER,5,16-03-2011 11:41,2.95,14606.0,United Kingdom,2011-03-16,14.75
572458,23351,ROLL WRAP 50'S CHRISTMAS,24,24-10-2011 12:51,1.25,15142.0,United Kingdom,2011-10-24,30.0
563193,22379,RECYCLING BAG RETROSPOT ,1,12-08-2011 16:30,4.13,,United Kingdom,2011-12-08,4.13
568060,23517,EMBROIDERED RIBBON REEL REBECCA ,2,23-09-2011 13:11,2.89,14546.0,United Kingdom,2011-09-23,5.78
580682,22055,MINI CAKE STAND  HANGING STRAWBERY,16,05-12-2011 15:02,0.39,16968.0,United Kingdom,2011-05-12,6.24
568567,72799E,IVORY PILLAR CANDLE SILVER FLOCK,1,27-09-2011 18:41,3.29,,United Kingdom,2011-09-27,3.29
551657,22843,BISCUIT TIN VINTAGE GREEN,2,03-05-2011 12:12,6.75,14911.0,EIRE,2011-03-05,13.5
543277,21034,REX CASH+CARRY JUMBO SHOPPER,1,06-02-2011 14:33,0.95,15808.0,United Kingdom,2011-06-02,0.95
575943,79191B,RETRO PLASTIC POLKA TRAY,1,13-11-2011 11:44,0.85,17920.0,United Kingdom,2011-11-13,0.85
576837,21452,TOADSTOOL MONEY BOX,4,16-11-2011 15:16,5.79,,United Kingdom,2011-11-16,23.16
548198,22845,VINTAGE CREAM CAT FOOD CONTAINER,1,29-03-2011 16:05,6.35,16712.0,United Kingdom,2011-03-29,6.35
578929,21485,RETROSPOT HEART HOT WATER BOTTLE,3,27-11-2011 12:31,4.95,13064.0,United Kingdom,2011-11-27,14.850000000000001
539993,22302,COFFEE MUG PEARS  DESIGN,6,04-01-2011 10:00,2.55,13313.0,United Kingdom,2011-04-01,15.299999999999999
544445,21621,VINTAGE UNION JACK BUNTING,2,20-02-2011 10:56,8.5,16746.0,United Kingdom,2011-02-20,17.0
564065,22810,SET OF 6 T-LIGHTS SNOWMEN,6,22-08-2011 15:05,2.95,15150.0,United Kingdom,2011-08-22,17.700000000000003
568152,85150,LADIES & GENTLEMEN METAL SIGN,1,25-09-2011 11:40,2.55,16480.0,United Kingdom,2011-09-25,2.55
565919,20724,RED RETROSPOT CHARLOTTE BAG,3,07-09-2011 16:48,1.63,,United Kingdom,2011-07-09,4.89
572540,21080,SET/20 RED RETROSPOT PAPER NAPKINS ,2,24-10-2011 16:17,2.46,,United Kingdom,2011-10-24,4.92
573908,23284,DOORMAT KEEP CALM AND COME IN,20,01-11-2011 15:19,7.08,17739.0,United Kingdom,2011-01-11,141.6
551564,22109,FULL ENGLISH BREAKFAST PLATE,4,03-05-2011 10:56,3.75,16609.0,United Kingdom,2011-03-05,15.0
572219,23536,WALL ART VILLAGE SHOW ,1,21-10-2011 13:17,5.95,17463.0,United Kingdom,2011-10-21,5.95
563935,22966,GINGERBREAD MAN COOKIE CUTTER,1,21-08-2011 16:24,1.25,15547.0,United Kingdom,2011-08-21,1.25
557676,23054,RECYCLED ACAPULCO MAT LAVENDER,2,22-06-2011 10:28,8.25,15804.0,United Kingdom,2011-06-22,16.5
556267,15034,PAPER POCKET TRAVELING FAN ,1200,09-06-2011 19:33,0.07,13694.0,United Kingdom,2011-09-06,84.00000000000001
539434,22595,CHRISTMAS GINGHAM HEART,8,17-12-2010 14:41,1.66,,United Kingdom,2010-12-17,13.28
538108,21802,CHRISTMAS TREE HEART DECORATION,36,09-12-2010 15:23,0.42,17456.0,United Kingdom,2010-09-12,15.12
570838,79051A,SMOKEY GREY COLOUR GLASS,16,12-10-2011 14:05,0.29,,United Kingdom,2011-12-10,4.64
571427,22716,CARD CIRCUS PARADE,36,17-10-2011 12:46,0.42,17205.0,United Kingdom,2011-10-17,15.12
574714,22554,PLASTERS IN TIN WOODLAND ANIMALS,2,06-11-2011 14:29,1.65,15427.0,United Kingdom,2011-06-11,3.3
562085,23360,SET 8 CANDLES VINTAGE DOILEY,12,02-08-2011 12:27,1.95,15228.0,United Kingdom,2011-02-08,23.4
577076,21207,SKULL AND CROSSBONES  GARLAND ,1,17-11-2011 15:08,1.65,14362.0,United Kingdom,2011-11-17,1.65
572549,90161C,ANT COPPER LIME BOUDICCA BRACELET,1,24-10-2011 17:03,4.98,,United Kingdom,2011-10-24,4.98
566048,23298,SPOTTY BUNTING,3,08-09-2011 14:21,4.95,16558.0,United Kingdom,2011-08-09,14.850000000000001
568654,23173,REGENCY TEAPOT ROSES ,2,28-09-2011 12:20,9.95,14911.0,EIRE,2011-09-28,19.9
576463,21640,ASSORTED TUTTI FRUTTI  FOB NOTEBOOK,6,15-11-2011 11:37,0.85,17974.0,United Kingdom,2011-11-15,5.1
566952,21212,PACK OF 72 RETROSPOT CAKE CASES,1,15-09-2011 16:37,1.25,,United Kingdom,2011-09-15,1.25
541115,21561,DINOSAUR LUNCH BOX WITH CUTLERY,6,13-01-2011 15:34,2.55,12578.0,Italy,2011-01-13,15.299999999999999
564076,37449,CERAMIC CAKE STAND + HANGING CAKES,48,22-08-2011 15:27,8.5,14045.0,United Kingdom,2011-08-22,408.0
580697,23520,EMBROIDERED RIBBON REEL RUBY ,1,05-12-2011 16:05,3.75,15984.0,United Kingdom,2011-05-12,3.75
559052,47580,TEA TIME DES TEA COSY,1,05-07-2011 16:53,2.46,,United Kingdom,2011-05-07,2.46
549567,22178,VICTORIAN GLASS HANGING T-LIGHT,6,10-04-2011 15:07,1.25,13632.0,United Kingdom,2011-10-04,7.5
539436,22403,MAGNETS PACK OF 4 VINTAGE LABELS ,1,17-12-2010 14:49,2.51,,United Kingdom,2010-12-17,2.51
568589,82486,3 DRAWER ANTIQUE WHITE WOOD CABINET,2,28-09-2011 10:27,8.95,17405.0,United Kingdom,2011-09-28,17.9
548561,22427,ENAMEL FLOWER JUG CREAM,3,01-04-2011 10:11,5.95,16609.0,United Kingdom,2011-01-04,17.85
574667,21260,FIRST AID TIN,6,06-11-2011 12:12,3.25,15514.0,United Kingdom,2011-06-11,19.5
571696,23022,SMALL BONNE JAM JAR  T-LIGHT HOLDER,6,18-10-2011 14:47,2.08,15604.0,United Kingdom,2011-10-18,12.48
566605,21068,VINTAGE BILLBOARD LOVE/HATE MUG,2,13-09-2011 16:27,1.25,13263.0,United Kingdom,2011-09-13,2.5
540473,82578,KITCHEN METAL SIGN,2,07-01-2011 14:31,0.55,17284.0,United Kingdom,2011-07-01,1.1
571477,23078,ICE CREAM PEN LIP GLOSS ,24,17-10-2011 14:54,1.25,12794.0,Portugal,2011-10-17,30.0
555638,21497,FANCY FONTS BIRTHDAY WRAP,25,06-06-2011 12:51,0.42,15150.0,United Kingdom,2011-06-06,10.5
580729,23565,EGG CUP MILKMAID HELGA ,1,05-12-2011 17:24,2.46,,United Kingdom,2011-05-12,2.46
568212,22139,RETROSPOT TEA SET CERAMIC 11 PC ,1,25-09-2011 16:05,4.95,15154.0,United Kingdom,2011-09-25,4.95
567191,22466,FAIRY TALE COTTAGE NIGHT LIGHT,12,19-09-2011 09:15,1.95,12562.0,France,2011-09-19,23.4
562380,23438,GIFT BAG LARGE SPOT ,12,04-08-2011 15:23,1.25,14778.0,United Kingdom,2011-04-08,15.0
570824,84978,HANGING HEART JAR T-LIGHT HOLDER,36,12-10-2011 12:58,1.06,14299.0,United Kingdom,2011-12-10,38.160000000000004
581219,22331,WOODLAND PARTY BAG + STICKER SET,1,08-12-2011 09:28,3.29,,United Kingdom,2011-08-12,3.29
543000,48185,DOORMAT FAIRY CAKE,3,02-02-2011 12:17,16.63,,United Kingdom,2011-02-02,49.89
570118,22835,HOT WATER BOTTLE I AM SO POORLY,4,07-10-2011 12:44,4.95,13276.0,United Kingdom,2011-07-10,19.8
553544,48194,DOORMAT HEARTS,1,17-05-2011 15:36,14.13,,United Kingdom,2011-05-17,14.13
579188,22453,MEASURING TAPE BABUSHKA BLUE,4,28-11-2011 15:34,2.95,12748.0,United Kingdom,2011-11-28,11.8
559817,85017B,ENVELOPE 50 BLOSSOM IMAGES,1,12-07-2011 16:20,0.83,,United Kingdom,2011-12-07,0.83
539436,84946,ANTIQUE SILVER TEA GLASS ETCHED,14,17-12-2010 14:49,2.51,,United Kingdom,2010-12-17,35.14
565840,20733,GOLD MINI TAPE MEASURE ,1,07-09-2011 12:02,0.83,,United Kingdom,2011-07-09,0.83
539434,22262,FELT EGG COSY CHICKEN,1,17-12-2010 14:41,1.66,,United Kingdom,2010-12-17,1.66
569997,POST,POSTAGE,9,07-10-2011 08:08,18.0,12394.0,Denmark,2011-07-10,162.0
541999,22549,PICTURE DOMINOES,1,25-01-2011 10:45,3.29,,United Kingdom,2011-01-25,3.29
557222,22960,JAM MAKING SET WITH JARS,6,17-06-2011 13:14,4.25,14936.0,Channel Islands,2011-06-17,25.5
564897,22728,ALARM CLOCK BAKELIKE PINK,20,31-08-2011 11:22,3.75,12678.0,France,2011-08-31,75.0
575007,23367,SET 12 COLOUR PENCILS SPACEBOY ,16,08-11-2011 11:20,0.65,14140.0,United Kingdom,2011-08-11,10.4
574704,22508,DOORSTOP RETROSPOT HEART,2,06-11-2011 14:02,3.75,15696.0,United Kingdom,2011-06-11,7.5
540355,22731,3D CHRISTMAS STAMPS STICKERS ,2,06-01-2011 15:11,1.66,,United Kingdom,2011-06-01,3.32
547334,22499,WOODEN UNION JACK BUNTING,8,22-03-2011 11:43,5.95,15044.0,United Kingdom,2011-03-22,47.6
575739,90055,CRACKED GLAZE EARRINGS BROWN,1,11-11-2011 09:05,2.48,,United Kingdom,2011-11-11,2.48
581439,23183,MOTHER'S KITCHEN SPOON REST ,1,08-12-2011 16:30,7.46,,United Kingdom,2011-08-12,7.46
550001,22088,PAPER BUNTING COLOURED LACE,6,14-04-2011 09:28,2.95,17704.0,United Kingdom,2011-04-14,17.700000000000003
574673,23462,ROCOCO WALL MIRROR WHITE,2,06-11-2011 12:26,19.95,15555.0,United Kingdom,2011-06-11,39.9
576051,21843,RED RETROSPOT CAKE STAND,5,13-11-2011 14:45,10.95,14911.0,EIRE,2011-11-13,54.75
572667,23215,JINGLE BELL HEART ANTIQUE SILVER,12,25-10-2011 13:05,2.08,15963.0,United Kingdom,2011-10-25,24.96
569140,22139,RETROSPOT TEA SET CERAMIC 11 PC ,3,30-09-2011 14:59,4.95,14503.0,United Kingdom,2011-09-30,14.850000000000001
552643,84992,72 SWEETHEART FAIRY CAKE CASES,2,10-05-2011 13:24,0.55,16791.0,United Kingdom,2011-10-05,1.1
563915,23160,REGENCY TEA SPOON,12,21-08-2011 13:24,1.25,14224.0,United Kingdom,2011-08-21,15.0
558614,90013B,BLACK VINTAGE EARRINGS,1,30-06-2011 15:56,4.15,,United Kingdom,2011-06-30,4.15
569228,84581,DOG TOY WITH PINK CROCHET SKIRT,1,02-10-2011 14:47,3.75,15547.0,United Kingdom,2011-02-10,3.75
537385,22699,ROSES REGENCY TEACUP AND SAUCER ,6,06-12-2010 13:22,2.95,14487.0,United Kingdom,2010-06-12,17.700000000000003
580721,22543,MINI JIGSAW BAKE A CAKE ,24,05-12-2011 16:57,0.19,15274.0,United Kingdom,2011-05-12,4.5600000000000005
558709,22970,LONDON BUS COFFEE MUG,6,01-07-2011 13:02,2.55,17338.0,United Kingdom,2011-01-07,15.299999999999999
578087,85123A,WHITE HANGING HEART T-LIGHT HOLDER,10,22-11-2011 16:44,2.95,15965.0,United Kingdom,2011-11-22,29.5
547565,21677,HEARTS  STICKERS,12,24-03-2011 09:21,0.85,13035.0,United Kingdom,2011-03-24,10.2
557006,22356,CHARLOTTE BAG PINK POLKADOT,20,16-06-2011 11:29,0.85,14282.0,United Kingdom,2011-06-16,17.0
573380,22966,GINGERBREAD MAN COOKIE CUTTER,3,30-10-2011 14:04,1.25,14572.0,United Kingdom,2011-10-30,3.75
560225,17012A,ORIGAMI VANILLA INCENSE/CANDLE SET ,1,15-07-2011 16:27,2.46,,United Kingdom,2011-07-15,2.46
570413,23356,LOVE HOT WATER BOTTLE,6,10-10-2011 13:13,5.95,17652.0,United Kingdom,2011-10-10,35.7
573248,23350,ROLL WRAP VINTAGE SPOT ,3,28-10-2011 12:09,1.25,14498.0,United Kingdom,2011-10-28,3.75
560239,22844,VINTAGE CREAM DOG FOOD CONTAINER,2,17-07-2011 11:50,8.5,13507.0,United Kingdom,2011-07-17,17.0
579787,82600,N0 SINGING METAL SIGN,2,30-11-2011 15:33,4.13,,United Kingdom,2011-11-30,8.26
566922,23355,HOT WATER BOTTLE KEEP CALM,24,15-09-2011 14:58,4.15,16156.0,United Kingdom,2011-09-15,99.60000000000001
545658,85227,SET OF 6 3D KIT CARDS FOR KIDS,3,04-03-2011 14:13,0.85,14670.0,United Kingdom,2011-04-03,2.55
550956,22768,FAMILY PHOTO FRAME CORNICE,1,21-04-2011 16:37,9.95,17179.0,United Kingdom,2011-04-21,9.95
555524,21166,COOK WITH WINE METAL SIGN ,3,05-06-2011 11:37,2.08,16923.0,United Kingdom,2011-05-06,6.24
539737,22301,COFFEE MUG CAT + BIRD DESIGN,1,21-12-2010 15:19,5.06,,United Kingdom,2010-12-21,5.06
578510,22335,HEART DECORATION PAINTED ZINC ,4,24-11-2011 13:25,0.65,14056.0,United Kingdom,2011-11-24,2.6
544059,22786,CUSHION COVER PINK UNION JACK,2,15-02-2011 13:00,5.95,14534.0,United Kingdom,2011-02-15,11.9
560445,21984,PACK OF 12 PINK PAISLEY TISSUES ,96,19-07-2011 09:08,0.29,14156.0,EIRE,2011-07-19,27.839999999999996
546767,84988,SET OF 72 PINK HEART PAPER DOILIES,12,16-03-2011 14:51,1.45,12971.0,United Kingdom,2011-03-16,17.4
540418,20725,LUNCH BAG RED RETROSPOT,1,07-01-2011 11:04,4.21,,United Kingdom,2011-07-01,4.21
554101,22666,RECIPE BOX PANTRY YELLOW DESIGN,6,22-05-2011 13:29,2.95,13549.0,United Kingdom,2011-05-22,17.700000000000003
577078,22070,SMALL RED RETROSPOT MUG IN BOX ,1,17-11-2011 15:17,7.46,,United Kingdom,2011-11-17,7.46
557846,20985,HEART CALCULATOR,4,23-06-2011 10:44,1.25,17365.0,United Kingdom,2011-06-23,5.0
562024,22584,PACK OF 6 PANNETONE GIFT BOXES,1,01-08-2011 16:07,4.96,,United Kingdom,2011-01-08,4.96
545901,21389,IVORY HANGING DECORATION  BIRD,4,07-03-2011 17:52,0.85,15834.0,United Kingdom,2011-07-03,3.4
580163,23355,HOT WATER BOTTLE KEEP CALM,4,02-12-2011 11:12,4.95,12828.0,United Kingdom,2011-02-12,19.8
579196,22445,PENCIL CASE LIFE IS BEAUTIFUL,1,28-11-2011 15:54,5.79,14096.0,United Kingdom,2011-11-28,5.79
562258,21086,SET/6 RED SPOTTY PAPER CUPS,3,03-08-2011 15:28,0.65,16348.0,United Kingdom,2011-03-08,1.9500000000000002
573006,47566B,TEA TIME PARTY BUNTING,10,27-10-2011 12:16,4.95,16232.0,United Kingdom,2011-10-27,49.5
556045,21930,JUMBO STORAGE BAG SKULLS,10,08-06-2011 12:54,2.08,15764.0,United Kingdom,2011-08-06,20.8
580647,23564,EGG CUP MILKMAID INGRID,6,05-12-2011 13:14,1.25,14083.0,United Kingdom,2011-05-12,7.5
547386,22684,FRENCH BLUE METAL DOOR SIGN 9,1,22-03-2011 15:52,2.46,,United Kingdom,2011-03-22,2.46
559693,84692,BOX OF 24 COCKTAIL PARASOLS,2,11-07-2011 16:21,0.83,,United Kingdom,2011-11-07,1.66
541422,22743,MAKE YOUR OWN FLOWERPOWER CARD KIT,1,17-01-2011 17:48,5.79,,United Kingdom,2011-01-17,5.79
565243,22188,BLACK HEART CARD HOLDER,8,02-09-2011 10:20,3.95,16735.0,United Kingdom,2011-02-09,31.6
574741,22496,SET OF 2 ROUND TINS DUTCH CHEESE,1,06-11-2011 16:13,2.95,15993.0,United Kingdom,2011-06-11,2.95
551724,82583,HOT BATHS METAL SIGN,2,03-05-2011 17:12,2.1,15976.0,United Kingdom,2011-03-05,4.2
580367,22375,AIRLINE BAG VINTAGE JET SET BROWN,1,02-12-2011 16:39,8.29,,United Kingdom,2011-02-12,8.29
539434,84375,SET OF 20 KIDS COOKIE CUTTERS,1,17-12-2010 14:41,4.21,,United Kingdom,2010-12-17,4.21
552295,23159,SET OF 5 PANCAKE DAY MAGNETS,2,08-05-2011 14:08,2.08,14224.0,United Kingdom,2011-08-05,4.16
555858,22908,PACK OF 20 NAPKINS RED APPLES,12,07-06-2011 14:12,0.85,14911.0,EIRE,2011-07-06,10.2
562377,23192,BUNDLE OF 3 ALPHABET EXERCISE BOOKS,3,04-08-2011 15:04,1.65,14535.0,United Kingdom,2011-04-08,4.949999999999999
572317,85049G,CHOCOLATE BOX RIBBONS ,1,23-10-2011 16:13,1.25,14629.0,United Kingdom,2011-10-23,1.25
562768,22386,JUMBO BAG PINK POLKADOT,10,09-08-2011 10:49,2.08,14127.0,United Kingdom,2011-09-08,20.8
562146,22383,LUNCH BAG SUKI DESIGN ,10,03-08-2011 10:45,1.65,17675.0,United Kingdom,2011-03-08,16.5
578344,22083,PAPER CHAIN KIT RETROSPOT,1,24-11-2011 09:21,5.79,,United Kingdom,2011-11-24,5.79
579787,23241,TREASURE TIN GYMKHANA DESIGN,1,30-11-2011 15:33,4.13,,United Kingdom,2011-11-30,4.13
547656,82552,WASHROOM METAL SIGN,1,24-03-2011 12:53,1.45,13263.0,United Kingdom,2011-03-24,1.45
579550,22222,CAKE PLATE LOVEBIRD WHITE,3,30-11-2011 10:48,4.95,12630.0,Finland,2011-11-30,14.850000000000001
580697,22639,SET OF 4 NAPKIN CHARMS HEARTS,3,05-12-2011 16:05,0.79,15984.0,United Kingdom,2011-05-12,2.37
568515,47591D,PINK FAIRY CAKE CHILDRENS APRON,20,27-09-2011 12:44,1.95,14466.0,United Kingdom,2011-09-27,39.0
574950,23269,SET OF 2 CERAMIC CHRISTMAS TREES,1,08-11-2011 09:29,2.92,,United Kingdom,2011-08-11,2.92
575930,22641,SET OF 4 NAPKIN CHARMS INSTRUMENT,2,11-11-2011 17:58,4.96,,United Kingdom,2011-11-11,9.92
546896,22534,MAGIC DRAWING SLATE SPACEBOY ,8,17-03-2011 18:24,0.83,,United Kingdom,2011-03-17,6.64
578065,23426,METAL SIGN DROP YOUR PANTS,1,22-11-2011 15:41,5.79,,United Kingdom,2011-11-22,5.79
548714,84050,PINK HEART SHAPE EGG FRYING PAN,1,03-04-2011 15:07,1.65,17337.0,United Kingdom,2011-03-04,1.65
570197,23338,EGG FRYING PAN RED ,1,07-10-2011 15:45,2.08,13755.0,United Kingdom,2011-07-10,2.08
571676,23264,SET OF 3 WOODEN SLEIGH DECORATIONS,1,18-10-2011 13:29,1.25,16910.0,United Kingdom,2011-10-18,1.25
548663,72801c,4 ROSE PINK DINNER CANDLES,1,01-04-2011 14:44,2.46,,United Kingdom,2011-01-04,2.46
571456,20725,LUNCH BAG RED RETROSPOT,10,17-10-2011 13:57,1.65,16729.0,United Kingdom,2011-10-17,16.5
562933,20977,36 PENCILS TUBE WOODLAND,1,10-08-2011 16:51,2.46,,United Kingdom,2011-10-08,2.46
559338,22683,FRENCH BLUE METAL DOOR SIGN 8,2,07-07-2011 16:30,2.46,,United Kingdom,2011-07-07,4.92
574547,23397,FOOT STOOL HOME SWEET HOME ,2,04-11-2011 15:08,9.95,17841.0,United Kingdom,2011-04-11,19.9
571305,22297,HEART IVORY TRELLIS SMALL,1,17-10-2011 09:55,2.46,,United Kingdom,2011-10-17,2.46
558904,46776A,WOVEN BUBBLE GUM CUSHION COVER,2,04-07-2011 16:18,4.13,,United Kingdom,2011-04-07,8.26
576618,82482,WOODEN PICTURE FRAME WHITE FINISH,2,15-11-2011 17:00,5.79,,United Kingdom,2011-11-15,11.58
565141,20726,LUNCH BAG WOODLAND,1,01-09-2011 13:40,1.65,17841.0,United Kingdom,2011-01-09,1.65
542795,22476,EMPIRE UNION JACK TV DINNER TRAY,3,01-02-2011 10:59,4.95,18055.0,United Kingdom,2011-01-02,14.850000000000001
569695,22092,BLUE PAISLEY TISSUE BOX,36,05-10-2011 15:35,0.39,16843.0,United Kingdom,2011-05-10,14.040000000000001
566969,23245,SET OF 3 REGENCY CAKE TINS,4,15-09-2011 19:36,4.95,15205.0,United Kingdom,2011-09-15,19.8
581238,47591b,SCOTTIES CHILDRENS APRON,1,08-12-2011 10:53,4.13,,United Kingdom,2011-08-12,4.13
561218,23297,SET 40 HEART SHAPE PETIT FOUR CASES,1,25-07-2011 17:11,3.29,,United Kingdom,2011-07-25,3.29
544355,22350,ILLUSTRATED CAT BOWL ,6,18-02-2011 10:53,2.55,12714.0,France,2011-02-18,15.299999999999999
546406,20972,PINK CREAM FELT CRAFT TRINKET BOX ,1,11-03-2011 16:21,2.46,,United Kingdom,2011-11-03,2.46
578852,22467,GUMBALL COAT RACK,4,27-11-2011 11:12,2.55,17841.0,United Kingdom,2011-11-27,10.2
544293,22090,PAPER BUNTING RETROSPOT,3,17-02-2011 12:42,2.95,17954.0,United Kingdom,2011-02-17,8.850000000000001
565396,21080,SET/20 RED RETROSPOT PAPER NAPKINS ,1,02-09-2011 16:39,1.63,,United Kingdom,2011-02-09,1.63
564065,23293,SET OF 12 FAIRY CAKE BAKING CASES,8,22-08-2011 15:05,0.83,15150.0,United Kingdom,2011-08-22,6.64
539754,47566,PARTY BUNTING,1,21-12-2010 16:06,4.65,12748.0,United Kingdom,2010-12-21,4.65
570333,23101,SILVER STARS TABLE DECORATION,1,10-10-2011 12:19,0.83,18126.0,United Kingdom,2011-10-10,0.83
577483,21485,RETROSPOT HEART HOT WATER BOTTLE,1,20-11-2011 11:50,4.95,14502.0,United Kingdom,2011-11-20,4.95
577358,23397,FOOT STOOL HOME SWEET HOME ,1,18-11-2011 15:59,19.96,,United Kingdom,2011-11-18,19.96
558046,20914,SET/5 RED RETROSPOT LID GLASS BOWLS,6,24-06-2011 13:47,2.95,,EIRE,2011-06-24,17.700000000000003
566571,22950,36 DOILIES VINTAGE CHRISTMAS,12,13-09-2011 12:49,1.45,17037.0,United Kingdom,2011-09-13,17.4
580612,23541,WALL ART CLASSIC PUDDINGS ,2,05-12-2011 11:58,12.46,,United Kingdom,2011-05-12,24.92
547225,72819,CUPID DESIGN SCENTED CANDLES,3,21-03-2011 15:20,2.55,,United Kingdom,2011-03-21,7.6499999999999995
537057,22478,BIRDHOUSE GARDEN MARKER ,3,05-12-2010 11:49,1.25,15351.0,United Kingdom,2010-05-12,3.75
553149,22831,WHITE BROCANTE SOAP DISH,6,13-05-2011 14:16,2.95,14226.0,United Kingdom,2011-05-13,17.700000000000003
549556,22519,CHILDS GARDEN BRUSH PINK,1,10-04-2011 12:53,2.1,17372.0,United Kingdom,2011-10-04,2.1
555276,20719,WOODLAND CHARLOTTE BAG,1,01-06-2011 17:28,1.63,,United Kingdom,2011-01-06,1.63
573763,23173,REGENCY TEAPOT ROSES ,2,01-11-2011 09:56,9.95,17139.0,United Kingdom,2011-01-11,19.9
567340,23080,RED METAL BOX TOP SECRET,2,19-09-2011 15:02,8.25,12540.0,Spain,2011-09-19,16.5
577855,22621,TRADITIONAL KNITTING NANCY,1,22-11-2011 11:18,1.65,15877.0,United Kingdom,2011-11-22,1.65
545215,20712,JUMBO BAG WOODLAND ANIMALS,4,28-02-2011 16:47,4.13,,United Kingdom,2011-02-28,16.52
544182,22502,PICNIC BASKET WICKER SMALL,4,16-02-2011 15:13,5.95,18257.0,United Kingdom,2011-02-16,23.8
545906,21890,S/6 WOODEN SKITTLES IN COTTON BAG,6,08-03-2011 09:23,2.95,15764.0,United Kingdom,2011-08-03,17.700000000000003
546654,21174,POTTERING IN THE SHED METAL SIGN,1,15-03-2011 14:18,4.13,,United Kingdom,2011-03-15,4.13
579099,20675,BLUE POLKADOT BOWL,1,28-11-2011 11:26,1.25,15714.0,United Kingdom,2011-11-28,1.25
557397,22660,DOORMAT I LOVE LONDON,1,20-06-2011 11:23,7.95,17897.0,United Kingdom,2011-06-20,7.95
568179,21974,SET OF 36 PAISLEY FLOWER DOILIES,24,25-09-2011 13:39,1.45,12545.0,Spain,2011-09-25,34.8
574678,20914,SET/5 RED RETROSPOT LID GLASS BOWLS,6,06-11-2011 12:36,2.95,13365.0,United Kingdom,2011-06-11,17.700000000000003
561512,22894,TABLECLOTH RED APPLES DESIGN ,3,27-07-2011 15:09,9.95,14534.0,United Kingdom,2011-07-27,29.849999999999998
550196,37448,CERAMIC CAKE DESIGN SPOTTED MUG,7,15-04-2011 10:09,1.49,14796.0,United Kingdom,2011-04-15,10.43
558049,22557,PLASTERS IN TIN VINTAGE PAISLEY ,1,24-06-2011 14:16,1.65,15850.0,United Kingdom,2011-06-24,1.65
549291,22907,PACK OF 20 NAPKINS PANTRY DESIGN,2,07-04-2011 19:05,0.85,16261.0,United Kingdom,2011-07-04,1.7
574877,22099,CARAVAN SQUARE TISSUE BOX,36,07-11-2011 13:17,0.39,16637.0,United Kingdom,2011-07-11,14.040000000000001
557303,23156,SET OF 5 MINI GROCERY MAGNETS,12,19-06-2011 14:36,2.08,12450.0,Spain,2011-06-19,24.96
568057,21989,PACK OF 20 SKULL PAPER NAPKINS,1,23-09-2011 12:56,1.63,,United Kingdom,2011-09-23,1.63
565378,22197,POPCORN HOLDER,37,02-09-2011 15:16,1.63,,United Kingdom,2011-02-09,60.309999999999995
543647,21544,SKULLS  WATER TRANSFER TATTOOS ,6,10-02-2011 19:49,0.85,12841.0,United Kingdom,2011-10-02,5.1
555108,21169,YOU'RE CONFUSING ME METAL SIGN ,2,31-05-2011 14:18,1.69,18231.0,United Kingdom,2011-05-31,3.38
545019,22681,FRENCH BLUE METAL DOOR SIGN 6,10,25-02-2011 13:56,1.25,15093.0,United Kingdom,2011-02-25,12.5
569545,21123,SET/10 IVORY POLKADOT PARTY CANDLES,3,04-10-2011 16:37,0.83,,United Kingdom,2011-04-10,2.4899999999999998
556484,20726,LUNCH BAG WOODLAND,2,12-06-2011 13:17,1.65,16938.0,United Kingdom,2011-12-06,3.3
540848,21931,JUMBO STORAGE BAG SUKI,1,12-01-2011 09:26,4.21,,United Kingdom,2011-12-01,4.21
558195,22469,HEART OF WICKER SMALL,12,27-06-2011 12:32,1.65,17735.0,United Kingdom,2011-06-27,19.799999999999997
547841,22293,HANGING CHICK GREEN DECORATION,5,27-03-2011 11:02,1.45,16923.0,United Kingdom,2011-03-27,7.25
572321,23307,SET OF 60 PANTRY DESIGN CAKE CASES ,24,24-10-2011 08:59,0.55,15592.0,United Kingdom,2011-10-24,13.200000000000001
558247,72351A,SET/6 TURQUOISE BUTTERFLY T-LIGHTS,2,27-06-2011 16:46,2.1,14167.0,United Kingdom,2011-06-27,4.2
580385,21375,LARGE CAMPHOR WOOD FIELD MUSHROOM ,1,04-12-2011 10:11,1.25,16326.0,United Kingdom,2011-04-12,1.25
555604,21931,JUMBO STORAGE BAG SUKI,10,06-06-2011 11:37,2.08,16612.0,United Kingdom,2011-06-06,20.8
562274,84970S,HANGING HEART ZINC T-LIGHT HOLDER,12,04-08-2011 10:00,0.85,12704.0,Finland,2011-04-08,10.2
564815,22659,LUNCH BOX I LOVE LONDON,2,30-08-2011 12:00,1.95,12748.0,United Kingdom,2011-08-30,3.9
551414,21169,YOU'RE CONFUSING ME METAL SIGN ,12,28-04-2011 13:35,1.69,15622.0,United Kingdom,2011-04-28,20.28
551718,21086,SET/6 RED SPOTTY PAPER CUPS,1,03-05-2011 16:06,1.63,,United Kingdom,2011-03-05,1.63
551277,35961,FOLKART ZINC HEART CHRISTMAS DEC,5,27-04-2011 13:06,0.85,13637.0,United Kingdom,2011-04-27,4.25
578703,22457,NATURAL SLATE HEART CHALKBOARD ,3,25-11-2011 11:02,2.95,17385.0,United Kingdom,2011-11-25,8.850000000000001
577056,90160C,TURQ+RED BOUDICCA LARGE BRACELET,10,17-11-2011 14:24,6.95,17985.0,United Kingdom,2011-11-17,69.5
548703,21982,PACK OF 12 SUKI TISSUES ,6,03-04-2011 11:37,0.29,16010.0,United Kingdom,2011-03-04,1.7399999999999998
556041,21204,DAISIES  HONEYCOMB GARLAND ,6,08-06-2011 12:44,1.65,17954.0,United Kingdom,2011-08-06,9.899999999999999
541215,22386,JUMBO BAG PINK POLKADOT,10,14-01-2011 13:42,1.95,14329.0,United Kingdom,2011-01-14,19.5
563206,21929,JUMBO BAG PINK VINTAGE PAISLEY,5,14-08-2011 12:08,2.08,17613.0,United Kingdom,2011-08-14,10.4
568095,90024B,NEW BAROQUE B'FLY NECKLACE RED,2,23-09-2011 14:49,8.5,14911.0,EIRE,2011-09-23,17.0
580513,22505,MEMO BOARD COTTAGE DESIGN,1,04-12-2011 13:59,4.95,14456.0,United Kingdom,2011-04-12,4.95
570672,20979,36 PENCILS TUBE RED RETROSPOT,16,11-10-2011 14:52,1.25,12536.0,France,2011-11-10,20.0
576520,23333,IVORY WICKER HEART MEDIUM,2,15-11-2011 12:33,1.25,14467.0,United Kingdom,2011-11-15,2.5
541969,22059,CERAMIC STRAWBERRY DESIGN MUG,1,24-01-2011 13:46,3.29,,United Kingdom,2011-01-24,3.29
578678,22754,SMALL RED BABUSHKA NOTEBOOK ,6,24-11-2011 19:59,0.85,17841.0,United Kingdom,2011-11-24,5.1
546246,22720,SET OF 3 CAKE TINS PANTRY DESIGN ,6,10-03-2011 13:28,4.95,14841.0,United Kingdom,2011-10-03,29.700000000000003
577768,23372,SET 36 COLOUR PENCILS DOLLY GIRL,1,21-11-2011 15:18,2.46,,United Kingdom,2011-11-21,2.46
569843,22082,RIBBON REEL STRIPES DESIGN ,1,06-10-2011 13:29,1.65,14449.0,United Kingdom,2011-06-10,1.65
568212,23065,LARGE DECO JEWELLERY STAND,2,25-09-2011 16:05,12.5,15154.0,United Kingdom,2011-09-25,25.0
545346,82600,NO SINGING METAL SIGN,12,02-03-2011 09:49,2.1,12834.0,United Kingdom,2011-02-03,25.200000000000003
541405,22328,ROUND SNACK BOXES SET OF 4 FRUITS ,12,17-01-2011 15:17,2.95,12683.0,France,2011-01-17,35.400000000000006
575390,23267,SET OF 4 SANTA PLACE SETTINGS,12,09-11-2011 15:31,1.25,12971.0,United Kingdom,2011-09-11,15.0
548214,22229,BUNNY WOODEN PAINTED WITH FLOWER ,12,30-03-2011 09:17,0.85,13720.0,United Kingdom,2011-03-30,10.2
575911,23393,HOME SWEET HOME CUSHION COVER ,4,11-11-2011 16:13,3.75,17314.0,United Kingdom,2011-11-11,15.0
541266,22558,CLOTHES PEGS RETROSPOT PACK 24 ,6,16-01-2011 16:25,1.49,15673.0,United Kingdom,2011-01-16,8.94
560732,22996,TRAVEL CARD WALLET VINTAGE TICKET,24,20-07-2011 14:55,0.42,14056.0,United Kingdom,2011-07-20,10.08
573139,21927,BLUE/CREAM STRIPE CUSHION COVER ,4,27-10-2011 17:29,1.25,14716.0,United Kingdom,2011-10-27,5.0
544598,84947,ANTIQUE SILVER TEA GLASS ENGRAVED,3,21-02-2011 18:10,2.46,,United Kingdom,2011-02-21,7.38
574076,21975,PACK OF 60 DINOSAUR CAKE CASES,1,02-11-2011 15:38,1.25,,United Kingdom,2011-02-11,1.25
555278,22489,PACK OF 12 TRADITIONAL CRAYONS,10,01-06-2011 17:33,0.83,,United Kingdom,2011-01-06,8.299999999999999
545559,85123A,WHITE HANGING HEART T-LIGHT HOLDER,2,03-03-2011 15:31,2.95,15005.0,United Kingdom,2011-03-03,5.9
575176,20719,WOODLAND CHARLOTTE BAG,1,08-11-2011 18:29,1.63,,United Kingdom,2011-08-11,1.63
546365,21843,RED RETROSPOT CAKE STAND,1,11-03-2011 11:35,10.95,12520.0,Germany,2011-11-03,10.95
556578,21671,RED SPOT CERAMIC DRAWER KNOB,12,13-06-2011 14:13,1.25,12472.0,Germany,2011-06-13,15.0
550169,21929,JUMBO BAG PINK VINTAGE PAISLEY,2,14-04-2011 16:41,2.08,14482.0,United Kingdom,2011-04-14,4.16
545038,21210,SET OF 72 RETROSPOT PAPER  DOILIES,1,27-02-2011 10:13,1.45,13684.0,United Kingdom,2011-02-27,1.45
559338,47566,PARTY BUNTING,2,07-07-2011 16:30,10.79,,United Kingdom,2011-07-07,21.58
560926,22031,BOTANICAL LAVENDER BIRTHDAY CARD,2,22-07-2011 09:20,0.42,,United Kingdom,2011-07-22,0.84
566738,21137,BLACK RECORD COVER FRAME,96,14-09-2011 14:28,3.39,14110.0,United Kingdom,2011-09-14,325.44
541238,22957,SET 3 PAPER VINTAGE CHICK PAPER EGG,1,16-01-2011 10:42,2.95,16746.0,United Kingdom,2011-01-16,2.95
571305,22411,JUMBO SHOPPER VINTAGE RED PAISLEY,17,17-10-2011 09:55,4.13,,United Kingdom,2011-10-17,70.21
578844,22077,6 RIBBONS RUSTIC CHARM,2,25-11-2011 16:14,4.13,,United Kingdom,2011-11-25,8.26
540515,22348,TEA BAG PLATE RED RETROSPOT,2,09-01-2011 11:54,0.85,15059.0,United Kingdom,2011-09-01,1.7
564995,21821,GLITTER STAR GARLAND WITH BELLS ,1,31-08-2011 16:09,3.75,16780.0,United Kingdom,2011-08-31,3.75
575930,23352,ROLL WRAP 50'S RED CHRISTMAS ,4,11-11-2011 17:58,2.46,,United Kingdom,2011-11-11,9.84
538658,17021,NAMASTE SWAGAT INCENSE,6,13-12-2010 15:34,0.3,17969.0,United Kingdom,2010-12-13,1.7999999999999998
553718,85131A,BEADED PEARL HEART WHITE ON STICK,1,18-05-2011 16:14,0.83,,United Kingdom,2011-05-18,0.83
572540,21943,CAKES AND RABBITS DESIGN FLANNEL ,1,24-10-2011 16:17,1.63,,United Kingdom,2011-10-24,1.63
580395,21790,VINTAGE SNAP CARDS,12,04-12-2011 10:56,0.85,17629.0,United Kingdom,2011-04-12,10.2
563942,84510A,SET OF 4 ENGLISH ROSE COASTERS,10,22-08-2011 09:53,1.25,15801.0,United Kingdom,2011-08-22,12.5
574721,22367,CHILDRENS APRON SPACEBOY DESIGN,3,06-11-2011 14:43,1.95,17920.0,United Kingdom,2011-06-11,5.85
575211,22077,6 RIBBONS RUSTIC CHARM,10,09-11-2011 10:39,1.95,17377.0,United Kingdom,2011-09-11,19.5
564965,23084,RABBIT NIGHT LIGHT,48,31-08-2011 15:07,1.79,17677.0,United Kingdom,2011-08-31,85.92
561388,22899,CHILDREN'S APRON DOLLY GIRL ,50,27-07-2011 09:32,1.85,12753.0,Japan,2011-07-27,92.5
570488,22144,CHRISTMAS CRAFT LITTLE FRIENDS,1,10-10-2011 17:12,4.13,14096.0,United Kingdom,2011-10-10,4.13
578827,22278,OVERNIGHT BAG VINTAGE ROSE PAISLEY,1,25-11-2011 14:25,10.79,,United Kingdom,2011-11-25,10.79
557960,23138,SINGLE WIRE HOOK IVORY HEART,2,23-06-2011 19:46,1.45,15453.0,United Kingdom,2011-06-23,2.9
556072,21621,VINTAGE UNION JACK BUNTING,12,08-06-2011 14:57,8.5,16126.0,United Kingdom,2011-08-06,102.0
574691,23138,SINGLE WIRE HOOK IVORY HEART,3,06-11-2011 13:17,1.45,14174.0,United Kingdom,2011-06-11,4.35
540352,16237,SLEEPING CAT ERASERS,4,06-01-2011 14:27,0.43,,United Kingdom,2011-06-01,1.72
537382,22729,ALARM CLOCK BAKELIKE ORANGE,2,06-12-2010 13:13,3.75,16710.0,United Kingdom,2010-06-12,7.5
553125,23204,CHARLOTTE BAG APPLES DESIGN,10,13-05-2011 12:13,0.85,17139.0,United Kingdom,2011-05-13,8.5
548673,22726,ALARM CLOCK BAKELIKE GREEN,4,01-04-2011 16:18,3.75,13767.0,United Kingdom,2011-01-04,15.0
551284,84508B,STRIPES DESIGN TEDDY,3,27-04-2011 14:05,2.55,15005.0,United Kingdom,2011-04-27,7.6499999999999995
575037,22578,WOODEN STAR CHRISTMAS SCANDINAVIAN,20,08-11-2011 11:51,0.29,16066.0,United Kingdom,2011-08-11,5.8
567618,23231,WRAP  VINTAGE DOILY ,25,21-09-2011 12:26,0.42,12721.0,France,2011-09-21,10.5
537144,84352,SILVER CHRISTMAS TREE BAUBLE STAND ,1,05-12-2010 13:00,16.95,15880.0,United Kingdom,2010-05-12,16.95
575477,21894,POTTING SHED SEED ENVELOPES,1,09-11-2011 16:14,2.46,,United Kingdom,2011-09-11,2.46
574074,23484,HEART TRELLIS TRIPLE T-LIGHT HOLDER,1,02-11-2011 15:33,5.79,,United Kingdom,2011-02-11,5.79
546236,85199S,SMALL HANGING IVORY/RED WOOD BIRD,24,10-03-2011 12:48,0.42,12370.0,Cyprus,2011-10-03,10.08
576560,22579,WOODEN TREE CHRISTMAS SCANDINAVIAN,2,15-11-2011 13:21,0.29,12877.0,United Kingdom,2011-11-15,0.58
547070,22261,FELT EGG COSY WHITE RABBIT ,1,20-03-2011 13:58,0.85,16115.0,United Kingdom,2011-03-20,0.85
569828,82484,WOOD BLACK BOARD ANT WHITE FINISH,2,06-10-2011 12:35,7.95,14527.0,United Kingdom,2011-06-10,15.9
559894,22356,CHARLOTTE BAG PINK POLKADOT,1,13-07-2011 12:06,0.85,14159.0,United Kingdom,2011-07-13,0.85
540255,21881,CUTE CATS TAPE,1,05-01-2011 16:50,0.43,,United Kingdom,2011-05-01,0.43
553202,21703,BAG 125g SWIRLY MARBLES,25,15-05-2011 16:02,0.42,15854.0,United Kingdom,2011-05-15,10.5
549121,22423,REGENCY CAKESTAND 3 TIER,2,06-04-2011 13:33,12.75,17140.0,United Kingdom,2011-06-04,25.5
559036,22435,SET OF 9 HEART SHAPED BALLOONS,12,05-07-2011 15:14,1.25,12637.0,France,2011-05-07,15.0
538071,22212,FOUR HOOK  WHITE LOVEBIRDS,3,09-12-2010 14:09,4.21,,United Kingdom,2010-09-12,12.629999999999999
568992,21931,JUMBO STORAGE BAG SUKI,1,29-09-2011 16:48,2.08,17218.0,United Kingdom,2011-09-29,2.08
554795,22429,ENAMEL MEASURING JUG CREAM,4,26-05-2011 12:46,4.25,14210.0,United Kingdom,2011-05-26,17.0
579455,23319,BOX OF 6 MINI 50'S CRACKERS,12,29-11-2011 14:14,2.49,15239.0,United Kingdom,2011-11-29,29.880000000000003
544772,20713,JUMBO BAG OWLS,1,23-02-2011 11:12,4.13,,United Kingdom,2011-02-23,4.13
573553,47566b,TEA TIME PARTY BUNTING,1,31-10-2011 13:48,8.29,,United Kingdom,2011-10-31,8.29
573280,23486,ANTIQUE HEART SHELF UNIT,1,28-10-2011 13:42,16.65,14221.0,United Kingdom,2011-10-28,16.65
541422,84968A,SET OF 16 VINTAGE ROSE CUTLERY,2,17-01-2011 17:48,8.29,,United Kingdom,2011-01-17,16.58
544930,22723,SET OF 6 HERB TINS SKETCHBOOK,1,24-02-2011 18:26,3.95,17472.0,United Kingdom,2011-02-24,3.95
580902,82582,AREA PATROLLED METAL SIGN,72,06-12-2011 12:50,1.85,13881.0,United Kingdom,2011-06-12,133.20000000000002
560122,23109,LED TEA LIGHTS,36,15-07-2011 10:33,2.89,14332.0,United Kingdom,2011-07-15,104.04
560861,16238,PARTY TIME PENCIL ERASERS,1,21-07-2011 13:37,0.21,17660.0,United Kingdom,2011-07-21,0.21
555925,22865,HAND WARMER OWL DESIGN,1,07-06-2011 17:13,4.13,,United Kingdom,2011-07-06,4.13
540509,22746,POPPY'S PLAYHOUSE LIVINGROOM ,5,09-01-2011 11:27,2.1,14800.0,United Kingdom,2011-09-01,10.5
559340,22115,METAL SIGN EMPIRE TEA,12,07-07-2011 16:51,0.79,13699.0,United Kingdom,2011-07-07,9.48
538783,22274,FELTCRAFT DOLL EMILY,12,14-12-2010 11:38,2.95,14961.0,United Kingdom,2010-12-14,35.400000000000006
578901,22572,ROCKING HORSE GREEN CHRISTMAS ,3,27-11-2011 11:47,0.85,17812.0,United Kingdom,2011-11-27,2.55
575930,20726,LUNCH BAG WOODLAND,1,11-11-2011 17:58,4.13,,United Kingdom,2011-11-11,4.13
572517,22562,MONSTERS STENCIL CRAFT,2,24-10-2011 14:47,1.25,15068.0,United Kingdom,2011-10-24,2.5
581574,21257,VICTORIAN SEWING BOX MEDIUM,2,09-12-2011 12:09,7.95,12526.0,Germany,2011-09-12,15.9
543428,84836,ZINC METAL HEART DECORATION,12,08-02-2011 11:36,1.25,17787.0,United Kingdom,2011-08-02,15.0
574328,22332,SKULLS PARTY BAG + STICKER SET,8,04-11-2011 09:05,1.65,13081.0,United Kingdom,2011-04-11,13.2
550131,22982,PANTRY PASTRY BRUSH,12,14-04-2011 13:27,1.25,15935.0,United Kingdom,2011-04-14,15.0
558237,22570,FELTCRAFT CUSHION RABBIT,3,27-06-2011 15:04,3.75,12867.0,United Kingdom,2011-06-27,11.25
561894,22999,TRAVEL CARD WALLET VINTAGE LEAF,2,31-07-2011 15:00,0.42,14456.0,United Kingdom,2011-07-31,0.84
550542,22365,DOORMAT RESPECTABLE HOUSE,1,19-04-2011 11:37,15.79,,United Kingdom,2011-04-19,15.79
551658,20719,WOODLAND CHARLOTTE BAG,20,03-05-2011 12:13,0.85,16746.0,United Kingdom,2011-03-05,17.0
576587,23439,HAND WARMER RED LOVE HEART,3,15-11-2011 14:23,2.1,18123.0,United Kingdom,2011-11-15,6.300000000000001
542777,48194,DOORMAT HEARTS,2,01-02-2011 08:31,7.95,14911.0,EIRE,2011-01-02,15.9
572309,35651,VINTAGE BEAD PINK SCARF ,4,23-10-2011 15:29,1.65,14432.0,United Kingdom,2011-10-23,6.6
537823,90059D,DIAMANTE HAIR GRIP PACK/2 PERIDOT,1,08-12-2010 14:25,1.69,,United Kingdom,2010-08-12,1.69
568191,23293,SET OF 12 FAIRY CAKE BAKING CASES,2,25-09-2011 14:37,0.83,16655.0,United Kingdom,2011-09-25,1.66
560360,21470,FLOWER VINE RAFFIA FOOD COVER,6,18-07-2011 11:55,3.75,12744.0,Singapore,2011-07-18,22.5
555289,85099B,JUMBO BAG RED RETROSPOT,10,02-06-2011 10:00,2.08,15078.0,United Kingdom,2011-02-06,20.8
580136,20794,BLUE  TILE HOOK,2,01-12-2011 19:42,2.55,17841.0,United Kingdom,2011-01-12,5.1
538071,85177,BASKET OF FLOWERS SEWING KIT,1,09-12-2010 14:09,1.66,,United Kingdom,2010-09-12,1.66
563911,22630,DOLLY GIRL LUNCH BOX,12,21-08-2011 12:39,1.95,16265.0,United Kingdom,2011-08-21,23.4
566427,15039,SANDALWOOD FAN,1,12-09-2011 14:24,0.85,17433.0,United Kingdom,2011-12-09,0.85
576618,23534,WALL ART STOP FOR TEA ,2,15-11-2011 17:00,12.46,,United Kingdom,2011-11-15,24.92
544093,20685,DOORMAT RED RETROSPOT,2,16-02-2011 09:08,7.95,13750.0,United Kingdom,2011-02-16,15.9
549954,23156,SET OF 5 MINI GROCERY MAGNETS,12,13-04-2011 13:25,2.08,13700.0,United Kingdom,2011-04-13,24.96
539401,21122,SET/10 PINK POLKADOT PARTY CANDLES,24,17-12-2010 12:02,1.25,12709.0,Germany,2010-12-17,30.0
537044,22471,TV DINNER TRAY AIR HOSTESS ,3,05-12-2010 10:52,4.95,18055.0,United Kingdom,2010-05-12,14.850000000000001
572924,22112,CHOCOLATE HOT WATER BOTTLE,6,27-10-2011 08:56,4.95,13416.0,United Kingdom,2011-10-27,29.700000000000003
562445,21843,RED RETROSPOT CAKE STAND,1,04-08-2011 18:51,10.95,12417.0,Belgium,2011-04-08,10.95
546306,21462,"NURSERY A,B,C PAINTED LETTERS",1,10-03-2011 16:16,13.29,,United Kingdom,2011-10-03,13.29
554956,21238,RED RETROSPOT CUP,2,27-05-2011 15:17,1.63,,United Kingdom,2011-05-27,3.26
539988,21380,WOODEN HAPPY BIRTHDAY GARLAND,2,23-12-2010 16:06,2.95,18116.0,United Kingdom,2010-12-23,5.9
556252,21166,COOK WITH WINE METAL SIGN ,12,09-06-2011 16:44,2.08,16779.0,United Kingdom,2011-09-06,24.96
549571,84970L,SINGLE HEART ZINC T-LIGHT HOLDER,12,10-04-2011 15:25,0.95,15655.0,United Kingdom,2011-10-04,11.399999999999999
575755,23222,CHRISTMAS TREE HANGING GOLD,12,11-11-2011 10:45,0.83,17015.0,United Kingdom,2011-11-11,9.959999999999999
565234,22584,PACK OF 6 PANNETONE GIFT BOXES,2,02-09-2011 09:38,4.96,,United Kingdom,2011-02-09,9.92
539311,82613C,"METAL SIGN,CUPCAKE SINGLE HOOK",40,16-12-2010 17:53,0.42,14643.0,United Kingdom,2010-12-16,16.8
581579,22197,POPCORN HOLDER,24,09-12-2011 12:19,0.85,17581.0,United Kingdom,2011-09-12,20.4
574914,84842,HELLO SAILOR BATHROOM SET,2,07-11-2011 16:16,3.75,17109.0,United Kingdom,2011-07-11,7.5
540278,20974,12 PENCILS SMALL TUBE SKULL,2,06-01-2011 12:31,0.65,15719.0,United Kingdom,2011-06-01,1.3
562670,22423,REGENCY CAKESTAND 3 TIER,1,08-08-2011 13:42,12.75,14911.0,EIRE,2011-08-08,12.75
563036,20969,RED FLORAL FELTCRAFT SHOULDER BAG,4,11-08-2011 14:55,3.75,14868.0,United Kingdom,2011-11-08,15.0
549728,22334,DINOSAUR PARTY BAG + STICKER SET,4,11-04-2011 16:15,1.65,17799.0,United Kingdom,2011-11-04,6.6
575481,20983,12 PENCILS TALL TUBE RED RETROSPOT,4,09-11-2011 16:28,0.85,15679.0,United Kingdom,2011-09-11,3.4
572288,23356,LOVE HOT WATER BOTTLE,3,23-10-2011 12:28,5.95,17377.0,United Kingdom,2011-10-23,17.85
563928,21929,JUMBO BAG PINK VINTAGE PAISLEY,2,21-08-2011 15:17,2.08,17059.0,United Kingdom,2011-08-21,4.16
554836,20971,PINK BLUE FELT CRAFT TRINKET BOX,12,26-05-2011 16:25,1.25,13015.0,United Kingdom,2011-05-26,15.0
571850,23354,6 GIFT TAGS 50'S CHRISTMAS ,8,19-10-2011 12:54,0.83,14698.0,United Kingdom,2011-10-19,6.64
578266,22602,RETROSPOT WOODEN HEART DECORATION,2,23-11-2011 13:34,0.85,12748.0,United Kingdom,2011-11-23,1.7
568165,23298,SPOTTY BUNTING,6,25-09-2011 12:42,4.95,17131.0,United Kingdom,2011-09-25,29.700000000000003
544406,21683,MEDIUM MEDINA STAMPED METAL BOWL ,2,18-02-2011 13:26,2.95,16726.0,United Kingdom,2011-02-18,5.9
561658,21588,RETROSPOT GIANT TUBE MATCHES,1,28-07-2011 16:06,2.55,12743.0,Unspecified,2011-07-28,2.55
580119,23575,SNACK TRAY PAISLEY PARK,1,01-12-2011 16:37,1.95,17920.0,United Kingdom,2011-01-12,1.95
550389,22302,COFFEE MUG PEARS  DESIGN,4,18-04-2011 11:53,2.55,17284.0,United Kingdom,2011-04-18,10.2
581492,23245,SET OF 3 REGENCY CAKE TINS,7,09-12-2011 10:03,10.79,,United Kingdom,2011-09-12,75.53
541508,22518,CHILDS GARDEN BRUSH BLUE,1,18-01-2011 16:06,4.13,,United Kingdom,2011-01-18,4.13
548014,22728,ALARM CLOCK BAKELIKE PINK,4,29-03-2011 11:29,3.75,17719.0,United Kingdom,2011-03-29,15.0
545309,22507,MEMO BOARD RETROSPOT  DESIGN,4,01-03-2011 13:40,4.95,13884.0,United Kingdom,2011-01-03,19.8
580983,90214N,"LETTER ""N"" BLING KEY RING",1,06-12-2011 16:26,0.83,,United Kingdom,2011-06-12,0.83
574714,23275,SET OF 3 HANGING OWLS OLLIE BEAK,2,06-11-2011 14:29,1.25,15427.0,United Kingdom,2011-06-11,2.5
541997,22859,EASTER TIN BUNNY BOUQUET,6,25-01-2011 10:38,1.65,18077.0,United Kingdom,2011-01-25,9.899999999999999
564719,47566,PARTY BUNTING,1,28-08-2011 11:55,4.95,15325.0,United Kingdom,2011-08-28,4.95
575692,22601,CHRISTMAS RETROSPOT ANGEL WOOD,10,10-11-2011 16:27,0.85,12508.0,France,2011-10-11,8.5
579531,23497,CLASSIC CHROME BICYCLE BELL ,24,30-11-2011 09:18,1.45,17017.0,United Kingdom,2011-11-30,34.8
555324,84660a,WHITE STITCHED WALL CLOCK,3,02-06-2011 11:02,7.46,,United Kingdom,2011-02-06,22.38
568676,23012,GLASS APOTHECARY BOTTLE PERFUME,4,28-09-2011 13:43,3.95,18242.0,United Kingdom,2011-09-28,15.8
556473,22998,TRAVEL CARD WALLET KEEP CALM,11,12-06-2011 12:00,0.42,17265.0,United Kingdom,2011-12-06,4.62
581006,21537,RED RETROSPOT PUDDING BOWL,8,07-12-2011 08:45,4.25,14911.0,EIRE,2011-07-12,34.0
542612,22041,"RECORD FRAME 7"" SINGLE SIZE ",1,30-01-2011 14:19,2.55,17841.0,United Kingdom,2011-01-30,2.55
577504,35923,CANDY HEART HANGING DECORATION,10,20-11-2011 12:36,0.39,14159.0,United Kingdom,2011-11-20,3.9000000000000004
551843,23133,LARGE IVORY HEART WALL ORGANISER,2,04-05-2011 13:57,8.25,16094.0,United Kingdom,2011-04-05,16.5
561818,82486,WOOD S/3 CABINET ANT WHITE FINISH,2,29-07-2011 15:51,8.95,16775.0,United Kingdom,2011-07-29,17.9
564065,22142,CHRISTMAS CRAFT WHITE FAIRY ,12,22-08-2011 15:05,1.45,15150.0,United Kingdom,2011-08-22,17.4
570857,22139,RETROSPOT TEA SET CERAMIC 11 PC ,3,12-10-2011 15:06,4.95,15555.0,United Kingdom,2011-12-10,14.850000000000001
550186,22699,ROSES REGENCY TEACUP AND SAUCER ,18,14-04-2011 18:28,2.95,14051.0,United Kingdom,2011-04-14,53.1
573585,22644,CERAMIC CHERRY CAKE MONEY BANK,1,31-10-2011 14:41,3.29,,United Kingdom,2011-10-31,3.29
546155,22720,SET OF 3 CAKE TINS PANTRY DESIGN ,3,10-03-2011 08:29,4.95,15632.0,United Kingdom,2011-10-03,14.850000000000001
552358,85185B,PINK HORSE SOCK PUPPET,12,09-05-2011 12:20,2.95,15673.0,United Kingdom,2011-09-05,35.400000000000006
550362,47503A,ASS FLORAL PRINT MULTI SCREWDRIVER,1,18-04-2011 11:13,1.25,13113.0,United Kingdom,2011-04-18,1.25
538888,40016,CHINESE DRAGON PAPER LANTERNS,24,14-12-2010 16:23,0.42,17912.0,United Kingdom,2010-12-14,10.08
563755,47590A,BLUE HAPPY BIRTHDAY BUNTING,3,19-08-2011 10:58,5.45,17612.0,United Kingdom,2011-08-19,16.35
572903,35648,VINTAGE BEAD PINK PURSE ,3,26-10-2011 15:17,0.83,17974.0,United Kingdom,2011-10-26,2.4899999999999998
547248,20723,STRAWBERRY CHARLOTTE BAG,1,22-03-2011 09:23,1.63,,United Kingdom,2011-03-22,1.63
555845,23301,GARDENERS KNEELING PAD KEEP CALM ,1,07-06-2011 13:19,1.65,17015.0,United Kingdom,2011-07-06,1.65
559338,22613,PACK OF 20 SPACEBOY NAPKINS,2,07-07-2011 16:30,1.63,,United Kingdom,2011-07-07,3.26
576575,21523,DOORMAT FANCY FONT HOME SWEET HOME,2,15-11-2011 13:55,8.25,16295.0,United Kingdom,2011-11-15,16.5
540468,21709,FOLDING UMBRELLA CHOCOLATE POLKADOT,2,07-01-2011 13:55,3.36,,United Kingdom,2011-07-01,6.72
549569,22292,HANGING CHICK  YELLOW DECORATION,4,10-04-2011 15:15,1.45,15547.0,United Kingdom,2011-10-04,5.8
557215,23120,PACK OF 6 SMALL FRUIT STRAWS,24,17-06-2011 12:22,0.42,17677.0,United Kingdom,2011-06-17,10.08
544077,20771,CHRYSANTHEMUM  JOURNAL,1,15-02-2011 15:04,2.55,14825.0,United Kingdom,2011-02-15,2.55
557771,23237,SET OF 4 KNICK KNACK TINS LEAVES ,6,22-06-2011 14:43,4.15,15601.0,United Kingdom,2011-06-22,24.900000000000002
559052,84796A,PINK HAWAIIAN PICNIC HAMPER FOR 2,2,05-07-2011 16:53,8.29,,United Kingdom,2011-05-07,16.58
566277,23313,VINTAGE CHRISTMAS BUNTING,10,11-09-2011 14:01,4.95,16796.0,United Kingdom,2011-11-09,49.5
538379,72816,SET/3 CHRISTMAS DECOUPAGE CANDLES,1,12-12-2010 11:26,1.25,17126.0,United Kingdom,2010-12-12,1.25
579980,23267,SET OF 4 SANTA PLACE SETTINGS,2,01-12-2011 11:16,1.25,13263.0,United Kingdom,2011-01-12,2.5
569255,23528,SPACEBOY WALL ART,144,03-10-2011 11:01,2.66,18102.0,United Kingdom,2011-03-10,383.04
560239,22845,VINTAGE CREAM CAT FOOD CONTAINER,2,17-07-2011 11:50,6.35,13507.0,United Kingdom,2011-07-17,12.7
581134,23562,SET OF 6 RIBBONS PERFECTLY PRETTY  ,1,07-12-2011 13:12,2.89,16368.0,United Kingdom,2011-07-12,2.89
569728,21181,PLEASE ONE PERSON METAL SIGN,24,06-10-2011 09:38,2.1,15416.0,United Kingdom,2011-06-10,50.400000000000006
561192,22072,RED RETROSPOT TEA CUP AND SAUCER ,2,25-07-2011 13:45,3.75,16033.0,United Kingdom,2011-07-25,7.5
567699,22624,IVORY KITCHEN SCALES,2,22-09-2011 09:16,8.5,17466.0,United Kingdom,2011-09-22,17.0
549279,22246,MAGIC GARDEN FELT GARLAND ,1,07-04-2011 13:16,1.95,16469.0,United Kingdom,2011-07-04,1.95
556912,82483,WOOD 2 DRAWER CABINET WHITE FINISH,2,15-06-2011 13:26,6.95,15005.0,United Kingdom,2011-06-15,13.9
553158,21870,I CAN ONLY PLEASE ONE PERSON MUG,12,13-05-2011 15:24,1.25,14194.0,United Kingdom,2011-05-13,15.0
537818,22637,PIGGY BANK RETROSPOT ,12,08-12-2010 13:53,2.55,12766.0,Portugal,2010-08-12,30.599999999999998
557397,23000,TRAVEL CARD WALLET TRANSPORT,1,20-06-2011 11:23,0.42,17897.0,United Kingdom,2011-06-20,0.42
536984,20668,DISCO BALL CHRISTMAS DECORATION,24,03-12-2010 14:35,0.12,17841.0,United Kingdom,2010-03-12,2.88
557937,21001,ROSE DU SUD WASHBAG ,1,23-06-2011 15:30,4.13,,United Kingdom,2011-06-23,4.13
552539,22423,REGENCY CAKESTAND 3 TIER,4,10-05-2011 10:17,12.75,,EIRE,2011-10-05,51.0
580188,23165,LARGE CERAMIC TOP STORAGE JAR,2,02-12-2011 12:02,1.65,16440.0,United Kingdom,2011-02-12,3.3
573485,23208,LUNCH BAG VINTAGE LEAF DESIGN,5,31-10-2011 11:37,1.65,15752.0,United Kingdom,2011-10-31,8.25
541842,21733,RED HANGING HEART T-LIGHT HOLDER,4,23-01-2011 12:07,2.95,16085.0,United Kingdom,2011-01-23,11.8
558625,23191,BUNDLE OF 3 RETRO NOTE BOOKS,12,30-06-2011 17:29,1.65,14132.0,United Kingdom,2011-06-30,19.799999999999997
572037,23500,KEY RING BASEBALL BOOT ASSORTED ,20,20-10-2011 12:07,1.25,17365.0,United Kingdom,2011-10-20,25.0
565411,22666,RECIPE BOX PANTRY YELLOW DESIGN,2,04-09-2011 11:22,2.95,13772.0,United Kingdom,2011-04-09,5.9
542667,21975,PACK OF 60 DINOSAUR CAKE CASES,6,31-01-2011 12:16,0.55,17068.0,United Kingdom,2011-01-31,3.3000000000000003
544801,16161U,WRAP SUKI AND FRIENDS,25,23-02-2011 13:48,0.42,16145.0,United Kingdom,2011-02-23,10.5
569369,23089,GLASS BON BON JAR,12,03-10-2011 15:32,1.95,15105.0,United Kingdom,2011-03-10,23.4
577768,21889,WOODEN BOX OF DOMINOES,4,21-11-2011 15:18,2.46,,United Kingdom,2011-11-21,9.84
570127,23329,DECORATIVE WICKER HEART LARGE,6,07-10-2011 13:17,1.65,16900.0,United Kingdom,2011-07-10,9.899999999999999
538566,22095,LADS ONLY TISSUE BOX,1,13-12-2010 11:21,2.51,,United Kingdom,2010-12-13,2.51
556921,23109,LED TEA LIGHTS,12,15-06-2011 13:50,2.89,16038.0,United Kingdom,2011-06-15,34.68
553387,23201,JUMBO BAG ALPHABET,1,16-05-2011 16:33,4.13,,United Kingdom,2011-05-16,4.13
554104,22722,SET OF 6 SPICE TINS PANTRY DESIGN,4,22-05-2011 14:03,3.95,12705.0,Germany,2011-05-22,15.8
538566,22679,FRENCH BLUE METAL DOOR SIGN 4,1,13-12-2010 11:21,2.51,,United Kingdom,2010-12-13,2.51
565803,20713,JUMBO BAG OWLS,10,07-09-2011 10:38,2.08,17735.0,United Kingdom,2011-07-09,20.8
569528,22586,FELTCRAFT HAIRBAND PINK AND BLUE,3,04-10-2011 14:53,0.85,16242.0,United Kingdom,2011-04-10,2.55
570842,47591D,PINK FAIRY CAKE CHILDRENS APRON,8,12-10-2011 14:21,1.95,17676.0,United Kingdom,2011-12-10,15.6
562161,35648,VINTAGE BEAD PINK PURSE ,4,03-08-2011 11:58,0.83,17841.0,United Kingdom,2011-03-08,3.32
571654,23343,JUMBO BAG VINTAGE CHRISTMAS ,3,18-10-2011 12:17,2.08,18118.0,United Kingdom,2011-10-18,6.24
550627,20970,PINK FLORAL FELTCRAFT SHOULDER BAG,4,19-04-2011 14:36,3.75,16633.0,United Kingdom,2011-04-19,15.0
576365,23526,WALL ART DOG LICENCE ,14,14-11-2011 17:55,14.95,,United Kingdom,2011-11-14,209.29999999999998
565219,23287,RED VINTAGE SPOT BEAKER,8,01-09-2011 18:07,0.85,14420.0,United Kingdom,2011-01-09,6.8
565243,23201,JUMBO BAG ALPHABET,10,02-09-2011 10:20,2.08,16735.0,United Kingdom,2011-02-09,20.8
552229,21930,JUMBO STORAGE BAG SKULLS,1,06-05-2011 15:40,4.13,,United Kingdom,2011-06-05,4.13
536562,22423,REGENCY CAKESTAND 3 TIER,2,01-12-2010 15:08,12.75,13468.0,United Kingdom,2010-01-12,25.5
578088,21822,GLITTER CHRISTMAS TREE WITH BELLS,12,22-11-2011 16:47,0.79,16376.0,United Kingdom,2011-11-22,9.48
580596,23494,VINTAGE DOILY DELUXE SEWING KIT ,6,05-12-2011 11:01,5.95,15392.0,United Kingdom,2011-05-12,35.7
557937,84796B,BLUE SAVANNAH PICNIC HAMPER FOR 2,1,23-06-2011 15:30,8.29,,United Kingdom,2011-06-23,8.29
541266,21383,PACK OF 12 STICKY BUNNIES,16,16-01-2011 16:25,0.65,15673.0,United Kingdom,2011-01-16,10.4
547050,22332,SKULLS PARTY BAG + STICKER SET,10,20-03-2011 12:02,1.65,17795.0,United Kingdom,2011-03-20,16.5
559923,21165,BEWARE OF THE CAT METAL SIGN ,1,13-07-2011 16:07,4.13,,United Kingdom,2011-07-13,4.13
540848,21706,FOLDING UMBRELLA RED/WHITE POLKADOT,2,12-01-2011 09:26,3.36,,United Kingdom,2011-12-01,6.72
546884,85130B,BEADED CRYSTAL HEART GREEN LARGE,1,17-03-2011 18:08,3.29,,United Kingdom,2011-03-17,3.29
550921,22027,TEA PARTY BIRTHDAY CARD,12,21-04-2011 14:21,0.42,14770.0,United Kingdom,2011-04-21,5.04
555383,20728,LUNCH BAG CARS BLUE,4,02-06-2011 15:13,1.65,12517.0,Germany,2011-02-06,6.6
551010,21094,SET/6 RED SPOTTY PAPER PLATES,4,26-04-2011 09:52,2.46,,United Kingdom,2011-04-26,9.84
568721,21933,PINK VINTAGE PAISLEY PICNIC BAG,1,28-09-2011 16:24,2.46,,United Kingdom,2011-09-28,2.46
569137,72349b,SET/6 PURPLE BUTTERFLY T-LIGHTS,1,30-09-2011 14:45,4.13,,United Kingdom,2011-09-30,4.13
539325,22915,ASSORTED BOTTLE TOP  MAGNETS ,12,17-12-2010 08:20,0.42,13004.0,United Kingdom,2010-12-17,5.04
558432,22669,RED BABY BUNTING ,10,29-06-2011 12:16,2.95,17730.0,United Kingdom,2011-06-29,29.5
578043,23569,TRADTIONAL ALPHABET STAMP SET,4,22-11-2011 14:39,4.95,12474.0,Germany,2011-11-22,19.8
551344,20718,RED RETROSPOT SHOPPER BAG,10,28-04-2011 09:02,1.25,16187.0,United Kingdom,2011-04-28,12.5
537623,22082,RIBBON REEL STRIPES DESIGN ,5,07-12-2010 14:31,1.65,15858.0,United Kingdom,2010-07-12,8.25
541576,21884,CAKES AND BOWS GIFT  TAPE,2,19-01-2011 13:32,0.65,17097.0,Spain,2011-01-19,1.3
570699,85099B,JUMBO BAG RED RETROSPOT,10,12-10-2011 09:20,2.08,15421.0,United Kingdom,2011-12-10,20.8
552168,47566,PARTY BUNTING,4,06-05-2011 12:28,4.95,13880.0,United Kingdom,2011-06-05,19.8
554507,22197,SMALL POPCORN HOLDER,12,24-05-2011 15:29,0.85,15513.0,United Kingdom,2011-05-24,10.2
570273,85123A,WHITE HANGING HEART T-LIGHT HOLDER,12,10-10-2011 10:51,2.95,13373.0,United Kingdom,2011-10-10,35.400000000000006
541219,21675,BUTTERFLIES STICKERS,1,14-01-2011 14:06,0.79,,United Kingdom,2011-01-14,0.79
549949,85200,BUNNY EGG BOX,3,13-04-2011 12:57,1.25,13208.0,United Kingdom,2011-04-13,3.75
555574,22624,IVORY KITCHEN SCALES,2,05-06-2011 15:46,8.5,12417.0,Belgium,2011-05-06,17.0
551719,21535,RED RETROSPOT SMALL MILK JUG,1,03-05-2011 16:09,4.96,,United Kingdom,2011-03-05,4.96
554682,37327,ASSTD MULTICOLOUR CIRCLES MUG,6,25-05-2011 16:08,0.39,14085.0,United Kingdom,2011-05-25,2.34
547662,17091J,VANILLA INCENSE IN TIN,3,24-03-2011 13:12,1.25,14085.0,United Kingdom,2011-03-24,3.75
543814,20751,FUNKY WASHING UP GLOVES ASSORTED,12,13-02-2011 15:17,2.1,15640.0,United Kingdom,2011-02-13,25.200000000000003
572552,23301,GARDENERS KNEELING PAD KEEP CALM ,7,24-10-2011 17:07,3.29,14096.0,United Kingdom,2011-10-24,23.03
573387,84347,ROTATING SILVER ANGELS T-LIGHT HLDR,3,30-10-2011 14:33,2.55,15054.0,United Kingdom,2011-10-30,7.6499999999999995
555586,22318,FIVE HEART HANGING DECORATION,6,06-06-2011 09:12,2.95,14232.0,United Kingdom,2011-06-06,17.700000000000003
539595,22555,PLASTERS IN TIN STRONGMAN,1,20-12-2010 13:43,3.36,,United Kingdom,2010-12-20,3.36
547485,22554,PLASTERS IN TIN WOODLAND ANIMALS,4,23-03-2011 11:16,1.65,17019.0,United Kingdom,2011-03-23,6.6
558564,22616,PACK OF 12 LONDON TISSUES ,36,30-06-2011 13:45,0.29,14057.0,United Kingdom,2011-06-30,10.44
577504,21154,RED RETROSPOT OVEN GLOVE ,4,20-11-2011 12:36,1.25,14159.0,United Kingdom,2011-11-20,5.0
548312,22920,HERB MARKER BASIL,2,30-03-2011 12:12,0.65,16059.0,United Kingdom,2011-03-30,1.3
564743,82486,3 DRAWER ANTIQUE WHITE WOOD CABINET,1,28-08-2011 15:17,8.95,14606.0,United Kingdom,2011-08-28,8.95
541592,22720,SET OF 3 CAKE TINS PANTRY DESIGN ,1,19-01-2011 15:08,10.79,,United Kingdom,2011-01-19,10.79
578548,23399,HOME SWEET HOME HANGING HEART,2,24-11-2011 15:02,0.85,17345.0,United Kingdom,2011-11-24,1.7
539750,21669,BLUE STRIPE CERAMIC DRAWER KNOB,2,21-12-2010 15:40,3.36,,United Kingdom,2010-12-21,6.72
573585,22670,FRENCH WC SIGN BLUE METAL,3,31-10-2011 14:41,2.46,,United Kingdom,2011-10-31,7.38
577531,22142,CHRISTMAS CRAFT WHITE FAIRY ,1,20-11-2011 13:58,3.29,,United Kingdom,2011-11-20,3.29
557442,22483,RED GINGHAM TEDDY BEAR ,2,20-06-2011 12:53,2.95,14808.0,United Kingdom,2011-06-20,5.9
554280,21931,JUMBO STORAGE BAG SUKI,20,23-05-2011 13:35,2.08,14817.0,United Kingdom,2011-05-23,41.6
536972,48138,DOORMAT UNION FLAG,2,03-12-2010 13:42,7.95,16926.0,United Kingdom,2010-03-12,15.9
556641,22935,BAKING MOULD ROSE MILK CHOCOLATE,6,13-06-2011 15:44,3.25,13663.0,United Kingdom,2011-06-13,19.5
564552,22465,HANGING METAL STAR LANTERN,12,25-08-2011 17:22,1.65,16670.0,United Kingdom,2011-08-25,19.799999999999997
547788,84970S,HANGING HEART ZINC T-LIGHT HOLDER,10,25-03-2011 12:00,2.08,,United Kingdom,2011-03-25,20.8
562264,84991,60 TEATIME FAIRY CAKE CASES,2,03-08-2011 16:14,1.25,,United Kingdom,2011-03-08,2.5
562804,21257,VICTORIAN SEWING BOX MEDIUM,2,09-08-2011 14:48,7.95,13355.0,United Kingdom,2011-09-08,15.9
560445,23299,FOOD COVER WITH BEADS SET 2 ,100,19-07-2011 09:08,3.39,14156.0,EIRE,2011-07-19,339.0
562351,21669,BLUE STRIPE CERAMIC DRAWER KNOB,12,04-08-2011 13:10,1.25,16626.0,United Kingdom,2011-04-08,15.0
568895,22663,JUMBO BAG DOLLY GIRL DESIGN,5,29-09-2011 13:11,2.08,15356.0,United Kingdom,2011-09-29,10.4
566757,22554,PLASTERS IN TIN WOODLAND ANIMALS,1,14-09-2011 15:54,3.29,,United Kingdom,2011-09-14,3.29
545821,85099B,JUMBO BAG RED RETROSPOT,10,07-03-2011 12:50,1.95,13001.0,United Kingdom,2011-07-03,19.5
580730,22749,FELTCRAFT PRINCESS CHARLOTTE DOLL,1,05-12-2011 17:28,7.46,,United Kingdom,2011-05-12,7.46
569528,23350,ROLL WRAP VINTAGE SPOT ,3,04-10-2011 14:53,1.25,16242.0,United Kingdom,2011-04-10,3.75
538877,22549,PICTURE DOMINOES,2,14-12-2010 15:29,3.36,,United Kingdom,2010-12-14,6.72
566271,23356,LOVE HOT WATER BOTTLE,3,11-09-2011 13:44,5.95,14250.0,United Kingdom,2011-11-09,17.85
542601,21523,DOORMAT FANCY FONT HOME SWEET HOME,1,30-01-2011 11:52,7.95,16897.0,United Kingdom,2011-01-30,7.95
545165,48111,DOORMAT 3 SMILEY CATS,1,28-02-2011 13:41,7.95,16339.0,United Kingdom,2011-02-28,7.95
545701,21382,SET/4 SPRING FLOWER DECORATION,4,06-03-2011 15:17,2.95,17107.0,United Kingdom,2011-06-03,11.8
539451,21679,SKULLS  STICKERS,1,17-12-2010 16:59,1.66,,United Kingdom,2010-12-17,1.66
573492,23100,SILVER BELLS TABLE DECORATION,1,31-10-2011 11:57,1.25,13544.0,United Kingdom,2011-10-31,1.25
552640,22771,CLEAR DRAWER KNOB ACRYLIC EDWARDIAN,2,10-05-2011 13:19,1.25,17841.0,United Kingdom,2011-10-05,2.5
578067,23102,SILVER HEARTS TABLE DECORATION,1,22-11-2011 15:43,2.46,,United Kingdom,2011-11-22,2.46
540352,22481,BLACK TEA TOWEL CLASSIC DESIGN,3,06-01-2011 14:27,0.85,,United Kingdom,2011-06-01,2.55
562031,84947,ANTIQUE SILVER TEA GLASS ENGRAVED,6,01-08-2011 17:37,1.25,16984.0,United Kingdom,2011-01-08,7.5
558539,82494L,WOODEN FRAME ANTIQUE WHITE ,6,30-06-2011 12:14,2.95,16556.0,United Kingdom,2011-06-30,17.700000000000003
553890,DOT,DOTCOM POSTAGE,1,19-05-2011 16:32,167.03,,United Kingdom,2011-05-19,167.03
557938,82552,WASHROOM METAL SIGN,1,23-06-2011 15:35,2.46,,United Kingdom,2011-06-23,2.46
569369,23272,TREE T-LIGHT HOLDER WILLIE WINKIE,12,03-10-2011 15:32,1.65,15105.0,United Kingdom,2011-03-10,19.799999999999997
542617,22133,PINK LOVE HEART SHAPE CUP,2,30-01-2011 15:48,0.85,17463.0,United Kingdom,2011-01-30,1.7
563706,23342,MINT DINER WALL CLOCK,4,18-08-2011 14:48,8.5,14189.0,United Kingdom,2011-08-18,34.0
549813,22487,WHITE WOOD GARDEN PLANT LADDER,1,12-04-2011 12:16,9.95,17972.0,United Kingdom,2011-12-04,9.95
563550,20728,LUNCH BAG CARS BLUE,10,17-08-2011 12:50,1.65,14194.0,United Kingdom,2011-08-17,16.5
559680,84929,ASSTD FRUIT+FLOWERS FRIDGE MAGNETS,24,11-07-2011 14:47,0.19,12717.0,Greece,2011-11-07,4.5600000000000005
565388,22411,JUMBO SHOPPER VINTAGE RED PAISLEY,5,02-09-2011 15:56,2.08,14415.0,United Kingdom,2011-02-09,10.4
563262,21427,SKULLS STORAGE BOX SMALL,2,15-08-2011 12:44,2.1,15311.0,United Kingdom,2011-08-15,4.2
541104,84459B,YELLOW METAL CHICKEN HEART ,1,13-01-2011 14:29,3.29,,United Kingdom,2011-01-13,3.29
560883,21905,MORE BUTTER METAL SIGN ,48,21-07-2011 16:10,0.79,13694.0,United Kingdom,2011-07-21,37.92
541655,20764,ABSTRACT CIRCLES SKETCHBOOK ,1,20-01-2011 12:04,3.75,14779.0,United Kingdom,2011-01-20,3.75
560251,23238,SET OF 4 KNICK KNACK TINS LONDON ,2,17-07-2011 12:32,4.15,17774.0,United Kingdom,2011-07-17,8.3
553546,22620,4 TRADITIONAL SPINNING TOPS,320,17-05-2011 15:42,1.25,12415.0,Australia,2011-05-17,400.0
541854,22758,LARGE PURPLE BABUSHKA NOTEBOOK  ,1,23-01-2011 14:58,1.25,18283.0,United Kingdom,2011-01-23,1.25
538664,85035B,CHOCOLATE 3 WICK MORRIS BOX CANDLE,12,13-12-2010 15:46,1.25,14733.0,United Kingdom,2010-12-13,15.0
548529,22991,GIRAFFE WOODEN RULER,12,31-03-2011 16:56,1.95,18223.0,United Kingdom,2011-03-31,23.4
579501,22941,CHRISTMAS LIGHTS 10 REINDEER,10,29-11-2011 16:16,7.65,14088.0,United Kingdom,2011-11-29,76.5
574709,85066,CREAM SWEETHEART MINI CHEST,2,06-11-2011 14:14,12.75,17768.0,United Kingdom,2011-06-11,25.5
550615,22984,CARD GINGHAM ROSE ,12,19-04-2011 12:41,0.42,16730.0,United Kingdom,2011-04-19,5.04
540178,22961,JAM MAKING SET PRINTED,12,05-01-2011 12:42,1.45,12681.0,France,2011-05-01,17.4
558483,22457,NATURAL SLATE HEART CHALKBOARD ,6,30-06-2011 09:59,2.95,18171.0,United Kingdom,2011-06-30,17.700000000000003
540458,21155,RED RETROSPOT PEG BAG,6,07-01-2011 12:28,2.1,12501.0,Germany,2011-07-01,12.600000000000001
575985,23427,STOOL HOME SWEET HOME ,1,13-11-2011 14:09,12.5,17841.0,United Kingdom,2011-11-13,12.5
577150,22834,HAND WARMER BABUSHKA DESIGN,3,18-11-2011 09:48,4.96,,United Kingdom,2011-11-18,14.879999999999999
572217,23148,MINIATURE ANTIQUE ROSE HOOK IVORY,4,21-10-2011 13:03,0.83,15311.0,United Kingdom,2011-10-21,3.32
540414,22556,PLASTERS IN TIN CIRCUS PARADE ,36,07-01-2011 10:32,1.65,12481.0,Germany,2011-07-01,59.4
541965,22961,JAM MAKING SET PRINTED,24,24-01-2011 13:27,1.45,12625.0,Germany,2011-01-24,34.8
564438,22383,LUNCH BAG SUKI DESIGN ,10,25-08-2011 12:11,1.65,16628.0,United Kingdom,2011-08-25,16.5
552557,22698,PINK REGENCY TEACUP AND SAUCER,6,10-05-2011 11:31,2.95,16696.0,United Kingdom,2011-10-05,17.700000000000003
564756,21094,SET/6 RED SPOTTY PAPER PLATES,6,30-08-2011 10:33,0.83,,United Kingdom,2011-08-30,4.9799999999999995
568908,21155,RED RETROSPOT PEG BAG,6,29-09-2011 13:38,2.55,16653.0,United Kingdom,2011-09-29,15.299999999999999
572918,22726,ALARM CLOCK BAKELIKE GREEN,1,26-10-2011 16:43,3.75,14379.0,United Kingdom,2011-10-26,3.75
571726,22930,BAKING MOULD HEART MILK CHOCOLATE,6,19-10-2011 09:00,2.55,16191.0,United Kingdom,2011-10-19,15.299999999999999
566559,22971,QUEENS GUARD COFFEE MUG,6,13-09-2011 11:52,2.55,18044.0,United Kingdom,2011-09-13,15.299999999999999
552000,84976,RECTANGULAR SHAPED MIRROR,1,05-05-2011 15:55,3.29,,United Kingdom,2011-05-05,3.29
562113,84459A,PINK METAL CHICKEN HEART ,1,02-08-2011 16:11,3.29,,United Kingdom,2011-02-08,3.29
559322,20713,JUMBO BAG OWLS,300,07-07-2011 14:46,1.79,15769.0,United Kingdom,2011-07-07,537.0
559817,21534,DAIRY MAID LARGE MILK JUG,10,12-07-2011 16:20,4.13,,United Kingdom,2011-12-07,41.3
550125,22630,DOLLY GIRL LUNCH BOX,12,14-04-2011 12:42,1.95,13317.0,United Kingdom,2011-04-14,23.4
570700,23245,SET OF 3 REGENCY CAKE TINS,4,12-10-2011 09:29,4.95,14156.0,EIRE,2011-12-10,19.8
571183,84596B,SMALL DOLLY MIX DESIGN ORANGE BOWL,8,14-10-2011 11:08,0.42,14796.0,United Kingdom,2011-10-14,3.36
556244,21718,RED METAL BEACH SPADE ,3,09-06-2011 16:08,1.25,15867.0,United Kingdom,2011-09-06,3.75
557502,22029,SPACEBOY BIRTHDAY CARD,1,20-06-2011 15:32,0.83,,United Kingdom,2011-06-20,0.83
556683,23245,SET OF 3 REGENCY CAKE TINS,4,14-06-2011 09:43,4.95,15358.0,United Kingdom,2011-06-14,19.8
554016,22839,3 TIER CAKE TIN GREEN AND CREAM,1,20-05-2011 13:14,14.95,13243.0,United Kingdom,2011-05-20,14.95
559455,22716,CARD CIRCUS PARADE,12,08-07-2011 12:34,0.42,13018.0,United Kingdom,2011-08-07,5.04
568325,22111,SCOTTIE DOG HOT WATER BOTTLE,6,26-09-2011 13:57,4.95,14667.0,United Kingdom,2011-09-26,29.700000000000003
580367,22357,KINGS CHOICE BISCUIT TIN,3,02-12-2011 16:39,4.13,,United Kingdom,2011-02-12,12.39
579161,21429,RED GINGHAM ROSE JEWELLERY BOX,2,28-11-2011 13:56,1.95,17379.0,United Kingdom,2011-11-28,3.9
561773,21931,JUMBO STORAGE BAG SUKI,1,29-07-2011 12:41,2.08,17841.0,United Kingdom,2011-07-29,2.08
569868,21497,FANCY FONTS BIRTHDAY WRAP,25,06-10-2011 14:59,0.42,13018.0,United Kingdom,2011-06-10,10.5
576520,21034,REX CASH+CARRY JUMBO SHOPPER,2,15-11-2011 12:33,0.95,14467.0,United Kingdom,2011-11-15,1.9
549754,22749,FELTCRAFT PRINCESS CHARLOTTE DOLL,8,12-04-2011 11:32,3.75,13700.0,United Kingdom,2011-12-04,30.0
563170,22773,GREEN DRAWER KNOB ACRYLIC EDWARDIAN,12,12-08-2011 12:44,1.25,18237.0,United Kingdom,2011-12-08,15.0
566451,21915,RED  HARMONICA IN BOX ,2,12-09-2011 16:14,1.25,18069.0,United Kingdom,2011-12-09,2.5
574653,22739,RIBBON REEL CHRISTMAS SOCK BAUBLE,20,06-11-2011 11:30,1.65,12619.0,Germany,2011-06-11,33.0
553387,23199,JUMBO BAG APPLES,2,16-05-2011 16:33,4.13,,United Kingdom,2011-05-16,8.26
579037,23498,CLASSIC BICYCLE CLIPS ,72,28-11-2011 10:23,1.25,13418.0,United Kingdom,2011-11-28,90.0
554054,21746,SMALL RED RETROSPOT WINDMILL,2,20-05-2011 15:29,2.46,,United Kingdom,2011-05-20,4.92
581217,22340,NOEL GARLAND PAINTED ZINC ,6,08-12-2011 09:20,0.83,,United Kingdom,2011-08-12,4.9799999999999995
540907,22624,IVORY KITCHEN SCALES,2,12-01-2011 11:52,8.5,13488.0,United Kingdom,2011-12-01,17.0
558628,22128,PARTY CONES CANDY ASSORTED,12,30-06-2011 17:59,1.25,12626.0,Germany,2011-06-30,15.0
536544,22757,LARGE RED BABUSHKA NOTEBOOK ,3,01-12-2010 14:32,2.51,,United Kingdom,2010-01-12,7.529999999999999
563435,21984,PACK OF 12 PINK PAISLEY TISSUES ,24,16-08-2011 12:29,0.29,16131.0,United Kingdom,2011-08-16,6.959999999999999
581219,22818,CARD CHRISTMAS VILLAGE,9,08-12-2011 09:28,0.42,,United Kingdom,2011-08-12,3.78
560434,23050,RECYCLED ACAPULCO MAT GREEN,1,18-07-2011 15:56,16.63,,United Kingdom,2011-07-18,16.63
547708,21259,VICTORIAN SEWING BOX SMALL ,192,24-03-2011 18:34,6.0,17450.0,United Kingdom,2011-03-24,1152.0
578999,22809,SET OF 6 T-LIGHTS SANTA,2,27-11-2011 16:08,2.95,17595.0,United Kingdom,2011-11-27,5.9
559863,20992,JAZZ HEARTS PURSE NOTEBOOK,24,13-07-2011 10:33,0.39,15039.0,United Kingdom,2011-07-13,9.36
560282,22180,RETROSPOT LAMP,3,18-07-2011 08:21,9.95,14758.0,United Kingdom,2011-07-18,29.849999999999998
556636,22469,HEART OF WICKER SMALL,10,13-06-2011 15:30,1.63,,United Kingdom,2011-06-13,16.299999999999997
576837,21015,DARK BIRD HOUSE TREE DECORATION,2,16-11-2011 15:16,0.83,,United Kingdom,2011-11-16,1.66
562114,16254,TRANSPARENT ACRYLIC TAPE DISPENSER,1,02-08-2011 16:14,1.63,,United Kingdom,2011-02-08,1.63
559332,21903,MAN FLU METAL SIGN,12,07-07-2011 15:46,2.1,14021.0,United Kingdom,2011-07-07,25.200000000000003
572092,23335,EGG FRYING PAN IVORY ,1,20-10-2011 14:41,2.08,17125.0,United Kingdom,2011-10-20,2.08
569220,23343,JUMBO BAG VINTAGE CHRISTMAS ,2,02-10-2011 13:26,2.08,16007.0,United Kingdom,2011-02-10,4.16
559330,21935,SUKI  SHOULDER BAG,20,07-07-2011 15:44,1.65,17696.0,United Kingdom,2011-07-07,33.0
547106,22417,PACK OF 60 SPACEBOY CAKE CASES,2,21-03-2011 11:24,0.55,15039.0,United Kingdom,2011-03-21,1.1
576644,23355,HOT WATER BOTTLE KEEP CALM,3,16-11-2011 10:01,8.29,,United Kingdom,2011-11-16,24.869999999999997
544893,21977,PACK OF 60 PINK PAISLEY CAKE CASES,24,24-02-2011 12:01,0.55,17865.0,United Kingdom,2011-02-24,13.200000000000001
556427,21621,VINTAGE UNION JACK BUNTING,1,10-06-2011 13:23,12.46,,United Kingdom,2011-10-06,12.46
548975,21829,DINOSAUR KEYRINGS ASSORTED,72,05-04-2011 11:47,0.21,17596.0,United Kingdom,2011-05-04,15.12
563369,22301,COFFEE MUG CAT + BIRD DESIGN,36,16-08-2011 09:25,2.1,13394.0,United Kingdom,2011-08-16,75.60000000000001
546127,22318,FIVE HEART HANGING DECORATION,6,09-03-2011 14:57,2.95,17730.0,United Kingdom,2011-09-03,17.700000000000003
569545,85049E,SCANDINAVIAN REDS RIBBONS,1,04-10-2011 16:37,2.46,,United Kingdom,2011-04-10,2.46
545221,22967,SET 3 SONG BIRD PAPER EGGS ASSORTED,6,01-03-2011 08:35,2.95,14740.0,United Kingdom,2011-01-03,17.700000000000003
543770,22288,HANGING METAL RABBIT DECORATION,24,11-02-2011 15:39,1.25,13875.0,United Kingdom,2011-11-02,30.0
560473,21706,FOLDING UMBRELLA RED/WHITE POLKADOT,8,19-07-2011 10:42,4.95,12431.0,Australia,2011-07-19,39.6
553919,21927,BLUE/CREAM STRIPE CUSHION COVER ,12,20-05-2011 08:41,1.25,17416.0,United Kingdom,2011-05-20,15.0
571676,35646,VINTAGE BEAD PINK EVENING BAG,3,18-10-2011 13:29,1.25,16910.0,United Kingdom,2011-10-18,3.75
570465,35953,FOLKART STAR CHRISTMAS DECORATIONS,16,10-10-2011 16:02,0.61,,United Kingdom,2011-10-10,9.76
541219,84931A,PINK SCOTTIE DOG W FLOWER PATTERN,1,14-01-2011 14:06,1.63,,United Kingdom,2011-01-14,1.63
573576,23184,BULL DOG BOTTLE OPENER,2,31-10-2011 14:09,10.79,14096.0,United Kingdom,2011-10-31,21.58
559629,84997A,CHILDRENS CUTLERY POLKADOT GREEN ,1,11-07-2011 11:58,4.15,14690.0,United Kingdom,2011-11-07,4.15
569524,22296,HEART IVORY TRELLIS LARGE,1,04-10-2011 14:42,1.65,14506.0,United Kingdom,2011-04-10,1.65
566760,37449,CERAMIC CAKE STAND + HANGING CAKES,1,14-09-2011 16:36,9.95,15272.0,United Kingdom,2011-09-14,9.95
556106,23241,TREASURE TIN GYMKHANA DESIGN,3,08-06-2011 16:54,2.08,14056.0,United Kingdom,2011-08-06,6.24
547652,21311,SET/4 BIRD MIRROR MAGNETS ,1,24-03-2011 12:15,2.1,14606.0,United Kingdom,2011-03-24,2.1
568697,20972,PINK CREAM FELT CRAFT TRINKET BOX ,144,28-09-2011 14:57,1.06,16281.0,United Kingdom,2011-09-28,152.64000000000001
554978,22634,CHILDS BREAKFAST SET SPACEBOY ,2,29-05-2011 11:05,9.95,16889.0,United Kingdom,2011-05-29,19.9
581219,22994,TRAVEL CARD WALLET RETROSPOT,3,08-12-2011 09:28,0.83,,United Kingdom,2011-08-12,2.4899999999999998
540005,22780,LIGHT GARLAND BUTTERFILES PINK,1,04-01-2011 10:38,4.25,17315.0,United Kingdom,2011-04-01,4.25
562955,23241,TREASURE TIN GYMKHANA DESIGN,2,11-08-2011 10:14,4.13,,United Kingdom,2011-11-08,8.26
576051,23172,REGENCY TEA PLATE PINK,12,13-11-2011 14:45,1.65,14911.0,EIRE,2011-11-13,19.799999999999997
553188,22386,JUMBO BAG PINK POLKADOT,10,15-05-2011 12:55,2.08,15379.0,United Kingdom,2011-05-15,20.8
570676,21533,RETROSPOT LARGE MILK JUG,3,11-10-2011 15:10,4.95,14640.0,United Kingdom,2011-11-10,14.850000000000001
547370,20851,ZINC HEART LATTICE TRAY OVAL ,1,22-03-2011 13:32,5.95,14711.0,United Kingdom,2011-03-22,5.95
544768,22041,"RECORD FRAME 7"" SINGLE SIZE ",1,23-02-2011 11:10,4.96,,United Kingdom,2011-02-23,4.96
553766,22698,PINK REGENCY TEACUP AND SAUCER,1,19-05-2011 10:44,5.79,,United Kingdom,2011-05-19,5.79
570871,21808,"CHRISTMAS GARLAND STARS,TREES",4,12-10-2011 16:36,3.29,,United Kingdom,2011-12-10,13.16
578950,20669,RED HEART LUGGAGE TAG,2,27-11-2011 14:40,1.25,17885.0,United Kingdom,2011-11-27,2.5
552268,23201,JUMBO BAG ALPHABET,20,08-05-2011 11:49,2.08,14709.0,United Kingdom,2011-08-05,41.6
573510,16207A,PINK STRAWBERRY HANDBAG ,6,31-10-2011 12:21,2.95,14808.0,United Kingdom,2011-10-31,17.700000000000003
559866,20711,JUMBO BAG TOYS ,10,13-07-2011 10:43,2.08,15795.0,United Kingdom,2011-07-13,20.8
554285,23177,TREASURE ISLAND BOOK BOX,1,23-05-2011 14:15,4.58,,United Kingdom,2011-05-23,4.58
536544,21070,VINTAGE BILLBOARD MUG ,1,01-12-2010 14:32,2.51,,United Kingdom,2010-01-12,2.51
559909,16161P,WRAP ENGLISH ROSE ,25,13-07-2011 14:28,0.42,18245.0,United Kingdom,2011-07-13,10.5
579472,21790,VINTAGE SNAP CARDS,1,29-11-2011 15:09,0.85,13521.0,United Kingdom,2011-11-29,0.85
549985,22047,EMPIRE GIFT WRAP,25,13-04-2011 15:58,0.42,15640.0,United Kingdom,2011-04-13,10.5
568320,22037,ROBOT BIRTHDAY CARD,12,26-09-2011 13:35,0.42,17674.0,United Kingdom,2011-09-26,5.04
551011,72741,GRAND CHOCOLATECANDLE,27,26-04-2011 10:23,1.45,17090.0,United Kingdom,2011-04-26,39.15
551824,20724,RED RETROSPOT CHARLOTTE BAG,10,04-05-2011 12:32,0.85,15128.0,United Kingdom,2011-04-05,8.5
576364,22441,GROW YOUR OWN BASIL IN ENAMEL MUG,4,14-11-2011 17:40,2.1,15009.0,United Kingdom,2011-11-14,8.4
548522,22697,GREEN REGENCY TEACUP AND SAUCER,3,31-03-2011 16:43,5.79,,United Kingdom,2011-03-31,17.37
573184,21479,WHITE SKULL HOT WATER BOTTLE ,12,28-10-2011 11:33,4.25,14110.0,United Kingdom,2011-10-28,51.0
542001,21198,WHITE HEART CONFETTI IN TUBE,48,25-01-2011 10:56,0.42,14298.0,United Kingdom,2011-01-25,20.16
573485,20973,12 PENCIL SMALL TUBE WOODLAND,4,31-10-2011 11:37,0.65,15752.0,United Kingdom,2011-10-31,2.6
566163,22029,SPACEBOY BIRTHDAY CARD,12,09-09-2011 11:48,0.42,12637.0,France,2011-09-09,5.04
573585,23490,T-LIGHT HOLDER HANGING LOVE BIRD,2,31-10-2011 14:41,7.46,,United Kingdom,2011-10-31,14.92
548870,21902,"KEY FOB , FRONT  DOOR ",1,04-04-2011 14:41,0.65,14606.0,United Kingdom,2011-04-04,0.65
562934,20719,WOODLAND CHARLOTTE BAG,1,10-08-2011 16:56,1.63,,United Kingdom,2011-10-08,1.63
543399,22379,RECYCLING BAG RETROSPOT ,1,08-02-2011 11:07,4.13,,United Kingdom,2011-08-02,4.13
565413,20724,RED RETROSPOT CHARLOTTE BAG,10,04-09-2011 11:49,0.85,18223.0,United Kingdom,2011-04-09,8.5
561218,90000B,MIDNIGHT BLUE COPPER FLOWER NECKLAC,1,25-07-2011 17:11,6.23,,United Kingdom,2011-07-25,6.23
570652,22086,PAPER CHAIN KIT 50'S CHRISTMAS ,12,11-10-2011 13:45,2.95,17863.0,United Kingdom,2011-11-10,35.400000000000006
570187,84378,SET OF 3 HEART COOKIE CUTTERS,1,07-10-2011 15:09,2.46,,United Kingdom,2011-07-10,2.46
580903,22668,PINK BABY BUNTING,1,06-12-2011 12:56,2.95,14606.0,United Kingdom,2011-06-12,2.95
568782,23203,JUMBO BAG VINTAGE DOILY ,10,29-09-2011 08:53,2.08,13985.0,United Kingdom,2011-09-29,20.8
573094,82583,HOT BATHS METAL SIGN,1,27-10-2011 14:39,2.1,15707.0,United Kingdom,2011-10-27,2.1
550512,22243,5 HOOK HANGER RED MAGIC TOADSTOOL,1,18-04-2011 16:31,1.65,18069.0,United Kingdom,2011-04-18,1.65
544940,21700,BIG DOUGHNUT FRIDGE MAGNETS,12,25-02-2011 10:19,0.85,16592.0,United Kingdom,2011-02-25,10.2
567700,22556,PLASTERS IN TIN CIRCUS PARADE ,12,22-09-2011 09:33,1.65,16379.0,United Kingdom,2011-09-22,19.799999999999997
576592,84509G,SET OF 4 FAIRY CAKE PLACEMATS ,1,15-11-2011 14:47,3.75,13614.0,United Kingdom,2011-11-15,3.75
566949,21929,JUMBO BAG PINK VINTAGE PAISLEY,1,15-09-2011 16:32,4.13,,United Kingdom,2011-09-15,4.13
555852,22192,BLUE DINER WALL CLOCK,2,07-06-2011 13:38,8.5,17429.0,United Kingdom,2011-07-06,17.0
577746,22469,HEART OF WICKER SMALL,12,21-11-2011 14:17,1.65,15274.0,United Kingdom,2011-11-21,19.799999999999997
558567,23202,JUMBO BAG VINTAGE LEAF,10,30-06-2011 14:37,2.08,14191.0,United Kingdom,2011-06-30,20.8
547663,20728,LUNCH BAG CARS BLUE,6,24-03-2011 13:16,1.65,16022.0,United Kingdom,2011-03-24,9.899999999999999
581405,20975,12 PENCILS SMALL TUBE RED RETROSPOT,1,08-12-2011 13:50,0.65,13521.0,United Kingdom,2011-08-12,0.65
556781,22840,ROUND CAKE TIN VINTAGE RED,2,14-06-2011 12:47,7.95,13384.0,United Kingdom,2011-06-14,15.9
577050,22319,HAIRCLIPS FORTIES FABRIC ASSORTED,12,17-11-2011 13:59,0.65,14191.0,United Kingdom,2011-11-17,7.800000000000001
545217,48111,DOORMAT 3 SMILEY CATS,1,28-02-2011 16:59,15.79,,United Kingdom,2011-02-28,15.79
561242,22193,RED DINER WALL CLOCK,2,26-07-2011 11:05,8.5,16258.0,United Kingdom,2011-07-26,17.0
540543,21903,MAN FLU METAL SIGN,6,09-01-2011 15:23,2.1,14395.0,United Kingdom,2011-09-01,12.600000000000001
580514,84949,SILVER HANGING T-LIGHT HOLDER,10,04-12-2011 14:01,1.65,16905.0,United Kingdom,2011-04-12,16.5
580053,22698,PINK REGENCY TEACUP AND SAUCER,24,01-12-2011 13:03,2.55,12912.0,United Kingdom,2011-01-12,61.199999999999996
546317,21506,"FANCY FONT BIRTHDAY CARD, ",12,11-03-2011 09:07,0.42,14913.0,United Kingdom,2011-11-03,5.04
574950,20750,RED RETROSPOT MINI CASES,1,08-11-2011 09:29,16.63,,United Kingdom,2011-08-11,16.63
569562,23388,WOODLAND MINI BACKPACK,4,05-10-2011 09:43,4.15,12720.0,Germany,2011-05-10,16.6
563837,21928,JUMBO BAG SCANDINAVIAN BLUE PAISLEY,10,19-08-2011 13:03,2.08,15078.0,United Kingdom,2011-08-19,20.8
570591,22865,HAND WARMER OWL DESIGN,12,11-10-2011 11:35,2.1,17071.0,United Kingdom,2011-11-10,25.200000000000003
539039,79067,CORONA MEXICAN TRAY,10,15-12-2010 15:00,3.75,13124.0,United Kingdom,2010-12-15,37.5
540533,21411,GINGHAM HEART  DOORSTOP RED,1,09-01-2011 14:12,4.25,15005.0,United Kingdom,2011-09-01,4.25
571082,23377,PACK OF 12 DOLLY GIRL TISSUES,1,13-10-2011 15:25,0.83,,United Kingdom,2011-10-13,0.83
540821,22198,LARGE POPCORN HOLDER ,2,11-01-2011 13:16,3.36,,United Kingdom,2011-11-01,6.72
540418,84870C,GREEN GEISHA GIRL ,2,07-01-2011 11:04,2.51,,United Kingdom,2011-07-01,5.02
574950,22135,MINI LADLE LOVE HEART PINK,1,08-11-2011 09:29,0.83,,United Kingdom,2011-08-11,0.83
569246,20723,STRAWBERRY CHARLOTTE BAG,2,03-10-2011 09:57,1.63,14096.0,United Kingdom,2011-03-10,3.26
576075,20759,CHRYSANTHEMUM POCKET BOOK ,3,13-11-2011 16:16,0.85,15861.0,United Kingdom,2011-11-13,2.55
558096,21867,PINK UNION JACK  LUGGAGE TAG,1,26-06-2011 13:24,1.25,15532.0,United Kingdom,2011-06-26,1.25
548552,21714,CITRONELLA CANDLE GARDEN POT,12,01-04-2011 09:06,1.25,17613.0,United Kingdom,2011-01-04,15.0
570688,22417,PACK OF 60 SPACEBOY CAKE CASES,1,11-10-2011 16:29,1.25,,United Kingdom,2011-11-10,1.25
557764,15039,SANDALWOOD FAN,20,22-06-2011 14:21,0.85,13089.0,United Kingdom,2011-06-22,17.0
574836,22910,PAPER CHAIN KIT VINTAGE CHRISTMAS,6,07-11-2011 11:32,2.95,17623.0,United Kingdom,2011-07-11,17.700000000000003
541219,22819,"BIRTHDAY CARD, RETRO SPOT",14,14-01-2011 14:06,0.42,,United Kingdom,2011-01-14,5.88
573875,23177,TREASURE ISLAND BOOK BOX,8,01-11-2011 12:47,2.25,15018.0,United Kingdom,2011-01-11,18.0
553415,22923,FRIDGE MAGNETS LES ENFANTS ASSORTED,12,17-05-2011 10:02,0.85,12463.0,Belgium,2011-05-17,10.2
552667,21714,CITRONELLA CANDLE GARDEN POT,1,10-05-2011 15:05,2.46,,United Kingdom,2011-10-05,2.46
547057,22427,ENAMEL FLOWER JUG CREAM,3,20-03-2011 12:28,5.95,14217.0,United Kingdom,2011-03-20,17.85
559527,82600,NO SINGING METAL SIGN,6,10-07-2011 11:24,2.1,17787.0,United Kingdom,2011-10-07,12.600000000000001
574477,82494L,WOODEN FRAME ANTIQUE WHITE ,1,04-11-2011 12:21,2.95,15453.0,United Kingdom,2011-04-11,2.95
542423,22900, SET 2 TEA TOWELS I LOVE LONDON ,12,28-01-2011 09:09,2.95,15057.0,United Kingdom,2011-01-28,35.400000000000006
560018,21988,PACK OF 6 SKULL PAPER PLATES,3,14-07-2011 12:52,0.85,15987.0,United Kingdom,2011-07-14,2.55
536528,22584,PACK OF 6 PANNETONE GIFT BOXES,2,01-12-2010 13:17,2.55,15525.0,United Kingdom,2010-01-12,5.1
546896,21686,MEDINA STAMPED METAL STOOL,1,17-03-2011 18:24,78.29,,United Kingdom,2011-03-17,78.29
550000,22683,FRENCH BLUE METAL DOOR SIGN 8,10,14-04-2011 09:18,1.25,17058.0,United Kingdom,2011-04-14,12.5
540977,20717,STRAWBERRY SHOPPER BAG,22,12-01-2011 15:01,0.85,,United Kingdom,2011-12-01,18.7
544309,84755,COLOUR GLASS T-LIGHT HOLDER HANGING,16,17-02-2011 14:17,0.65,15785.0,United Kingdom,2011-02-17,10.4
580688,21012,ANTIQUE ALL GLASS CANDLESTICK,8,05-12-2011 15:38,2.1,15550.0,United Kingdom,2011-05-12,16.8
550474,20735,BLACK MINI TAPE MEASURE ,1,18-04-2011 13:58,0.83,,United Kingdom,2011-04-18,0.83
580115,23116,VEGETABLE GARDEN CHOPPING BOARD,1,01-12-2011 16:22,10.79,,United Kingdom,2011-01-12,10.79
571931,21207,SKULL AND CROSSBONES  GARLAND ,2,19-10-2011 16:59,1.63,,United Kingdom,2011-10-19,3.26
561600,22382,LUNCH BAG SPACEBOY DESIGN ,8,28-07-2011 11:29,1.65,15861.0,United Kingdom,2011-07-28,13.2
537792,22622,BOX OF VINTAGE ALPHABET BLOCKS,1,08-12-2010 12:56,9.95,16385.0,United Kingdom,2010-08-12,9.95
560261,23293,SET OF 12 FAIRY CAKE BAKING CASES,4,17-07-2011 13:35,0.83,12841.0,United Kingdom,2011-07-17,3.32
537240,21892,TRADITIONAL WOODEN CATCH CUP GAME ,6,06-12-2010 10:08,2.51,,United Kingdom,2010-06-12,15.059999999999999
537159,22946,WOODEN ADVENT CALENDAR CREAM,2,05-12-2010 13:17,16.95,14527.0,United Kingdom,2010-05-12,33.9
575037,23301,GARDENERS KNEELING PAD KEEP CALM ,48,08-11-2011 11:51,1.45,16066.0,United Kingdom,2011-08-11,69.6
556043,23177,TREASURE ISLAND BOOK BOX,2,08-06-2011 12:49,2.25,14078.0,United Kingdom,2011-08-06,4.5
552365,22993,SET OF 4 PANTRY JELLY MOULDS,2,09-05-2011 12:25,1.25,16440.0,United Kingdom,2011-09-05,2.5
566060,84692,BOX OF 24 COCKTAIL PARASOLS,1,08-09-2011 15:27,0.83,,United Kingdom,2011-08-09,0.83
566188,23321,SMALL WHITE HEART OF WICKER,12,09-09-2011 13:14,1.65,14312.0,United Kingdom,2011-09-09,19.799999999999997
542409,22774,RED DRAWER KNOB ACRYLIC EDWARDIAN,24,27-01-2011 16:30,1.25,15311.0,United Kingdom,2011-01-27,30.0
537369,22834,HAND WARMER BABUSHKA DESIGN,1,06-12-2010 12:41,2.1,17860.0,United Kingdom,2010-06-12,2.1
565849,21402,RED  EGG  SPOON,24,07-09-2011 12:50,0.12,14309.0,United Kingdom,2011-07-09,2.88
537237,22314,OFFICE MUG WARMER CHOC+BLUE,2,06-12-2010 09:58,5.91,,United Kingdom,2010-06-12,11.82
546376,22766,PHOTO FRAME CORNICE,8,11-03-2011 12:11,2.95,13842.0,United Kingdom,2011-11-03,23.6
577545,22996,TRAVEL CARD WALLET VINTAGE TICKET,6,20-11-2011 14:43,0.42,16931.0,United Kingdom,2011-11-20,2.52
560723,22361,GLASS JAR DAISY FRESH COTTON WOOL,1,20-07-2011 13:53,2.95,16464.0,United Kingdom,2011-07-20,2.95
552372,21088,SET/6 FRUIT SALAD PAPER CUPS,24,09-05-2011 12:29,0.19,13394.0,United Kingdom,2011-09-05,4.5600000000000005
559671,22367,CHILDRENS APRON SPACEBOY DESIGN,2,11-07-2011 13:55,1.95,17811.0,United Kingdom,2011-11-07,3.9
552643,21977,PACK OF 60 PINK PAISLEY CAKE CASES,8,10-05-2011 13:24,0.55,16791.0,United Kingdom,2011-10-05,4.4
561614,20724,RED RETROSPOT CHARLOTTE BAG,10,28-07-2011 12:50,0.85,13871.0,United Kingdom,2011-07-28,8.5
562964,23298,SPOTTY BUNTING,6,11-08-2011 10:29,4.95,13488.0,United Kingdom,2011-11-08,29.700000000000003
567206,20711,JUMBO BAG TOYS ,10,19-09-2011 10:51,2.08,13562.0,United Kingdom,2011-09-19,20.8
552058,21754,HOME BUILDING BLOCK WORD,4,06-05-2011 10:36,5.95,15218.0,United Kingdom,2011-06-05,23.8
574076,22299,PIG KEYRING WITH LIGHT & SOUND ,3,02-11-2011 15:38,2.46,,United Kingdom,2011-02-11,7.38
559289,22917,HERB MARKER ROSEMARY,1,07-07-2011 12:22,0.65,15719.0,United Kingdom,2011-07-07,0.65
548612,22564,ALPHABET STENCIL CRAFT,2,01-04-2011 11:34,1.25,13137.0,United Kingdom,2011-01-04,2.5
581122,20724,RED RETROSPOT CHARLOTTE BAG,20,07-12-2011 12:33,0.85,12839.0,United Kingdom,2011-07-12,17.0
576648,23378,PACK OF 12 50'S CHRISTMAS TISSUES,48,16-11-2011 10:32,0.39,14057.0,United Kingdom,2011-11-16,18.72
554310,85099F,JUMBO BAG STRAWBERRY,2,23-05-2011 15:25,4.13,,United Kingdom,2011-05-23,8.26
574298,84988,SET OF 72 PINK HEART PAPER DOILIES,2,03-11-2011 15:56,2.92,,United Kingdom,2011-03-11,5.84
578270,82482,WOODEN PICTURE FRAME WHITE FINISH,2,23-11-2011 13:39,5.79,14096.0,United Kingdom,2011-11-23,11.58
578305,22372,AIRLINE BAG VINTAGE WORLD CHAMPION ,8,23-11-2011 15:44,3.95,14088.0,United Kingdom,2011-11-23,31.6
560300,22435,SET OF 9 HEART SHAPED BALLOONS,12,18-07-2011 10:29,1.25,14911.0,EIRE,2011-07-18,15.0
546438,22892,SET OF SALT AND PEPPER TOADSTOOLS,72,14-03-2011 09:59,1.06,15125.0,United Kingdom,2011-03-14,76.32000000000001
542122,21883,STARS GIFT TAPE ,24,25-01-2011 14:36,0.19,17082.0,United Kingdom,2011-01-25,4.5600000000000005
538566,21238,RED RETROSPOT CUP,2,13-12-2010 11:21,1.66,,United Kingdom,2010-12-13,3.32
550311,22413,METAL SIGN TAKE IT OR LEAVE IT ,1,17-04-2011 11:04,2.95,16728.0,United Kingdom,2011-04-17,2.95
576629,21212,PACK OF 72 RETROSPOT CAKE CASES,24,16-11-2011 08:37,0.55,12621.0,Germany,2011-11-16,13.200000000000001
554054,22692,DOORMAT WELCOME TO OUR HOME,2,20-05-2011 15:29,15.79,,United Kingdom,2011-05-20,31.58
569568,22899,CHILDREN'S APRON DOLLY GIRL ,6,05-10-2011 09:57,2.1,12700.0,France,2011-05-10,12.600000000000001
544071,82551,LAUNDRY 15C METAL SIGN,12,15-02-2011 14:30,1.45,16317.0,United Kingdom,2011-02-15,17.4
543653,21231,SWEETHEART CERAMIC TRINKET BOX,16,11-02-2011 10:26,1.25,14796.0,United Kingdom,2011-11-02,20.0
541971,22714,CARD BIRTHDAY COWBOY,1,24-01-2011 13:48,0.83,,United Kingdom,2011-01-24,0.83
542344,85032D,YULETIDE IMAGES GIFT WRAP SET,1,27-01-2011 11:30,1.63,,United Kingdom,2011-01-27,1.63
578270,22419,LIPSTICK PEN RED,33,23-11-2011 13:39,0.83,14096.0,United Kingdom,2011-11-23,27.389999999999997
550303,22646,CERAMIC STRAWBERRY CAKE MONEY BANK,12,17-04-2011 10:21,1.45,18213.0,United Kingdom,2011-04-17,17.4
570180,22940,FELTCRAFT CHRISTMAS FAIRY,4,07-10-2011 14:28,4.25,17509.0,United Kingdom,2011-07-10,17.0
566787,20713,JUMBO BAG OWLS,11,15-09-2011 10:31,4.13,,United Kingdom,2011-09-15,45.43
566787,21865,PINK UNION JACK  PASSPORT COVER ,3,15-09-2011 10:31,4.13,,United Kingdom,2011-09-15,12.39
567667,21775,DECORATIVE FLORE BATHROOM BOTTLE,1,21-09-2011 15:24,2.46,,United Kingdom,2011-09-21,2.46
547379,21399,BLUE POLKADOT COFFEE MUG,48,22-03-2011 15:13,0.39,12720.0,Germany,2011-03-22,18.72
569898,22654,DELUXE SEWING KIT ,1,06-10-2011 16:08,11.63,,United Kingdom,2011-06-10,11.63
568188,23326,HANGING MINI COLOURED BOTTLES,4,25-09-2011 14:33,0.63,16049.0,United Kingdom,2011-09-25,2.52
572652,22553,PLASTERS IN TIN SKULLS,12,25-10-2011 12:11,1.65,15805.0,United Kingdom,2011-10-25,19.799999999999997
549291,22293,HANGING CHICK GREEN DECORATION,1,07-04-2011 19:05,1.45,16261.0,United Kingdom,2011-07-04,1.45
544349,71053,WHITE METAL LANTERN,4,18-02-2011 10:03,3.75,16713.0,United Kingdom,2011-02-18,15.0
536945,22437,SET OF 9 BLACK SKULL BALLOONS,1,03-12-2010 12:24,0.85,14083.0,United Kingdom,2010-03-12,0.85
555565,21930,JUMBO STORAGE BAG SKULLS,10,05-06-2011 15:06,2.08,15298.0,United Kingdom,2011-05-06,20.8
537608,22577,WOODEN HEART CHRISTMAS SCANDINAVIAN,8,07-12-2010 13:20,0.85,15024.0,United Kingdom,2010-07-12,6.8
575046,22197,POPCORN HOLDER,21,08-11-2011 12:09,0.85,15039.0,United Kingdom,2011-08-11,17.849999999999998
572285,22692,DOORMAT WELCOME TO OUR HOME,1,23-10-2011 12:16,8.25,14698.0,United Kingdom,2011-10-23,8.25
554974,22699,ROSES REGENCY TEACUP AND SAUCER ,2,27-05-2011 17:14,2.95,14031.0,United Kingdom,2011-05-27,5.9
562114,22907,PACK OF 20 NAPKINS PANTRY DESIGN,2,02-08-2011 16:14,1.63,,United Kingdom,2011-02-08,3.26
549881,21508,VINTAGE KID DOLLY CARD ,12,12-04-2011 15:30,0.42,14032.0,United Kingdom,2011-12-04,5.04
547785,23181,BULL DOG BOTTLE TOP WALL CLOCK,2,25-03-2011 11:41,8.25,13097.0,United Kingdom,2011-03-25,16.5
555510,22132,RED LOVE HEART SHAPE CUP,2,03-06-2011 17:09,1.63,,United Kingdom,2011-03-06,3.26
573100,23390,DOLLY GIRL MINI BACKPACK,4,27-10-2011 14:49,4.15,17528.0,United Kingdom,2011-10-27,16.6
576618,47471,RAINBOW PEGS PHOTO CLIP STRING,1,15-11-2011 17:00,1.46,,United Kingdom,2011-11-15,1.46
538637,22910,PAPER CHAIN KIT VINTAGE CHRISTMAS,3,13-12-2010 13:52,2.95,17611.0,United Kingdom,2010-12-13,8.850000000000001
538524,10125,MINI FUNKY DESIGN TAPES,1,13-12-2010 09:35,1.66,,United Kingdom,2010-12-13,1.66
578248,21977,PACK OF 60 PINK PAISLEY CAKE CASES,24,23-11-2011 12:40,0.55,16255.0,United Kingdom,2011-11-23,13.200000000000001
547850,22284,HEN HOUSE DECORATION,1,27-03-2011 12:06,1.65,14472.0,United Kingdom,2011-03-27,1.65
541266,21563,RED HEART SHAPE LOVE BUCKET ,9,16-01-2011 16:25,2.95,15673.0,United Kingdom,2011-01-16,26.55
579403,22386,JUMBO BAG PINK POLKADOT,10,29-11-2011 12:15,2.08,14503.0,United Kingdom,2011-11-29,20.8
568721,22814,CARD PARTY GAMES ,2,28-09-2011 16:24,0.42,,United Kingdom,2011-09-28,0.84
561507,23290,SPACEBOY CHILDRENS BOWL,8,27-07-2011 14:21,1.25,12397.0,Belgium,2011-07-27,10.0
555549,21561,DINOSAUR LUNCH BOX WITH CUTLERY,2,05-06-2011 13:24,2.55,13637.0,United Kingdom,2011-05-06,5.1
576071,21155,RED RETROSPOT PEG BAG,1,13-11-2011 16:03,2.55,18069.0,United Kingdom,2011-11-13,2.55
542780,85150,LADIES & GENTLEMEN METAL SIGN,12,01-02-2011 09:38,2.55,17675.0,United Kingdom,2011-01-02,30.599999999999998
560245,22469,HEART OF WICKER SMALL,1,17-07-2011 12:15,1.65,,Switzerland,2011-07-17,1.65
553374,23208,LUNCH BAG VINTAGE LEAF DESIGN,10,16-05-2011 14:51,1.65,14489.0,United Kingdom,2011-05-16,16.5
552663,22900, SET 2 TEA TOWELS I LOVE LONDON ,1,10-05-2011 15:04,4.13,,United Kingdom,2011-10-05,4.13
561600,21899,GARAGE KEY FOB,3,28-07-2011 11:29,0.65,15861.0,United Kingdom,2011-07-28,1.9500000000000002
551982,22055,MINI CAKE STAND  HANGING STRAWBERY,6,05-05-2011 13:56,1.65,15023.0,United Kingdom,2011-05-05,9.899999999999999
568367,22666,RECIPE BOX PANTRY YELLOW DESIGN,6,26-09-2011 15:51,2.95,15755.0,United Kingdom,2011-09-26,17.700000000000003
575063,22720,SET OF 3 CAKE TINS PANTRY DESIGN ,1,08-11-2011 12:32,4.95,16764.0,United Kingdom,2011-08-11,4.95
574856,84969,BOX OF 6 ASSORTED COLOUR TEASPOONS,1,07-11-2011 12:06,8.29,,United Kingdom,2011-07-11,8.29
538071,85227,SET OF 6 3D KIT CARDS FOR KIDS,1,09-12-2010 14:09,1.66,,United Kingdom,2010-09-12,1.66
560434,22077,6 RIBBONS RUSTIC CHARM,1,18-07-2011 15:56,3.29,,United Kingdom,2011-07-18,3.29
569105,82613B,"METAL SIGN,CUPCAKE SINGLE HOOK",3,30-09-2011 12:35,1.25,16729.0,United Kingdom,2011-09-30,3.75
566319,22766,PHOTO FRAME CORNICE,8,12-09-2011 11:25,2.95,13431.0,United Kingdom,2011-12-09,23.6
575215,85123A,WHITE HANGING HEART T-LIGHT HOLDER,3,09-11-2011 11:04,2.95,18109.0,United Kingdom,2011-09-11,8.850000000000001
578344,22141,CHRISTMAS CRAFT TREE TOP ANGEL,2,24-11-2011 09:21,4.13,,United Kingdom,2011-11-24,8.26
564200,22582,PACK OF 6 SWEETIE GIFT BOXES,2,23-08-2011 17:37,2.55,18018.0,United Kingdom,2011-08-23,5.1
580520,21716,BOYS VINTAGE TIN SEASIDE BUCKET,2,04-12-2011 14:55,2.55,13521.0,United Kingdom,2011-04-12,5.1
541972,48185,DOORMAT FAIRY CAKE,2,24-01-2011 13:58,7.95,12935.0,United Kingdom,2011-01-24,15.9
572652,23570,TRADITIONAL PICK UP STICKS GAME ,12,25-10-2011 12:11,1.25,15805.0,United Kingdom,2011-10-25,15.0
559051,22216,T-LIGHT HOLDER WHITE LACE,27,05-07-2011 16:47,1.63,,United Kingdom,2011-05-07,44.01
540524,84032B,CHARLIE + LOLA RED HOT WATER BOTTLE,5,09-01-2011 12:53,2.95,16735.0,United Kingdom,2011-09-01,14.75
537375,70007,HI TEC ALPINE HAND WARMER,6,06-12-2010 12:55,1.65,17019.0,United Kingdom,2010-06-12,9.899999999999999
569129,23332,IVORY WICKER HEART LARGE,3,30-09-2011 13:40,1.65,15034.0,United Kingdom,2011-09-30,4.949999999999999
547892,22971,QUEENS GUARD COFFEE MUG,6,28-03-2011 10:15,2.55,12669.0,France,2011-03-28,15.299999999999999
566790,84375,SET OF 20 KIDS COOKIE CUTTERS,48,15-09-2011 10:35,2.1,17679.0,United Kingdom,2011-09-15,100.80000000000001
538868,22418,10 COLOUR SPACEBOY PEN,48,14-12-2010 14:42,0.85,17017.0,United Kingdom,2010-12-14,40.8
567973,22867,HAND WARMER BIRD DESIGN,12,23-09-2011 10:17,2.1,13994.0,United Kingdom,2011-09-23,25.200000000000003
578844,21873,IF YOU CAN'T STAND THE HEAT MUG,1,25-11-2011 16:14,3.29,,United Kingdom,2011-11-25,3.29
581407,22942,CHRISTMAS LIGHTS 10 SANTAS ,1,08-12-2011 13:59,2.95,13263.0,United Kingdom,2011-08-12,2.95
564301,22996,TRAVEL CARD WALLET VINTAGE TICKET,24,24-08-2011 11:54,0.42,14299.0,United Kingdom,2011-08-24,10.08
548191,85099B,JUMBO BAG RED RETROSPOT,1,29-03-2011 15:20,4.13,,United Kingdom,2011-03-29,4.13
575728,21080,SET/20 RED RETROSPOT PAPER NAPKINS ,12,10-11-2011 19:40,0.85,14911.0,EIRE,2011-10-11,10.2
539609,84580,MOUSE TOY WITH PINK T-SHIRT,1,20-12-2010 14:15,3.75,15527.0,United Kingdom,2010-12-20,3.75
577126,84828,JUNGLE POPSICLES ICE LOLLY MOULDS,12,17-11-2011 19:22,1.25,12406.0,Denmark,2011-11-17,15.0
547785,23194,GYMKHANA TREASURE BOOK BOX,3,25-03-2011 11:41,2.25,13097.0,United Kingdom,2011-03-25,6.75
551657,22558,CLOTHES PEGS RETROSPOT PACK 24 ,12,03-05-2011 12:12,1.49,14911.0,EIRE,2011-03-05,17.88
541838,22789,T-LIGHT HOLDER SWEETHEART HANGING,4,23-01-2011 10:43,1.95,12916.0,United Kingdom,2011-01-23,7.8
537369,85035A,GARDENIA 3 WICK MORRIS BOXED CANDLE,1,06-12-2010 12:41,4.25,17860.0,United Kingdom,2010-06-12,4.25
573137,23536,WALL ART VILLAGE SHOW ,1,27-10-2011 17:15,12.46,,United Kingdom,2011-10-27,12.46
570722,47566,PARTY BUNTING,4,12-10-2011 11:08,4.95,14642.0,United Kingdom,2011-12-10,19.8
541421,84032A,CHARLIE+LOLA PINK HOT WATER BOTTLE,4,17-01-2011 17:44,3.29,,United Kingdom,2011-01-17,13.16
554654,22963,JAM JAR WITH GREEN LID,12,25-05-2011 13:34,0.85,12815.0,Poland,2011-05-25,10.2
573576,90166,PINK & WHITE ROSEBUD RING,1,31-10-2011 14:09,4.15,14096.0,United Kingdom,2011-10-31,4.15
540015,22727,ALARM CLOCK BAKELIKE RED ,4,04-01-2011 11:40,3.75,13319.0,United Kingdom,2011-04-01,15.0
571247,84970L,SINGLE HEART ZINC T-LIGHT HOLDER,24,14-10-2011 16:04,1.25,15826.0,United Kingdom,2011-10-14,30.0
574328,23293,SET OF 12 FAIRY CAKE BAKING CASES,16,04-11-2011 09:05,0.83,13081.0,United Kingdom,2011-04-11,13.28
559338,22835,HOT WATER BOTTLE I AM SO POORLY,1,07-07-2011 16:30,9.13,,United Kingdom,2011-07-07,9.13
555150,21084,SET/6 COLLAGE PAPER CUPS,6,31-05-2011 15:53,0.83,,United Kingdom,2011-05-31,4.9799999999999995
537434,22573,STAR WOODEN CHRISTMAS DECORATION,9,06-12-2010 16:57,1.66,,United Kingdom,2010-06-12,14.94
551270,21719,LOVELY BONBON STICKER SHEET,3,27-04-2011 12:35,0.85,15891.0,United Kingdom,2011-04-27,2.55
572317,22328,ROUND SNACK BOXES SET OF 4 FRUITS ,1,23-10-2011 16:13,2.95,14629.0,United Kingdom,2011-10-23,2.95
581188,23294,SET OF 6 SNACK LOAF BAKING CASES,8,07-12-2011 16:47,0.83,17735.0,United Kingdom,2011-07-12,6.64
544074,22667,RECIPE BOX RETROSPOT ,3,15-02-2011 14:49,2.95,14156.0,EIRE,2011-02-15,8.850000000000001
575681,23322,LARGE WHITE HEART OF WICKER,1,10-11-2011 15:32,2.95,16903.0,United Kingdom,2011-10-11,2.95
575739,85049H,URBAN BLACK RIBBONS ,3,11-11-2011 09:05,0.83,,United Kingdom,2011-11-11,2.4899999999999998
577504,84596G,SMALL CHOCOLATES PINK BOWL,8,20-11-2011 12:36,0.42,14159.0,United Kingdom,2011-11-20,3.36
539502,21065,BOOM BOX SPEAKER GIRLS,24,20-12-2010 11:14,1.25,14099.0,United Kingdom,2010-12-20,30.0
577861,22287,DECORATION WOBBLY CHICKEN,24,22-11-2011 11:28,0.39,13924.0,United Kingdom,2011-11-22,9.36
547491,85123A,WHITE HANGING HEART T-LIGHT HOLDER,6,23-03-2011 12:05,2.95,17096.0,United Kingdom,2011-03-23,17.700000000000003
579003,84832,ZINC WILLIE WINKIE  CANDLE STICK,24,28-11-2011 08:48,0.85,14741.0,United Kingdom,2011-11-28,20.4
580115,21873,IF YOU CAN'T STAND THE HEAT MUG,1,01-12-2011 16:22,3.29,,United Kingdom,2011-01-12,3.29
550474,85039B,S/4 IVORY MINI ROSE CANDLE IN BOWL,2,18-04-2011 13:58,1.63,,United Kingdom,2011-04-18,3.26
574015,35970,ZINC FOLKART SLEIGH BELLS,6,02-11-2011 12:03,1.69,15576.0,United Kingdom,2011-02-11,10.14
558758,23109,LED TEA LIGHTS,4,03-07-2011 12:27,2.89,17939.0,United Kingdom,2011-03-07,11.56
544205,21080,SET/20 RED RETROSPOT PAPER NAPKINS ,3,17-02-2011 10:31,2.46,,United Kingdom,2011-02-17,7.38
541660,85123A,WHITE HANGING HEART T-LIGHT HOLDER,3,20-01-2011 12:20,2.95,17787.0,United Kingdom,2011-01-20,8.850000000000001
580188,22065,CHRISTMAS PUDDING TRINKET POT ,8,02-12-2011 12:02,0.39,16440.0,United Kingdom,2011-02-12,3.12
579495,22578,WOODEN STAR CHRISTMAS SCANDINAVIAN,24,29-11-2011 15:34,0.29,13576.0,United Kingdom,2011-11-29,6.959999999999999
558614,21935,SUKI  SHOULDER BAG,7,30-06-2011 15:56,1.63,,United Kingdom,2011-06-30,11.41
567381,21876,POTTERING MUG,624,20-09-2011 10:12,1.48,17450.0,United Kingdom,2011-09-20,923.52
574887,22376,AIRLINE BAG VINTAGE JET SET WHITE,4,07-11-2011 14:13,4.25,13717.0,United Kingdom,2011-07-11,17.0
548792,79030G,"TUMBLER, NEW ENGLAND",4,04-04-2011 12:42,0.39,14711.0,United Kingdom,2011-04-04,1.56
568721,21992,VINTAGE PAISLEY STATIONERY SET,2,28-09-2011 16:24,2.46,,United Kingdom,2011-09-28,4.92
574874,23199,JUMBO BAG APPLES,10,07-11-2011 13:06,2.08,14911.0,EIRE,2011-07-11,20.8
546896,21246,RED RETROSPOT BIG BOWL,1,17-03-2011 18:24,4.13,,United Kingdom,2011-03-17,4.13
577359,20996,JAZZ HEARTS ADDRESS BOOK,8,18-11-2011 16:07,0.19,14903.0,United Kingdom,2011-11-18,1.52
560995,22440,BALLOON WATER BOMB PACK OF 35,2,22-07-2011 13:48,0.42,,United Kingdom,2011-07-22,0.84
552259,22429,ENAMEL MEASURING JUG CREAM,4,08-05-2011 11:13,4.25,15796.0,United Kingdom,2011-08-05,17.0
554512,20712,JUMBO BAG WOODLAND ANIMALS,1,24-05-2011 15:54,4.13,,United Kingdom,2011-05-24,4.13
552821,84978,HANGING HEART JAR T-LIGHT HOLDER,1,11-05-2011 12:58,1.25,18118.0,United Kingdom,2011-11-05,1.25
544295,21165,BEWARE OF THE CAT METAL SIGN ,12,17-02-2011 12:43,1.45,14298.0,United Kingdom,2011-02-17,17.4
556494,22616,PACK OF 12 LONDON TISSUES ,12,12-06-2011 14:57,0.29,17802.0,United Kingdom,2011-12-06,3.4799999999999995
549568,21975,PACK OF 60 DINOSAUR CAKE CASES,10,10-04-2011 15:09,0.55,15665.0,United Kingdom,2011-10-04,5.5
551718,21928,JUMBO BAG SCANDINAVIAN BLUE PAISLEY,11,03-05-2011 16:06,2.08,,United Kingdom,2011-03-05,22.880000000000003
545215,22960,JAM MAKING SET WITH JARS,1,28-02-2011 16:47,8.29,,United Kingdom,2011-02-28,8.29
572219,84755,COLOUR GLASS T-LIGHT HOLDER HANGING,8,21-10-2011 13:17,0.65,17463.0,United Kingdom,2011-10-21,5.2
576147,23209,LUNCH BAG VINTAGE DOILY ,20,14-11-2011 10:49,1.65,16303.0,United Kingdom,2011-11-14,33.0
564231,22424,ENAMEL BREAD BIN CREAM,1,24-08-2011 10:22,12.75,13468.0,United Kingdom,2011-08-24,12.75
537202,22075,6 RIBBONS ELEGANT CHRISTMAS ,1,05-12-2010 14:25,1.65,14506.0,United Kingdom,2010-05-12,1.65
539416,22047,EMPIRE GIFT WRAP,25,17-12-2010 13:56,0.42,17888.0,United Kingdom,2010-12-17,10.5
546437,23049,RECYCLED ACAPULCO MAT RED,2,14-03-2011 09:46,8.25,16807.0,United Kingdom,2011-03-14,16.5
558064,40001,WHITE BAMBOO RIBS LAMPSHADE,2,24-06-2011 15:31,0.85,,United Kingdom,2011-06-24,1.7
565234,23004,TRAVEL CARD WALLET PANTRY,3,02-09-2011 09:38,0.83,,United Kingdom,2011-02-09,2.4899999999999998
565224,23199,JUMBO BAG APPLES,2,01-09-2011 19:11,2.08,14713.0,United Kingdom,2011-01-09,4.16
561600,22587,FELTCRAFT HAIRBAND RED AND BLUE,2,28-07-2011 11:29,0.85,15861.0,United Kingdom,2011-07-28,1.7
569555,22571,ROCKING HORSE RED CHRISTMAS ,12,05-10-2011 08:17,0.85,17728.0,United Kingdom,2011-05-10,10.2
561214,84946,ANTIQUE SILVER T-LIGHT GLASS,14,25-07-2011 17:00,2.46,,United Kingdom,2011-07-25,34.44
541422,22660,DOORMAT I LOVE LONDON,1,17-01-2011 17:48,14.13,,United Kingdom,2011-01-17,14.13
577531,22308,TEA COSY BLUE STRIPE,2,20-11-2011 13:58,4.96,,United Kingdom,2011-11-20,9.92
560225,22503,CABIN BAG VINTAGE PAISLEY,1,15-07-2011 16:27,16.63,,United Kingdom,2011-07-15,16.63
552310,84673B,BLUE FLY SWAT,1,08-05-2011 15:22,0.65,17323.0,United Kingdom,2011-08-05,0.65
550144,22919,HERB MARKER MINT,12,14-04-2011 14:14,0.65,16520.0,United Kingdom,2011-04-14,7.800000000000001
552824,23051,RECYCLED ACAPULCO MAT BLUE,5,11-05-2011 13:16,8.25,14056.0,United Kingdom,2011-11-05,41.25
553543,22753,SMALL YELLOW BABUSHKA NOTEBOOK ,1,17-05-2011 15:35,1.63,,United Kingdom,2011-05-17,1.63
561093,23229,VINTAGE DONKEY TAIL GAME ,6,25-07-2011 10:01,3.75,12540.0,Spain,2011-07-25,22.5
580654,22983,CARD BILLBOARD FONT,12,05-12-2011 13:37,0.42,15854.0,United Kingdom,2011-05-12,5.04
576927,22352,LUNCH BOX WITH CUTLERY RETROSPOT ,6,17-11-2011 11:02,2.55,12567.0,France,2011-11-17,15.299999999999999
581173,23503,PLAYING CARDS KEEP CALM & CARRY ON,1,07-12-2011 15:07,1.25,17870.0,United Kingdom,2011-07-12,1.25
566756,21675,BUTTERFLIES STICKERS,12,14-09-2011 15:54,0.85,12457.0,Switzerland,2011-09-14,10.2
543237,22077,6 RIBBONS RUSTIC CHARM,3,04-02-2011 13:39,4.13,,United Kingdom,2011-04-02,12.39
565931,POST,POSTAGE,2,08-09-2011 10:35,18.0,12683.0,France,2011-08-09,36.0
550987,22859,EASTER TIN BUNNY BOUQUET,2,21-04-2011 18:10,3.29,,United Kingdom,2011-04-21,6.58
553679,22558,CLOTHES PEGS RETROSPOT PACK 24 ,12,18-05-2011 13:09,1.65,14565.0,United Kingdom,2011-05-18,19.799999999999997
566021,21356,TOAST ITS - FAIRY FLOWER,24,08-09-2011 12:47,1.25,15306.0,United Kingdom,2011-08-09,30.0
580136,23210,WHITE ROCKING HORSE HAND PAINTED,3,01-12-2011 19:42,1.25,17841.0,United Kingdom,2011-01-12,3.75
537781,22555,PLASTERS IN TIN STRONGMAN,1,08-12-2010 12:46,1.65,17341.0,United Kingdom,2010-08-12,1.65
577098,21928,JUMBO BAG SCANDINAVIAN BLUE PAISLEY,10,17-11-2011 16:43,2.08,16839.0,United Kingdom,2011-11-17,20.8
555947,21262,WHITE GOOSE FEATHER CHRISTMAS TREE ,24,08-06-2011 10:45,2.95,14911.0,EIRE,2011-08-06,70.80000000000001
579434,22573,STAR WOODEN CHRISTMAS DECORATION,12,29-11-2011 13:17,0.85,16678.0,United Kingdom,2011-11-29,10.2
557442,84920,PINK FLOWER FABRIC PONY,2,20-06-2011 12:53,3.75,14808.0,United Kingdom,2011-06-20,7.5
539607,22413,METAL SIGN TAKE IT OR LEAVE IT ,6,20-12-2010 14:10,2.95,12681.0,France,2010-12-20,17.700000000000003
562263,85099F,JUMBO BAG STRAWBERRY,5,03-08-2011 15:45,2.08,17514.0,United Kingdom,2011-03-08,10.4
538080,22625,RED KITCHEN SCALES,6,09-12-2010 14:28,8.5,17646.0,United Kingdom,2010-09-12,51.0
566976,84991,60 TEATIME FAIRY CAKE CASES,24,16-09-2011 09:27,0.55,15382.0,United Kingdom,2011-09-16,13.200000000000001
577358,22815,CARD PSYCHEDELIC APPLES,3,18-11-2011 15:59,0.42,,United Kingdom,2011-11-18,1.26
543596,21781,MA CAMPAGNE CUTLERY BOX,2,10-02-2011 12:21,14.95,14898.0,United Kingdom,2011-10-02,29.9
540798,84077,WORLD WAR 2 GLIDERS ASSTD DESIGNS,48,11-01-2011 12:11,0.29,17365.0,United Kingdom,2011-11-01,13.919999999999998
573501,22130,PARTY CONE CHRISTMAS DECORATION ,36,31-10-2011 12:02,0.85,18055.0,United Kingdom,2011-10-31,30.599999999999998
569060,22144,CHRISTMAS CRAFT LITTLE FRIENDS,6,30-09-2011 10:52,2.1,13954.0,United Kingdom,2011-09-30,12.600000000000001
578925,23126,FELTCRAFT GIRL AMELIE KIT,3,27-11-2011 12:13,4.95,17365.0,United Kingdom,2011-11-27,14.850000000000001
576463,22457,NATURAL SLATE HEART CHALKBOARD ,1,15-11-2011 11:37,2.95,17974.0,United Kingdom,2011-11-15,2.95
536544,22876,NUMBER TILE COTTAGE GARDEN 8,1,01-12-2010 14:32,4.21,,United Kingdom,2010-01-12,4.21
552670,21731,RED TOADSTOOL LED NIGHT LIGHT,1,10-05-2011 15:06,4.13,,United Kingdom,2011-10-05,4.13
577860,22909,SET OF 20 VINTAGE CHRISTMAS NAPKINS,12,22-11-2011 11:25,0.85,16655.0,United Kingdom,2011-11-22,10.2
559526,21992,VINTAGE PAISLEY STATIONERY SET,1,10-07-2011 11:19,1.25,15756.0,United Kingdom,2011-10-07,1.25
538369,22941,CHRISTMAS LIGHTS 10 REINDEER,2,12-12-2010 11:06,8.5,17251.0,United Kingdom,2010-12-12,17.0
581492,23579,SNACK TRAY I LOVE LONDON,1,09-12-2011 10:03,4.13,,United Kingdom,2011-09-12,4.13
540662,21314,SMALL GLASS HEART TRINKET POT,24,10-01-2011 15:16,2.1,13767.0,United Kingdom,2011-10-01,50.400000000000006
559505,22457,NATURAL SLATE HEART CHALKBOARD ,12,08-07-2011 15:16,2.95,16398.0,United Kingdom,2011-08-07,35.400000000000006
574716,22161,HEART DECORATION RUSTIC HANGING ,1,06-11-2011 14:33,0.19,14502.0,United Kingdom,2011-06-11,0.19
576246,23697,A PRETTY THANK YOU CARD,12,14-11-2011 13:42,0.42,17566.0,United Kingdom,2011-11-14,5.04
540163,22819,"BIRTHDAY CARD, RETRO SPOT",12,05-01-2011 11:52,0.42,13089.0,United Kingdom,2011-05-01,5.04
565251,15034,PAPER POCKET TRAVELING FAN ,12,02-09-2011 10:49,0.14,12748.0,United Kingdom,2011-02-09,1.6800000000000002
539250,84820,DANISH ROSE TRINKET TRAYS,8,16-12-2010 13:44,1.25,15157.0,United Kingdom,2010-12-16,10.0
574074,90018B,GOLD M.O.P ORBIT DROP EARRINGS,1,02-11-2011 15:33,4.15,,United Kingdom,2011-02-11,4.15
555923,22502,PICNIC BASKET WICKER SMALL,2,07-06-2011 17:09,10.79,,United Kingdom,2011-07-06,21.58
577844,21238,RED RETROSPOT CUP,5,22-11-2011 10:41,1.63,,United Kingdom,2011-11-22,8.149999999999999
556813,22781,GUMBALL MAGAZINE RACK,1,14-06-2011 17:28,14.96,,United Kingdom,2011-06-14,14.96
580727,22726,ALARM CLOCK BAKELIKE GREEN,11,05-12-2011 17:17,7.46,14096.0,United Kingdom,2011-05-12,82.06
574561,21249,WOODLAND  HEIGHT CHART STICKERS ,1,04-11-2011 15:52,5.79,,United Kingdom,2011-04-11,5.79
554937,85123A,WHITE HANGING HEART T-LIGHT HOLDER,10,27-05-2011 13:32,2.95,15402.0,United Kingdom,2011-05-27,29.5
562264,22713,CARD I LOVE LONDON ,3,03-08-2011 16:14,0.83,,United Kingdom,2011-03-08,2.4899999999999998
565152,22382,LUNCH BAG SPACEBOY DESIGN ,2,01-09-2011 14:42,1.65,17799.0,United Kingdom,2011-01-09,3.3
541981,22352,LUNCH BOX WITH CUTLERY RETROSPOT ,6,24-01-2011 15:32,2.55,12691.0,France,2011-01-24,15.299999999999999
568187,22470,HEART OF WICKER LARGE,40,25-09-2011 14:32,2.55,13408.0,United Kingdom,2011-09-25,102.0
538356,22903,CALENDAR FAMILY FAVOURITES,40,10-12-2010 15:56,2.95,14062.0,United Kingdom,2010-10-12,118.0
554489,22028,PENNY FARTHING BIRTHDAY CARD,12,24-05-2011 13:46,0.42,17272.0,United Kingdom,2011-05-24,5.04
566952,20774,GREEN FERN NOTEBOOK,4,15-09-2011 16:37,1.63,,United Kingdom,2011-09-15,6.52
541999,22597,MUSICAL ZINC HEART DECORATION ,3,25-01-2011 10:45,1.63,,United Kingdom,2011-01-25,4.89
536569,22086,PAPER CHAIN KIT 50'S CHRISTMAS ,1,01-12-2010 15:35,2.95,16274.0,United Kingdom,2010-01-12,2.95
541596,21977,PACK OF 60 PINK PAISLEY CAKE CASES,2,19-01-2011 16:19,0.55,17602.0,United Kingdom,2011-01-19,1.1
546117,22508,DOORSTOP RETROSPOT HEART,2,09-03-2011 13:56,3.75,16771.0,United Kingdom,2011-09-03,7.5
556507,23076,ICE CREAM SUNDAE LIP GLOSS,24,13-06-2011 09:55,1.25,12567.0,France,2011-06-13,30.0
555025,23118,PARISIENNE JEWELLERY DRAWER ,2,31-05-2011 11:21,7.5,17648.0,United Kingdom,2011-05-31,15.0
572301,23415,HOME SWEET HOME HOOK,1,23-10-2011 14:41,1.65,16794.0,United Kingdom,2011-10-23,1.65
543182,22023,EMPIRE BIRTHDAY CARD,1,04-02-2011 10:40,0.83,,United Kingdom,2011-04-02,0.83
545085,22084,PAPER CHAIN KIT EMPIRE,6,28-02-2011 11:19,2.95,15039.0,United Kingdom,2011-02-28,17.700000000000003
547374,21034,REX CASH+CARRY JUMBO SHOPPER,2,22-03-2011 13:54,0.95,16110.0,United Kingdom,2011-03-22,1.9
567665,23078,ICE CREAM PEN LIP GLOSS ,1,21-09-2011 15:22,2.46,,United Kingdom,2011-09-21,2.46
564090,23294,SET OF 6 SNACK LOAF BAKING CASES,8,23-08-2011 09:53,0.83,17041.0,United Kingdom,2011-08-23,6.64
550216,22722,SET OF 6 SPICE TINS PANTRY DESIGN,4,15-04-2011 11:06,3.95,13516.0,United Kingdom,2011-04-15,15.8
566285,23091,ZINC HERB GARDEN CONTAINER,3,11-09-2011 14:51,6.25,13611.0,United Kingdom,2011-11-09,18.75
577157,22467,GUMBALL COAT RACK,36,18-11-2011 09:58,2.1,12451.0,Switzerland,2011-11-18,75.60000000000001
562649,21843,RED RETROSPOT CAKE STAND,1,08-08-2011 13:11,10.95,14606.0,United Kingdom,2011-08-08,10.95
578293,23583,LUNCH BAG PAISLEY PARK  ,10,23-11-2011 14:36,1.65,15640.0,United Kingdom,2011-11-23,16.5
548739,85125,SMALL ROUND CUT GLASS CANDLESTICK,1,04-04-2011 11:28,4.95,15493.0,United Kingdom,2011-04-04,4.95
561923,22149,FELTCRAFT 6 FLOWER FRIENDS,6,01-08-2011 12:16,2.1,14112.0,United Kingdom,2011-01-08,12.600000000000001
569238,22382,LUNCH BAG SPACEBOY DESIGN ,1,02-10-2011 15:52,1.65,17954.0,United Kingdom,2011-02-10,1.65
569718,22220,CAKE STAND LOVEBIRD 2 TIER WHITE,2,06-10-2011 09:01,9.95,15837.0,United Kingdom,2011-06-10,19.9
566572,22697,GREEN REGENCY TEACUP AND SAUCER,12,13-09-2011 12:52,2.95,13488.0,United Kingdom,2011-09-13,35.400000000000006
578114,23373,VINTAGE CHRISTMAS PAPER GIFT BAG,10,23-11-2011 09:41,0.82,16185.0,United Kingdom,2011-11-23,8.2
543106,22726,ALARM CLOCK BAKELIKE GREEN,4,03-02-2011 12:12,3.75,15658.0,United Kingdom,2011-03-02,15.0
556087,22501,PICNIC BASKET WICKER LARGE,3,08-06-2011 15:24,20.79,,United Kingdom,2011-08-06,62.37
540977,85170D,SET/6 PINK BIRD T-LIGHT CANDLES,3,12-01-2011 15:01,2.51,,United Kingdom,2011-12-01,7.529999999999999
576573,22208,WOOD STAMP SET THANK YOU,12,15-11-2011 13:52,0.83,16600.0,United Kingdom,2011-11-15,9.959999999999999
547963,22480,RED TEA TOWEL CLASSIC DESIGN,12,28-03-2011 15:42,1.25,13037.0,United Kingdom,2011-03-28,15.0
557480,22488,NATURAL SLATE RECTANGLE CHALKBOARD,1,20-06-2011 14:10,3.29,,United Kingdom,2011-06-20,3.29
559422,20725,LUNCH BAG RED RETROSPOT,10,08-07-2011 12:00,1.65,12553.0,France,2011-08-07,16.5
558194,22197,POPCORN HOLDER,30,27-06-2011 12:28,0.85,14583.0,United Kingdom,2011-06-27,25.5
552641,84947,ANTIQUE SILVER TEA GLASS ENGRAVED,12,10-05-2011 13:20,1.25,16525.0,United Kingdom,2011-10-05,15.0
538071,22457,NATURAL SLATE HEART CHALKBOARD ,13,09-12-2010 14:09,5.91,,United Kingdom,2010-09-12,76.83
561820,21985,PACK OF 12 HEARTS DESIGN TISSUES ,3,29-07-2011 16:00,0.83,,United Kingdom,2011-07-29,2.4899999999999998
537823,90214M,"LETTER ""M"" BLING KEY RING",2,08-12-2010 14:25,0.85,,United Kingdom,2010-08-12,1.7
557271,23238,SET OF 4 KNICK KNACK TINS LONDON ,6,19-06-2011 11:41,4.15,17769.0,United Kingdom,2011-06-19,24.900000000000002
548373,21900,"KEY FOB , SHED",1,30-03-2011 16:34,1.63,,United Kingdom,2011-03-30,1.63
577358,21116,OWL DOORSTOP,1,18-11-2011 15:59,8.29,,United Kingdom,2011-11-18,8.29
539708,22774,RED DRAWER KNOB ACRYLIC EDWARDIAN,6,21-12-2010 12:18,2.51,,United Kingdom,2010-12-21,15.059999999999999
570807,84378,SET OF 3 HEART COOKIE CUTTERS,12,12-10-2011 12:44,1.45,13704.0,United Kingdom,2011-12-10,17.4
579161,22909,SET OF 20 VINTAGE CHRISTMAS NAPKINS,2,28-11-2011 13:56,0.85,17379.0,United Kingdom,2011-11-28,1.7
577698,23078,ICE CREAM PEN LIP GLOSS ,24,21-11-2011 12:05,1.25,14963.0,United Kingdom,2011-11-21,30.0
564216,21121,SET/10 RED POLKADOT PARTY CANDLES,24,24-08-2011 09:23,1.25,12642.0,Germany,2011-08-24,30.0
562846,22748,POPPY'S PLAYHOUSE KITCHEN,2,10-08-2011 09:29,3.29,,United Kingdom,2011-10-08,6.58
570906,22147,FELTCRAFT BUTTERFLY HEARTS,12,13-10-2011 10:54,1.25,14537.0,United Kingdom,2011-10-13,15.0
548325,21243,PINK  POLKADOT PLATE ,16,30-03-2011 13:01,1.69,13509.0,United Kingdom,2011-03-30,27.04
573137,21917,SET 12 KIDS  WHITE CHALK STICKS,1,27-10-2011 17:15,0.83,,United Kingdom,2011-10-27,0.83
547247,16161P,WRAP ENGLISH ROSE ,25,22-03-2011 09:01,0.42,18225.0,United Kingdom,2011-03-22,10.5
547892,22192,BLUE DINER WALL CLOCK,2,28-03-2011 10:15,8.5,12669.0,France,2011-03-28,17.0
565141,22851,SET 20 NAPKINS FAIRY CAKES DESIGN ,1,01-09-2011 13:40,0.85,17841.0,United Kingdom,2011-01-09,0.85
566601,22371,AIRLINE BAG VINTAGE TOKYO 78,1,13-09-2011 15:57,4.25,16469.0,United Kingdom,2011-09-13,4.25
544837,22998,TRAVEL CARD WALLET KEEP CALM,4,24-02-2011 10:29,0.42,15910.0,United Kingdom,2011-02-24,1.68
570003,47594A,CAROUSEL DESIGN WASHBAG,1,07-10-2011 09:19,1.95,14792.0,United Kingdom,2011-07-10,1.95
567170,21327,SKULLS WRITING SET ,2,18-09-2011 12:40,1.65,13566.0,United Kingdom,2011-09-18,3.3
549120,82494L,WOODEN FRAME ANTIQUE WHITE ,4,06-04-2011 13:28,2.95,14587.0,United Kingdom,2011-06-04,11.8
567163,23245,SET OF 3 REGENCY CAKE TINS,4,18-09-2011 11:31,4.95,13247.0,United Kingdom,2011-09-18,19.8
539434,22545,MINI JIGSAW BUNNIES,1,17-12-2010 14:41,0.85,,United Kingdom,2010-12-17,0.85
552726,21914,BLUE HARMONICA IN BOX ,12,11-05-2011 10:31,1.25,14920.0,United Kingdom,2011-11-05,15.0
572309,22163,HEART STRING MEMO HOLDER HANGING,5,23-10-2011 15:29,0.79,14432.0,United Kingdom,2011-10-23,3.95
573364,22669,RED BABY BUNTING ,2,30-10-2011 13:09,2.95,14710.0,United Kingdom,2011-10-30,5.9
547099,84920,PINK FLOWER FABRIC PONY,4,21-03-2011 10:30,3.75,18224.0,United Kingdom,2011-03-21,15.0
568667,22541,MINI JIGSAW LEAP FROG,1,28-09-2011 13:00,0.42,14606.0,United Kingdom,2011-09-28,0.42
556330,23207,LUNCH BAG ALPHABET DESIGN,2,10-06-2011 11:29,1.65,17797.0,United Kingdom,2011-10-06,3.3
565838,22699,ROSES REGENCY TEACUP AND SAUCER ,6,07-09-2011 11:43,2.95,15071.0,United Kingdom,2011-07-09,17.700000000000003
549262,21086,SET/6 RED SPOTTY PAPER CUPS,2,07-04-2011 12:38,0.65,14465.0,United Kingdom,2011-07-04,1.3
571747,22187,GREEN CHRISTMAS TREE CARD HOLDER,12,19-10-2011 10:59,1.95,13849.0,United Kingdom,2011-10-19,23.4
545658,22517,CHILDS GARDEN RAKE PINK,1,04-03-2011 14:13,2.1,14670.0,United Kingdom,2011-04-03,2.1
568553,22139,RETROSPOT TEA SET CERAMIC 11 PC ,3,27-09-2011 15:17,4.95,15674.0,United Kingdom,2011-09-27,14.850000000000001
541104,84313C,ORANGE TV TRAY TABLE ,3,13-01-2011 14:29,5.79,,United Kingdom,2011-01-13,17.37
538351,47559b,TEA TIME OVEN GLOVE,11,10-12-2010 15:17,3.36,,United Kingdom,2010-10-12,36.96
564186,22867,HAND WARMER BIRD DESIGN,12,23-08-2011 15:20,2.1,15755.0,United Kingdom,2011-08-23,25.200000000000003
549100,22835,HOT WATER BOTTLE I AM SO POORLY,1,06-04-2011 11:14,7.46,,United Kingdom,2011-06-04,7.46
573553,22139,RETROSPOT TEA SET CERAMIC 11 PC ,2,31-10-2011 13:48,10.79,,United Kingdom,2011-10-31,21.58
574909,22620,4 TRADITIONAL SPINNING TOPS,1,07-11-2011 15:40,1.45,13673.0,United Kingdom,2011-07-11,1.45
560894,20728,LUNCH BAG CARS BLUE,10,21-07-2011 17:09,1.65,14911.0,EIRE,2011-07-21,16.5
572219,23263,SET OF 3 WOODEN HEART DECORATIONS,4,21-10-2011 13:17,1.25,17463.0,United Kingdom,2011-10-21,5.0
547651,22285,HANGING HEN ON NEST DECORATION,1,24-03-2011 12:11,1.65,16904.0,United Kingdom,2011-03-24,1.65
542786,21314,SMALL GLASS HEART TRINKET POT,8,01-02-2011 10:15,2.1,17314.0,United Kingdom,2011-01-02,16.8
577078,21980,PACK OF 12 RED RETROSPOT TISSUES ,4,17-11-2011 15:17,0.83,,United Kingdom,2011-11-17,3.32
542090,84992,72 SWEETHEART FAIRY CAKE CASES,24,25-01-2011 12:39,0.55,15518.0,United Kingdom,2011-01-25,13.200000000000001
579194,23312,VINTAGE CHRISTMAS GIFT SACK,4,28-11-2011 15:50,4.15,15804.0,United Kingdom,2011-11-28,16.6
577519,23046,PAPER LANTERN 9 POINT DELUXE STAR,2,20-11-2011 13:20,6.65,15044.0,United Kingdom,2011-11-20,13.3
548505,21218,RED SPOTTY BISCUIT TIN,1,31-03-2011 14:34,8.29,,United Kingdom,2011-03-31,8.29
581137,20973,12 PENCIL SMALL TUBE WOODLAND,24,07-12-2011 13:16,0.65,17434.0,United Kingdom,2011-07-12,15.600000000000001
569208,22990,COTTON APRON PANTRY DESIGN,1,02-10-2011 11:10,4.95,16693.0,United Kingdom,2011-02-10,4.95
540161,21870,I CAN ONLY PLEASE ONE PERSON MUG,2,05-01-2011 11:52,1.25,16719.0,United Kingdom,2011-05-01,2.5
566041,23197,SKETCHBOOK MAGNETIC SHOPPING LIST,12,08-09-2011 13:48,1.45,13814.0,Germany,2011-08-09,17.4
572307,23215,JINGLE BELL HEART ANTIQUE SILVER,24,23-10-2011 15:23,2.08,16905.0,United Kingdom,2011-10-23,49.92
578511,22720,SET OF 3 CAKE TINS PANTRY DESIGN ,1,24-11-2011 13:27,4.95,17975.0,United Kingdom,2011-11-24,4.95
573876,22232,JIGSAW TOADSTOOLS 3 PIECE,5,01-11-2011 12:48,0.59,16360.0,United Kingdom,2011-01-11,2.9499999999999997
543546,20771,CHRYSANTHEMUM  JOURNAL,1,09-02-2011 16:52,4.96,,United Kingdom,2011-09-02,4.96
551293,84857C,PINK MONTE CARLO HANDBAG,12,27-04-2011 14:28,1.95,14298.0,United Kingdom,2011-04-27,23.4
545232,21623,VINTAGE UNION JACK MEMOBOARD,2,01-03-2011 10:19,9.95,15676.0,United Kingdom,2011-01-03,19.9
576645,23264,SET OF 3 WOODEN SLEIGH DECORATIONS,12,16-11-2011 10:14,1.25,16245.0,United Kingdom,2011-11-16,15.0
544571,22248,DECORATION  PINK CHICK MAGIC GARDEN,16,21-02-2011 13:07,0.85,15146.0,United Kingdom,2011-02-21,13.6
553411,22904,CALENDAR PAPER CUT DESIGN,6,17-05-2011 09:28,2.95,12714.0,France,2011-05-17,17.700000000000003
561671,22550,HOLIDAY FUN LUDO,72,28-07-2011 17:17,2.62,12830.0,United Kingdom,2011-07-28,188.64000000000001
569661,22182,CAKE STAND VICTORIAN FILIGREE SMALL,8,05-10-2011 13:10,4.95,17483.0,United Kingdom,2011-05-10,39.6
546414,20914,SET/5 RED RETROSPOT LID GLASS BOWLS,1,13-03-2011 10:25,2.95,16768.0,United Kingdom,2011-03-13,2.95
562928,22547,MINI JIGSAW DINOSAUR ,6,10-08-2011 15:29,0.42,15494.0,United Kingdom,2011-10-08,2.52
543909,85123A,WHITE HANGING HEART T-LIGHT HOLDER,1,14-02-2011 12:32,5.79,,United Kingdom,2011-02-14,5.79
559497,21935,SUKI  SHOULDER BAG,1,08-07-2011 13:54,4.13,,United Kingdom,2011-08-07,4.13
552668,21714,CITRONELLA CANDLE GARDEN POT,10,10-05-2011 15:05,2.46,,United Kingdom,2011-10-05,24.6
576370,23201,JUMBO BAG ALPHABET,40,15-11-2011 08:00,2.08,15981.0,United Kingdom,2011-11-15,83.2
568712,21733,RED HANGING HEART T-LIGHT HOLDER,2,28-09-2011 15:50,2.95,17841.0,United Kingdom,2011-09-28,5.9
538035,21733,RED HANGING HEART T-LIGHT HOLDER,4,09-12-2010 13:03,2.95,16065.0,United Kingdom,2010-09-12,11.8
579938,85049E,SCANDINAVIAN REDS RIBBONS,12,01-12-2011 10:18,1.25,14146.0,United Kingdom,2011-01-12,15.0
541969,21326,AGED GLASS SILVER T-LIGHT HOLDER,1,24-01-2011 13:46,1.63,,United Kingdom,2011-01-24,1.63
557268,21658,GLASS  BEURRE DISH,1,19-06-2011 11:26,3.95,13097.0,United Kingdom,2011-06-19,3.95
554788,22178,VICTORIAN GLASS HANGING T-LIGHT,12,26-05-2011 12:00,1.25,12987.0,United Kingdom,2011-05-26,15.0
572969,21055,TOOL BOX SOFT TOY ,1,27-10-2011 10:46,8.95,13363.0,United Kingdom,2011-10-27,8.95
543985,21012,ANTIQUE ALL GLASS CANDLESTICK,12,15-02-2011 09:44,2.46,,United Kingdom,2011-02-15,29.52
546896,21415,CLAM SHELL SMALL ,1,17-03-2011 18:24,4.13,,United Kingdom,2011-03-17,4.13
562046,22779,WOODEN OWLS LIGHT GARLAND ,4,02-08-2011 10:34,4.25,12378.0,Switzerland,2011-02-08,17.0
574532,23439,HAND WARMER RED LOVE HEART,12,04-11-2011 14:19,2.1,15676.0,United Kingdom,2011-04-11,25.200000000000003
544776,21212,PACK OF 72 RETROSPOT CAKE CASES,8,23-02-2011 11:39,2.08,,United Kingdom,2011-02-23,16.64
553672,47566,PARTY BUNTING,4,18-05-2011 12:44,4.95,15811.0,United Kingdom,2011-05-18,19.8
571294,23356,LOVE HOT WATER BOTTLE,3,16-10-2011 16:09,5.95,16987.0,United Kingdom,2011-10-16,17.85
562980,22734,SET OF 6 RIBBONS VINTAGE CHRISTMAS,6,11-08-2011 11:44,2.89,17686.0,United Kingdom,2011-11-08,17.34
572296,23300,GARDENERS KNEELING PAD CUP OF TEA ,1,23-10-2011 14:28,1.65,13598.0,United Kingdom,2011-10-23,1.65
539414,22904,CALENDAR PAPER CUT DESIGN,1,17-12-2010 13:45,2.95,16931.0,United Kingdom,2010-12-17,2.95
558074,22356,CHARLOTTE BAG PINK POLKADOT,100,24-06-2011 16:38,0.72,13791.0,United Kingdom,2011-06-24,72.0
538196,22549,PICTURE DOMINOES,24,10-12-2010 10:56,1.45,12731.0,France,2010-10-12,34.8
557937,21080,SET/20 RED RETROSPOT PAPER NAPKINS ,2,23-06-2011 15:30,1.63,,United Kingdom,2011-06-23,3.26
565847,21955,DOORMAT UNION JACK GUNS AND ROSES,1,07-09-2011 12:44,12.46,,United Kingdom,2011-07-09,12.46
552671,21945,STRAWBERRIES  DESIGN FLANNEL ,1,10-05-2011 15:06,1.63,,United Kingdom,2011-10-05,1.63
576563,84029E,RED WOOLLY HOTTIE WHITE HEART.,2,15-11-2011 13:27,4.25,17564.0,United Kingdom,2011-11-15,8.5
572301,22371,AIRLINE BAG VINTAGE TOKYO 78,1,23-10-2011 14:41,4.25,16794.0,United Kingdom,2011-10-23,4.25
552287,22383,LUNCH BAG SUKI DESIGN ,10,08-05-2011 13:19,1.65,17705.0,United Kingdom,2011-08-05,16.5
555276,22346,PARTY PIZZA DISH GREEN POLKADOT,1,01-06-2011 17:28,1.63,,United Kingdom,2011-01-06,1.63
556812,37450,CERAMIC CAKE BOWL + HANGING CAKES,2,14-06-2011 17:25,5.79,,United Kingdom,2011-06-14,11.58
554015,48194,DOORMAT HEARTS,2,20-05-2011 13:14,7.95,17644.0,United Kingdom,2011-05-20,15.9
550204,85174,S/4 CACTI CANDLES,1,15-04-2011 10:37,10.79,,United Kingdom,2011-04-15,10.79
577086,16008,SMALL FOLDING SCISSOR(POINTED EDGE),24,17-11-2011 15:50,0.12,16070.0,United Kingdom,2011-11-17,2.88
560272,22352,LUNCH BOX WITH CUTLERY RETROSPOT ,6,17-07-2011 14:56,2.55,12691.0,France,2011-07-17,15.299999999999999
568949,51014L,"FEATHER PEN,LIGHT PINK",1,29-09-2011 15:13,0.83,,United Kingdom,2011-09-29,0.83
567672,23266,SET OF 3 WOODEN STOCKING DECORATION,2,21-09-2011 15:39,1.25,16085.0,United Kingdom,2011-09-21,2.5
561632,21495,SKULLS AND CROSSBONES WRAP,25,28-07-2011 14:30,0.42,15639.0,United Kingdom,2011-07-28,10.5
541869,17084N,FAIRY DREAMS INCENSE ,25,24-01-2011 09:35,0.42,,United Kingdom,2011-01-24,10.5
571281,21111,"SWISS ROLL TOWEL, CHOCOLATE  SPOTS",48,16-10-2011 13:23,2.55,14088.0,United Kingdom,2011-10-16,122.39999999999999
552232,21212,PACK OF 72 RETROSPOT CAKE CASES,1,06-05-2011 15:54,1.25,,United Kingdom,2011-06-05,1.25
544356,21880,RED RETROSPOT TAPE,12,18-02-2011 11:18,0.65,13904.0,United Kingdom,2011-02-18,7.800000000000001
561583,22169,FAMILY ALBUM WHITE PICTURE FRAME,6,28-07-2011 10:33,8.5,13813.0,Germany,2011-07-28,51.0
556484,22150,3 STRIPEY MICE FELTCRAFT,2,12-06-2011 13:17,1.95,16938.0,United Kingdom,2011-12-06,3.9
539595,22342,HOME GARLAND PAINTED ZINC ,1,20-12-2010 13:43,3.36,,United Kingdom,2010-12-20,3.36
540839,72802C,VANILLA SCENT CANDLE JEWELLED BOX,1,11-01-2011 15:42,4.25,16791.0,United Kingdom,2011-11-01,4.25
555510,84992,72 SWEETHEART FAIRY CAKE CASES,1,03-06-2011 17:09,1.25,,United Kingdom,2011-03-06,1.25
569030,48138,DOORMAT UNION FLAG,40,30-09-2011 10:27,8.0,17450.0,United Kingdom,2011-09-30,320.0
545653,22613,PACK OF 20 SPACEBOY NAPKINS,5,04-03-2011 13:39,0.85,15311.0,United Kingdom,2011-04-03,4.25
569491,85053,FRENCH ENAMEL CANDLEHOLDER,1,04-10-2011 13:25,2.1,14056.0,United Kingdom,2011-04-10,2.1
563857,21925,UNION STRIPE CUSHION COVER ,12,19-08-2011 15:44,1.25,12968.0,United Kingdom,2011-08-19,15.0
562085,22840,ROUND CAKE TIN VINTAGE RED,2,02-08-2011 12:27,7.95,15228.0,United Kingdom,2011-02-08,15.9
563215,23300,GARDENERS KNEELING PAD CUP OF TEA ,12,14-08-2011 12:56,1.65,15683.0,United Kingdom,2011-08-14,19.799999999999997
581219,22918,HERB MARKER PARSLEY,1,08-12-2011 09:28,1.63,,United Kingdom,2011-08-12,1.63
541421,21275,ZINC TOP  2 DOOR WOODEN SHELF ,1,17-01-2011 17:44,33.29,,United Kingdom,2011-01-17,33.29
564353,22712,CARD DOLLY GIRL ,12,24-08-2011 15:08,0.42,15764.0,United Kingdom,2011-08-24,5.04
575117,79161A,ST GEORGE SET OF 10 PARTY LIGHTS,1,08-11-2011 14:22,2.95,12748.0,United Kingdom,2011-08-11,2.95
545447,20972,PINK CREAM FELT CRAFT TRINKET BOX ,12,02-03-2011 16:34,1.25,17426.0,United Kingdom,2011-02-03,15.0
549262,21094,SET/6 RED SPOTTY PAPER PLATES,2,07-04-2011 12:38,0.85,14465.0,United Kingdom,2011-07-04,1.7
555284,23171,REGENCY TEA PLATE GREEN ,12,02-06-2011 09:37,1.45,14298.0,United Kingdom,2011-02-06,17.4
550941,22669,RED BABY BUNTING ,5,21-04-2011 15:46,2.95,17109.0,United Kingdom,2011-04-21,14.75
572528,22112,CHOCOLATE HOT WATER BOTTLE,1,24-10-2011 15:43,4.95,13176.0,United Kingdom,2011-10-24,4.95
549988,22084,PAPER CHAIN KIT EMPIRE,12,13-04-2011 16:43,2.95,14367.0,United Kingdom,2011-04-13,35.400000000000006
566281,23052,RECYCLED ACAPULCO MAT TURQUOISE,1,11-09-2011 14:15,8.25,12748.0,United Kingdom,2011-11-09,8.25
558814,23302,KNEELING MAT HOUSEWORK  DESIGN,1,04-07-2011 11:47,1.65,14049.0,United Kingdom,2011-04-07,1.65
556437,22661,CHARLOTTE BAG DOLLY GIRL DESIGN,10,10-06-2011 14:31,0.85,14077.0,United Kingdom,2011-10-06,8.5
548212,22551,PLASTERS IN TIN SPACEBOY,12,30-03-2011 09:12,1.65,12456.0,Switzerland,2011-03-30,19.799999999999997
577061,21791,VINTAGE HEADS AND TAILS CARD GAME ,12,17-11-2011 14:40,1.25,14911.0,EIRE,2011-11-17,15.0
536674,22964,3 PIECE SPACEBOY COOKIE CUTTER SET,1,02-12-2010 12:16,2.1,15923.0,United Kingdom,2010-02-12,2.1
581219,23650,SET 10 CARDS FILIGREE BAUBLE 16961,1,08-12-2011 09:28,2.49,,United Kingdom,2011-08-12,2.49
578289,23035,DRAWER KNOB CERAMIC IVORY,4,23-11-2011 14:07,1.45,17841.0,United Kingdom,2011-11-23,5.8
573149,20933,YELLOW POT PLANT CANDLE,2,27-10-2011 19:56,2.95,16438.0,United Kingdom,2011-10-27,5.9
546498,22913,RED COAT RACK PARIS FASHION,1,14-03-2011 11:44,4.95,15493.0,United Kingdom,2011-03-14,4.95
581217,85152,HAND OVER THE CHOCOLATE   SIGN ,2,08-12-2011 09:20,4.13,,United Kingdom,2011-08-12,8.26
565218,22028,PENNY FARTHING BIRTHDAY CARD,12,01-09-2011 17:45,0.42,12739.0,United Arab Emirates,2011-01-09,5.04
576559,21733,RED HANGING HEART T-LIGHT HOLDER,2,15-11-2011 13:19,2.95,14711.0,United Kingdom,2011-11-15,5.9
545543,22423,REGENCY CAKESTAND 3 TIER,2,03-03-2011 14:43,12.75,13476.0,United Kingdom,2011-03-03,25.5
537781,22562,MONSTERS STENCIL CRAFT,1,08-12-2010 12:46,1.25,17341.0,United Kingdom,2010-08-12,1.25
564760,gift_0001_30,Dotcomgiftshop Gift Voucher 30.00,1,30-08-2011 10:47,25.0,,United Kingdom,2011-08-30,25.0
575607,21899,GARAGE KEY FOB,2,10-11-2011 12:37,1.63,14096.0,United Kingdom,2011-10-11,3.26
576893,21917,SET 12 KIDS  WHITE CHALK STICKS,24,17-11-2011 08:29,0.42,12481.0,Germany,2011-11-17,10.08
570715,21819,GLITTER CHRISTMAS STAR ,36,12-10-2011 10:23,0.39,18287.0,United Kingdom,2011-12-10,14.040000000000001
572549,22167, OVAL WALL MIRROR DIAMANTE ,1,24-10-2011 17:03,8.29,,United Kingdom,2011-10-24,8.29
538008,21122,SET/10 PINK POLKADOT PARTY CANDLES,24,09-12-2010 12:17,1.25,12683.0,France,2010-09-12,30.0
539437,22943,CHRISTMAS LIGHTS 10 VINTAGE BAUBLES,1,17-12-2010 14:54,11.02,,United Kingdom,2010-12-17,11.02
539462,22988,SOLDIERS EGG CUP ,24,19-12-2010 11:19,1.25,14032.0,United Kingdom,2010-12-19,30.0
549596,23155,KNICKERBOCKERGLORY MAGNET ASSORTED ,12,11-04-2011 11:06,0.83,14339.0,United Kingdom,2011-11-04,9.959999999999999
570479,23285,PINK VINTAGE SPOT BEAKER,5,10-10-2011 16:58,0.85,17589.0,United Kingdom,2011-10-10,4.25
541497,22029,SPACEBOY BIRTHDAY CARD,2,18-01-2011 15:19,0.83,,United Kingdom,2011-01-18,1.66
567295,21926,RED/CREAM STRIPE CUSHION COVER ,40,19-09-2011 12:16,1.06,17490.0,United Kingdom,2011-09-19,42.400000000000006
554682,22912,YELLOW COAT RACK PARIS FASHION,1,25-05-2011 16:08,4.95,14085.0,United Kingdom,2011-05-25,4.95
555564,23006,TRAVEL CARD WALLET FLOWER MEADOW,24,05-06-2011 15:01,0.42,15005.0,United Kingdom,2011-05-06,10.08
539728,22282,12 EGG HOUSE PAINTED WOOD,2,21-12-2010 14:26,12.75,16270.0,United Kingdom,2010-12-21,25.5
549276,21930,JUMBO STORAGE BAG SKULLS,5,07-04-2011 13:11,2.08,16745.0,United Kingdom,2011-07-04,10.4
544678,21167,WHITE SAGE INCENSE,25,22-02-2011 16:15,0.21,13077.0,United Kingdom,2011-02-22,5.25
557301,22835,HOT WATER BOTTLE I AM SO POORLY,4,19-06-2011 14:08,4.65,15373.0,United Kingdom,2011-06-19,18.6
548868,23184,BULL DOG BOTTLE OPENER,4,04-04-2011 14:28,4.95,13015.0,United Kingdom,2011-04-04,19.8
538250,22064,PINK DOUGHNUT TRINKET POT ,2,10-12-2010 12:20,1.65,18118.0,United Kingdom,2010-10-12,3.3
552839,22692,DOORMAT WELCOME TO OUR HOME,2,11-05-2011 14:25,7.95,14367.0,United Kingdom,2011-11-05,15.9
541830,22166,WALL MIRROR RECTANGLE DIAMANTE PINK,1,21-01-2011 17:09,7.46,,United Kingdom,2011-01-21,7.46
581585,84879,ASSORTED COLOUR BIRD ORNAMENT,16,09-12-2011 12:31,1.69,15804.0,United Kingdom,2011-09-12,27.04
555327,21672,WHITE SPOT RED CERAMIC DRAWER KNOB,4,02-06-2011 11:03,2.46,,United Kingdom,2011-02-06,9.84
543180,22242,5 HOOK HANGER MAGIC TOADSTOOL,12,04-02-2011 10:38,1.65,12410.0,Switzerland,2011-04-02,19.799999999999997
557305,20970,PINK FLORAL FELTCRAFT SHOULDER BAG,1,19-06-2011 14:42,3.75,13568.0,United Kingdom,2011-06-19,3.75
579261,23200,JUMBO BAG PEARS,10,29-11-2011 09:10,2.08,13429.0,United Kingdom,2011-11-29,20.8
561219,21992,VINTAGE PAISLEY STATIONERY SET,12,26-07-2011 08:51,1.25,18180.0,United Kingdom,2011-07-26,15.0
541966,84789,ENCHANTED BIRD PLANT CAGE,16,24-01-2011 13:35,2.95,13854.0,United Kingdom,2011-01-24,47.2
575607,22646,CERAMIC STRAWBERRY CAKE MONEY BANK,1,10-11-2011 12:37,3.29,14096.0,United Kingdom,2011-10-11,3.29
577545,37413,ICON MUG REVOLUTIONARY,6,20-11-2011 14:43,0.39,16931.0,United Kingdom,2011-11-20,2.34
574481,23353,6 GIFT TAGS VINTAGE CHRISTMAS ,2,04-11-2011 12:45,0.83,18022.0,United Kingdom,2011-04-11,1.66
554637,79321,CHILLI LIGHTS,4,25-05-2011 11:58,5.75,14688.0,United Kingdom,2011-05-25,23.0
581217,23581,JUMBO BAG PAISLEY PARK,1,08-12-2011 09:20,4.13,,United Kingdom,2011-08-12,4.13
570258,21942,SKULLS DESIGN FLANNEL,1,10-10-2011 09:56,1.63,,United Kingdom,2011-10-10,1.63
549728,84991,60 TEATIME FAIRY CAKE CASES,3,11-04-2011 16:15,0.55,17799.0,United Kingdom,2011-11-04,1.6500000000000001
553922,22089,PAPER BUNTING VINTAGE PAISLEY,6,20-05-2011 09:24,2.95,17926.0,United Kingdom,2011-05-20,17.700000000000003
581404,21908,CHOCOLATE THIS WAY METAL SIGN,6,08-12-2011 13:47,2.1,13680.0,United Kingdom,2011-08-12,12.600000000000001
551398,84987,SET OF 36 TEATIME PAPER DOILIES,12,28-04-2011 13:09,1.45,12417.0,Spain,2011-04-28,17.4
561399,23240,SET OF 4 KNICK KNACK TINS DOILEY ,48,27-07-2011 10:53,3.75,15125.0,United Kingdom,2011-07-27,180.0
548331,21754,HOME BUILDING BLOCK WORD,3,30-03-2011 13:28,5.95,13047.0,United Kingdom,2011-03-30,17.85
548405,22138,BAKING SET 9 PIECE RETROSPOT ,3,31-03-2011 09:48,4.95,17088.0,United Kingdom,2011-03-31,14.850000000000001
537765,21232,STRAWBERRY CERAMIC TRINKET BOX,1,08-12-2010 12:08,1.25,14606.0,United Kingdom,2010-08-12,1.25
557734,22437,SET OF 9 BLACK SKULL BALLOONS,40,22-06-2011 11:20,0.85,12684.0,France,2011-06-22,34.0
580115,23220,REINDEER HEART DECORATION GOLD,1,01-12-2011 16:22,1.63,,United Kingdom,2011-01-12,1.63
544162,84755,COLOUR GLASS T-LIGHT HOLDER HANGING,8,16-02-2011 13:00,0.65,14959.0,United Kingdom,2011-02-16,5.2
580612,20713,JUMBO BAG OWLS,10,05-12-2011 11:58,4.13,,United Kingdom,2011-05-12,41.3
549235,22148,EASTER CRAFT 4 CHICKS ,1,07-04-2011 11:16,1.95,15530.0,United Kingdom,2011-07-04,1.95
576864,22564,ALPHABET STENCIL CRAFT,1,16-11-2011 16:06,1.25,12748.0,United Kingdom,2011-11-16,1.25
539321,21232,STRAWBERRY CERAMIC TRINKET BOX,1,16-12-2010 19:19,1.25,14723.0,United Kingdom,2010-12-16,1.25
562166,20725,LUNCH BAG RED RETROSPOT,10,03-08-2011 12:10,1.65,13209.0,United Kingdom,2011-03-08,16.5
566558,21929,JUMBO BAG PINK VINTAGE PAISLEY,5,13-09-2011 11:51,2.08,15311.0,United Kingdom,2011-09-13,10.4
570906,22940,FELTCRAFT CHRISTMAS FAIRY,12,13-10-2011 10:54,3.75,14537.0,United Kingdom,2011-10-13,45.0
556536,22847,BREAD BIN DINER STYLE IVORY,1,13-06-2011 12:36,16.95,17795.0,United Kingdom,2011-06-13,16.95
545853,22188,BLACK HEART CARD HOLDER,1,07-03-2011 13:50,3.95,16517.0,United Kingdom,2011-07-03,3.95
545408,22975,SPACEBOY CHILDRENS EGG CUP,12,02-03-2011 12:10,1.25,15067.0,United Kingdom,2011-02-03,15.0
581425,23243,SET OF TEA COFFEE SUGAR TINS PANTRY,1,08-12-2011 15:31,4.95,14796.0,United Kingdom,2011-08-12,4.95
541136,79321,CHILLI LIGHTS,24,14-01-2011 10:39,4.25,18229.0,United Kingdom,2011-01-14,102.0
538071,21774,DECORATIVE CATS BATHROOM BOTTLE,1,09-12-2010 14:09,2.51,,United Kingdom,2010-09-12,2.51
566399,22189,CREAM HEART CARD HOLDER,4,12-09-2011 13:11,3.95,16141.0,United Kingdom,2011-12-09,15.8
578993,23354,6 GIFT TAGS 50'S CHRISTMAS ,1,27-11-2011 15:38,0.83,15987.0,United Kingdom,2011-11-27,0.83
549048,22084,PAPER CHAIN KIT EMPIRE,19,06-04-2011 10:14,2.95,17811.0,United Kingdom,2011-06-04,56.050000000000004
575337,90119,METALIC LEAVES BAG CHARMS,1,09-11-2011 14:11,2.55,17867.0,United Kingdom,2011-09-11,2.55
575753,20996,JAZZ HEARTS ADDRESS BOOK,24,11-11-2011 10:41,0.19,17841.0,United Kingdom,2011-11-11,4.5600000000000005
556085,22094,RED RETROSPOT TISSUE BOX,1,08-06-2011 15:23,2.46,,United Kingdom,2011-08-06,2.46
580469,23552,BICYCLE PUNCTURE REPAIR KIT ,1,04-12-2011 12:32,2.08,14583.0,United Kingdom,2011-04-12,2.08
576329,23339,EGG FRYING PAN BLUE ,1,14-11-2011 15:22,4.13,,United Kingdom,2011-11-14,4.13
557769,23031,DRAWER KNOB CRACKLE GLAZE PINK,6,22-06-2011 14:38,1.65,16626.0,United Kingdom,2011-06-22,9.899999999999999
571192,23333,IVORY WICKER HEART MEDIUM,12,14-10-2011 11:55,1.25,13050.0,United Kingdom,2011-10-14,15.0
566235,23138,SINGLE WIRE HOOK IVORY HEART,12,11-09-2011 11:17,1.45,15636.0,United Kingdom,2011-11-09,17.4
563613,23296,SET OF 6 TEA TIME BAKING CASES,16,18-08-2011 08:49,1.25,12688.0,Israel,2011-08-18,20.0
549916,22423,REGENCY CAKESTAND 3 TIER,1,13-04-2011 09:39,12.75,13717.0,United Kingdom,2011-04-13,12.75
542891,20914,SET/5 RED RETROSPOT LID GLASS BOWLS,32,01-02-2011 13:26,2.55,16705.0,United Kingdom,2011-01-02,81.6
554940,23108,SET OF 10 LED DOLLY LIGHTS,2,27-05-2011 13:49,6.25,12494.0,France,2011-05-27,12.5
564803,23221,REINDEER HEART DECORATION SILVER,24,30-08-2011 11:32,0.83,13870.0,United Kingdom,2011-08-30,19.919999999999998
551529,22748,POPPY'S PLAYHOUSE KITCHEN,6,01-05-2011 13:18,2.1,12524.0,Germany,2011-01-05,12.600000000000001
546008,82551,LAUNDRY 15C METAL SIGN,1,08-03-2011 15:43,2.46,,United Kingdom,2011-08-03,2.46
569692,23206,LUNCH BAG APPLE DESIGN,20,05-10-2011 15:17,1.65,14389.0,United Kingdom,2011-05-10,33.0
563093,21933,PINK VINTAGE PAISLEY PICNIC BAG,1,11-08-2011 17:28,2.46,,United Kingdom,2011-11-08,2.46
550899,22417,PACK OF 60 SPACEBOY CAKE CASES,24,21-04-2011 12:07,0.55,13505.0,Switzerland,2011-04-21,13.200000000000001
548014,21394,RED POLKADOT BEAKER ,48,29-03-2011 11:29,0.39,17719.0,United Kingdom,2011-03-29,18.72
577768,22153,ANGEL DECORATION STARS ON DRESS,1,21-11-2011 15:18,0.83,,United Kingdom,2011-11-21,0.83
581514,22721,SET OF 3 CAKE TINS SKETCHBOOK,4,09-12-2011 11:20,1.95,17754.0,United Kingdom,2011-09-12,7.8
574063,21619,4 VANILLA BOTANICAL CANDLES,1,02-11-2011 14:31,1.25,13271.0,United Kingdom,2011-02-11,1.25
554083,22998,TRAVEL CARD WALLET KEEP CALM,6,22-05-2011 11:51,0.42,18125.0,United Kingdom,2011-05-22,2.52
541139,21164,HOME SWEET HOME METAL SIGN ,6,14-01-2011 11:05,2.95,15213.0,United Kingdom,2011-01-14,17.700000000000003
559163,23166,MEDIUM CERAMIC TOP STORAGE JAR,1,06-07-2011 16:33,2.46,,United Kingdom,2011-06-07,2.46
559338,21467,CHERRY CROCHET FOOD COVER,2,07-07-2011 16:30,3.29,,United Kingdom,2011-07-07,6.58
536982,84380,SET OF 3 BUTTERFLY COOKIE CUTTERS,13,03-12-2010 14:27,3.36,,United Kingdom,2010-03-12,43.68
547883,21390,FILIGRIS HEART WITH BUTTERFLY,24,28-03-2011 08:40,1.25,14755.0,United Kingdom,2011-03-28,30.0
550651,21175,GIN + TONIC DIET METAL SIGN,1,19-04-2011 16:52,2.55,15436.0,United Kingdom,2011-04-19,2.55
546644,22426,ENAMEL WASH BOWL CREAM,16,15-03-2011 13:28,2.95,15932.0,United Kingdom,2011-03-15,47.2
575177,21098,CHRISTMAS TOILET ROLL,1,08-11-2011 18:41,2.46,,United Kingdom,2011-08-11,2.46
545690,22114,HOT WATER BOTTLE TEA AND SYMPATHY,2,06-03-2011 12:46,3.95,13263.0,United Kingdom,2011-06-03,7.9
547350,22985,"WRAP, BILLBOARD FONTS DESIGN",25,22-03-2011 12:05,0.42,17272.0,United Kingdom,2011-03-22,10.5
562933,22557,PLASTERS IN TIN VINTAGE PAISLEY ,1,10-08-2011 16:51,3.29,,United Kingdom,2011-10-08,3.29
539437,21455,PAINTED YELLOW WOODEN DAISY,1,17-12-2010 14:54,1.66,,United Kingdom,2010-12-17,1.66
550332,22161,HEART DECORATION RUSTIC HANGING ,1,17-04-2011 13:53,0.65,13474.0,United Kingdom,2011-04-17,0.65
558622,21643,ASSORTED TUTTI FRUTTI MIRROR,12,30-06-2011 16:51,1.25,16357.0,United Kingdom,2011-06-30,15.0
573407,22383,LUNCH BAG SUKI DESIGN ,1,30-10-2011 15:58,1.65,18067.0,United Kingdom,2011-10-30,1.65
544214,21078,SET/20 STRAWBERRY PAPER NAPKINS ,4,17-02-2011 11:19,2.46,,United Kingdom,2011-02-17,9.84
543650,22041,"RECORD FRAME 7"" SINGLE SIZE ",36,11-02-2011 09:17,2.55,12980.0,United Kingdom,2011-11-02,91.8
568147,22866,HAND WARMER SCOTTY DOG DESIGN,4,25-09-2011 11:34,2.1,15044.0,United Kingdom,2011-09-25,8.4
569847,21791,VINTAGE HEADS AND TAILS CARD GAME ,12,06-10-2011 13:45,1.25,14116.0,United Kingdom,2011-06-10,15.0
578302,23243,SET OF TEA COFFEE SUGAR TINS PANTRY,4,23-11-2011 15:23,4.95,16057.0,United Kingdom,2011-11-23,19.8
543382,21506,"FANCY FONT BIRTHDAY CARD, ",12,07-02-2011 16:21,0.42,14030.0,United Kingdom,2011-07-02,5.04
546364,22076,6 RIBBONS EMPIRE  ,1,11-03-2011 11:33,1.65,,United Kingdom,2011-11-03,1.65
572913,22732,3D VINTAGE CHRISTMAS STICKERS ,4,26-10-2011 16:21,1.25,15993.0,United Kingdom,2011-10-26,5.0
555150,22244,3 HOOK HANGER MAGIC GARDEN,1,31-05-2011 15:53,4.13,,United Kingdom,2011-05-31,4.13
569897,22083,PAPER CHAIN KIT RETROSPOT,1,06-10-2011 16:01,2.95,17813.0,United Kingdom,2011-06-10,2.95
556459,84380,SET OF 3 BUTTERFLY COOKIE CUTTERS,1,10-06-2011 17:25,2.46,,United Kingdom,2011-10-06,2.46
577104,23581,JUMBO BAG PAISLEY PARK,10,17-11-2011 17:13,2.08,12747.0,United Kingdom,2011-11-17,20.8
544070,84378,SET OF 3 HEART COOKIE CUTTERS,12,15-02-2011 14:19,1.25,15370.0,United Kingdom,2011-02-15,15.0
544776,21989,PACK OF 20 SKULL PAPER NAPKINS,3,23-02-2011 11:39,1.63,,United Kingdom,2011-02-23,4.89
538566,22405,MONEY BOX POCKET MONEY DESIGN,1,13-12-2010 11:21,2.51,,United Kingdom,2010-12-13,2.51
559680,23161,REGENCY CAKE FORK,12,11-07-2011 14:47,1.25,12717.0,Greece,2011-11-07,15.0
578935,22315,200 RED + WHITE BENDY STRAWS,2,27-11-2011 12:52,1.25,15351.0,United Kingdom,2011-11-27,2.5
572076,22960,JAM MAKING SET WITH JARS,6,20-10-2011 14:01,4.25,13761.0,United Kingdom,2011-10-20,25.5
544664,20971,PINK BLUE FELT CRAFT TRINKET BOX,12,22-02-2011 14:55,1.25,16045.0,United Kingdom,2011-02-22,15.0
565091,22680,FRENCH BLUE METAL DOOR SIGN 5,10,01-09-2011 10:28,1.25,16011.0,United Kingdom,2011-01-09,12.5
555110,22753,SMALL YELLOW BABUSHKA NOTEBOOK ,1,31-05-2011 14:34,0.85,17841.0,United Kingdom,2011-05-31,0.85
567668,23075,PARLOUR CERAMIC WALL HOOK,2,21-09-2011 15:29,8.29,,United Kingdom,2011-09-21,16.58
572307,22113,GREY HEART HOT WATER BOTTLE,6,23-10-2011 15:23,4.25,16905.0,United Kingdom,2011-10-23,25.5
539311,22467,GUMBALL COAT RACK,36,16-12-2010 17:53,2.1,14643.0,United Kingdom,2010-12-16,75.60000000000001
570799,23082,SET 6 PAPER TABLE LANTERN HEARTS ,6,12-10-2011 12:31,3.75,16203.0,United Kingdom,2011-12-10,22.5
574856,21218,RED SPOTTY BISCUIT TIN,3,07-11-2011 12:06,8.29,,United Kingdom,2011-07-11,24.869999999999997
561020,20868,SILVER FABRIC MIRROR,30,22-07-2011 17:21,0.39,13563.0,United Kingdom,2011-07-22,11.700000000000001
536390,22963,JAM JAR WITH GREEN LID,48,01-12-2010 10:19,0.72,17511.0,United Kingdom,2010-01-12,34.56
575728,22797,CHEST OF DRAWERS GINGHAM HEART ,1,10-11-2011 19:40,16.95,14911.0,EIRE,2011-10-11,16.95
548310,22779,WOODEN OWLS LIGHT GARLAND ,1,30-03-2011 12:04,4.25,,United Kingdom,2011-03-30,4.25
557328,23201,JUMBO BAG ALPHABET,1,20-06-2011 09:53,2.08,14646.0,Netherlands,2011-06-20,2.08
573585,84596G,SMALL CHOCOLATES PINK BOWL,1,31-10-2011 14:41,0.83,,United Kingdom,2011-10-31,0.83
547100,21929,JUMBO BAG PINK VINTAGE PAISLEY,20,21-03-2011 10:31,1.95,15615.0,United Kingdom,2011-03-21,39.0
563439,21240,BLUE POLKADOT CUP,7,16-08-2011 13:05,1.63,,United Kingdom,2011-08-16,11.41
538801,70006,LOVE HEART POCKET WARMER,30,14-12-2010 11:51,0.42,16083.0,United Kingdom,2010-12-14,12.6
539492,21279,VINTAGE KITCHEN PRINT FRUITS,1,20-12-2010 10:14,5.06,,United Kingdom,2010-12-20,5.06
536856,22699,ROSES REGENCY TEACUP AND SAUCER ,6,03-12-2010 10:26,2.95,13370.0,United Kingdom,2010-03-12,17.700000000000003
571017,23162,REGENCY TEA STRAINER,48,13-10-2011 12:17,3.29,15116.0,United Kingdom,2011-10-13,157.92000000000002
547860,21041,RED RETROSPOT OVEN GLOVE DOUBLE,1,27-03-2011 12:21,2.95,17625.0,United Kingdom,2011-03-27,2.95
550989,23206,LUNCH BAG APPLE DESIGN,10,21-04-2011 18:22,1.65,13969.0,United Kingdom,2011-04-21,16.5
568781,23162,REGENCY TEA STRAINER,48,29-09-2011 08:28,3.29,14952.0,United Kingdom,2011-09-29,157.92000000000002
574667,23568,EGG CUP HENRIETTA HEN CREAM ,12,06-11-2011 12:12,1.25,15514.0,United Kingdom,2011-06-11,15.0
580514,21790,VINTAGE SNAP CARDS,1,04-12-2011 14:01,0.85,16905.0,United Kingdom,2011-04-12,0.85
563931,21531,RED RETROSPOT SUGAR JAM BOWL,6,21-08-2011 15:49,2.55,14895.0,United Kingdom,2011-08-21,15.299999999999999
565588,22382,LUNCH BAG SPACEBOY DESIGN ,2,05-09-2011 13:50,1.65,16918.0,United Kingdom,2011-05-09,3.3
561113,23191,BUNDLE OF 3 RETRO NOTE BOOKS,3,25-07-2011 12:09,1.65,17841.0,United Kingdom,2011-07-25,4.949999999999999
553931,71053,WHITE METAL LANTERN,8,20-05-2011 10:27,3.75,14911.0,EIRE,2011-05-20,30.0
579777,21900,"KEY FOB , SHED",1,30-11-2011 15:13,1.63,,United Kingdom,2011-11-30,1.63
570420,21155,RED RETROSPOT PEG BAG,1,10-10-2011 13:33,2.55,17841.0,United Kingdom,2011-10-10,2.55
549185,22969,HOMEMADE JAM SCENTED CANDLES,24,07-04-2011 09:35,1.45,18272.0,United Kingdom,2011-07-04,34.8
548178,47566,PARTY BUNTING,12,29-03-2011 14:35,4.95,14367.0,United Kingdom,2011-03-29,59.400000000000006
578922,23202,JUMBO BAG VINTAGE LEAF,3,27-11-2011 12:00,2.08,17236.0,United Kingdom,2011-11-27,6.24
565199,21623,VINTAGE UNION JACK MEMOBOARD,4,01-09-2011 16:30,9.95,18171.0,United Kingdom,2011-01-09,39.8
567901,48184,DOORMAT ENGLISH ROSE ,1,22-09-2011 16:28,15.79,,United Kingdom,2011-09-22,15.79
571464,21770,OPEN CLOSED METAL SIGN,1,17-10-2011 14:28,4.95,14805.0,United Kingdom,2011-10-17,4.95
543306,22493,PAINT YOUR OWN CANVAS SET,2,07-02-2011 11:56,1.65,16686.0,United Kingdom,2011-07-02,3.3
539729,84562A,PINK/WHITE RIBBED MELAMINE JUG,1,21-12-2010 14:29,7.95,,United Kingdom,2010-12-21,7.95
539744,22845,VINTAGE CREAM CAT FOOD CONTAINER,1,21-12-2010 15:21,12.72,,United Kingdom,2010-12-21,12.72
581219,22581,WOOD STOCKING CHRISTMAS SCANDISPOT,10,08-12-2011 09:28,0.83,,United Kingdom,2011-08-12,8.299999999999999
561917,21930,JUMBO STORAGE BAG SKULLS,1,01-08-2011 11:57,2.08,16904.0,United Kingdom,2011-01-08,2.08
558241,23321,SMALL WHITE HEART OF WICKER,12,27-06-2011 15:28,1.65,15932.0,United Kingdom,2011-06-27,19.799999999999997
552302,84692,BOX OF 24 COCKTAIL PARASOLS,2,08-05-2011 14:59,0.42,14606.0,United Kingdom,2011-08-05,0.84
544772,DOT,DOTCOM POSTAGE,1,23-02-2011 11:12,161.04,,United Kingdom,2011-02-23,161.04
541262,22831,WHITE BROCANTE SOAP DISH,1,16-01-2011 15:50,2.95,18069.0,United Kingdom,2011-01-16,2.95
563061,23312,VINTAGE CHRISTMAS GIFT SACK,8,11-08-2011 15:25,4.15,13588.0,United Kingdom,2011-11-08,33.2
572552,84375,SET OF 20 KIDS COOKIE CUTTERS,3,24-10-2011 17:07,4.13,14096.0,United Kingdom,2011-10-24,12.39
560186,22361,GLASS JAR DAISY FRESH COTTON WOOL,1,15-07-2011 11:57,2.95,17266.0,United Kingdom,2011-07-15,2.95
548726,84879,ASSORTED COLOUR BIRD ORNAMENT,32,04-04-2011 09:38,1.69,13767.0,United Kingdom,2011-04-04,54.08
540499,22423,REGENCY CAKESTAND 3 TIER,3,09-01-2011 10:21,12.75,16923.0,United Kingdom,2011-09-01,38.25
555945,23201,JUMBO BAG ALPHABET,10,08-06-2011 10:36,2.08,17409.0,United Kingdom,2011-08-06,20.8
537823,35598D,PINK/WHITE CHRISTMAS TREE 60CM,2,08-12-2010 14:25,2.51,,United Kingdom,2010-08-12,5.02
560841,82600,NO SINGING METAL SIGN,12,21-07-2011 12:25,1.85,14298.0,United Kingdom,2011-07-21,22.200000000000003
553162,82551,LAUNDRY 15C METAL SIGN,1,13-05-2011 15:53,2.46,,United Kingdom,2011-05-13,2.46
543354,22321,BIRD DECORATION RED RETROSPOT,12,07-02-2011 13:50,0.85,13458.0,United Kingdom,2011-07-02,10.2
574501,22596,CHRISTMAS STAR WISH LIST CHALKBOARD,12,04-11-2011 13:15,1.25,12577.0,France,2011-04-11,15.0
536938,21479,WHITE SKULL HOT WATER BOTTLE ,72,03-12-2010 12:05,3.39,14680.0,United Kingdom,2010-03-12,244.08
555477,23053,RECYCLED ACAPULCO MAT PINK,2,03-06-2011 12:26,8.25,12359.0,Cyprus,2011-03-06,16.5
537603,21651,HANGING GLASS ETCHED TEALIGHT,12,07-12-2010 12:49,1.65,14673.0,United Kingdom,2010-07-12,19.799999999999997
572301,23206,LUNCH BAG APPLE DESIGN,3,23-10-2011 14:41,1.65,16794.0,United Kingdom,2011-10-23,4.949999999999999
578211,82616B,FRAPPUCINO SCARF KNITTING KIT,1,23-11-2011 11:47,1.25,12748.0,United Kingdom,2011-11-23,1.25
538146,37501,TEA TIME TEA SET IN GIFT BOX,3,09-12-2010 16:10,6.95,15596.0,United Kingdom,2010-09-12,20.85
559938,23174,REGENCY SUGAR BOWL GREEN,1,14-07-2011 10:15,4.15,17315.0,United Kingdom,2011-07-14,4.15
568952,21506,"FANCY FONT BIRTHDAY CARD, ",12,29-09-2011 15:29,0.42,14305.0,United Kingdom,2011-09-29,5.04
558887,84380,SET OF 3 BUTTERFLY COOKIE CUTTERS,12,04-07-2011 15:26,1.25,18265.0,United Kingdom,2011-04-07,15.0
545475,22635,CHILDS BREAKFAST SET DOLLY GIRL ,24,03-03-2011 10:59,8.5,12415.0,Australia,2011-03-03,204.0
565847,85039a,SET/4 RED MINI ROSE CANDLE IN BOWL,2,07-09-2011 12:44,3.29,,United Kingdom,2011-07-09,6.58
550474,82494L,WOODEN FRAME ANTIQUE WHITE ,1,18-04-2011 13:58,2.95,,United Kingdom,2011-04-18,2.95
563735,23005,TRAVEL CARD WALLET I LOVE LONDON,48,18-08-2011 18:15,0.42,16743.0,United Kingdom,2011-08-18,20.16
579694,23300,GARDENERS KNEELING PAD CUP OF TEA ,6,30-11-2011 14:11,3.29,,United Kingdom,2011-11-30,19.740000000000002
551325,22900, SET 2 TEA TOWELS I LOVE LONDON ,2,27-04-2011 15:49,3.25,,United Kingdom,2011-04-27,6.5
561783,22984,CARD GINGHAM ROSE ,12,29-07-2011 12:50,0.42,16062.0,United Kingdom,2011-07-29,5.04
579106,22625,RED KITCHEN SCALES,2,28-11-2011 11:42,8.5,16705.0,United Kingdom,2011-11-28,17.0
546656,82494l,WOODEN FRAME ANTIQUE WHITE ,1,15-03-2011 14:19,8.29,,United Kingdom,2011-03-15,8.29
559493,85099B,JUMBO BAG RED RETROSPOT,3,08-07-2011 13:53,4.13,,United Kingdom,2011-08-07,12.39
557854,22693,GROW A FLYTRAP OR SUNFLOWER IN TIN,48,23-06-2011 11:38,1.25,13268.0,United Kingdom,2011-06-23,60.0
552337,22629,SPACEBOY LUNCH BOX ,24,09-05-2011 11:34,1.95,12621.0,Germany,2011-09-05,46.8
574170,22947,WOODEN ADVENT CALENDAR RED,2,03-11-2011 11:43,7.95,16221.0,United Kingdom,2011-03-11,15.9
567912,23206,LUNCH BAG APPLE DESIGN,5,22-09-2011 17:07,1.65,15555.0,United Kingdom,2011-09-22,8.25
553229,82484,WOOD BLACK BOARD ANT WHITE FINISH,4,16-05-2011 10:50,7.95,15039.0,United Kingdom,2011-05-16,31.8
567372,23202,JUMBO BAG VINTAGE LEAF,10,20-09-2011 09:24,2.08,14191.0,United Kingdom,2011-09-20,20.8
570187,22717,CARD DOG AND BALL ,1,07-10-2011 15:09,0.83,,United Kingdom,2011-07-10,0.83
544191,47566,PARTY BUNTING,12,16-02-2011 16:57,4.95,13089.0,United Kingdom,2011-02-16,59.400000000000006
538877,21240,BLUE POLKADOT CUP,1,14-12-2010 15:29,2.51,,United Kingdom,2010-12-14,2.51
557938,85015,SET OF 12  VINTAGE POSTCARD SET,6,23-06-2011 15:35,2.46,,United Kingdom,2011-06-23,14.76
555979,23206,LUNCH BAG APPLE DESIGN,2,08-06-2011 11:18,1.65,15039.0,United Kingdom,2011-08-06,3.3
572720,21823,PAINTED METAL HEART WITH HOLLY BELL,48,25-10-2011 15:04,0.39,13978.0,United Kingdom,2011-10-25,18.72
558777,22279,POCKET BAG BLUE PAISLEY RED SPOT,1,04-07-2011 10:23,0.83,,United Kingdom,2011-04-07,0.83
541516,21030,SPACE CADET RED,1,18-01-2011 17:34,0.83,,United Kingdom,2011-01-18,0.83
567667,85095,THREE CANVAS LUGGAGE TAGS,1,21-09-2011 15:24,4.13,,United Kingdom,2011-09-21,4.13
552978,21937,STRAWBERRY   PICNIC BAG,50,12-05-2011 14:46,2.55,12590.0,Germany,2011-12-05,127.49999999999999
546755,22691,DOORMAT WELCOME SUNRISE,2,16-03-2011 13:29,7.95,12502.0,Spain,2011-03-16,15.9
546121,20828,GLITTER BUTTERFLY CLIPS,3,09-03-2011 14:30,2.55,14085.0,United Kingdom,2011-09-03,7.6499999999999995
575176,22355,CHARLOTTE BAG SUKI DESIGN,1,08-11-2011 18:29,1.63,,United Kingdom,2011-08-11,1.63
567183,22197,POPCORN HOLDER,40,18-09-2011 15:33,0.85,14769.0,United Kingdom,2011-09-18,34.0
563718,20712,JUMBO BAG WOODLAND ANIMALS,20,18-08-2011 16:18,2.08,15144.0,United Kingdom,2011-08-18,41.6
570214,84077,WORLD WAR 2 GLIDERS ASSTD DESIGNS,96,09-10-2011 11:50,0.29,12748.0,United Kingdom,2011-09-10,27.839999999999996
572930,22403,MAGNETS PACK OF 4 VINTAGE LABELS ,12,27-10-2011 10:01,0.39,17613.0,United Kingdom,2011-10-27,4.68
561914,20724,RED RETROSPOT CHARLOTTE BAG,10,01-08-2011 11:13,0.85,17676.0,United Kingdom,2011-01-08,8.5
556486,85212,MINI PAINTED GARDEN DECORATION ,24,12-06-2011 13:22,0.29,17422.0,United Kingdom,2011-12-06,6.959999999999999
547794,85215,ASSORTED CHEESE FRIDGE MAGNETS,6,25-03-2011 12:13,0.65,14085.0,United Kingdom,2011-03-25,3.9000000000000004
572096,22944,CHRISTMAS METAL POSTCARD WITH BELLS,5,20-10-2011 15:20,0.39,16813.0,United Kingdom,2011-10-20,1.9500000000000002
550911,23010,CIRCUS PARADE BABY GIFT SET,1,21-04-2011 13:11,16.95,12354.0,Spain,2011-04-21,16.95
580983,21733,RED HANGING HEART T-LIGHT HOLDER,1,06-12-2011 16:26,5.79,,United Kingdom,2011-06-12,5.79
561514,21916,SET 12 RETRO WHITE CHALK STICKS,24,27-07-2011 15:14,0.42,14331.0,United Kingdom,2011-07-27,10.08
548169,22384,LUNCH BAG PINK POLKADOT,20,29-03-2011 13:48,1.65,14680.0,United Kingdom,2011-03-29,33.0
558631,23209,LUNCH BAG DOILEY PATTERN ,2,30-06-2011 18:17,1.65,17921.0,United Kingdom,2011-06-30,3.3
550885,22993,SET OF 4 PANTRY JELLY MOULDS,12,21-04-2011 11:59,1.25,16185.0,United Kingdom,2011-04-21,15.0
542779,22699,ROSES REGENCY TEACUP AND SAUCER ,18,01-02-2011 09:36,2.95,17147.0,United Kingdom,2011-01-02,53.1
547396,21424,WOODLAND STORAGE BOX LARGE ,6,22-03-2011 16:54,6.63,,United Kingdom,2011-03-22,39.78
540242,21389,IVORY HANGING DECORATION  BIRD,24,05-01-2011 15:30,0.85,15046.0,United Kingdom,2011-05-01,20.4
558193,22779,WOODEN OWLS LIGHT GARLAND ,48,27-06-2011 12:25,3.37,16029.0,United Kingdom,2011-06-27,161.76
550193,21080,SET/20 RED RETROSPOT PAPER NAPKINS ,12,15-04-2011 09:27,0.85,13952.0,United Kingdom,2011-04-15,10.2
567024,21672,WHITE SPOT RED CERAMIC DRAWER KNOB,10,16-09-2011 11:23,2.46,,United Kingdom,2011-09-16,24.6
557267,21908,CHOCOLATE THIS WAY METAL SIGN,1,19-06-2011 11:23,2.1,16805.0,United Kingdom,2011-06-19,2.1
540239,15056N,EDWARDIAN PARASOL NATURAL,3,05-01-2011 14:48,5.95,12682.0,France,2011-05-01,17.85
578255,85039A,SET/4 RED MINI ROSE CANDLE IN BOWL,1,23-11-2011 12:58,1.65,14675.0,United Kingdom,2011-11-23,1.65
571442,23209,LUNCH BAG VINTAGE DOILY ,10,17-10-2011 13:39,1.65,17049.0,United Kingdom,2011-10-17,16.5
551995,22993,SET OF 4 PANTRY JELLY MOULDS,3,05-05-2011 15:42,2.46,,United Kingdom,2011-05-05,7.38
581217,23339,EGG FRYING PAN BLUE ,1,08-12-2011 09:20,4.13,,United Kingdom,2011-08-12,4.13
553061,21930,JUMBO STORAGE BAG SKULLS,1,13-05-2011 11:12,2.08,17238.0,United Kingdom,2011-05-13,2.08
557271,84755,COLOUR GLASS T-LIGHT HOLDER HANGING,32,19-06-2011 11:41,0.65,17769.0,United Kingdom,2011-06-19,20.8
561911,21666,RIDGED GLASS T-LIGHT HOLDER,12,01-08-2011 10:26,0.65,12534.0,Germany,2011-01-08,7.800000000000001
578022,22562,MONSTERS STENCIL CRAFT,1,22-11-2011 13:25,1.25,17371.0,United Kingdom,2011-11-22,1.25
557492,75172,PAINTED SEA SHELL METAL WINDCHIME,12,20-06-2011 15:08,0.79,13717.0,United Kingdom,2011-06-20,9.48
543979,84880,WHITE WIRE EGG HOLDER,1,14-02-2011 15:43,7.5,14606.0,United Kingdom,2011-02-14,7.5
540859,22569,FELTCRAFT CUSHION BUTTERFLY,1,12-01-2011 10:58,3.75,17965.0,United Kingdom,2011-12-01,3.75
549525,22244,3 HOOK HANGER MAGIC GARDEN,1,08-04-2011 15:44,4.13,,United Kingdom,2011-08-04,4.13
553156,22156,HEART DECORATION WITH PEARLS ,1,13-05-2011 14:58,0.85,17841.0,United Kingdom,2011-05-13,0.85
570257,22699,ROSES REGENCY TEACUP AND SAUCER ,12,10-10-2011 09:56,2.95,13767.0,United Kingdom,2011-10-10,35.400000000000006
558752,22297,HEART IVORY TRELLIS SMALL,3,03-07-2011 11:40,1.25,16931.0,United Kingdom,2011-03-07,3.75
579867,22955,36 FOIL STAR CAKE CASES ,12,30-11-2011 16:41,2.1,16265.0,United Kingdom,2011-11-30,25.200000000000003
576053,23308,SET OF 60 VINTAGE LEAF CAKE CASES ,2,13-11-2011 14:53,0.55,16726.0,United Kingdom,2011-11-13,1.1
560271,22367,CHILDRENS APRON SPACEBOY DESIGN,2,17-07-2011 14:51,1.95,16474.0,United Kingdom,2011-07-17,3.9
571039,21901,"KEY FOB , BACK DOOR ",4,13-10-2011 12:59,0.65,16121.0,United Kingdom,2011-10-13,2.6
566296,20728,LUNCH BAG CARS BLUE,1,11-09-2011 15:47,1.65,17841.0,United Kingdom,2011-11-09,1.65
557500,22029,SPACEBOY BIRTHDAY CARD,1,20-06-2011 15:27,0.83,,United Kingdom,2011-06-20,0.83
540681,84031A,CHARLIE+LOLA RED HOT WATER BOTTLE ,1,10-01-2011 16:25,4.21,,United Kingdom,2011-10-01,4.21
576652,22694,WICKER STAR ,5,16-11-2011 10:39,2.1,17198.0,United Kingdom,2011-11-16,10.5
540026,84032B,CHARLIE + LOLA RED HOT WATER BOTTLE,1,04-01-2011 13:25,3.36,,United Kingdom,2011-04-01,3.36
570224,22208,WOOD STAMP SET THANK YOU,6,09-10-2011 13:15,0.83,16931.0,United Kingdom,2011-09-10,4.9799999999999995
562528,22961,JAM MAKING SET PRINTED,12,05-08-2011 13:52,1.45,12610.0,Italy,2011-05-08,17.4
566426,21673,WHITE SPOT BLUE CERAMIC DRAWER KNOB,96,12-09-2011 14:23,1.25,17865.0,United Kingdom,2011-12-09,120.0
539453,22900, SET 2 TEA TOWELS I LOVE LONDON ,1,17-12-2010 17:08,5.91,,United Kingdom,2010-12-17,5.91
554542,22149,FELTCRAFT 6 FLOWER FRIENDS,6,25-05-2011 08:32,2.1,15194.0,United Kingdom,2011-05-25,12.600000000000001
581407,22118,JOY WOODEN BLOCK LETTERS,2,08-12-2011 13:59,1.25,13263.0,United Kingdom,2011-08-12,2.5
580077,23349,ROLL WRAP VINTAGE CHRISTMAS,24,01-12-2011 14:17,1.25,14262.0,United Kingdom,2011-01-12,30.0
554098,85049G,CHOCOLATE BOX RIBBONS ,2,22-05-2011 13:01,1.25,14769.0,United Kingdom,2011-05-22,2.5
565995,23298,SPOTTY BUNTING,2,08-09-2011 11:48,4.95,16076.0,United Kingdom,2011-08-09,9.9
561876,22637,PIGGY BANK RETROSPOT ,4,31-07-2011 12:08,2.55,14472.0,United Kingdom,2011-07-31,10.2
564087,23255,CHILDRENS CUTLERY CIRCUS PARADE,24,23-08-2011 09:38,4.15,,Hong Kong,2011-08-23,99.60000000000001
559698,22711,WRAP CIRCUS PARADE,25,11-07-2011 17:07,0.42,17589.0,United Kingdom,2011-11-07,10.5
566394,22147,FELTCRAFT BUTTERFLY HEARTS,12,12-09-2011 12:45,1.45,13650.0,United Kingdom,2011-12-09,17.4
549525,22136,LOVE HEART SOCK HANGER,1,08-04-2011 15:44,3.29,,United Kingdom,2011-08-04,3.29
571213,22470,HEART OF WICKER LARGE,6,14-10-2011 12:55,2.95,13995.0,United Kingdom,2011-10-14,17.700000000000003
540856,22727,ALARM CLOCK BAKELIKE RED ,4,12-01-2011 10:16,3.75,16655.0,United Kingdom,2011-12-01,15.0
537362,48173C,DOORMAT BLACK FLOCK ,1,06-12-2010 12:34,7.95,17596.0,United Kingdom,2010-06-12,7.95
552465,21524,DOORMAT SPOTTY HOME SWEET HOME,1,09-05-2011 15:17,7.95,16242.0,United Kingdom,2011-09-05,7.95
574544,23582,VINTAGE DOILY JUMBO BAG RED ,10,04-11-2011 14:49,2.08,17084.0,United Kingdom,2011-04-11,20.8
545081,22558,CLOTHES PEGS RETROSPOT PACK 24 ,12,28-02-2011 10:35,1.49,16057.0,United Kingdom,2011-02-28,17.88
571670,22553,PLASTERS IN TIN SKULLS,12,18-10-2011 13:12,1.65,12611.0,Italy,2011-10-18,19.799999999999997
564860,23103,JINGLE BELL HEART DECORATION,24,31-08-2011 10:06,1.65,17725.0,United Kingdom,2011-08-31,39.599999999999994
569398,22564,ALPHABET STENCIL CRAFT,48,04-10-2011 08:27,1.06,17381.0,United Kingdom,2011-04-10,50.88
544194,84946,ANTIQUE SILVER TEA GLASS ETCHED,72,17-02-2011 08:40,1.06,16839.0,United Kingdom,2011-02-17,76.32000000000001
577606,22057,CERAMIC PLATE STRAWBERRY DESIGN,12,21-11-2011 09:11,1.49,12462.0,Spain,2011-11-21,17.88
563368,20727,LUNCH BAG  BLACK SKULL.,10,16-08-2011 09:00,1.65,13995.0,United Kingdom,2011-08-16,16.5
555150,84637,KITCHEN FLOWER POTS WALL PLAQUE,1,31-05-2011 15:53,4.96,,United Kingdom,2011-05-31,4.96
552677,DOT,DOTCOM POSTAGE,1,10-05-2011 15:07,202.96,,United Kingdom,2011-10-05,202.96
571427,22436,12 COLOURED PARTY BALLOONS,48,17-10-2011 12:46,0.65,17205.0,United Kingdom,2011-10-17,31.200000000000003
557322,21871,SAVE THE PLANET MUG,36,20-06-2011 09:04,1.25,17444.0,Canada,2011-06-20,45.0
576054,20617,FIRST CLASS PASSPORT COVER ,1,13-11-2011 14:55,2.1,15787.0,United Kingdom,2011-11-13,2.1
549169,21034,REX CASH+CARRY JUMBO SHOPPER,3,06-04-2011 17:25,0.95,17906.0,United Kingdom,2011-06-04,2.8499999999999996
577080,23240,SET OF 4 KNICK KNACK TINS DOILY ,6,17-11-2011 15:24,4.15,17001.0,United Kingdom,2011-11-17,24.900000000000002
576321,22196,SMALL HEART MEASURING SPOONS,1,14-11-2011 14:59,0.85,14953.0,United Kingdom,2011-11-14,0.85
545682,23194,GYMKHANA TREASURE BOOK BOX,1,06-03-2011 11:39,2.25,14701.0,United Kingdom,2011-06-03,2.25
564732,22470,HEART OF WICKER LARGE,9,28-08-2011 13:08,2.95,16466.0,United Kingdom,2011-08-28,26.55
580833,21931,JUMBO STORAGE BAG SUKI,2,06-12-2011 11:41,2.08,16764.0,United Kingdom,2011-06-12,4.16
569527,22204,MILK PAN BLUE POLKADOT,1,04-10-2011 14:53,3.75,12512.0,Israel,2011-04-10,3.75
558620,22411,JUMBO SHOPPER VINTAGE RED PAISLEY,1,30-06-2011 16:39,2.08,15584.0,United Kingdom,2011-06-30,2.08
544569,84050,PINK HEART SHAPE EGG FRYING PAN,2,21-02-2011 12:58,1.65,16980.0,United Kingdom,2011-02-21,3.3
554101,20914,SET/5 RED RETROSPOT LID GLASS BOWLS,6,22-05-2011 13:29,2.95,13549.0,United Kingdom,2011-05-22,17.700000000000003
575138,20676,RED RETROSPOT BOWL,1,08-11-2011 15:24,2.46,,United Kingdom,2011-08-11,2.46
576837,23426,METAL SIGN DROP YOUR PANTS,3,16-11-2011 15:16,5.79,,United Kingdom,2011-11-16,17.37
575480,20679,EDWARDIAN PARASOL RED,3,09-11-2011 16:26,5.95,15594.0,United Kingdom,2011-09-11,17.85
568492,22596,CHRISTMAS STAR WISH LIST CHALKBOARD,12,27-09-2011 11:58,1.25,18278.0,United Kingdom,2011-09-27,15.0
555841,22355,CHARLOTTE BAG SUKI DESIGN,1,07-06-2011 12:47,0.85,14583.0,United Kingdom,2011-07-06,0.85
545226,22918,HERB MARKER PARSLEY,12,01-03-2011 09:33,0.65,12428.0,Finland,2011-01-03,7.800000000000001
581450,22993,SET OF 4 PANTRY JELLY MOULDS,2,08-12-2011 17:54,1.25,16794.0,United Kingdom,2011-08-12,2.5
556503,22478,BIRDHOUSE GARDEN MARKER ,10,13-06-2011 08:44,1.25,13517.0,United Kingdom,2011-06-13,12.5
565919,21629,SQUARE FLOOR CUSHION VINTAGE RED,1,07-09-2011 16:48,15.79,,United Kingdom,2011-07-09,15.79
577806,21429,RED GINGHAM ROSE JEWELLERY BOX,8,22-11-2011 08:20,1.95,12963.0,United Kingdom,2011-11-22,15.6
570239,22083,PAPER CHAIN KIT RETROSPOT,3,09-10-2011 15:04,2.95,16518.0,United Kingdom,2011-09-10,8.850000000000001
575145,21340,CLASSIC METAL BIRDCAGE PLANT HOLDER,2,08-11-2011 15:40,12.75,14116.0,United Kingdom,2011-08-11,25.5
576329,21558,SKULL LUNCH BOX WITH CUTLERY ,1,14-11-2011 15:22,4.96,,United Kingdom,2011-11-14,4.96
581492,90014A,SILVER M.O.P. ORBIT NECKLACE,1,09-12-2011 10:03,10.4,,United Kingdom,2011-09-12,10.4
541794,20712,JUMBO BAG WOODLAND ANIMALS,2,21-01-2011 13:21,1.95,17238.0,United Kingdom,2011-01-21,3.9
544077,21717,EASTER TIN BUCKET,6,15-02-2011 15:04,2.55,14825.0,United Kingdom,2011-02-15,15.299999999999999
555278,90214V,"LETTER ""V"" BLING KEY RING",1,01-06-2011 17:33,0.83,,United Kingdom,2011-01-06,0.83
537126,21125,SET 6 FOOTBALL CELEBRATION CANDLES,1,05-12-2010 12:13,1.25,18118.0,United Kingdom,2010-05-12,1.25
571300,22952,60 CAKE CASES VINTAGE CHRISTMAS,24,17-10-2011 08:56,0.55,14262.0,United Kingdom,2011-10-17,13.200000000000001
578074,22795,SWEETHEART RECIPE BOOK STAND,1,22-11-2011 16:06,6.75,17590.0,United Kingdom,2011-11-22,6.75
545078,22300,COFFEE MUG DOG + BALL DESIGN,1,28-02-2011 10:15,4.96,,United Kingdom,2011-02-28,4.96
539042,20713,JUMBO BAG OWLS,10,15-12-2010 15:37,1.95,15062.0,United Kingdom,2010-12-15,19.5
571281,22761,CHEST 7 DRAWER MA CAMPAGNE,3,16-10-2011 13:23,21.95,14088.0,United Kingdom,2011-10-16,65.85
547830,22766,PHOTO FRAME CORNICE,1,25-03-2011 15:50,5.79,,United Kingdom,2011-03-25,5.79
564187,82483,WOOD 2 DRAWER CABINET WHITE FINISH,2,23-08-2011 15:24,6.95,15005.0,United Kingdom,2011-08-23,13.9
563506,37449,CERAMIC CAKE STAND + HANGING CAKES,2,17-08-2011 09:48,9.95,17398.0,United Kingdom,2011-08-17,19.9
566434,23199,JUMBO BAG APPLES,2,12-09-2011 15:01,2.08,17090.0,United Kingdom,2011-12-09,4.16
575512,22821,GIFT BAG PSYCHEDELIC APPLES,12,10-11-2011 10:36,0.65,14121.0,United Kingdom,2011-10-11,7.800000000000001
575607,20707,CRAZY DAISY HEART DECORATION,1,10-11-2011 12:37,2.46,14096.0,United Kingdom,2011-10-11,2.46
578664,23274,STAR T-LIGHT HOLDER WILLIE WINKIE,4,24-11-2011 16:59,1.65,15910.0,United Kingdom,2011-11-24,6.6
574074,21976,PACK OF 60 MUSHROOM CAKE CASES,1,02-11-2011 15:33,1.25,,United Kingdom,2011-02-11,1.25
573358,22774,RED DRAWER KNOB ACRYLIC EDWARDIAN,12,30-10-2011 12:46,1.25,17213.0,United Kingdom,2011-10-30,15.0
566789,72807A,SET/3 ROSE CANDLE IN JEWELLED BOX,4,15-09-2011 10:35,4.25,13134.0,United Kingdom,2011-09-15,17.0
555240,47599A,PINK PARTY BAGS,8,01-06-2011 13:07,2.1,15039.0,United Kingdom,2011-01-06,16.8
562031,85061W,WHITE JEWELLED HEART DECORATION,8,01-08-2011 17:37,0.85,16984.0,United Kingdom,2011-01-08,6.8
537086,22750,FELTCRAFT PRINCESS LOLA DOLL,16,05-12-2010 12:01,3.75,15332.0,Lithuania,2010-05-12,60.0
536637,22916,HERB MARKER THYME,2,02-12-2010 11:35,0.65,18041.0,United Kingdom,2010-02-12,1.3
546912,22417,PACK OF 60 SPACEBOY CAKE CASES,4,17-03-2011 20:12,0.55,15861.0,United Kingdom,2011-03-17,2.2
573411,22077,6 RIBBONS RUSTIC CHARM,12,30-10-2011 16:10,1.95,13870.0,United Kingdom,2011-10-30,23.4
548451,22971,QUEENS GUARD COFFEE MUG,1,31-03-2011 11:25,2.55,17365.0,United Kingdom,2011-03-31,2.55
548163,22352,LUNCH BOX WITH CUTLERY RETROSPOT ,2,29-03-2011 13:43,4.96,,United Kingdom,2011-03-29,9.92
558199,22072,RED RETROSPOT TEA CUP AND SAUCER ,5,27-06-2011 12:58,3.75,17110.0,United Kingdom,2011-06-27,18.75
542228,37447,CERAMIC CAKE DESIGN SPOTTED PLATE,8,26-01-2011 13:37,1.49,13113.0,United Kingdom,2011-01-26,11.92
558774,22627,MINT KITCHEN SCALES,1,04-07-2011 10:17,16.63,,United Kingdom,2011-04-07,16.63
557938,22754,SMALL RED BABUSHKA NOTEBOOK ,1,23-06-2011 15:35,1.63,,United Kingdom,2011-06-23,1.63
568991,23322,LARGE WHITE HEART OF WICKER,2,29-09-2011 16:44,2.95,18204.0,United Kingdom,2011-09-29,5.9
545897,84596L,BISCUITS SMALL BOWL LIGHT BLUE,1,07-03-2011 17:22,0.83,,United Kingdom,2011-07-03,0.83
541564,21865,PINK UNION JACK  PASSPORT COVER ,2,19-01-2011 11:38,2.1,16904.0,United Kingdom,2011-01-19,4.2
558542,21754,HOME BUILDING BLOCK WORD,4,30-06-2011 12:23,5.95,13593.0,United Kingdom,2011-06-30,23.8
552039,15056BL,EDWARDIAN PARASOL BLACK,3,06-05-2011 08:10,5.95,13081.0,United Kingdom,2011-06-05,17.85
555240,22171,3 HOOK PHOTO SHELF ANTIQUE WHITE,4,01-06-2011 13:07,8.5,15039.0,United Kingdom,2011-01-06,34.0
552323,23298,SPOTTY BUNTING,6,09-05-2011 09:33,4.95,16756.0,United Kingdom,2011-09-05,29.700000000000003
566035,23202,JUMBO BAG VINTAGE LEAF,10,08-09-2011 13:17,2.08,12839.0,United Kingdom,2011-08-09,20.8
574561,21932,SCANDINAVIAN PAISLEY PICNIC BAG,1,04-11-2011 15:52,2.46,,United Kingdom,2011-04-11,2.46
551351,84970L,SINGLE HEART ZINC T-LIGHT HOLDER,36,28-04-2011 10:20,0.79,14298.0,United Kingdom,2011-04-28,28.44
569148,21891,TRADITIONAL WOODEN SKIPPING ROPE,12,30-09-2011 15:52,1.45,16613.0,United Kingdom,2011-09-30,17.4
568949,23419,HOME SWEET HOME BOTTLE ,1,29-09-2011 15:13,4.13,,United Kingdom,2011-09-29,4.13
537199,22417,PACK OF 60 SPACEBOY CAKE CASES,1,05-12-2010 14:06,0.55,15894.0,United Kingdom,2010-05-12,0.55
557662,84946,ANTIQUE SILVER T-LIGHT GLASS,1,21-06-2011 17:51,1.25,13630.0,United Kingdom,2011-06-21,1.25
566025,23300,GARDENERS KNEELING PAD CUP OF TEA ,1,08-09-2011 12:55,1.65,17634.0,United Kingdom,2011-08-09,1.65
560105,22212,FOUR HOOK  WHITE LOVEBIRDS,2,14-07-2011 19:23,2.1,16794.0,United Kingdom,2011-07-14,4.2
573339,16015,MEDIUM CHINESE STYLE SCISSOR,10,30-10-2011 11:49,0.5,13278.0,United Kingdom,2011-10-30,5.0
543600,22090,PAPER BUNTING RETROSPOT,2,10-02-2011 13:19,2.95,18168.0,United Kingdom,2011-10-02,5.9
547248,22558,CLOTHES PEGS RETROSPOT PACK 24 ,1,22-03-2011 09:23,3.29,,United Kingdom,2011-03-22,3.29
575932,23156,SET OF 5 MINI GROCERY MAGNETS,2,13-11-2011 10:35,2.08,16923.0,United Kingdom,2011-11-13,4.16
550279,20749,ASSORTED COLOUR MINI CASES,8,15-04-2011 13:16,7.95,14700.0,United Kingdom,2011-04-15,63.6
560018,22367,CHILDRENS APRON SPACEBOY DESIGN,1,14-07-2011 12:52,1.95,15987.0,United Kingdom,2011-07-14,1.95
558475,84596L,BISCUITS SMALL BOWL LIGHT BLUE,4,29-06-2011 15:58,0.83,,United Kingdom,2011-06-29,3.32
576852,22951,60 CAKE CASES DOLLY GIRL DESIGN,6,16-11-2011 15:45,0.55,16809.0,United Kingdom,2011-11-16,3.3000000000000003
567700,21889,WOODEN BOX OF DOMINOES,12,22-09-2011 09:33,1.25,16379.0,United Kingdom,2011-09-22,15.0
548212,22045,SPACEBOY GIFT WRAP,25,30-03-2011 09:12,0.42,12456.0,Switzerland,2011-03-30,10.5
578470,23533,WALL ART GARDEN HAVEN ,3,24-11-2011 12:38,5.95,16824.0,United Kingdom,2011-11-24,17.85
570228,22110,BIRD HOUSE HOT WATER BOTTLE,2,09-10-2011 13:28,2.55,15821.0,United Kingdom,2011-09-10,5.1
574301,22960,JAM MAKING SET WITH JARS,6,03-11-2011 16:15,4.25,12544.0,Spain,2011-03-11,25.5
558837,84796a,PINK HAWAIIAN PICNIC HAMPER FOR 2,1,04-07-2011 11:58,8.29,,United Kingdom,2011-04-07,8.29
549981,22241,GARLAND WOODEN HAPPY EASTER,4,13-04-2011 15:49,1.25,16348.0,United Kingdom,2011-04-13,5.0
556813,21992,VINTAGE PAISLEY STATIONERY SET,1,14-06-2011 17:28,2.46,,United Kingdom,2011-06-14,2.46
576778,82486,3 DRAWER ANTIQUE WHITE WOOD CABINET,2,16-11-2011 13:24,8.95,16085.0,United Kingdom,2011-11-16,17.9
555279,21623,VINTAGE UNION JACK MEMOBOARD,1,01-06-2011 17:42,9.95,16348.0,United Kingdom,2011-01-06,9.95
575637,23048,SET OF 10 LANTERNS FAIRY LIGHT STAR,5,10-11-2011 13:46,4.15,16904.0,United Kingdom,2011-10-11,20.75
540538,22179,SET 10 LIGHTS NIGHT OWL,2,09-01-2011 14:36,6.75,17841.0,United Kingdom,2011-09-01,13.5
561209,DOT,DOTCOM POSTAGE,1,25-07-2011 16:57,299.72,,United Kingdom,2011-07-25,299.72
580664,21619,4 VANILLA BOTANICAL CANDLES,12,05-12-2011 14:03,1.25,15097.0,United Kingdom,2011-05-12,15.0
544456,22698,PINK REGENCY TEACUP AND SAUCER,48,20-02-2011 13:21,2.55,14803.0,United Kingdom,2011-02-20,122.39999999999999
537654,20727,LUNCH BAG  BLACK SKULL.,1,07-12-2010 15:59,1.65,,United Kingdom,2010-07-12,1.65
552687,22023,EMPIRE BIRTHDAY CARD,1,10-05-2011 15:09,0.83,,United Kingdom,2011-10-05,0.83
571307,23048,SET OF 10 LANTERNS FAIRY LIGHT STAR,4,17-10-2011 10:10,4.15,14443.0,United Kingdom,2011-10-17,16.6
562457,23196,VINTAGE LEAF MAGNETIC NOTEPAD,48,05-08-2011 11:00,1.25,18079.0,United Kingdom,2011-05-08,60.0
565326,84596B,SMALL DOLLY MIX DESIGN ORANGE BOWL,1,02-09-2011 13:41,0.42,16706.0,United Kingdom,2011-02-09,0.42
557145,23173,REGENCY TEAPOT ROSES ,2,17-06-2011 10:43,9.95,17139.0,United Kingdom,2011-06-17,19.9
581281,23118,PARISIENNE JEWELLERY DRAWER ,16,08-12-2011 11:36,6.65,18109.0,United Kingdom,2011-08-12,106.4
576081,23344,JUMBO BAG 50'S CHRISTMAS ,10,14-11-2011 08:16,2.08,15203.0,United Kingdom,2011-11-14,20.8
544676,22498,WOODEN REGATTA BUNTING,1,22-02-2011 16:03,5.95,17841.0,United Kingdom,2011-02-22,5.95
573330,85061W,WHITE JEWELLED HEART DECORATION,1,30-10-2011 11:22,0.85,16923.0,United Kingdom,2011-10-30,0.85
537846,22558,CLOTHES PEGS RETROSPOT PACK 24 ,96,08-12-2010 15:25,1.25,15347.0,United Kingdom,2010-08-12,120.0
556942,85099F,JUMBO BAG STRAWBERRY,10,15-06-2011 16:42,2.08,14222.0,United Kingdom,2011-06-15,20.8
543374,20702,PINK PADDED MOBILE,3,07-02-2011 15:05,4.25,16945.0,United Kingdom,2011-07-02,12.75
566440,23380,PACK OF 12 VINTAGE DOILY TISSUES,24,12-09-2011 15:19,0.39,15755.0,United Kingdom,2011-12-09,9.36
536876,22255,FELT TOADSTOOL  SMALL,1,03-12-2010 11:36,1.66,,United Kingdom,2010-03-12,1.66
559052,37327,ASSTD MULTICOLOUR CIRCLES MUG,18,05-07-2011 16:53,0.97,,United Kingdom,2011-05-07,17.46
563348,22728,ALARM CLOCK BAKELIKE PINK,8,15-08-2011 13:48,3.75,13078.0,United Kingdom,2011-08-15,30.0
557235,22604,SET OF 4 NAPKIN CHARMS CUTLERY,6,17-06-2011 14:45,2.55,17204.0,United Kingdom,2011-06-17,15.299999999999999
544352,22021,BLUE FELT EASTER EGG BASKET,12,18-02-2011 10:16,1.65,15290.0,United Kingdom,2011-02-18,19.799999999999997
574532,23559,WOODLAND BUNNIES LOLLY MAKERS,6,04-11-2011 14:19,2.08,15676.0,United Kingdom,2011-04-11,12.48
561192,22854,CREAM SWEETHEART EGG HOLDER,1,25-07-2011 13:45,4.95,16033.0,United Kingdom,2011-07-25,4.95
554671,22759,SET OF 3 NOTEBOOKS IN PARCEL,12,25-05-2011 15:47,1.65,14009.0,United Kingdom,2011-05-25,19.799999999999997
570459,20724,RED RETROSPOT CHARLOTTE BAG,10,10-10-2011 15:42,0.85,15801.0,United Kingdom,2011-10-10,8.5
540681,82613C,"METAL SIGN,CUPCAKE SINGLE HOOK",6,10-01-2011 16:25,0.85,,United Kingdom,2011-10-01,5.1
566816,22629,SPACEBOY LUNCH BOX ,24,15-09-2011 10:53,1.95,12731.0,France,2011-09-15,46.8
548011,22423,REGENCY CAKESTAND 3 TIER,32,29-03-2011 11:14,10.95,14646.0,Netherlands,2011-03-29,350.4
552452,21985,PACK OF 12 HEARTS DESIGN TISSUES ,12,09-05-2011 14:02,0.29,13752.0,United Kingdom,2011-09-05,3.4799999999999995
556813,22366,DOORMAT AIRMAIL ,1,14-06-2011 17:28,15.79,,United Kingdom,2011-06-14,15.79
575681,23484,HEART TRELLIS TRIPLE T-LIGHT HOLDER,1,10-11-2011 15:32,2.89,16903.0,United Kingdom,2011-10-11,2.89
564818,20726,LUNCH BAG WOODLAND,1,30-08-2011 12:10,4.13,,United Kingdom,2011-08-30,4.13
564534,21034,REX CASH+CARRY JUMBO SHOPPER,2,25-08-2011 15:09,0.95,12748.0,United Kingdom,2011-08-25,1.9
574074,21982,PACK OF 12 SUKI TISSUES ,1,02-11-2011 15:33,0.83,,United Kingdom,2011-02-11,0.83
572872,20975,12 PENCILS SMALL TUBE RED RETROSPOT,2,26-10-2011 13:27,0.65,15320.0,United Kingdom,2011-10-26,1.3
578251,22865,HAND WARMER OWL DESIGN,3,23-11-2011 12:45,2.1,15993.0,United Kingdom,2011-11-23,6.300000000000001
537666,21698,MOCK LOBSTER FRIDGE MAGNET,1,07-12-2010 18:36,1.66,,United Kingdom,2010-07-12,1.66
550310,21609,SET 12 LAVENDER  BOTANICAL T-LIGHTS,48,17-04-2011 11:04,2.55,15985.0,United Kingdom,2011-04-17,122.39999999999999
575602,21175,GIN + TONIC DIET METAL SIGN,1,10-11-2011 12:27,2.55,17059.0,United Kingdom,2011-10-11,2.55
567024,84031B,CHARLIE LOLA BLUE HOT WATER BOTTLE ,1,16-09-2011 11:23,8.33,,United Kingdom,2011-09-16,8.33
579297,22156,HEART DECORATION WITH PEARLS ,2,29-11-2011 11:23,1.63,,United Kingdom,2011-11-29,3.26
562348,23203,JUMBO BAG DOILEY PATTERNS,100,04-08-2011 12:36,1.79,17511.0,United Kingdom,2011-04-08,179.0
570428,22959,WRAP CHRISTMAS VILLAGE,25,10-10-2011 14:02,0.42,15553.0,United Kingdom,2011-10-10,10.5
541213,84991,60 TEATIME FAIRY CAKE CASES,1,14-01-2011 13:28,0.55,15033.0,United Kingdom,2011-01-14,0.55
553162,22561,WOODEN SCHOOL COLOURING SET,2,13-05-2011 15:53,3.29,,United Kingdom,2011-05-13,6.58
537209,20615,BLUE POLKADOT PASSPORT COVER,1,05-12-2010 15:12,2.1,14606.0,United Kingdom,2010-05-12,2.1
579787,21137,BLACK RECORD COVER FRAME,6,30-11-2011 15:33,7.46,,United Kingdom,2011-11-30,44.76
542598,21524,DOORMAT SPOTTY HOME SWEET HOME,1,30-01-2011 10:43,7.95,14805.0,United Kingdom,2011-01-30,7.95
570187,22517,CHILDS GARDEN RAKE PINK,1,07-10-2011 15:09,4.13,,United Kingdom,2011-07-10,4.13
553663,21035,SET/2 RED RETROSPOT TEA TOWELS ,1,18-05-2011 12:13,3.25,14527.0,United Kingdom,2011-05-18,3.25
572127,84596B,SMALL DOLLY MIX DESIGN ORANGE BOWL,16,21-10-2011 09:20,0.42,14911.0,EIRE,2011-10-21,6.72
573336,23117,POPPY FIELDS CHOPPING BOARD,2,30-10-2011 11:37,4.95,17372.0,United Kingdom,2011-10-30,9.9
540951,47566,PARTY BUNTING,15,12-01-2011 13:10,4.65,13113.0,United Kingdom,2011-12-01,69.75
551428,82582,AREA PATROLLED METAL SIGN,12,28-04-2011 14:59,2.1,13499.0,United Kingdom,2011-04-28,25.200000000000003
550322,21936,RED RETROSPOT PICNIC BAG,1,17-04-2011 12:53,2.95,14524.0,United Kingdom,2011-04-17,2.95
570127,22988,SOLDIERS EGG CUP ,12,07-10-2011 13:17,1.25,16900.0,United Kingdom,2011-07-10,15.0
570380,20717,STRAWBERRY SHOPPER BAG,1,10-10-2011 12:35,1.25,14606.0,United Kingdom,2011-10-10,1.25
581439,23093,SMALL PARISIENNE HEART PHOTO FRAME ,3,08-12-2011 16:30,4.96,,United Kingdom,2011-08-12,14.879999999999999
539434,22602,CHRISTMAS RETROSPOT HEART WOOD,1,17-12-2010 14:41,1.66,,United Kingdom,2010-12-17,1.66
559289,21928,JUMBO BAG SCANDINAVIAN BLUE PAISLEY,6,07-07-2011 12:22,2.08,15719.0,United Kingdom,2011-07-07,12.48
547555,22025,RING OF ROSES BIRTHDAY CARD,24,23-03-2011 16:35,0.42,14075.0,United Kingdom,2011-03-23,10.08
559923,90122A,PINK CRYSTAL+GLASS BRACELET,1,13-07-2011 16:07,4.98,,United Kingdom,2011-07-13,4.98
562285,15036,ASSORTED COLOURS SILK FAN,720,04-08-2011 10:45,0.72,17404.0,Sweden,2011-04-08,518.4
543597,21693,SMALL HAMMERED SILVER CANDLEPOT ,8,10-02-2011 12:32,2.95,12857.0,United Kingdom,2011-10-02,23.6
556501,85099C,JUMBO  BAG BAROQUE BLACK WHITE,10,13-06-2011 08:40,2.08,16700.0,United Kingdom,2011-06-13,20.8
543300,22444,GROW YOUR OWN PLANT IN A CAN ,24,07-02-2011 11:42,1.25,13334.0,United Kingdom,2011-07-02,30.0
572127,21821,GLITTER STAR GARLAND WITH BELLS ,6,21-10-2011 09:20,3.75,14911.0,EIRE,2011-10-21,22.5
554009,84987,SET OF 36 TEATIME PAPER DOILIES,12,20-05-2011 12:38,1.45,12935.0,United Kingdom,2011-05-20,17.4
575656,22178,VICTORIAN GLASS HANGING T-LIGHT,24,10-11-2011 14:29,1.95,13319.0,United Kingdom,2011-10-11,46.8
550279,22385,JUMBO BAG SPACEBOY DESIGN,2,15-04-2011 13:16,2.08,14700.0,United Kingdom,2011-04-15,4.16
564049,22532,MAGIC DRAWING SLATE LEAP FROG ,5,22-08-2011 13:30,0.42,17585.0,United Kingdom,2011-08-22,2.1
561529,22667,RECIPE BOX RETROSPOT ,6,28-07-2011 09:19,2.95,13013.0,United Kingdom,2011-07-28,17.700000000000003
573151,23353,6 GIFT TAGS VINTAGE CHRISTMAS ,7,27-10-2011 20:09,0.83,17602.0,United Kingdom,2011-10-27,5.81
539447,22355,CHARLOTTE BAG SUKI DESIGN,10,17-12-2010 16:00,0.85,12395.0,Belgium,2010-12-17,8.5
562999,22149,FELTCRAFT 6 FLOWER FRIENDS,6,11-08-2011 11:51,2.1,15117.0,United Kingdom,2011-11-08,12.600000000000001
566592,21154,RED RETROSPOT OVEN GLOVE ,20,13-09-2011 14:53,1.25,15201.0,United Kingdom,2011-09-13,25.0
568156,22781,GUMBALL MAGAZINE RACK,2,25-09-2011 12:16,7.65,14367.0,United Kingdom,2011-09-25,15.3
572062,23405,HOME SWEET HOME 2 DRAWER CABINET,4,20-10-2011 12:57,4.95,16177.0,United Kingdom,2011-10-20,19.8
578305,23526,WALL ART DOG LICENCE ,20,23-11-2011 15:44,5.35,14088.0,United Kingdom,2011-11-23,107.0
544694,48138,DOORMAT UNION FLAG,2,23-02-2011 09:30,7.95,17706.0,United Kingdom,2011-02-23,15.9
581538,23320,GIANT 50'S CHRISTMAS CRACKER,1,09-12-2011 11:34,1.25,14446.0,United Kingdom,2011-09-12,1.25
569361,85048,15CM CHRISTMAS GLASS BALL 20 LIGHTS,12,03-10-2011 14:59,6.95,16183.0,United Kingdom,2011-03-10,83.4
559933,22374,AIRLINE BAG VINTAGE JET SET RED,1,14-07-2011 09:54,4.25,16719.0,United Kingdom,2011-07-14,4.25
537608,20685,DOORMAT RED RETROSPOT,1,07-12-2010 13:20,7.95,15024.0,United Kingdom,2010-07-12,7.95
556059,84946,ANTIQUE SILVER T-LIGHT GLASS,24,08-06-2011 13:56,1.25,13630.0,United Kingdom,2011-08-06,30.0
551174,22717,CARD DOG AND BALL ,2,26-04-2011 17:02,0.83,,United Kingdom,2011-04-26,1.66
552338,48138,DOORMAT UNION FLAG,1,09-05-2011 11:51,7.95,,United Kingdom,2011-09-05,7.95
538209,84536A,ENGLISH ROSE NOTEBOOK A7 SIZE,2,10-12-2010 11:42,0.42,12748.0,United Kingdom,2010-10-12,0.84
554963,23135,SMALL ZINC HEART WALL ORGANISER,4,27-05-2011 15:32,5.75,14625.0,United Kingdom,2011-05-27,23.0
575739,22114,HOT WATER BOTTLE TEA AND SYMPATHY,1,11-11-2011 09:05,8.29,,United Kingdom,2011-11-11,8.29
568800,22142,CHRISTMAS CRAFT WHITE FAIRY ,24,29-09-2011 10:45,1.45,14868.0,United Kingdom,2011-09-29,34.8
580956,22515,CHILDS GARDEN SPADE PINK,1,06-12-2011 14:23,2.1,17841.0,United Kingdom,2011-06-12,2.1
554151,22082,RIBBON REEL STRIPES DESIGN ,15,23-05-2011 11:07,1.65,14049.0,United Kingdom,2011-05-23,24.75
577783,84380,SET OF 3 BUTTERFLY COOKIE CUTTERS,36,21-11-2011 16:20,1.45,18139.0,United Kingdom,2011-11-21,52.199999999999996
539708,22495,SET OF 2 ROUND TINS CAMEMBERT ,1,21-12-2010 12:18,5.91,,United Kingdom,2010-12-21,5.91
580543,21165,BEWARE OF THE CAT METAL SIGN ,24,05-12-2011 09:11,1.69,18223.0,United Kingdom,2011-05-12,40.56
576228,22906,12 MESSAGE CARDS WITH ENVELOPES,3,14-11-2011 13:12,1.65,15033.0,United Kingdom,2011-11-14,4.949999999999999
537460,85123A,WHITE HANGING HEART T-LIGHT HOLDER,128,07-12-2010 10:04,2.55,17616.0,United Kingdom,2010-07-12,326.4
541575,21561,DINOSAUR LUNCH BOX WITH CUTLERY,2,19-01-2011 13:21,2.55,15311.0,United Kingdom,2011-01-19,5.1
552723,22991,GIRAFFE WOODEN RULER,12,11-05-2011 10:18,1.95,16229.0,United Kingdom,2011-11-05,23.4
565648,23131,MISTLETOE HEART WREATH CREAM,5,05-09-2011 16:22,4.15,18196.0,United Kingdom,2011-05-09,20.75
571556,84997B,CHILDRENS CUTLERY RETROSPOT RED ,4,18-10-2011 09:24,4.15,12662.0,Germany,2011-10-18,16.6
566230,20914,SET/5 RED RETROSPOT LID GLASS BOWLS,12,11-09-2011 10:57,2.95,15159.0,United Kingdom,2011-11-09,35.400000000000006
556924,82552,WASHROOM METAL SIGN,1,15-06-2011 14:14,1.45,,France,2011-06-15,1.45
579301,23321,SMALL WHITE HEART OF WICKER,1,29-11-2011 11:32,1.65,18118.0,United Kingdom,2011-11-29,1.65
567664,23083,SET 6 PAPER TABLE LANTERN STARS ,6,21-09-2011 15:15,3.75,14780.0,United Kingdom,2011-09-21,22.5
574076,22025,RING OF ROSES BIRTHDAY CARD,1,02-11-2011 15:38,0.83,,United Kingdom,2011-02-11,0.83
563241,22384,LUNCH BAG PINK POLKADOT,20,15-08-2011 10:22,1.65,12758.0,Portugal,2011-08-15,33.0
577160,23274,STAR T-LIGHT HOLDER WILLIE WINKIE,12,18-11-2011 10:05,1.65,16134.0,United Kingdom,2011-11-18,19.799999999999997
573866,82484,WOOD BLACK BOARD ANT WHITE FINISH,2,01-11-2011 12:06,7.95,17495.0,United Kingdom,2011-01-11,15.9
578844,22469,HEART OF WICKER SMALL,2,25-11-2011 16:14,3.29,,United Kingdom,2011-11-25,6.58
543909,21507,"ELEPHANT, BIRTHDAY CARD, ",1,14-02-2011 12:32,0.83,,United Kingdom,2011-02-14,0.83
549690,22993,SET OF 4 PANTRY JELLY MOULDS,1,11-04-2011 13:41,1.25,17841.0,United Kingdom,2011-11-04,1.25
579777,22086,PAPER CHAIN KIT 50'S CHRISTMAS ,15,30-11-2011 15:13,5.79,,United Kingdom,2011-11-30,86.85
568533,22659,LUNCH BOX I LOVE LONDON,64,27-09-2011 13:56,1.65,15061.0,United Kingdom,2011-09-27,105.6
537759,22795,SWEETHEART RECIPE BOOK STAND,2,08-12-2010 11:42,6.75,13126.0,United Kingdom,2010-08-12,13.5
541215,22835,HOT WATER BOTTLE I AM SO POORLY,4,14-01-2011 13:42,4.65,14329.0,United Kingdom,2011-01-14,18.6
539436,22910,PAPER CHAIN KIT VINTAGE CHRISTMAS,9,17-12-2010 14:49,3.36,,United Kingdom,2010-12-17,30.24
565329,85078,SCANDINAVIAN 3 HEARTS NAPKIN RING,1,02-09-2011 13:54,0.19,14606.0,United Kingdom,2011-02-09,0.19
557790,21865,PINK UNION JACK  PASSPORT COVER ,2,22-06-2011 16:33,2.1,14099.0,United Kingdom,2011-06-22,4.2
553002,21218,RED SPOTTY BISCUIT TIN,2,12-05-2011 15:26,3.75,13263.0,United Kingdom,2011-12-05,7.5
580996,23504,PLAYING CARDS JUBILEE UNION JACK,1,06-12-2011 17:18,1.25,14578.0,United Kingdom,2011-06-12,1.25
544684,22087,PAPER BUNTING WHITE LACE,6,22-02-2011 16:32,5.79,,United Kingdom,2011-02-22,34.74
562283,22403,MAGNETS PACK OF 4 VINTAGE LABELS ,12,04-08-2011 10:43,0.39,15249.0,United Kingdom,2011-04-08,4.68
555158,48111,DOORMAT 3 SMILEY CATS,2,01-06-2011 08:38,7.95,14842.0,United Kingdom,2011-01-06,15.9
540277,84356,POMPOM CURTAIN,36,06-01-2011 12:18,1.95,14258.0,United Kingdom,2011-06-01,70.2
549901,23054,RECYCLED ACAPULCO MAT LAVENDER,1,12-04-2011 16:17,8.25,17180.0,United Kingdom,2011-12-04,8.25
578088,22645,CERAMIC HEART FAIRY CAKE MONEY BANK,4,22-11-2011 16:47,1.45,16376.0,United Kingdom,2011-11-22,5.8
545897,22630,DOLLY GIRL LUNCH BOX,1,07-03-2011 17:22,4.13,,United Kingdom,2011-07-03,4.13
554714,22411,JUMBO SHOPPER VINTAGE RED PAISLEY,9,26-05-2011 10:44,4.13,,United Kingdom,2011-05-26,37.17
578067,22382,LUNCH BAG SPACEBOY DESIGN ,1,22-11-2011 15:43,4.13,,United Kingdom,2011-11-22,4.13
562457,22713,CARD I LOVE LONDON ,12,05-08-2011 11:00,0.42,18079.0,United Kingdom,2011-05-08,5.04
570168,22996,TRAVEL CARD WALLET VINTAGE TICKET,1,07-10-2011 14:05,0.42,17596.0,United Kingdom,2011-07-10,0.42
537852,22419,LIPSTICK PEN RED,50,08-12-2010 15:56,0.42,17340.0,United Kingdom,2010-08-12,21.0
540646,21775,DECORATIVE FLORE BATHROOM BOTTLE,3,10-01-2011 14:32,1.28,,United Kingdom,2011-10-01,3.84
541986,22624,IVORY KITCHEN SCALES,2,24-01-2011 15:59,8.5,17001.0,United Kingdom,2011-01-24,17.0
580305,22720,SET OF 3 CAKE TINS PANTRY DESIGN ,1,02-12-2011 14:26,4.95,12970.0,United Kingdom,2011-02-12,4.95
544918,22630,DOLLY GIRL LUNCH BOX,12,24-02-2011 16:30,1.95,13081.0,United Kingdom,2011-02-24,23.4
542664,22972,CHILDREN'S SPACEBOY MUG,1,31-01-2011 12:14,3.29,,United Kingdom,2011-01-31,3.29
571229,22507,MEMO BOARD RETROSPOT  DESIGN,1,14-10-2011 14:04,4.95,15453.0,United Kingdom,2011-10-14,4.95
563842,22192,BLUE DINER WALL CLOCK,2,19-08-2011 13:54,8.5,13871.0,United Kingdom,2011-08-19,17.0
572558,22569,FELTCRAFT CUSHION BUTTERFLY,4,25-10-2011 08:26,3.75,14286.0,United Kingdom,2011-10-25,15.0
577217,23328,SET 6 SCHOOL MILK BOTTLES IN CRATE,1,18-11-2011 11:53,3.75,17324.0,United Kingdom,2011-11-18,3.75
554348,22960,JAM MAKING SET WITH JARS,6,24-05-2011 08:49,4.25,13523.0,United Kingdom,2011-05-24,25.5
537159,22112,CHOCOLATE HOT WATER BOTTLE,6,05-12-2010 13:17,4.95,14527.0,United Kingdom,2010-05-12,29.700000000000003
566221,21623,VINTAGE UNION JACK MEMOBOARD,1,09-09-2011 16:13,19.96,,United Kingdom,2011-09-09,19.96
555276,22324,BLUE POLKADOT KIDS BAG,2,01-06-2011 17:28,4.13,,United Kingdom,2011-01-06,8.26
565239,21883,STARS GIFT TAPE ,12,02-09-2011 09:51,0.65,12670.0,France,2011-02-09,7.800000000000001
580309,23301,GARDENERS KNEELING PAD KEEP CALM ,12,02-12-2011 14:46,1.65,14503.0,United Kingdom,2011-02-12,19.799999999999997
555638,22037,ROBOT BIRTHDAY CARD,12,06-06-2011 12:51,0.42,15150.0,United Kingdom,2011-06-06,5.04
559689,23102,SILVER HEARTS TABLE DECORATION,1,11-07-2011 15:46,0.83,,United Kingdom,2011-11-07,0.83
553655,47566,PARTY BUNTING,4,18-05-2011 11:14,4.95,16775.0,United Kingdom,2011-05-18,19.8
557801,23209,LUNCH BAG DOILEY PATTERN ,10,23-06-2011 10:14,1.65,13319.0,United Kingdom,2011-06-23,16.5
579787,23311,VINTAGE CHRISTMAS STOCKING ,4,30-11-2011 15:33,4.96,,United Kingdom,2011-11-30,19.84
570714,22328,ROUND SNACK BOXES SET OF 4 FRUITS ,12,12-10-2011 10:20,2.95,13520.0,Switzerland,2011-12-10,35.400000000000006
567370,20750,RED RETROSPOT MINI CASES,24,20-09-2011 09:13,6.35,14236.0,United Kingdom,2011-09-20,152.39999999999998
579505,21754,HOME BUILDING BLOCK WORD,3,29-11-2011 16:31,6.25,13078.0,United Kingdom,2011-11-29,18.75
569002,21106,CREAM SLICE FLANNEL CHOCOLATE SPOT ,6,29-09-2011 17:53,2.95,17572.0,United Kingdom,2011-09-29,17.700000000000003
555108,21621,VINTAGE UNION JACK BUNTING,6,31-05-2011 14:18,8.5,18231.0,United Kingdom,2011-05-31,51.0
571656,23238,SET OF 4 KNICK KNACK TINS LONDON ,12,18-10-2011 12:43,4.15,16393.0,United Kingdom,2011-10-18,49.800000000000004
545530,22860,EASTER TIN CHICKS PINK DAISY,6,03-03-2011 13:45,1.65,17416.0,United Kingdom,2011-03-03,9.899999999999999
580729,23184,BULL DOG BOTTLE OPENER,2,05-12-2011 17:24,10.79,,United Kingdom,2011-05-12,21.58
539016,22726,ALARM CLOCK BAKELIKE GREEN,8,15-12-2010 13:49,3.75,13418.0,United Kingdom,2010-12-15,30.0
540672,22972,CHILDREN'S SPACEBOY MUG,12,10-01-2011 15:51,1.65,15281.0,United Kingdom,2011-10-01,19.799999999999997
580695,23313,VINTAGE CHRISTMAS BUNTING,2,05-12-2011 16:03,4.95,13230.0,United Kingdom,2011-05-12,9.9
552649,POST,POSTAGE,1,10-05-2011 13:44,18.0,12592.0,Germany,2011-10-05,18.0
545060,84218,BOX/12 CHICK & EGG IN BASKET,4,27-02-2011 13:47,1.95,15547.0,United Kingdom,2011-02-27,7.8
578510,23283,DOORMAT VINTAGE LEAF,1,24-11-2011 13:25,8.25,14056.0,United Kingdom,2011-11-24,8.25
561648,85049A,TRADITIONAL CHRISTMAS RIBBONS,2,28-07-2011 15:21,1.25,15746.0,United Kingdom,2011-07-28,2.5
568995,21155,RED RETROSPOT PEG BAG,6,29-09-2011 16:53,2.55,16779.0,United Kingdom,2011-09-29,15.299999999999999
537065,84279P,CHERRY BLOSSOM  DECORATIVE FLASK,4,05-12-2010 11:57,3.75,12567.0,France,2010-05-12,15.0
578270,21983,PACK OF 12 BLUE PAISLEY TISSUES ,2,23-11-2011 13:39,0.83,14096.0,United Kingdom,2011-11-23,1.66
576611,47559B,TEA TIME OVEN GLOVE,2,15-11-2011 16:29,1.25,17357.0,United Kingdom,2011-11-15,2.5
551250,22982,PANTRY PASTRY BRUSH,1,27-04-2011 12:00,1.25,17841.0,United Kingdom,2011-04-27,1.25
551009,47591d,PINK FAIRY CAKE CHILDRENS APRON,1,26-04-2011 09:50,4.96,,United Kingdom,2011-04-26,4.96
539471,22988,SOLDIERS EGG CUP ,12,19-12-2010 14:16,1.25,17358.0,United Kingdom,2010-12-19,15.0
560025,22663,JUMBO BAG DOLLY GIRL DESIGN,1,14-07-2011 13:00,2.08,18283.0,United Kingdom,2011-07-14,2.08
558761,22548,HEADS AND TAILS SPORTING FUN,2,03-07-2011 12:52,1.25,15033.0,United Kingdom,2011-03-07,2.5
580908,23310,BUBBLEGUM RING ASSORTED,1,06-12-2011 13:20,0.42,16495.0,United Kingdom,2011-06-12,0.42
571566,21531,RED RETROSPOT SUGAR JAM BOWL,6,18-10-2011 10:19,2.55,13594.0,United Kingdom,2011-10-18,15.299999999999999
565472,23424,GINGHAM RECIPE BOOK BOX,1,05-09-2011 10:15,4.95,16255.0,United Kingdom,2011-05-09,4.95
546892,84832,ZINC WILLIE WINKIE  CANDLE STICK,2,17-03-2011 18:20,1.63,,United Kingdom,2011-03-17,3.26
537823,85131B,BEADED CRYSTAL HEART GREEN ON STICK,1,08-12-2010 14:25,0.85,,United Kingdom,2010-08-12,0.85
553168,84313C,ORANGE TV TRAY TABLE ,6,13-05-2011 16:24,1.95,15159.0,United Kingdom,2011-05-13,11.7
560555,21163,DO NOT TOUCH MY STUFF DOOR HANGER ,1,19-07-2011 13:01,0.39,14178.0,United Kingdom,2011-07-19,0.39
572669,23291,DOLLY GIRL CHILDRENS CUP,4,25-10-2011 13:10,1.25,16549.0,United Kingdom,2011-10-25,5.0
577319,23085,ANTIQUE SILVER BAUBLE LAMP  ,1,18-11-2011 13:43,10.4,17301.0,United Kingdom,2011-11-18,10.4
558117,22197,POPCORN HOLDER,6,27-06-2011 09:11,1.63,,United Kingdom,2011-06-27,9.78
566571,21181,PLEASE ONE PERSON METAL SIGN,12,13-09-2011 12:49,2.1,17037.0,United Kingdom,2011-09-13,25.200000000000003
554083,20724,RED RETROSPOT CHARLOTTE BAG,3,22-05-2011 11:51,0.85,18125.0,United Kingdom,2011-05-22,2.55
544207,21257,VICTORIAN SEWING BOX MEDIUM,1,17-02-2011 10:34,15.79,,United Kingdom,2011-02-17,15.79
552234,23202,JUMBO BAG VINTAGE LEAF,8,06-05-2011 16:01,2.08,,United Kingdom,2011-06-05,16.64
572076,22996,TRAVEL CARD WALLET VINTAGE TICKET,24,20-10-2011 14:01,0.42,13761.0,United Kingdom,2011-10-20,10.08
553710,22750,FELTCRAFT PRINCESS LOLA DOLL,2,18-05-2011 15:35,3.75,17338.0,United Kingdom,2011-05-18,7.5
552803,21755,LOVE BUILDING BLOCK WORD,1,11-05-2011 12:32,5.95,14573.0,United Kingdom,2011-11-05,5.95
550915,85150,LADIES & GENTLEMEN METAL SIGN,4,21-04-2011 13:30,2.55,13263.0,United Kingdom,2011-04-21,10.2
571263,23209,LUNCH BAG VINTAGE DOILY ,10,16-10-2011 11:06,1.65,14910.0,United Kingdom,2011-10-16,16.5
573282,22776,SWEETHEART 3 TIER CAKE STAND ,2,28-10-2011 13:55,9.95,18030.0,United Kingdom,2011-10-28,19.9
562616,23307,SET OF 60 PANTRY DESIGN CAKE CASES ,24,08-08-2011 12:28,0.55,14748.0,United Kingdom,2011-08-08,13.200000000000001
576778,23130,MISTLETOE HEART WREATH GREEN,1,16-11-2011 13:24,4.15,16085.0,United Kingdom,2011-11-16,4.15
544412,84375,SET OF 20 KIDS COOKIE CUTTERS,12,18-02-2011 14:21,2.1,16531.0,United Kingdom,2011-02-18,25.200000000000003
548202,22646,CERAMIC STRAWBERRY CAKE MONEY BANK,12,29-03-2011 16:36,1.45,16980.0,United Kingdom,2011-03-29,17.4
569367,23110,PARISIENNE KEY CABINET ,2,03-10-2011 15:28,5.75,13994.0,United Kingdom,2011-03-10,11.5
546381,22356,CHARLOTTE BAG PINK POLKADOT,1,11-03-2011 12:29,0.85,12748.0,United Kingdom,2011-11-03,0.85
578036,23101,SILVER STARS TABLE DECORATION,5,22-11-2011 14:04,0.83,16474.0,United Kingdom,2011-11-22,4.1499999999999995
538626,21326,AGED GLASS SILVER T-LIGHT HOLDER,12,13-12-2010 12:57,0.65,17338.0,United Kingdom,2010-12-13,7.800000000000001
567821,20725,LUNCH BAG RED RETROSPOT,5,22-09-2011 12:45,1.65,14659.0,United Kingdom,2011-09-22,8.25
536876,22304,COFFEE MUG BLUE PAISLEY DESIGN,1,03-12-2010 11:36,5.06,,United Kingdom,2010-03-12,5.06
537022,22809,SET OF 6 T-LIGHTS SANTA,6,03-12-2010 15:45,2.95,12725.0,Italy,2010-03-12,17.700000000000003
554509,22197,SMALL POPCORN HOLDER,10,24-05-2011 15:45,0.85,17375.0,United Kingdom,2011-05-24,8.5
566094,23413,VINTAGE COFFEE GRINDER BOX,1,09-09-2011 10:42,4.95,17965.0,United Kingdom,2011-09-09,4.95
544667,22518,CHILDS GARDEN BRUSH BLUE,36,22-02-2011 15:10,1.85,17511.0,United Kingdom,2011-02-22,66.60000000000001
544444,20724,RED RETROSPOT CHARLOTTE BAG,100,20-02-2011 10:51,0.72,13246.0,United Kingdom,2011-02-20,72.0
566249,23100,SILVER BELLS TABLE DECORATION,4,11-09-2011 12:09,1.25,13527.0,United Kingdom,2011-11-09,5.0
564743,20996,JAZZ HEARTS ADDRESS BOOK,1,28-08-2011 15:17,0.19,14606.0,United Kingdom,2011-08-28,0.19
567139,22470,HEART OF WICKER LARGE,6,16-09-2011 14:45,2.95,13563.0,United Kingdom,2011-09-16,17.700000000000003
580115,22818,CARD CHRISTMAS VILLAGE,14,01-12-2011 16:22,0.42,,United Kingdom,2011-01-12,5.88
538488,84509A,SET OF 4 ENGLISH ROSE PLACEMATS,3,12-12-2010 12:41,3.75,13715.0,United Kingdom,2010-12-12,11.25
570232,84580,MOUSE TOY WITH PINK T-SHIRT,2,09-10-2011 13:58,3.75,14040.0,United Kingdom,2011-09-10,7.5
580882,23267,SET OF 4 SANTA PLACE SETTINGS,12,06-12-2011 12:20,1.25,12971.0,United Kingdom,2011-06-12,15.0
538566,20866,BLUE ROSE FABRIC MIRROR,1,13-12-2010 11:21,2.51,,United Kingdom,2010-12-13,2.51
570875,22627,MINT KITCHEN SCALES,2,12-10-2011 17:00,8.5,12667.0,Finland,2011-12-10,17.0
566602,23324,RUSTIC STRAWBERRY JAM POT LARGE ,1,13-09-2011 16:05,4.13,,United Kingdom,2011-09-13,4.13
547498,22977,DOLLY GIRL CHILDRENS EGG CUP,1,23-03-2011 12:24,1.25,15021.0,United Kingdom,2011-03-23,1.25
550004,37448,CERAMIC CAKE DESIGN SPOTTED MUG,12,14-04-2011 09:56,1.49,12569.0,Germany,2011-04-14,17.88
569360,21559,STRAWBERRY LUNCH BOX WITH CUTLERY,1,03-10-2011 14:59,2.55,14653.0,United Kingdom,2011-03-10,2.55
578534,22908,PACK OF 20 NAPKINS RED APPLES,6,24-11-2011 14:51,0.85,15725.0,United Kingdom,2011-11-24,5.1
547921,22558,CLOTHES PEGS RETROSPOT PACK 24 ,12,28-03-2011 13:28,1.49,14766.0,United Kingdom,2011-03-28,17.88
549125,90148,LONG SILVER NECKLACE PASTEL FLOWER,1,06-04-2011 14:13,12.75,14964.0,United Kingdom,2011-06-04,12.75
552508,22953,BIRTHDAY PARTY CORDON BARRIER TAPE,1,09-05-2011 16:27,2.46,,United Kingdom,2011-09-05,2.46
572281,23356,LOVE HOT WATER BOTTLE,3,23-10-2011 11:10,5.95,17211.0,United Kingdom,2011-10-23,17.85
568798,85014B,RED RETROSPOT UMBRELLA,3,29-09-2011 10:23,5.95,12615.0,France,2011-09-29,17.85
551400,21937,STRAWBERRY   PICNIC BAG,10,28-04-2011 13:18,2.95,17160.0,United Kingdom,2011-04-28,29.5
560119,POST,POSTAGE,2,15-07-2011 10:21,40.0,12815.0,Poland,2011-07-15,80.0
560239,21430,SET/3 RED GINGHAM ROSE STORAGE BOX,4,17-07-2011 11:50,3.75,13507.0,United Kingdom,2011-07-17,15.0
564313,48188,DOORMAT WELCOME PUPPIES,2,24-08-2011 12:54,7.95,13728.0,United Kingdom,2011-08-24,15.9
538662,85184C,S/4 VALENTINE DECOUPAGE HEART BOX,24,13-12-2010 15:44,1.25,15159.0,United Kingdom,2010-12-13,30.0
577056,90161C,ANT COPPER LIME BOUDICCA BRACELET,10,17-11-2011 14:24,4.95,17985.0,United Kingdom,2011-11-17,49.5
543833,POST,POSTAGE,1,14-02-2011 10:24,18.0,12476.0,Germany,2011-02-14,18.0
540550,84637,KITCHEN FLOWER POTS WALL PLAQUE,3,10-01-2011 09:11,5.95,12539.0,Spain,2011-10-01,17.85
579187,23243,SET OF TEA COFFEE SUGAR TINS PANTRY,2,28-11-2011 15:31,10.79,,United Kingdom,2011-11-28,21.58
545645,22652,TRAVEL SEWING KIT,1,04-03-2011 12:42,1.65,12755.0,Japan,2011-04-03,1.65
561798,85178,VICTORIAN SEWING KIT,12,29-07-2011 13:39,1.25,14911.0,EIRE,2011-07-29,15.0
557316,16169M,WRAP DAISY CARPET ,25,19-06-2011 16:04,0.42,17299.0,United Kingdom,2011-06-19,10.5
575607,21032,SPACE CADET WHITE,1,10-11-2011 12:37,2.46,14096.0,United Kingdom,2011-10-11,2.46
546008,22616,PACK OF 12 LONDON TISSUES ,1,08-03-2011 15:43,0.83,,United Kingdom,2011-08-03,0.83
566577,22993,SET OF 4 PANTRY JELLY MOULDS,1,13-09-2011 13:29,3.29,,United Kingdom,2011-09-13,3.29
566291,72131,COLUMBIAN CANDLE RECTANGLE,1,11-09-2011 15:31,1.95,12965.0,United Kingdom,2011-11-09,1.95
552957,84991,60 TEATIME FAIRY CAKE CASES,240,12-05-2011 12:36,0.55,17404.0,Sweden,2011-12-05,132.0
547205,21232,STRAWBERRY CERAMIC TRINKET BOX,12,21-03-2011 14:00,1.25,16558.0,United Kingdom,2011-03-21,15.0
542541,22079,RIBBON REEL HEARTS DESIGN ,1,28-01-2011 14:25,3.29,,United Kingdom,2011-01-28,3.29
561521,84984A,GREEN PEONY CUSHION COVER,2,27-07-2011 17:06,4.65,17870.0,United Kingdom,2011-07-27,9.3
565452,23293,SET OF 12 FAIRY CAKE BAKING CASES,16,04-09-2011 15:52,0.83,15187.0,United Kingdom,2011-04-09,13.28
580872,23344,JUMBO BAG 50'S CHRISTMAS ,10,06-12-2011 12:02,2.08,18283.0,United Kingdom,2011-06-12,20.8
559035,22178,VICTORIAN GLASS HANGING T-LIGHT,36,05-07-2011 15:12,1.25,13695.0,United Kingdom,2011-05-07,45.0
572318,85152,HAND OVER THE CHOCOLATE   SIGN ,1,23-10-2011 16:19,2.1,15436.0,United Kingdom,2011-10-23,2.1
554016,82482,WOODEN PICTURE FRAME WHITE FINISH,3,20-05-2011 13:14,2.55,13243.0,United Kingdom,2011-05-20,7.6499999999999995
564754,22662,LUNCH BAG DOLLY GIRL DESIGN,1,30-08-2011 10:29,4.13,,United Kingdom,2011-08-30,4.13
576075,21974,SET OF 36 PAISLEY FLOWER DOILIES,2,13-11-2011 16:16,1.45,15861.0,United Kingdom,2011-11-13,2.9
559816,84536A,ENGLISH ROSE NOTEBOOK A7 SIZE,3,12-07-2011 16:11,0.42,,United Kingdom,2011-12-07,1.26
565234,22445,PENCIL CASE LIFE IS BEAUTIFUL,1,02-09-2011 09:38,5.79,,United Kingdom,2011-02-09,5.79
575728,22722,SET OF 6 SPICE TINS PANTRY DESIGN,4,10-11-2011 19:40,3.95,14911.0,EIRE,2011-10-11,15.8
563720,21668,RED STRIPE CERAMIC DRAWER KNOB,2,18-08-2011 16:24,1.25,15867.0,United Kingdom,2011-08-18,2.5
555549,22969,HOMEMADE JAM SCENTED CANDLES,12,05-06-2011 13:24,1.45,13637.0,United Kingdom,2011-05-06,17.4
576075,23234,BISCUIT TIN VINTAGE CHRISTMAS,2,13-11-2011 16:16,2.89,15861.0,United Kingdom,2011-11-13,5.78
551811,21930,JUMBO STORAGE BAG SKULLS,10,04-05-2011 11:37,2.08,15039.0,United Kingdom,2011-04-05,20.8
569544,22189,CREAM HEART CARD HOLDER,1,04-10-2011 16:33,8.29,,United Kingdom,2011-04-10,8.29
565152,23209,LUNCH BAG VINTAGE DOILY ,2,01-09-2011 14:42,1.65,17799.0,United Kingdom,2011-01-09,3.3
550521,37370,RETRO COFFEE MUGS ASSORTED,24,19-04-2011 09:49,1.25,13647.0,United Kingdom,2011-04-19,30.0
558027,22441,GROW YOUR OWN BASIL IN ENAMEL MUG,8,24-06-2011 11:08,2.1,14032.0,United Kingdom,2011-06-24,16.8
547063,22966,GINGERBREAD MAN COOKIE CUTTER,3,20-03-2011 13:33,1.25,14769.0,United Kingdom,2011-03-20,3.75
542433,21094,SET/6 RED SPOTTY PAPER PLATES,24,28-01-2011 10:45,0.85,12726.0,France,2011-01-28,20.4
539010,20974,12 PENCILS SMALL TUBE SKULL,4,15-12-2010 13:24,0.65,15005.0,United Kingdom,2010-12-15,2.6
570696,23311,VINTAGE CHRISTMAS STOCKING ,6,12-10-2011 09:08,2.55,15840.0,United Kingdom,2011-12-10,15.299999999999999
574732,23296,SET OF 6 TEA TIME BAKING CASES,8,06-11-2011 15:11,1.25,13523.0,United Kingdom,2011-06-11,10.0
538517,22561,WOODEN SCHOOL COLOURING SET,2,12-12-2010 16:05,1.65,17618.0,United Kingdom,2010-12-12,3.3
548708,22371,AIRLINE BAG VINTAGE TOKYO 78,3,03-04-2011 12:41,4.25,13269.0,United Kingdom,2011-03-04,12.75
553545,21078,SET/20 STRAWBERRY PAPER NAPKINS ,1,17-05-2011 15:37,2.46,,United Kingdom,2011-05-17,2.46
542610,20727,LUNCH BAG  BLACK SKULL.,10,30-01-2011 14:05,1.65,13148.0,United Kingdom,2011-01-30,16.5
561900,84988,SET OF 72 PINK HEART PAPER DOILIES,3,31-07-2011 15:31,1.45,16655.0,United Kingdom,2011-07-31,4.35
564719,22667,RECIPE BOX RETROSPOT ,1,28-08-2011 11:55,2.95,15325.0,United Kingdom,2011-08-28,2.95
578506,16225,RATTLE SNAKE EGGS,2,24-11-2011 13:01,1.25,17458.0,United Kingdom,2011-11-24,2.5
566025,23400,SHELF WITH 4 HOOKS HOME SWEET HOME,1,08-09-2011 12:55,6.25,17634.0,United Kingdom,2011-08-09,6.25
574901,21523,DOORMAT FANCY FONT HOME SWEET HOME,2,07-11-2011 15:15,8.25,17158.0,United Kingdom,2011-07-11,16.5
578027,21616,4 PEAR BOTANICAL DINNER CANDLES,36,22-11-2011 13:29,1.25,15977.0,United Kingdom,2011-11-22,45.0
568135,20978,36 PENCILS TUBE SKULLS,1,23-09-2011 17:04,2.46,,United Kingdom,2011-09-23,2.46
567792,22752,SET 7 BABUSHKA NESTING BOXES,4,22-09-2011 11:40,8.5,17581.0,United Kingdom,2011-09-22,34.0
569726,22189,CREAM HEART CARD HOLDER,8,06-10-2011 09:36,3.95,17419.0,United Kingdom,2011-06-10,31.6
576053,22911,PAPER CHAIN KIT LONDON,3,13-11-2011 14:53,2.95,16726.0,United Kingdom,2011-11-13,8.850000000000001
558240,21989,PACK OF 20 SKULL PAPER NAPKINS,2,27-06-2011 15:27,1.63,,United Kingdom,2011-06-27,3.26
545568,22429,ENAMEL MEASURING JUG CREAM,1,03-03-2011 16:22,8.29,,United Kingdom,2011-03-03,8.29
556642,22921,HERB MARKER CHIVES ,5,13-06-2011 15:47,0.65,17236.0,United Kingdom,2011-06-13,3.25
576687,21935,SUKI  SHOULDER BAG,1,16-11-2011 12:13,1.65,13558.0,United Kingdom,2011-11-16,1.65
568699,23245,SET OF 3 REGENCY CAKE TINS,4,28-09-2011 14:58,4.95,12352.0,Norway,2011-09-28,19.8
559809,82600,NO SINGING METAL SIGN,2,12-07-2011 14:57,2.1,16409.0,United Kingdom,2011-12-07,4.2
543824,20971,PINK BLUE FELT CRAFT TRINKET BOX,12,14-02-2011 09:31,1.25,14631.0,United Kingdom,2011-02-14,15.0
580699,22619,SET OF 6 SOLDIER SKITTLES,1,05-12-2011 16:14,3.75,,United Kingdom,2011-05-12,3.75
541658,22756,LARGE YELLOW BABUSHKA NOTEBOOK ,3,20-01-2011 12:16,1.25,15529.0,United Kingdom,2011-01-20,3.75
561714,22699,ROSES REGENCY TEACUP AND SAUCER ,6,29-07-2011 11:56,2.95,18081.0,United Kingdom,2011-07-29,17.700000000000003
564165,48187,DOORMAT NEW ENGLAND,2,23-08-2011 13:35,7.95,13593.0,United Kingdom,2011-08-23,15.9
570416,22456,NATURAL SLATE CHALKBOARD LARGE ,3,10-10-2011 13:30,4.95,15608.0,United Kingdom,2011-10-10,14.850000000000001
572550,21889,WOODEN BOX OF DOMINOES,2,24-10-2011 17:06,2.46,,United Kingdom,2011-10-24,4.92
573074,22841,ROUND CAKE TIN VINTAGE GREEN,2,27-10-2011 14:03,7.95,16265.0,United Kingdom,2011-10-27,15.9
565778,22867,HAND WARMER BIRD DESIGN,12,06-09-2011 15:04,2.1,17460.0,United Kingdom,2011-06-09,25.200000000000003
554098,21786,POLKADOT RAIN HAT ,6,22-05-2011 13:01,0.42,14769.0,United Kingdom,2011-05-22,2.52
564139,22432,WATERING CAN PINK BUNNY,1,23-08-2011 11:41,1.95,16904.0,United Kingdom,2011-08-23,1.95
564221,21843,RED RETROSPOT CAKE STAND,1,24-08-2011 09:36,20.79,,United Kingdom,2011-08-24,20.79
575747,22838,3 TIER CAKE TIN RED AND CREAM,2,11-11-2011 10:19,14.95,12589.0,France,2011-11-11,29.9
537638,20867,PINK ROSE FABRIC MIRROR,2,07-12-2010 15:28,2.51,,United Kingdom,2010-07-12,5.02
543040,22531,MAGIC DRAWING SLATE CIRCUS PARADE  ,1,02-02-2011 17:06,0.42,17337.0,United Kingdom,2011-02-02,0.42
571205,22835,HOT WATER BOTTLE I AM SO POORLY,4,14-10-2011 12:41,4.95,15620.0,United Kingdom,2011-10-14,19.8
548308,22185,SLATE TILE NATURAL HANGING,5,30-03-2011 12:00,1.65,17220.0,United Kingdom,2011-03-30,8.25
559816,21865,PINK UNION JACK  PASSPORT COVER ,2,12-07-2011 16:11,0.83,,United Kingdom,2011-12-07,1.66
560875,23201,JUMBO BAG ALPHABET,10,21-07-2011 15:12,2.08,13562.0,United Kingdom,2011-07-21,20.8
545933,20685,DOORMAT RED RETROSPOT,2,08-03-2011 12:04,7.95,13908.0,United Kingdom,2011-08-03,15.9
557122,22661,CHARLOTTE BAG DOLLY GIRL DESIGN,10,16-06-2011 17:37,0.85,16558.0,United Kingdom,2011-06-16,8.5
556915,22906,12 MESSAGE CARDS WITH ENVELOPES,1,15-06-2011 13:35,1.65,15036.0,United Kingdom,2011-06-15,1.65
566049,23079,TOADSTOOL BEDSIDE LIGHT ,2,08-09-2011 14:28,8.95,15730.0,United Kingdom,2011-08-09,17.9
550213,22698,PINK REGENCY TEACUP AND SAUCER,3,15-04-2011 10:42,5.79,,United Kingdom,2011-04-15,17.37
581217,22920,HERB MARKER BASIL,1,08-12-2011 09:20,1.63,,United Kingdom,2011-08-12,1.63
561511,21755,LOVE BUILDING BLOCK WORD,3,27-07-2011 15:02,5.95,15624.0,United Kingdom,2011-07-27,17.85
545657,22620,4 TRADITIONAL SPINNING TOPS,12,04-03-2011 14:02,1.25,14911.0,EIRE,2011-04-03,15.0
544670,22326,ROUND SNACK BOXES SET OF4 WOODLAND ,2,22-02-2011 15:22,2.95,16161.0,United Kingdom,2011-02-22,5.9
557886,23202,JUMBO BAG VINTAGE LEAF,6,23-06-2011 13:39,2.08,17799.0,United Kingdom,2011-06-23,12.48
540537,22695,WICKER WREATH SMALL,4,09-01-2011 14:28,1.45,13565.0,United Kingdom,2011-09-01,5.8
577058,20981,12 PENCILS TALL TUBE WOODLAND,3,17-11-2011 14:29,0.85,18122.0,United Kingdom,2011-11-17,2.55
566015,22470,HEART OF WICKER LARGE,2,08-09-2011 12:19,2.95,16426.0,United Kingdom,2011-08-09,5.9
548211,21390,FILIGRIS HEART WITH BUTTERFLY,144,30-03-2011 09:06,1.25,14646.0,Netherlands,2011-03-30,180.0
581149,21212,PACK OF 72 RETROSPOT CAKE CASES,1,07-12-2011 14:12,0.55,15471.0,United Kingdom,2011-07-12,0.55
575477,22766,PHOTO FRAME CORNICE,1,09-11-2011 16:14,5.79,,United Kingdom,2011-09-11,5.79
561369,22280,POCKET BAG PINK PAISELY BROWN SPOT,1,26-07-2011 16:21,2.46,,United Kingdom,2011-07-26,2.46
577078,23213,STAR WREATH DECORATION WITH BELL,1,17-11-2011 15:17,2.46,,United Kingdom,2011-11-17,2.46
554837,85062,PEARL CRYSTAL PUMPKIN T-LIGHT HLDR,6,26-05-2011 16:30,1.65,14584.0,United Kingdom,2011-05-26,9.899999999999999
563346,23201,JUMBO BAG ALPHABET,10,15-08-2011 13:37,2.08,14282.0,United Kingdom,2011-08-15,20.8
570855,22154,ANGEL DECORATION 3 BUTTONS ,48,12-10-2011 14:56,0.42,17314.0,United Kingdom,2011-12-10,20.16
542386,22835,HOT WATER BOTTLE I AM SO POORLY,8,27-01-2011 14:35,4.65,17540.0,United Kingdom,2011-01-27,37.2
573897,22398,MAGNETS PACK OF 4 SWALLOWS,6,01-11-2011 14:29,0.39,16729.0,United Kingdom,2011-01-11,2.34
556827,22595,GINGHAM HEART DECORATION,12,15-06-2011 10:29,0.85,15134.0,United Kingdom,2011-06-15,10.2
571740,22693,GROW A FLYTRAP OR SUNFLOWER IN TIN,24,19-10-2011 10:34,1.25,17973.0,United Kingdom,2011-10-19,30.0
556100,22716,CARD CIRCUS PARADE,12,08-06-2011 16:00,0.42,15238.0,United Kingdom,2011-08-06,5.04
537231,21110,LARGE CAKE TOWEL PINK SPOTS,2,06-12-2010 09:21,6.75,13652.0,United Kingdom,2010-06-12,13.5
538351,22081,RIBBON REEL FLORA + FAUNA ,1,10-12-2010 15:17,4.21,,United Kingdom,2010-10-12,4.21
577078,22821,GIFT BAG PSYCHEDELIC APPLES,1,17-11-2011 15:17,0.83,,United Kingdom,2011-11-17,0.83
540026,21632,VINTAGE PINK DECORATIVE PARASOL,1,04-01-2011 13:25,8.47,,United Kingdom,2011-04-01,8.47
539750,22075,6 RIBBONS ELEGANT CHRISTMAS ,7,21-12-2010 15:40,4.21,,United Kingdom,2010-12-21,29.47
581410,21210,SET OF 72 RETROSPOT PAPER  DOILIES,12,08-12-2011 14:14,1.45,13098.0,United Kingdom,2011-08-12,17.4
567665,23423,PANTRY 3 HOOK ROLLING PIN HANGER,1,21-09-2011 15:22,7.46,,United Kingdom,2011-09-21,7.46
546655,21257,VICTORIAN SEWING BOX MEDIUM,1,15-03-2011 14:19,15.79,,United Kingdom,2011-03-15,15.79
569374,23307,SET OF 60 PANTRY DESIGN CAKE CASES ,1,03-10-2011 16:14,1.25,,United Kingdom,2011-03-10,1.25
548373,84970L,SINGLE HEART ZINC T-LIGHT HOLDER,1,30-03-2011 16:34,2.08,,United Kingdom,2011-03-30,2.08
556245,22604,SET OF 4 NAPKIN CHARMS CUTLERY,4,09-06-2011 16:10,2.55,17841.0,United Kingdom,2011-09-06,10.2
545237,10133,COLOURING PENCILS BROWN TUBE,20,01-03-2011 10:38,0.85,15709.0,United Kingdom,2011-01-03,17.0
541571,35911A,MULTICOLOUR RABBIT EGG WARMER,6,19-01-2011 12:38,2.1,12841.0,United Kingdom,2011-01-19,12.600000000000001
578053,23491,VINTAGE JINGLE BELLS HEART,4,22-11-2011 14:59,8.25,14422.0,United Kingdom,2011-11-22,33.0
551776,17003,BROCADE RING PURSE ,36,04-05-2011 11:23,0.29,13268.0,United Kingdom,2011-04-05,10.44
568095,23438, RED SPOT GIFT BAG LARGE,48,23-09-2011 14:49,1.25,14911.0,EIRE,2011-09-23,60.0
558626,22398,MAGNETS PACK OF 4 SWALLOWS,12,30-06-2011 17:34,1.25,12569.0,Germany,2011-06-30,15.0
553385,21883,STARS GIFT TAPE ,1,16-05-2011 15:53,0.65,16710.0,United Kingdom,2011-05-16,0.65
565242,21718,RED METAL BEACH SPADE ,12,02-09-2011 10:13,1.25,14436.0,United Kingdom,2011-02-09,15.0
576657,23582,VINTAGE DOILY JUMBO BAG RED ,10,16-11-2011 11:03,2.08,12720.0,Germany,2011-11-16,20.8
581439,17012F,ORIGAMI SANDLEWOOD INCENSE/CAND SET,1,08-12-2011 16:30,2.46,,United Kingdom,2011-08-12,2.46
539309,22386,JUMBO BAG PINK POLKADOT,10,16-12-2010 17:49,1.95,16945.0,United Kingdom,2010-12-16,19.5
566238,22630,DOLLY GIRL LUNCH BOX,1,11-09-2011 11:24,1.95,17377.0,United Kingdom,2011-11-09,1.95
560434,22907,PACK OF 20 NAPKINS PANTRY DESIGN,3,18-07-2011 15:56,1.63,,United Kingdom,2011-07-18,4.89
569205,23323,WHITE WICKER STAR ,5,02-10-2011 10:55,2.1,16923.0,United Kingdom,2011-02-10,10.5
576618,23196,VINTAGE LEAF MAGNETIC NOTEPAD,1,15-11-2011 17:00,3.29,,United Kingdom,2011-11-15,3.29
575867,22602,RETROSPOT WOODEN HEART DECORATION,4,11-11-2011 12:44,0.85,15034.0,United Kingdom,2011-11-11,3.4
543915,22440,BALLOON WATER BOMB PACK OF 35,20,14-02-2011 13:21,0.42,13717.0,United Kingdom,2011-02-14,8.4
549196,21498,RED RETROSPOT WRAP ,50,07-04-2011 10:33,0.42,14911.0,EIRE,2011-07-04,21.0
548156,23177,TREASURE ISLAND BOOK BOX,1,29-03-2011 13:22,2.25,14871.0,United Kingdom,2011-03-29,2.25
543377,84987,SET OF 36 TEATIME PAPER DOILIES,12,07-02-2011 15:14,1.45,13725.0,United Kingdom,2011-07-02,17.4
544657,21175,GIN + TONIC DIET METAL SIGN,6,22-02-2011 13:08,2.55,14895.0,United Kingdom,2011-02-22,15.299999999999999
576661,85099B,JUMBO BAG RED RETROSPOT,2,16-11-2011 11:17,2.08,17377.0,United Kingdom,2011-11-16,4.16
568564,21926,RED/CREAM STRIPE CUSHION COVER ,4,27-09-2011 17:03,1.25,17576.0,United Kingdom,2011-09-27,5.0
568671,22945,CHRISTMAS METAL TAGS ASSORTED ,24,28-09-2011 13:13,0.85,13139.0,United Kingdom,2011-09-28,20.4
563200,21390,FILIGRIS HEART WITH BUTTERFLY,2,14-08-2011 10:49,1.25,13838.0,United Kingdom,2011-08-14,2.5
544766,22383,LUNCH BAG SUKI  DESIGN ,1,23-02-2011 11:09,4.96,,United Kingdom,2011-02-23,4.96
556828,22900,SET 2 TEA TOWELS I LOVE LONDON ,4,15-06-2011 10:39,3.25,17284.0,United Kingdom,2011-06-15,13.0
541596,22227,HANGING HEART MIRROR DECORATION ,8,19-01-2011 16:19,0.65,17602.0,United Kingdom,2011-01-19,5.2
568567,22676,FRENCH BLUE METAL DOOR SIGN 1,1,27-09-2011 18:41,2.46,,United Kingdom,2011-09-27,2.46
560453,22745,POPPY'S PLAYHOUSE BEDROOM ,6,19-07-2011 09:52,2.1,13209.0,United Kingdom,2011-07-19,12.600000000000001
541424,84968C,SET OF 16 VINTAGE PISTACHIO CUTLERY,9,17-01-2011 17:57,8.29,,United Kingdom,2011-01-17,74.60999999999999
576339,22367,CHILDRENS APRON SPACEBOY DESIGN,3,14-11-2011 15:27,4.13,14096.0,United Kingdom,2011-11-14,12.39
579158,22971,QUEENS GUARD COFFEE MUG,6,28-11-2011 13:53,2.55,17188.0,United Kingdom,2011-11-28,15.299999999999999
562934,23072,MARIE ANTOINETTE TRINKET BOX SILVER,1,10-08-2011 16:56,12.5,,United Kingdom,2011-10-08,12.5
545289,22692,DOORMAT WELCOME TO OUR HOME,2,01-03-2011 11:55,7.95,14732.0,United Kingdom,2011-01-03,15.9
551997,22607,WOODEN ROUNDERS GARDEN SET ,1,05-05-2011 15:47,16.63,,United Kingdom,2011-05-05,16.63
560296,20712,JUMBO BAG WOODLAND ANIMALS,8,18-07-2011 10:21,4.13,,United Kingdom,2011-07-18,33.04
568878,23393,HOME SWEET HOME CUSHION COVER ,6,29-09-2011 12:34,3.75,14524.0,United Kingdom,2011-09-29,22.5
575766,84946,ANTIQUE SILVER T-LIGHT GLASS,18,11-11-2011 11:06,1.25,12856.0,United Kingdom,2011-11-11,22.5
552322,48184,DOORMAT ENGLISH ROSE ,2,09-05-2011 09:16,7.95,17049.0,United Kingdom,2011-09-05,15.9
548862,22485,SET OF 2 WOODEN MARKET CRATES,1,04-04-2011 13:47,12.75,17956.0,United Kingdom,2011-04-04,12.75
547030,22567,20 DOLLY PEGS RETROSPOT,12,20-03-2011 10:17,1.25,12948.0,United Kingdom,2011-03-20,15.0
556408,22371,AIRLINE BAG VINTAGE TOKYO 78,1,10-06-2011 11:54,4.25,13533.0,United Kingdom,2011-10-06,4.25
556108,20666,ECONOMY HOLIDAY PURSE,1,08-06-2011 17:59,2.46,,United Kingdom,2011-08-06,2.46
563920,23032,DRAWER KNOB CRACKLE GLAZE IVORY,12,21-08-2011 14:00,1.65,16407.0,United Kingdom,2011-08-21,19.799999999999997
538566,22837,HOT WATER BOTTLE BABUSHKA ,7,13-12-2010 11:21,4.65,,United Kingdom,2010-12-13,32.550000000000004
569403,22691,DOORMAT WELCOME SUNRISE,2,04-10-2011 09:02,8.25,13319.0,United Kingdom,2011-04-10,16.5
577598,22423,REGENCY CAKESTAND 3 TIER,4,21-11-2011 08:19,12.75,13430.0,United Kingdom,2011-11-21,51.0
569215,22339,CHRISTMAS TREE PAINTED ZINC ,20,02-10-2011 12:30,0.19,13571.0,United Kingdom,2011-02-10,3.8
541219,22031,BOTANICAL LAVENDER BIRTHDAY CARD,5,14-01-2011 14:06,0.42,,United Kingdom,2011-01-14,2.1
536976,84029E,RED WOOLLY HOTTIE WHITE HEART.,3,03-12-2010 14:18,3.75,14723.0,United Kingdom,2010-03-12,11.25
556484,22149,FELTCRAFT 6 FLOWER FRIENDS,3,12-06-2011 13:17,2.1,16938.0,United Kingdom,2011-12-06,6.300000000000001
547489,21524,DOORMAT SPOTTY HOME SWEET HOME,4,23-03-2011 11:44,7.95,17830.0,United Kingdom,2011-03-23,31.8
580188,22866,HAND WARMER SCOTTY DOG DESIGN,10,02-12-2011 12:02,2.1,16440.0,United Kingdom,2011-02-12,21.0
537826,22508,DOORSTOP RETROSPOT HEART,1,08-12-2010 14:38,3.75,15581.0,United Kingdom,2010-08-12,3.75
539437,72225C,LAVENDER SCENT CAKE CANDLE,24,17-12-2010 14:54,0.29,,United Kingdom,2010-12-17,6.959999999999999
570690,22310,IVORY KNITTED MUG COSY ,1,11-10-2011 16:37,3.29,,United Kingdom,2011-11-10,3.29
541999,90040B,MURANO STYLE GLASS BRACELET BLACK,6,25-01-2011 10:45,3.73,,United Kingdom,2011-01-25,22.38
561098,22457,NATURAL SLATE HEART CHALKBOARD ,6,25-07-2011 10:56,2.95,14194.0,United Kingdom,2011-07-25,17.700000000000003
575698,35471D,SET OF 3 BIRD LIGHT PINK FEATHER ,24,10-11-2011 16:51,0.39,16094.0,United Kingdom,2011-10-11,9.36
571913,21704,BAG 250g SWIRLY MARBLES,12,19-10-2011 15:29,0.85,18210.0,United Kingdom,2011-10-19,10.2
560694,23202,JUMBO BAG VINTAGE LEAF,10,20-07-2011 12:05,2.08,12757.0,Portugal,2011-07-20,20.8
569000,23233,WRAP POPPIES  DESIGN,25,29-09-2011 17:36,0.42,17015.0,United Kingdom,2011-09-29,10.5
564959,22617,BAKING SET SPACEBOY DESIGN,3,31-08-2011 14:22,4.95,17299.0,United Kingdom,2011-08-31,14.850000000000001
565205,22943,CHRISTMAS LIGHTS 10 VINTAGE BAUBLES,12,01-09-2011 16:45,4.95,14735.0,United Kingdom,2011-01-09,59.400000000000006
575931,23263,SET OF 3 WOODEN HEART DECORATIONS,12,13-11-2011 10:35,1.25,16560.0,United Kingdom,2011-11-13,15.0
554702,21523,DOORMAT FANCY FONT HOME SWEET HOME,2,26-05-2011 09:45,7.95,15805.0,United Kingdom,2011-05-26,15.9
565994,22698,PINK REGENCY TEACUP AND SAUCER,2,08-09-2011 11:46,2.95,13244.0,United Kingdom,2011-08-09,5.9
550632,23176,ABC TREASURE BOOK BOX ,1,19-04-2011 14:56,2.25,16907.0,United Kingdom,2011-04-19,2.25
559055,21576,LETS GO SHOPPING COTTON TOTE BAG,2,05-07-2011 17:09,1.63,,United Kingdom,2011-05-07,3.26
548893,21381,MINI WOODEN HAPPY BIRTHDAY GARLAND,1,04-04-2011 15:54,3.29,,United Kingdom,2011-04-04,3.29
575177,22251,BIRDHOUSE DECORATION MAGIC GARDEN,1,08-11-2011 18:41,2.46,,United Kingdom,2011-08-11,2.46
569894,23319,BOX OF 6 MINI 50'S CRACKERS,2,06-10-2011 15:53,2.49,15707.0,United Kingdom,2011-06-10,4.98
576052,84987,SET OF 36 TEATIME PAPER DOILIES,1,13-11-2011 14:48,1.45,15787.0,United Kingdom,2011-11-13,1.45
551292,23078,ICE CREAM PEN LIP GLOSS ,96,27-04-2011 14:27,1.04,14298.0,United Kingdom,2011-04-27,99.84
572236,23512,EMBROIDERED RIBBON REEL ROSIE,3,21-10-2011 14:42,2.08,14646.0,Netherlands,2011-10-21,6.24
565445,23396,LA JARDIN BOTANIQUE CUSHION COVER,2,04-09-2011 14:50,3.75,13548.0,United Kingdom,2011-04-09,7.5
554823,21733,RED HANGING HEART T-LIGHT HOLDER,10,26-05-2011 14:20,2.95,16624.0,United Kingdom,2011-05-26,29.5
572309,23219,LAUREL STAR ANTIQUE SILVER ,2,23-10-2011 15:29,1.25,14432.0,United Kingdom,2011-10-23,2.5
550740,22426,ENAMEL WASH BOWL CREAM,1,20-04-2011 11:33,8.29,,United Kingdom,2011-04-20,8.29
559349,20934,SET/3 POT PLANT CANDLES,2,07-07-2011 17:33,5.45,15150.0,United Kingdom,2011-07-07,10.9
555542,22842,BISCUIT TIN VINTAGE RED,6,05-06-2011 12:51,6.75,15108.0,European Community,2011-05-06,40.5
552881,22979,PANTRY WASHING UP BRUSH,12,12-05-2011 10:03,1.45,18245.0,United Kingdom,2011-12-05,17.4
549047,22316,200 BENDY SKULL STRAWS,1,06-04-2011 10:07,1.25,17783.0,United Kingdom,2011-06-04,1.25
550912,22501,PICNIC BASKET WICKER LARGE,2,21-04-2011 13:17,9.95,13267.0,United Kingdom,2011-04-21,19.9
568134,21108,FAIRY CAKE FLANNEL ASSORTED COLOUR,1,23-09-2011 17:02,4.96,,United Kingdom,2011-09-23,4.96
569106,48187,DOORMAT NEW ENGLAND,1,30-09-2011 12:36,8.25,17376.0,United Kingdom,2011-09-30,8.25
539436,22750,FELTCRAFT PRINCESS LOLA DOLL,1,17-12-2010 14:49,7.62,,United Kingdom,2010-12-17,7.62
577108,21914,BLUE HARMONICA IN BOX ,5,17-11-2011 17:34,1.25,15983.0,United Kingdom,2011-11-17,6.25
547063,22329,ROUND CONTAINER SET OF 5 RETROSPOT,2,20-03-2011 13:33,1.65,14769.0,United Kingdom,2011-03-20,3.3
543309,22918,HERB MARKER PARSLEY,1,07-02-2011 12:05,0.65,18118.0,United Kingdom,2011-07-02,0.65
581238,20713,JUMBO BAG OWLS,5,08-12-2011 10:53,4.13,,United Kingdom,2011-08-12,20.65
581425,21977,PACK OF 60 PINK PAISLEY CAKE CASES,3,08-12-2011 15:31,0.55,14796.0,United Kingdom,2011-08-12,1.6500000000000001
540359,20727,LUNCH BAG  BLACK SKULL.,20,06-01-2011 15:29,1.65,18041.0,United Kingdom,2011-06-01,33.0
580983,22601,CHRISTMAS RETROSPOT ANGEL WOOD,3,06-12-2011 16:26,1.63,,United Kingdom,2011-06-12,4.89
578357,84375,SET OF 20 KIDS COOKIE CUTTERS,3,24-11-2011 10:24,2.1,17228.0,United Kingdom,2011-11-24,6.300000000000001
539453,22065,CHRISTMAS PUDDING TRINKET POT ,1,17-12-2010 17:08,3.36,,United Kingdom,2010-12-17,3.36
562551,90209C,PINK ENAMEL+GLASS HAIR COMB,3,05-08-2011 16:19,2.1,17231.0,United Kingdom,2011-05-08,6.300000000000001
569202,22411,JUMBO SHOPPER VINTAGE RED PAISLEY,1,30-09-2011 17:22,4.13,,United Kingdom,2011-09-30,4.13
565766,22494,EMERGENCY FIRST AID TIN ,2,06-09-2011 14:23,1.25,17841.0,United Kingdom,2011-06-09,2.5
542720,20971,PINK BLUE FELT CRAFT TRINKET BOX,12,31-01-2011 14:35,1.25,12778.0,Netherlands,2011-01-31,15.0
569325,23333,IVORY WICKER HEART MEDIUM,13,03-10-2011 12:41,1.25,16774.0,United Kingdom,2011-03-10,16.25
566006,23225,CHERUB HEART DECORATION SILVER ,12,08-09-2011 12:01,0.83,13018.0,United Kingdom,2011-08-09,9.959999999999999
575512,23486,ANTIQUE HEART SHELF UNIT,1,10-11-2011 10:36,16.65,14121.0,United Kingdom,2011-10-11,16.65
562779,22212,FOUR HOOK  WHITE LOVEBIRDS,1,09-08-2011 12:58,2.1,17841.0,United Kingdom,2011-09-08,2.1
556067,47566,PARTY BUNTING,1,08-06-2011 14:35,4.95,12748.0,United Kingdom,2011-08-06,4.95
571508,90206C,CRYSTAL DIAMANTE STAR BROOCH,1,17-10-2011 15:27,4.98,,United Kingdom,2011-10-17,4.98
550321,22523,CHILDS GARDEN FORK PINK,1,17-04-2011 12:49,0.85,16770.0,United Kingdom,2011-04-17,0.85
552469,21224,SET/4 SKULL BADGES,3,09-05-2011 15:34,1.25,12867.0,United Kingdom,2011-09-05,3.75
561033,22029,SPACEBOY BIRTHDAY CARD,12,24-07-2011 11:40,0.42,14443.0,United Kingdom,2011-07-24,5.04
546424,22241,GARLAND WOODEN HAPPY EASTER,3,13-03-2011 12:51,1.25,13956.0,United Kingdom,2011-03-13,3.75
540499,21868,POTTING SHED TEA MUG,6,09-01-2011 10:21,1.25,16923.0,United Kingdom,2011-09-01,7.5
568411,22666,RECIPE BOX PANTRY YELLOW DESIGN,1,27-09-2011 10:52,5.79,,United Kingdom,2011-09-27,5.79
558963,21390,FILIGRIS HEART WITH BUTTERFLY,48,05-07-2011 10:57,1.25,14235.0,United Kingdom,2011-05-07,60.0
556024,22276,WASH BAG VINTAGE ROSE PAISLEY,6,08-06-2011 12:21,2.55,12808.0,Portugal,2011-08-06,15.299999999999999
579147,23210,WHITE ROCKING HORSE HAND PAINTED,5,28-11-2011 13:20,1.25,13263.0,United Kingdom,2011-11-28,6.25
544434,21218,RED SPOTTY BISCUIT TIN,1,18-02-2011 16:12,8.29,,United Kingdom,2011-02-18,8.29
557112,20963,APPLE BATH SPONGE,1,16-06-2011 16:31,2.46,,United Kingdom,2011-06-16,2.46
579301,85071B,RED CHARLIE+LOLA PERSONAL DOORSIGN,2,29-11-2011 11:32,0.39,18118.0,United Kingdom,2011-11-29,0.78
558679,22150,3 STRIPEY MICE FELTCRAFT,6,01-07-2011 10:58,1.95,17800.0,United Kingdom,2011-01-07,11.7
555853,85049G,CHOCOLATE BOX RIBBONS ,1,07-06-2011 13:44,1.25,14375.0,United Kingdom,2011-07-06,1.25
559693,22891,TEA FOR ONE POLKADOT,1,11-07-2011 16:21,4.13,,United Kingdom,2011-11-07,4.13
568165,20754,RETROSPOT RED WASHING UP GLOVES,2,25-09-2011 12:42,2.1,17131.0,United Kingdom,2011-09-25,4.2
576597,23521,WALL ART CAT AND BIRD ,6,15-11-2011 14:57,2.89,14194.0,United Kingdom,2011-11-15,17.34
573152,23169,CLASSIC GLASS COOKIE JAR,3,27-10-2011 20:16,4.15,17530.0,United Kingdom,2011-10-27,12.450000000000001
568693,21061,PARTY INVITES FOOTBALL,1,28-09-2011 14:54,0.85,,United Kingdom,2011-09-28,0.85
557267,22150,3 STRIPEY MICE FELTCRAFT,1,19-06-2011 11:23,1.95,16805.0,United Kingdom,2011-06-19,1.95
545445,22896,PEG BAG APPLES DESIGN,6,02-03-2011 16:26,2.55,17738.0,United Kingdom,2011-02-03,15.299999999999999
571119,22086,PAPER CHAIN KIT 50'S CHRISTMAS ,19,14-10-2011 09:04,6.63,,United Kingdom,2011-10-14,125.97
580258,21928,JUMBO BAG SCANDINAVIAN BLUE PAISLEY,100,02-12-2011 12:28,1.79,13798.0,United Kingdom,2011-02-12,179.0
581217,22549,PICTURE DOMINOES,2,08-12-2011 09:20,3.29,,United Kingdom,2011-08-12,6.58
556814,23133,LARGE IVORY HEART WALL ORGANISER,2,15-06-2011 08:34,8.25,14852.0,United Kingdom,2011-06-15,16.5
550458,22382,LUNCH BAG SPACEBOY DESIGN ,2,18-04-2011 13:13,4.13,,United Kingdom,2011-04-18,8.26
558628,23209,LUNCH BAG DOILEY PATTERN ,10,30-06-2011 17:59,1.65,12626.0,Germany,2011-06-30,16.5
566221,90200B,BLACK SWEETHEART BRACELET,1,09-09-2011 16:13,4.15,,United Kingdom,2011-09-09,4.15
537378,22082,RIBBON REEL STRIPES DESIGN ,20,06-12-2010 13:06,1.65,14911.0,EIRE,2010-06-12,33.0
565841,84032B,CHARLIE + LOLA RED HOT WATER BOTTLE,1,07-09-2011 12:04,3.29,,United Kingdom,2011-07-09,3.29
564321,84406B,CREAM CUPID HEARTS COAT HANGER,1,24-08-2011 13:22,4.15,15059.0,United Kingdom,2011-08-24,4.15
564327,22386,JUMBO BAG PINK POLKADOT,100,24-08-2011 13:33,1.74,16029.0,United Kingdom,2011-08-24,174.0
553895,22907,PACK OF 20 NAPKINS PANTRY DESIGN,12,19-05-2011 17:18,0.85,15271.0,United Kingdom,2011-05-19,10.2
557484,23245,SET OF 3 REGENCY CAKE TINS,1,20-06-2011 14:36,4.95,14796.0,United Kingdom,2011-06-20,4.95
554278,84077,WORLD WAR 2 GLIDERS ASSTD DESIGNS,48,23-05-2011 13:25,0.29,13831.0,United Kingdom,2011-05-23,13.919999999999998
568317,48194,DOORMAT HEARTS,4,26-09-2011 13:25,8.25,17491.0,United Kingdom,2011-09-26,33.0
545475,22540,MINI JIGSAW CIRCUS PARADE ,240,03-03-2011 10:59,0.36,12415.0,Australia,2011-03-03,86.39999999999999
570027,22726,ALARM CLOCK BAKELIKE GREEN,4,07-10-2011 10:41,3.75,14844.0,United Kingdom,2011-07-10,15.0
558475,22907,PACK OF 20 NAPKINS PANTRY DESIGN,4,29-06-2011 15:58,1.63,,United Kingdom,2011-06-29,6.52
545303,22777,GLASS CLOCHE LARGE,2,01-03-2011 12:48,8.5,15319.0,United Kingdom,2011-01-03,17.0
566171,23355,HOT WATER BOTTLE KEEP CALM,1,09-09-2011 12:22,4.95,18118.0,United Kingdom,2011-09-09,4.95
541883,22773,GREEN DRAWER KNOB ACRYLIC EDWARDIAN,24,24-01-2011 10:56,1.25,13408.0,United Kingdom,2011-01-24,30.0
547658,20723,STRAWBERRY CHARLOTTE BAG,6,24-03-2011 13:04,0.85,13736.0,United Kingdom,2011-03-24,5.1
547083,21625,VINTAGE UNION JACK APRON,1,20-03-2011 15:21,6.95,15452.0,United Kingdom,2011-03-20,6.95
566976,23307,SET OF 60 PANTRY DESIGN CAKE CASES ,24,16-09-2011 09:27,0.55,15382.0,United Kingdom,2011-09-16,13.200000000000001
567474,82583,HOT BATHS METAL SIGN,2,20-09-2011 12:53,2.1,13448.0,United Kingdom,2011-09-20,4.2
542303,22357,KINGS CHOICE BISCUIT TIN,4,27-01-2011 11:05,4.25,12539.0,Spain,2011-01-27,17.0
565421,22776,SWEETHEART 3 TIER CAKE STAND ,1,04-09-2011 12:10,9.95,16744.0,United Kingdom,2011-04-09,9.95
568060,22384,LUNCH BAG PINK POLKADOT,1,23-09-2011 13:11,1.65,14546.0,United Kingdom,2011-09-23,1.65
542220,21843,RED RETROSPOT CAKE STAND,3,26-01-2011 12:38,10.95,15373.0,United Kingdom,2011-01-26,32.849999999999994
572047,72817,SET OF 2 CHRISTMAS DECOUPAGE CANDLE,4,20-10-2011 12:13,0.79,16474.0,United Kingdom,2011-10-20,3.16
577358,22998,TRAVEL CARD WALLET KEEP CALM,3,18-11-2011 15:59,0.83,,United Kingdom,2011-11-18,2.4899999999999998
536987,22304,COFFEE MUG BLUE PAISLEY DESIGN,1,03-12-2010 14:54,2.55,17198.0,United Kingdom,2010-03-12,2.55
561114,22996,TRAVEL CARD WALLET VINTAGE TICKET,24,25-07-2011 12:12,0.42,14775.0,United Kingdom,2011-07-25,10.08
540551,85071A,BLUE CHARLIE+LOLA PERSONAL DOORSIGN,3,10-01-2011 09:43,0.85,,United Kingdom,2011-10-01,2.55
568568,23196,VINTAGE LEAF MAGNETIC NOTEPAD,12,28-09-2011 08:48,1.45,14412.0,United Kingdom,2011-09-28,17.4
578532,23191,BUNDLE OF 3 RETRO NOTE BOOKS,12,24-11-2011 14:40,1.65,18130.0,United Kingdom,2011-11-24,19.799999999999997
568786,23202,JUMBO BAG VINTAGE LEAF,20,29-09-2011 09:16,2.08,15144.0,United Kingdom,2011-09-29,41.6
556500,22179,SET 10 NIGHT OWL LIGHTS,2,13-06-2011 07:58,6.75,13468.0,United Kingdom,2011-06-13,13.5
580872,23208,LUNCH BAG VINTAGE LEAF DESIGN,3,06-12-2011 12:02,1.65,18283.0,United Kingdom,2011-06-12,4.949999999999999
552121,21498,RED RETROSPOT WRAP ,25,06-05-2011 11:40,0.42,15757.0,United Kingdom,2011-06-05,10.5
549546,22634,CHILDS BREAKFAST SET SPACEBOY ,2,10-04-2011 11:24,9.95,16889.0,United Kingdom,2011-10-04,19.9
569027,23199,JUMBO BAG APPLES,10,30-09-2011 10:19,2.08,13089.0,United Kingdom,2011-09-30,20.8
571323,85099B,JUMBO BAG RED RETROSPOT,10,17-10-2011 11:07,2.08,13534.0,United Kingdom,2011-10-17,20.8
552469,23231,WRAP DOILEY DESIGN,25,09-05-2011 15:34,0.42,12867.0,United Kingdom,2011-09-05,10.5
575740,23215,JINGLE BELL HEART ANTIQUE SILVER,12,11-11-2011 09:25,2.08,18130.0,United Kingdom,2011-11-11,24.96
575930,21065,BOOM BOX SPEAKER GIRLS,1,11-11-2011 17:58,4.13,,United Kingdom,2011-11-11,4.13
576857,22092,BLUE PAISLEY TISSUE BOX,1,16-11-2011 15:52,0.39,12748.0,United Kingdom,2011-11-16,0.39
553348,23199,JUMBO BAG APPLES,10,16-05-2011 13:20,2.08,14911.0,EIRE,2011-05-16,20.8
541206,22367,CHILDRENS APRON SPACEBOY DESIGN,100,14-01-2011 12:24,1.65,14646.0,Netherlands,2011-01-14,165.0
575141,23294,SET OF 6 SNACK LOAF BAKING CASES,8,08-11-2011 15:35,0.83,15615.0,United Kingdom,2011-08-11,6.64
543450,21080,SET/20 RED RETROSPOT PAPER NAPKINS ,25,08-02-2011 12:12,2.46,,United Kingdom,2011-08-02,61.5
580729,22625,RED KITCHEN SCALES,1,05-12-2011 17:24,16.63,,United Kingdom,2011-05-12,16.63
546365,21671,RED SPOT CERAMIC DRAWER KNOB,12,11-03-2011 11:35,1.25,12520.0,Germany,2011-11-03,15.0
569372,23169,CLASSIC GLASS COOKIE JAR,6,03-10-2011 16:04,8.29,,United Kingdom,2011-03-10,49.739999999999995
578946,22302,COFFEE MUG PEARS  DESIGN,1,27-11-2011 13:47,2.55,16005.0,United Kingdom,2011-11-27,2.55
569897,22554,PLASTERS IN TIN WOODLAND ANIMALS,1,06-10-2011 16:01,1.65,17813.0,United Kingdom,2011-06-10,1.65
578104,22942,CHRISTMAS LIGHTS 10 SANTAS ,2,23-11-2011 08:43,8.5,13969.0,United Kingdom,2011-11-23,17.0
541489,21564,PINK  HEART SHAPE LOVE BUCKET ,2,18-01-2011 13:38,2.95,15023.0,United Kingdom,2011-01-18,5.9
579572,23202,JUMBO BAG VINTAGE LEAF,10,30-11-2011 11:49,2.08,15394.0,United Kingdom,2011-11-30,20.8
562574,22570,FELTCRAFT CUSHION RABBIT,1,07-08-2011 12:42,3.75,14903.0,United Kingdom,2011-07-08,3.75
566317,22950,36 DOILIES VINTAGE CHRISTMAS,12,12-09-2011 10:19,1.45,13375.0,United Kingdom,2011-12-09,17.4
544293,20724,RED RETROSPOT CHARLOTTE BAG,1,17-02-2011 12:42,0.85,17954.0,United Kingdom,2011-02-17,0.85
558696,20679,EDWARDIAN PARASOL RED,1,01-07-2011 12:09,5.95,16746.0,United Kingdom,2011-01-07,5.95
579744,22138,BAKING SET 9 PIECE RETROSPOT ,3,30-11-2011 14:38,4.95,,United Kingdom,2011-11-30,14.850000000000001
569461,23242,TREASURE TIN BUFFALO BILL ,6,04-10-2011 11:36,2.08,16556.0,United Kingdom,2011-04-10,12.48
540984,72802C,VANILLA SCENT CANDLE JEWELLED BOX,3,12-01-2011 15:44,4.25,14167.0,United Kingdom,2011-12-01,12.75
567304,21164,HOME SWEET HOME METAL SIGN ,1,19-09-2011 13:27,2.95,14704.0,United Kingdom,2011-09-19,2.95
579832,22111,SCOTTIE DOG HOT WATER BOTTLE,3,30-11-2011 15:58,4.95,17434.0,United Kingdom,2011-11-30,14.850000000000001
561100,21179,NO JUNK MAIL METAL SIGN,24,25-07-2011 11:01,0.39,15289.0,United Kingdom,2011-07-25,9.36
546434,22487,WHITE WOOD GARDEN PLANT LADDER,1,14-03-2011 08:41,9.95,12383.0,Belgium,2011-03-14,9.95
552493,47566B,TEA TIME PARTY BUNTING,3,09-05-2011 16:21,10.79,,United Kingdom,2011-09-05,32.37
555637,21078,SET/20 STRAWBERRY PAPER NAPKINS ,12,06-06-2011 12:47,0.85,12535.0,France,2011-06-06,10.2
568997,20750,RED RETROSPOT MINI CASES,2,29-09-2011 17:27,7.95,16233.0,United Kingdom,2011-09-29,15.9
575039,23343,JUMBO BAG VINTAGE CHRISTMAS ,1,08-11-2011 11:53,2.08,15005.0,United Kingdom,2011-08-11,2.08
572076,23129,HEART SHAPED HOLLY WREATH,4,20-10-2011 14:01,4.15,13761.0,United Kingdom,2011-10-20,16.6
555925,22086,PAPER CHAIN KIT 50'S CHRISTMAS ,1,07-06-2011 17:13,5.79,,United Kingdom,2011-07-06,5.79
550907,21928,JUMBO BAG SCANDINAVIAN BLUE PAISLEY,100,21-04-2011 12:35,1.79,13798.0,United Kingdom,2011-04-21,179.0
569479,23225,CHERUB HEART DECORATION SILVER ,144,04-10-2011 12:41,0.72,13408.0,United Kingdom,2011-04-10,103.67999999999999
545468,21829,DINOSAUR KEYRINGS ASSORTED,36,03-03-2011 09:41,0.21,16571.0,United Kingdom,2011-03-03,7.56
537434,22027,TEA PARTY BIRTHDAY CARD,2,06-12-2010 16:57,0.85,,United Kingdom,2010-06-12,1.7
571745,21166,COOK WITH WINE METAL SIGN ,12,19-10-2011 10:48,2.08,14911.0,EIRE,2011-10-19,24.96
572303,22147,FELTCRAFT BUTTERFLY HEARTS,1,23-10-2011 14:56,1.45,18109.0,United Kingdom,2011-10-23,1.45
556905,23053,RECYCLED ACAPULCO MAT PINK,1,15-06-2011 13:05,8.25,16904.0,United Kingdom,2011-06-15,8.25
579503,22698,PINK REGENCY TEACUP AND SAUCER,2,29-11-2011 16:23,2.95,17097.0,Spain,2011-11-29,5.9
536423,21485,RETROSPOT HEART HOT WATER BOTTLE,8,01-12-2010 12:08,4.95,18085.0,United Kingdom,2010-01-12,39.6
567879,23200,JUMBO BAG PEARS,10,22-09-2011 14:53,2.08,16161.0,United Kingdom,2011-09-22,20.8
581217,23614,SET 10 CARDS 12 DAYS WRAP  17058,1,08-12-2011 09:20,3.33,,United Kingdom,2011-08-12,3.33
569234,23284,DOORMAT KEEP CALM AND COME IN,10,02-10-2011 15:33,7.08,17841.0,United Kingdom,2011-02-10,70.8
575959,23344,JUMBO BAG 50'S CHRISTMAS ,3,13-11-2011 12:27,2.08,14547.0,United Kingdom,2011-11-13,6.24
554979,85071C,"CHARLIE+LOLA""EXTREMELY BUSY"" SIGN",2,29-05-2011 11:34,2.55,16931.0,United Kingdom,2011-05-29,5.1
560296,21094,SET/6 RED SPOTTY PAPER PLATES,3,18-07-2011 10:21,2.46,,United Kingdom,2011-07-18,7.38
559401,21936,RED RETROSPOT PICNIC BAG,1,08-07-2011 10:49,2.95,15039.0,United Kingdom,2011-08-07,2.95
539470,21287,SCENTED VELVET LOUNGE CANDLE ,12,19-12-2010 14:03,1.25,14472.0,United Kingdom,2010-12-19,15.0
559038,22328,ROUND SNACK BOXES SET OF 4 FRUITS ,7,05-07-2011 15:31,4.13,,United Kingdom,2011-05-07,28.91
537434,22602,CHRISTMAS RETROSPOT HEART WOOD,1,06-12-2010 16:57,1.66,,United Kingdom,2010-06-12,1.66
573033,23503,PLAYING CARDS KEEP CALM & CARRY ON,4,27-10-2011 13:41,1.25,14099.0,United Kingdom,2011-10-27,5.0
574067,84347,ROTATING SILVER ANGELS T-LIGHT HLDR,60,02-11-2011 14:50,2.55,14088.0,United Kingdom,2011-02-11,153.0
577505,23357,HOT WATER BOTTLE SEX BOMB,4,20-11-2011 12:37,4.95,13118.0,United Kingdom,2011-11-20,19.8
547871,85028L,FRENCH CHATEAU LARGE FRUIT BOWL ,2,27-03-2011 14:28,1.95,16931.0,United Kingdom,2011-03-27,3.9
546365,21058,PARTY INVITES WOODLAND,12,11-03-2011 11:35,0.85,12520.0,Germany,2011-11-03,10.2
560298,84969,BOX OF 6 ASSORTED COLOUR TEASPOONS,1,18-07-2011 10:26,8.29,,United Kingdom,2011-07-18,8.29
576511,23084,RABBIT NIGHT LIGHT,6,15-11-2011 12:07,2.08,13846.0,United Kingdom,2011-11-15,12.48
580502,23490,T-LIGHT HOLDER HANGING LOVE BIRD,1,04-12-2011 13:15,3.75,16931.0,United Kingdom,2011-04-12,3.75
571565,21974,SET OF 36 PAISLEY FLOWER DOILIES,12,18-10-2011 10:18,1.45,12720.0,Germany,2011-10-18,17.4
545060,22768,FAMILY PHOTO FRAME CORNICE,1,27-02-2011 13:47,9.95,15547.0,United Kingdom,2011-02-27,9.95
571282,22976,CIRCUS PARADE CHILDRENS EGG CUP ,1,16-10-2011 13:24,1.25,15545.0,United Kingdom,2011-10-16,1.25
564230,84030e,ENGLISH ROSE HOT WATER BOTTLE,1,24-08-2011 10:22,8.29,,United Kingdom,2011-08-24,8.29
571909,90129C,GREEN GLASS TASSLE BAG CHARM,2,19-10-2011 15:08,2.95,15006.0,United Kingdom,2011-10-19,5.9
572380,23311,VINTAGE CHRISTMAS STOCKING ,6,24-10-2011 11:51,2.55,16019.0,United Kingdom,2011-10-24,15.299999999999999
564755,21931,JUMBO STORAGE BAG SUKI,1,30-08-2011 10:31,4.13,,United Kingdom,2011-08-30,4.13
541131,82578,KITCHEN METAL SIGN,1,14-01-2011 10:16,1.25,,United Kingdom,2011-01-14,1.25
574741,22687,DOORMAT CHRISTMAS VILLAGE,1,06-11-2011 16:13,8.25,15993.0,United Kingdom,2011-06-11,8.25
578065,23367,SET 12 COLOUR PENCILS SPACEBOY ,78,22-11-2011 15:41,1.25,,United Kingdom,2011-11-22,97.5
557518,47013C,WINE BOTTLE DRESSING DARK BLUE,6,20-06-2011 17:14,0.12,15280.0,United Kingdom,2011-06-20,0.72
537855,22988,SOLDIERS EGG CUP ,12,08-12-2010 15:59,1.25,15996.0,United Kingdom,2010-08-12,15.0
572499,23551,PACK OF 12 PAISLEY PARK TISSUES ,24,24-10-2011 14:10,0.39,15786.0,United Kingdom,2011-10-24,9.36
575342,22580,ADVENT CALENDAR GINGHAM SACK,3,09-11-2011 14:44,5.95,17528.0,United Kingdom,2011-09-11,17.85
579673,23199,JUMBO BAG APPLES,3,30-11-2011 12:59,2.08,18283.0,United Kingdom,2011-11-30,6.24
577358,22993,SET OF 4 PANTRY JELLY MOULDS,2,18-11-2011 15:59,2.46,,United Kingdom,2011-11-18,4.92
561192,23322,LARGE WHITE HEART OF WICKER,3,25-07-2011 13:45,2.95,16033.0,United Kingdom,2011-07-25,8.850000000000001
570187,23348,CHILDRENS TOY COOKING UTENSIL SET,2,07-10-2011 15:09,4.13,,United Kingdom,2011-07-10,8.26
565427,72800E,4 IVORY DINNER CANDLES SILVER FLOCK,5,04-09-2011 12:49,2.55,17774.0,United Kingdom,2011-04-09,12.75
544479,22243,5 HOOK HANGER RED MAGIC TOADSTOOL,288,21-02-2011 10:28,1.45,14646.0,Netherlands,2011-02-21,417.59999999999997
579751,22732,3D VINTAGE CHRISTMAS STICKERS ,1,30-11-2011 14:46,1.63,,United Kingdom,2011-11-30,1.63
553544,21033,JUMBO BAG CHARLIE AND LOLA TOYS,1,17-05-2011 15:36,4.13,,United Kingdom,2011-05-17,4.13
537201,22574,HEART WOODEN CHRISTMAS DECORATION,12,05-12-2010 14:19,0.85,12472.0,Germany,2010-05-12,10.2
555150,85170B,SET/6 BLACK BIRD T-LIGHT CANDLES,2,31-05-2011 15:53,4.13,,United Kingdom,2011-05-31,8.26
566281,22086,PAPER CHAIN KIT 50'S CHRISTMAS ,15,11-09-2011 14:15,2.95,12748.0,United Kingdom,2011-11-09,44.25
547644,22055,MINI CAKE STAND  HANGING STRAWBERY,16,24-03-2011 11:38,1.65,14267.0,United Kingdom,2011-03-24,26.4
545475,22846,BREAD BIN DINER STYLE RED ,16,03-03-2011 10:59,14.95,12415.0,Australia,2011-03-03,239.2
558837,85039a,SET/4 RED MINI ROSE CANDLE IN BOWL,2,04-07-2011 11:58,3.29,,United Kingdom,2011-04-07,6.58
561911,23028,DRAWER KNOB CRACKLE GLAZE BLUE,6,01-08-2011 10:26,1.65,12534.0,Germany,2011-01-08,9.899999999999999
572704,79321,CHILLI LIGHTS,9,25-10-2011 14:39,12.46,,United Kingdom,2011-10-25,112.14000000000001
551014,23137,ZINC WIRE SWEETHEART LETTER TRAY,4,26-04-2011 11:04,3.75,13209.0,United Kingdom,2011-04-26,15.0
560090,79144B,PAINTED LIGHTBULB STAR+ MOON,2,14-07-2011 16:46,0.83,,United Kingdom,2011-07-14,1.66
545937,22957,SET 3 PAPER VINTAGE CHICK PAPER EGG,12,08-03-2011 12:05,2.95,12758.0,Portugal,2011-08-03,35.400000000000006
578836,22581,WOOD STOCKING CHRISTMAS SCANDISPOT,20,25-11-2011 15:47,0.29,13069.0,United Kingdom,2011-11-25,5.8
581064,21822,GLITTER CHRISTMAS TREE WITH BELLS,12,07-12-2011 11:16,0.79,13882.0,United Kingdom,2011-07-12,9.48
554310,21172,PARTY METAL SIGN ,2,23-05-2011 15:25,4.13,,United Kingdom,2011-05-23,8.26
573346,22469,HEART OF WICKER SMALL,8,30-10-2011 12:18,1.65,17255.0,United Kingdom,2011-10-30,13.2
565664,22083,PAPER CHAIN KIT RETROSPOT,40,05-09-2011 17:36,2.55,13211.0,United Kingdom,2011-05-09,102.0
578345,22158,3 HEARTS HANGING DECORATION RUSTIC,24,24-11-2011 09:23,2.95,15270.0,United Kingdom,2011-11-24,70.80000000000001
553895,23048,SET OF 10 LANTERNS FAIRY LIGHT STAR,4,19-05-2011 17:18,4.15,15271.0,United Kingdom,2011-05-19,16.6
572127,22197,POPCORN HOLDER,36,21-10-2011 09:20,0.85,14911.0,EIRE,2011-10-21,30.599999999999998
572887,22727,ALARM CLOCK BAKELIKE RED ,8,26-10-2011 13:47,3.75,12362.0,Belgium,2011-10-26,30.0
571641,84347,ROTATING SILVER ANGELS T-LIGHT HLDR,6,18-10-2011 12:07,2.55,17135.0,United Kingdom,2011-10-18,15.299999999999999
577057,22112,CHOCOLATE HOT WATER BOTTLE,2,17-11-2011 14:26,4.95,12748.0,United Kingdom,2011-11-17,9.9
548893,21041,RED RETROSPOT OVEN GLOVE DOUBLE,2,04-04-2011 15:54,5.79,,United Kingdom,2011-04-04,11.58
573556,22867,HAND WARMER BIRD DESIGN,36,31-10-2011 13:51,2.1,17675.0,United Kingdom,2011-10-31,75.60000000000001
540692,22759,SET OF 3 NOTEBOOKS IN PARCEL,12,11-01-2011 09:12,1.65,14320.0,United Kingdom,2011-11-01,19.799999999999997
547940,21781,MA CAMPAGNE CUTLERY BOX,1,28-03-2011 14:43,14.95,16814.0,United Kingdom,2011-03-28,14.95
560249,72741,GRAND CHOCOLATECANDLE,9,17-07-2011 12:26,1.45,17571.0,United Kingdom,2011-07-17,13.049999999999999
537133,22111,SCOTTIE DOG HOT WATER BOTTLE,1,05-12-2010 12:29,4.95,18156.0,United Kingdom,2010-05-12,4.95
572867,22144,CHRISTMAS CRAFT LITTLE FRIENDS,2,26-10-2011 13:19,2.1,14598.0,United Kingdom,2011-10-26,4.2
549129,84596F,SMALL MARSHMALLOWS PINK BOWL,8,06-04-2011 14:53,0.42,17042.0,United Kingdom,2011-06-04,3.36
542796,21985,PACK OF 12 HEARTS DESIGN TISSUES ,12,01-02-2011 11:07,0.29,17356.0,United Kingdom,2011-01-02,3.4799999999999995
567293,23164,REGENCY CAKE SLICE,4,19-09-2011 12:01,4.95,12640.0,France,2011-09-19,19.8
556486,85204,HANGING WOOD AND FELT FLOWER,96,12-06-2011 13:22,0.12,17422.0,United Kingdom,2011-12-06,11.52
538527,22130,PARTY CONE CHRISTMAS DECORATION ,12,13-12-2010 09:52,0.85,15361.0,United Kingdom,2010-12-13,10.2
540126,21109,LARGE CAKE TOWEL CHOCOLATE SPOTS,96,05-01-2011 10:45,1.95,13798.0,United Kingdom,2011-05-01,187.2
540526,22650,CERAMIC PIRATE CHEST MONEY BANK,1,09-01-2011 13:41,1.45,14606.0,United Kingdom,2011-09-01,1.45
572287,23313,VINTAGE CHRISTMAS BUNTING,3,23-10-2011 12:26,4.95,15584.0,United Kingdom,2011-10-23,14.850000000000001
554906,71477,COLOUR GLASS. STAR T-LIGHT HOLDER,4,27-05-2011 11:41,3.25,14194.0,United Kingdom,2011-05-27,13.0
573426,22733,3D TRADITIONAL CHRISTMAS STICKERS,1,31-10-2011 10:17,1.63,,United Kingdom,2011-10-31,1.63
562602,23028,DRAWER KNOB CRACKLE GLAZE BLUE,12,08-08-2011 10:11,1.65,12865.0,Austria,2011-08-08,19.799999999999997
559715,21544,SKULLS  WATER TRANSFER TATTOOS ,24,12-07-2011 10:47,0.85,14132.0,United Kingdom,2011-12-07,20.4
544918,21063,PARTY INVITES JAZZ HEARTS,12,24-02-2011 16:30,0.85,13081.0,United Kingdom,2011-02-24,10.2
537199,22030,SWALLOWS GREETING CARD,12,05-12-2010 14:06,0.42,15894.0,United Kingdom,2010-05-12,5.04
577358,23112,PARISIENNE CURIO CABINET,1,18-11-2011 15:59,14.96,,United Kingdom,2011-11-18,14.96
578233,23365,SET 12 COLOUR PENCILS LOVE LONDON,12,23-11-2011 12:20,0.65,14049.0,United Kingdom,2011-11-23,7.800000000000001
561463,23202,JUMBO BAG VINTAGE LEAF,2,27-07-2011 12:38,2.08,14527.0,United Kingdom,2011-07-27,4.16
566534,21668,RED STRIPE CERAMIC DRAWER KNOB,2,13-09-2011 11:32,2.46,,United Kingdom,2011-09-13,4.92
550499,22088,PAPER BUNTING COLOURED LACE,3,18-04-2011 15:16,5.79,,United Kingdom,2011-04-18,17.37
545706,POST,POSTAGE,1,07-03-2011 09:10,18.0,12712.0,Germany,2011-07-03,18.0
560291,84032A,CHARLIE+LOLA PINK HOT WATER BOTTLE,2,18-07-2011 10:17,5.79,,United Kingdom,2011-07-18,11.58
538379,85123A,WHITE HANGING HEART T-LIGHT HOLDER,1,12-12-2010 11:26,2.95,17126.0,United Kingdom,2010-12-12,2.95
569363,23196,VINTAGE LEAF MAGNETIC NOTEPAD,24,03-10-2011 15:08,1.45,13297.0,United Kingdom,2011-03-10,34.8
546172,22089,PAPER BUNTING VINTAGE PAISLEY,6,10-03-2011 10:32,2.95,14156.0,EIRE,2011-10-03,17.700000000000003
550310,22917,HERB MARKER ROSEMARY,24,17-04-2011 11:04,0.65,15985.0,United Kingdom,2011-04-17,15.600000000000001
576779,23461,SWEETHEART BIRD HOUSE,1,16-11-2011 13:25,4.15,14554.0,United Kingdom,2011-11-16,4.15
572930,21811,HANGING HEART WITH BELL,48,27-10-2011 10:01,0.39,17613.0,United Kingdom,2011-10-27,18.72
546549,22396,MAGNETS PACK OF 4 RETRO PHOTO,1,14-03-2011 16:46,1.25,17799.0,United Kingdom,2011-03-14,1.25
540255,84968A,SET OF 16 VINTAGE ROSE CUTLERY,2,05-01-2011 16:50,8.47,,United Kingdom,2011-05-01,16.94
562549,21929,JUMBO BAG PINK VINTAGE PAISLEY,6,05-08-2011 16:10,2.08,17092.0,United Kingdom,2011-05-08,12.48
562955,72801c,4 ROSE PINK DINNER CANDLES,1,11-08-2011 10:14,2.46,,United Kingdom,2011-11-08,2.46
576236,85071B,RED CHARLIE+LOLA PERSONAL DOORSIGN,1,14-11-2011 13:31,0.39,13755.0,United Kingdom,2011-11-14,0.39
580865,21065,BOOM BOX SPEAKER GIRLS,1,06-12-2011 11:58,1.25,17914.0,United Kingdom,2011-06-12,1.25
573576,22789,T-LIGHT HOLDER SWEETHEART HANGING,1,31-10-2011 14:09,4.13,14096.0,United Kingdom,2011-10-31,4.13
537643,22109,FULL ENGLISH BREAKFAST PLATE,1,07-12-2010 15:34,7.62,,United Kingdom,2010-07-12,7.62
559418,23244,ROUND STORAGE TIN VINTAGE LEAF,6,08-07-2011 11:36,1.95,12681.0,France,2011-08-07,11.7
571461,23086,ZINC  STAR T-LIGHT HOLDER ,2,17-10-2011 14:12,1.25,16932.0,United Kingdom,2011-10-17,2.5
573927,23402,HOME SWEET HOME 3 PEG HANGER ,8,02-11-2011 09:59,3.75,13890.0,United Kingdom,2011-02-11,30.0
560552,21867,PINK UNION JACK  LUGGAGE TAG,1,19-07-2011 12:54,1.25,15311.0,United Kingdom,2011-07-19,1.25
548648,22295,HEART FILIGREE DOVE LARGE,12,01-04-2011 13:20,1.65,12949.0,United Kingdom,2011-01-04,19.799999999999997
562129,21217,RED RETROSPOT ROUND CAKE TINS,1,03-08-2011 09:09,9.95,13186.0,United Kingdom,2011-03-08,9.95
558481,21922,UNION STRIPE WITH FRINGE  HAMMOCK,6,30-06-2011 09:02,7.95,17675.0,United Kingdom,2011-06-30,47.7
542601,22720,SET OF 3 CAKE TINS PANTRY DESIGN ,2,30-01-2011 11:52,4.95,16897.0,United Kingdom,2011-01-30,9.9
563356,22423,REGENCY CAKESTAND 3 TIER,4,15-08-2011 14:44,12.75,16210.0,United Kingdom,2011-08-15,51.0
565836,21982,PACK OF 12 SUKI TISSUES ,24,07-09-2011 11:41,0.39,17511.0,United Kingdom,2011-07-09,9.36
554835,21043,APRON MODERN VINTAGE COTTON,12,26-05-2011 16:11,1.95,15241.0,United Kingdom,2011-05-26,23.4
555554,22607,WOODEN ROUNDERS GARDEN SET ,2,05-06-2011 13:46,9.95,13742.0,United Kingdom,2011-05-06,19.9
575128,84926D,LA PALMIERA TILE COASTER,24,08-11-2011 14:27,0.29,16837.0,United Kingdom,2011-08-11,6.959999999999999
556495,21447,12 IVORY ROSE PEG PLACE SETTINGS,1,12-06-2011 15:14,1.25,18069.0,United Kingdom,2011-12-06,1.25
562204,22780,LIGHT GARLAND BUTTERFILES PINK,1,03-08-2011 12:54,4.25,16324.0,United Kingdom,2011-03-08,4.25
567676,23346,SPACEBOY BEAKER,12,21-09-2011 15:54,1.25,15114.0,United Kingdom,2011-09-21,15.0
563376,23206,LUNCH BAG APPLE DESIGN,1,16-08-2011 10:36,1.65,15752.0,United Kingdom,2011-08-16,1.65
558777,21212,PACK OF 72 RETROSPOT CAKE CASES,1,04-07-2011 10:23,1.25,,United Kingdom,2011-04-07,1.25
560434,20771,CHRYSANTHEMUM  JOURNAL,3,18-07-2011 15:56,2.46,,United Kingdom,2011-07-18,7.38
544393,22386,JUMBO BAG PINK POLKADOT,3,18-02-2011 11:56,1.95,16393.0,United Kingdom,2011-02-18,5.85
574067,22943,CHRISTMAS LIGHTS 10 VINTAGE BAUBLES,33,02-11-2011 14:50,4.25,14088.0,United Kingdom,2011-02-11,140.25
575713,21428,SET3 BOOK BOX GREEN GINGHAM FLOWER ,4,10-11-2011 17:49,4.25,13817.0,Germany,2011-10-11,17.0
564482,23182,TOILET SIGN OCCUPIED OR VACANT,24,25-08-2011 13:40,0.83,13149.0,United Kingdom,2011-08-25,19.919999999999998
544791,84970S,HANGING HEART ZINC T-LIGHT HOLDER,12,23-02-2011 12:33,0.85,14289.0,United Kingdom,2011-02-23,10.2
574315,21715,GIRLS VINTAGE TIN SEASIDE BUCKET,32,03-11-2011 17:53,2.1,17076.0,United Kingdom,2011-03-11,67.2
579456,85178,VICTORIAN SEWING KIT,1,29-11-2011 14:20,1.25,13428.0,United Kingdom,2011-11-29,1.25
568218,21479,WHITE SKULL HOT WATER BOTTLE ,4,26-09-2011 09:52,4.25,13389.0,United Kingdom,2011-09-26,17.0
561605,23234,BISCUIT TIN VINTAGE CHRISTMAS,6,28-07-2011 12:09,2.89,13925.0,United Kingdom,2011-07-28,17.34
550637,22676,FRENCH BLUE METAL DOOR SIGN 1,5,19-04-2011 15:39,1.25,14415.0,United Kingdom,2011-04-19,6.25
537208,22550,HOLIDAY FUN LUDO,1,05-12-2010 15:12,3.75,15889.0,United Kingdom,2010-05-12,3.75
552727,71053,WHITE METAL LANTERN,4,11-05-2011 10:32,3.75,14920.0,United Kingdom,2011-11-05,15.0
552250,22556,PLASTERS IN TIN CIRCUS PARADE ,1,06-05-2011 19:55,1.65,12748.0,United Kingdom,2011-06-05,1.65
547093,21891,TRADITIONAL WOODEN SKIPPING ROPE,12,21-03-2011 08:20,1.25,14762.0,United Kingdom,2011-03-21,15.0
570252,21430,SET/3 RED GINGHAM ROSE STORAGE BOX,4,10-10-2011 09:14,3.75,14665.0,United Kingdom,2011-10-10,15.0
551812,22088,PAPER BUNTING COLOURED LACE,6,04-05-2011 11:39,2.95,15527.0,United Kingdom,2011-04-05,17.700000000000003
556039,21974,SET OF 36 PAISLEY FLOWER DOILIES,12,08-06-2011 12:40,1.45,13001.0,United Kingdom,2011-08-06,17.4
559109,22268,DECORATION SITTING BUNNY,4,06-07-2011 11:52,0.19,15021.0,United Kingdom,2011-06-07,0.76
568938,23102,SILVER HEARTS TABLE DECORATION,3,29-09-2011 14:46,0.83,17220.0,United Kingdom,2011-09-29,2.4899999999999998
569230,22794,SWEETHEART WIRE MAGAZINE RACK,1,02-10-2011 15:07,7.95,16533.0,United Kingdom,2011-02-10,7.95
574908,23084,RABBIT NIGHT LIGHT,24,07-11-2011 15:37,1.79,16009.0,United Kingdom,2011-07-11,42.96
546549,22670,FRENCH WC SIGN BLUE METAL,1,14-03-2011 16:46,1.25,17799.0,United Kingdom,2011-03-14,1.25
580482,23313,VINTAGE CHRISTMAS BUNTING,4,04-12-2011 12:44,4.95,16033.0,United Kingdom,2011-04-12,19.8
565445,22982,PANTRY PASTRY BRUSH,1,04-09-2011 14:50,1.25,13548.0,United Kingdom,2011-04-09,1.25
537397,22867,HAND WARMER BIRD DESIGN,12,06-12-2010 14:19,2.1,16817.0,United Kingdom,2010-06-12,25.200000000000003
541965,21249,WOODLAND  HEIGHT CHART STICKERS ,12,24-01-2011 13:27,2.95,12625.0,Germany,2011-01-24,35.400000000000006
581498,22308,TEA COSY BLUE STRIPE,2,09-12-2011 10:26,4.96,,United Kingdom,2011-09-12,9.92
574547,23266,SET OF 3 WOODEN STOCKING DECORATION,3,04-11-2011 15:08,1.25,17841.0,United Kingdom,2011-04-11,3.75
571082,82582,AREA PATROLLED METAL SIGN,1,13-10-2011 15:25,4.13,,United Kingdom,2011-10-13,4.13
552702,23006,TRAVEL CARD WALLET FLOWER MEADOW,1,10-05-2011 16:00,0.83,,United Kingdom,2011-10-05,0.83
549525,22158,3 HEARTS HANGING DECORATION RUSTIC,1,08-04-2011 15:44,5.79,,United Kingdom,2011-08-04,5.79
566571,23349,ROLL WRAP VINTAGE CHRISTMAS,12,13-09-2011 12:49,1.25,17037.0,United Kingdom,2011-09-13,15.0
581149,82580,BATHROOM METAL SIGN,4,07-12-2011 14:12,0.55,15471.0,United Kingdom,2011-07-12,2.2
555004,21039,RED RETROSPOT SHOPPING BAG,6,31-05-2011 09:37,2.55,13549.0,United Kingdom,2011-05-31,15.299999999999999
564184,21122,SET/10 PINK POLKADOT PARTY CANDLES,24,23-08-2011 15:11,1.25,,EIRE,2011-08-23,30.0
577358,23169,CLASSIC GLASS COOKIE JAR,1,18-11-2011 15:59,8.29,,United Kingdom,2011-11-18,8.29
564558,23145,ZINC T-LIGHT HOLDER STAR LARGE,12,26-08-2011 08:59,0.95,12704.0,Finland,2011-08-26,11.399999999999999
565734,23150,IVORY SWEETHEART SOAP DISH,2,06-09-2011 12:15,2.49,17191.0,United Kingdom,2011-06-09,4.98
577024,21494,ROTATING LEAVES T-LIGHT HOLDER,1,17-11-2011 12:47,1.25,14704.0,United Kingdom,2011-11-17,1.25
549572,23154,SET OF 4 JAM JAR MAGNETS,12,10-04-2011 15:32,2.08,17757.0,United Kingdom,2011-10-04,24.96
560732,22424,ENAMEL BREAD BIN CREAM,1,20-07-2011 14:55,12.75,14056.0,United Kingdom,2011-07-20,12.75
544037,22072,RED RETROSPOT TEA CUP AND SAUCER ,8,15-02-2011 11:31,3.75,14961.0,United Kingdom,2011-02-15,30.0
542470,22960,JAM MAKING SET WITH JARS,6,28-01-2011 11:27,4.25,14133.0,United Kingdom,2011-01-28,25.5
564050,21929,JUMBO BAG PINK VINTAGE PAISLEY,10,22-08-2011 13:32,2.08,17160.0,United Kingdom,2011-08-22,20.8
573311,22730,ALARM CLOCK BAKELIKE IVORY,1,28-10-2011 16:45,3.75,14071.0,United Kingdom,2011-10-28,3.75
579472,23368,SET 12 COLOUR PENCILS DOLLY GIRL ,1,29-11-2011 15:09,0.65,13521.0,United Kingdom,2011-11-29,0.65
559693,20894,HANGING BAUBLE T-LIGHT HOLDER LARGE,1,11-07-2011 16:21,5.79,,United Kingdom,2011-11-07,5.79
563352,23133,LARGE IVORY HEART WALL ORGANISER,2,15-08-2011 14:32,8.25,15706.0,United Kingdom,2011-08-15,16.5
567166,82582,AREA PATROLLED METAL SIGN,12,18-09-2011 12:15,2.1,13078.0,United Kingdom,2011-09-18,25.200000000000003
568701,23407,SET OF 2 TRAYS HOME SWEET HOME,2,28-09-2011 15:07,9.95,13924.0,United Kingdom,2011-09-28,19.9
570872,22380,TOY TIDY SPACEBOY  ,4,12-10-2011 16:40,2.46,,United Kingdom,2011-12-10,9.84
552714,21868,POTTING SHED TEA MUG,12,11-05-2011 09:28,1.25,17164.0,United Kingdom,2011-11-05,15.0
552285,22755,SMALL PURPLE BABUSHKA NOTEBOOK ,2,08-05-2011 12:58,0.85,14684.0,United Kingdom,2011-08-05,1.7
578681,23489,VINTAGE BELLS GARLAND,6,25-11-2011 08:41,2.89,13579.0,United Kingdom,2011-11-25,17.34
543040,22434,BALLOON PUMP WITH 10 BALLOONS,2,02-02-2011 17:06,1.95,17337.0,United Kingdom,2011-02-02,3.9
581238,21558,SKULL LUNCH BOX WITH CUTLERY ,2,08-12-2011 10:53,4.96,,United Kingdom,2011-08-12,9.92
553389,22423,REGENCY CAKESTAND 3 TIER,1,16-05-2011 16:37,24.96,,United Kingdom,2011-05-16,24.96
551014,22622,BOX OF VINTAGE ALPHABET BLOCKS,2,26-04-2011 11:04,9.95,13209.0,United Kingdom,2011-04-26,19.9
567667,23182,TOILET SIGN OCCUPIED OR VACANT,1,21-09-2011 15:24,2.46,,United Kingdom,2011-09-21,2.46
553369,21754,HOME BUILDING BLOCK WORD,4,16-05-2011 14:30,5.95,15044.0,United Kingdom,2011-05-16,23.8
545580,22382,LUNCH BAG SPACEBOY DESIGN ,10,04-03-2011 08:43,1.65,13931.0,United Kingdom,2011-04-03,16.5
554961,84997a,CHILDRENS CUTLERY POLKADOT GREEN ,2,27-05-2011 15:19,8.29,,United Kingdom,2011-05-27,16.58
556042,23209,LUNCH BAG DOILEY PATTERN ,10,08-06-2011 12:44,1.65,14367.0,United Kingdom,2011-08-06,16.5
576328,22411,JUMBO SHOPPER VINTAGE RED PAISLEY,10,14-11-2011 15:19,2.08,13577.0,United Kingdom,2011-11-14,20.8
549247,21622,VINTAGE UNION JACK CUSHION COVER,2,07-04-2011 12:04,4.95,13752.0,United Kingdom,2011-07-04,9.9
568399,47566,PARTY BUNTING,4,27-09-2011 10:26,4.95,16145.0,United Kingdom,2011-09-27,19.8
551277,21899,"KEY FOB , GARAGE DESIGN",2,27-04-2011 13:06,0.65,13637.0,United Kingdom,2011-04-27,1.3
553919,20972,PINK CREAM FELT CRAFT TRINKET BOX ,12,20-05-2011 08:41,1.25,17416.0,United Kingdom,2011-05-20,15.0
547386,22123,PING MICROWAVE APRON,2,22-03-2011 15:52,4.13,,United Kingdom,2011-03-22,8.26
564820,22759,SET OF 3 NOTEBOOKS IN PARCEL,1,30-08-2011 12:16,3.29,,United Kingdom,2011-08-30,3.29
580677,23068,ALUMINIUM STAMPED HEART,4,05-12-2011 14:40,2.49,16200.0,United Kingdom,2011-05-12,9.96
565407,22991,GIRAFFE WOODEN RULER,6,04-09-2011 11:00,1.95,16983.0,United Kingdom,2011-04-09,11.7
556481,22411,JUMBO SHOPPER VINTAGE RED PAISLEY,2,12-06-2011 13:00,2.08,16115.0,United Kingdom,2011-12-06,4.16
567507,22771,CLEAR DRAWER KNOB ACRYLIC EDWARDIAN,15,20-09-2011 14:46,2.46,,United Kingdom,2011-09-20,36.9
557026,21868,POTTING SHED TEA MUG,12,16-06-2011 13:14,1.25,16571.0,United Kingdom,2011-06-16,15.0
545349,21947,SET OF 6 HEART CHOPSTICKS,3,02-03-2011 11:07,1.25,18118.0,United Kingdom,2011-02-03,3.75
556813,23131,MISTLETOE HEART WREATH CREAM,1,14-06-2011 17:28,4.15,,United Kingdom,2011-06-14,4.15
580221,22971,QUEENS GUARD COFFEE MUG,6,02-12-2011 12:13,2.55,14092.0,United Kingdom,2011-02-12,15.299999999999999
563557,22078,RIBBON REEL LACE DESIGN ,10,17-08-2011 13:33,2.1,15786.0,United Kingdom,2011-08-17,21.0
566238,22630,DOLLY GIRL LUNCH BOX,1,11-09-2011 11:24,1.95,17377.0,United Kingdom,2011-11-09,1.95
540541,22718,CARD CAT AND TREE ,12,09-01-2011 15:13,0.42,15799.0,United Kingdom,2011-09-01,5.04
569008,22928,YELLOW GIANT GARDEN THERMOMETER,2,29-09-2011 18:53,5.95,15114.0,United Kingdom,2011-09-29,11.9
550134,21212,PACK OF 72 RETROSPOT CAKE CASES,24,14-04-2011 13:50,0.55,16249.0,United Kingdom,2011-04-14,13.200000000000001
577774,22636,CHILDS BREAKFAST SET CIRCUS PARADE,2,21-11-2011 15:57,8.5,16712.0,United Kingdom,2011-11-21,17.0
553411,22556,PLASTERS IN TIN CIRCUS PARADE ,12,17-05-2011 09:28,1.65,12714.0,France,2011-05-17,19.799999999999997
544931,22891,TEA FOR ONE POLKADOT,3,24-02-2011 18:59,4.25,13501.0,Switzerland,2011-02-24,12.75
550994,84970L,SINGLE HEART ZINC T-LIGHT HOLDER,12,21-04-2011 19:55,0.95,14562.0,United Kingdom,2011-04-21,11.399999999999999
558416,22692,DOORMAT WELCOME TO OUR HOME,1,29-06-2011 10:50,7.95,16059.0,United Kingdom,2011-06-29,7.95
572913,23376,PACK OF 12 VINTAGE CHRISTMAS TISSUE,3,26-10-2011 16:21,0.39,15993.0,United Kingdom,2011-10-26,1.17
572914,22144,CHRISTMAS CRAFT LITTLE FRIENDS,12,26-10-2011 16:25,2.1,12948.0,United Kingdom,2011-10-26,25.200000000000003
562770,23208,LUNCH BAG VINTAGE LEAF DESIGN,10,09-08-2011 11:56,1.65,17139.0,United Kingdom,2011-09-08,16.5
546753,85123A,WHITE HANGING HEART T-LIGHT HOLDER,2,16-03-2011 13:00,2.95,16383.0,United Kingdom,2011-03-16,5.9
555275,22028,PENNY FARTHING BIRTHDAY CARD,1,01-06-2011 17:18,0.83,,United Kingdom,2011-01-06,0.83
543285,22423,REGENCY CAKESTAND 3 TIER,1,07-02-2011 09:48,12.75,14600.0,United Kingdom,2011-07-02,12.75
548219,POST,POSTAGE,1,30-03-2011 09:46,3.95,,United Kingdom,2011-03-30,3.95
549567,21159,MOODY BOY  DOOR HANGER ,1,10-04-2011 15:07,1.45,13632.0,United Kingdom,2011-10-04,1.45
576615,22423,REGENCY CAKESTAND 3 TIER,1,15-11-2011 16:42,12.75,17231.0,United Kingdom,2011-11-15,12.75
548894,84988,SET OF 72 PINK HEART PAPER DOILIES,1,04-04-2011 16:01,2.92,,United Kingdom,2011-04-04,2.92
566042,21931,JUMBO STORAGE BAG SUKI,2,08-09-2011 13:53,2.08,17811.0,United Kingdom,2011-08-09,4.16
553134,23052,RECYCLED ACAPULCO MAT TURQUOISE,2,13-05-2011 12:50,8.25,15382.0,United Kingdom,2011-05-13,16.5
541421,84968A,SET OF 16 VINTAGE ROSE CUTLERY,6,17-01-2011 17:44,8.29,,United Kingdom,2011-01-17,49.739999999999995
570187,21401,BLUE PUDDING SPOON,1,07-10-2011 15:09,0.42,,United Kingdom,2011-07-10,0.42
578074,22791,T-LIGHT GLASS FLUTED ANTIQUE,12,22-11-2011 16:06,1.25,17590.0,United Kingdom,2011-11-22,15.0
562574,23086,ZINC  STAR T-LIGHT HOLDER ,16,07-08-2011 12:42,1.25,14903.0,United Kingdom,2011-07-08,20.0
552824,21936,RED RETROSPOT PICNIC BAG,2,11-05-2011 13:16,2.95,14056.0,United Kingdom,2011-11-05,5.9
567850,20728,LUNCH BAG CARS BLUE,10,22-09-2011 13:18,1.65,15067.0,United Kingdom,2011-09-22,16.5
537434,84580,MOUSE TOY WITH PINK T-SHIRT,2,06-12-2010 16:57,4.21,,United Kingdom,2010-06-12,8.42
539436,84459B,YELLOW METAL CHICKEN HEART ,2,17-12-2010 14:49,3.36,,United Kingdom,2010-12-17,6.72
579297,22386,JUMBO BAG PINK POLKADOT,4,29-11-2011 11:23,4.13,,United Kingdom,2011-11-29,16.52
560225,21722,SWEET PUDDING STICKER SHEET,1,15-07-2011 16:27,0.83,,United Kingdom,2011-07-15,0.83
562213,21986,PACK OF 12 PINK POLKADOT TISSUES,6,03-08-2011 13:39,0.29,13975.0,United Kingdom,2011-03-08,1.7399999999999998
558096,22620,4 TRADITIONAL SPINNING TOPS,2,26-06-2011 13:24,1.45,15532.0,United Kingdom,2011-06-26,2.9
541593,85169B,BLACK LOVE BIRD CANDLE,2,19-01-2011 15:20,1.25,17611.0,United Kingdom,2011-01-19,2.5
557938,82583,HOT BATHS METAL SIGN,1,23-06-2011 15:35,4.13,,United Kingdom,2011-06-23,4.13
536420,22358,KINGS CHOICE TEA CADDY ,6,01-12-2010 12:03,2.95,16583.0,United Kingdom,2010-01-12,17.700000000000003
573509,23370,SET 36 COLOURING PENCILS DOILY,16,31-10-2011 12:21,1.25,16169.0,United Kingdom,2011-10-31,20.0
537645,82582,AREA PATROLLED METAL SIGN,1,07-12-2010 15:34,4.21,,United Kingdom,2010-07-12,4.21
579508,84912B,GREEN ROSE WASHBAG,1,29-11-2011 16:33,3.29,,United Kingdom,2011-11-29,3.29
538652,21948,SET OF 6 CAKE CHOPSTICKS,4,13-12-2010 15:12,1.25,17890.0,United Kingdom,2010-12-13,5.0
567929,22383,LUNCH BAG SUKI DESIGN ,10,22-09-2011 17:31,1.65,12425.0,Portugal,2011-09-22,16.5
578305,22660,DOORMAT I LOVE LONDON,4,23-11-2011 15:44,7.08,14088.0,United Kingdom,2011-11-23,28.32
564835,22698,PINK REGENCY TEACUP AND SAUCER,4,30-08-2011 12:31,5.79,,United Kingdom,2011-08-30,23.16
572312,21615,4 LAVENDER BOTANICAL DINNER CANDLES,2,23-10-2011 15:47,1.25,15022.0,United Kingdom,2011-10-23,2.5
560712,23199,JUMBO BAG APPLES,2,20-07-2011 13:06,2.08,14456.0,United Kingdom,2011-07-20,4.16
542112,20685,DOORMAT RED RETROSPOT,2,25-01-2011 13:55,7.95,13168.0,United Kingdom,2011-01-25,15.9
559052,21328,BALLOONS  WRITING SET ,7,05-07-2011 16:53,0.83,,United Kingdom,2011-05-07,5.81
554820,23200,JUMBO BAG PEARS,10,26-05-2011 14:09,1.95,15622.0,United Kingdom,2011-05-26,19.5
559162,22374,AIRLINE BAG VINTAGE JET SET RED,2,06-07-2011 16:29,4.13,,United Kingdom,2011-06-07,8.26
574672,22586,FELTCRAFT HAIRBAND PINK AND BLUE,2,06-11-2011 12:25,0.85,13532.0,United Kingdom,2011-06-11,1.7
537765,20749,ASSORTED COLOUR MINI CASES,1,08-12-2010 12:08,7.95,14606.0,United Kingdom,2010-08-12,7.95
560650,84077,WORLD WAR 2 GLIDERS ASSTD DESIGNS,48,20-07-2011 11:38,0.29,15529.0,United Kingdom,2011-07-20,13.919999999999998
575176,22819,"BIRTHDAY CARD, RETRO SPOT",3,08-11-2011 18:29,0.42,,United Kingdom,2011-08-11,1.26
576190,47599A,PINK PARTY BAGS,6,14-11-2011 11:46,2.1,15039.0,United Kingdom,2011-11-14,12.600000000000001
548632,71053,WHITE METAL LANTERN,4,01-04-2011 12:25,3.75,17701.0,United Kingdom,2011-01-04,15.0
571903,22940,FELTCRAFT CHRISTMAS FAIRY,4,19-10-2011 14:40,4.25,15754.0,United Kingdom,2011-10-19,17.0
559525,23032,DRAWER KNOB CRACKLE GLAZE IVORY,12,10-07-2011 10:30,1.65,16923.0,United Kingdom,2011-10-07,19.799999999999997
537237,22571,ROCKING HORSE RED CHRISTMAS ,7,06-12-2010 09:58,1.66,,United Kingdom,2010-06-12,11.62
547862,22248,DECORATION  PINK CHICK MAGIC GARDEN,4,27-03-2011 12:54,0.85,12841.0,United Kingdom,2011-03-27,3.4
562933,23343,JUMBO BAG VINTAGE CHRISTMAS ,2,10-08-2011 16:51,4.13,,United Kingdom,2011-10-08,8.26
567537,21790,VINTAGE SNAP CARDS,72,21-09-2011 09:54,0.72,16656.0,United Kingdom,2011-09-21,51.839999999999996
550818,20829,GLITTER HANGING BUTTERFLY STRING,8,20-04-2011 17:10,2.1,15912.0,United Kingdom,2011-04-20,16.8
551352,22699,ROSES REGENCY TEACUP AND SAUCER ,6,28-04-2011 10:20,2.95,16637.0,United Kingdom,2011-04-28,17.700000000000003
579069,23458,DOLLY CABINET 3 DRAWERS ,2,28-11-2011 10:31,14.95,14911.0,EIRE,2011-11-28,29.9
554960,21929,JUMBO BAG PINK VINTAGE PAISLEY,1,27-05-2011 15:18,4.13,,United Kingdom,2011-05-27,4.13
566296,20726,LUNCH BAG WOODLAND,1,11-09-2011 15:47,1.65,17841.0,United Kingdom,2011-11-09,1.65
576364,21770,OPEN CLOSED METAL SIGN,1,14-11-2011 17:40,4.95,15009.0,United Kingdom,2011-11-14,4.95
562843,21094,SET/6 RED SPOTTY PAPER PLATES,4,09-08-2011 17:37,0.83,,United Kingdom,2011-09-08,3.32
562104,22423,REGENCY CAKESTAND 3 TIER,6,02-08-2011 14:31,24.96,,United Kingdom,2011-02-08,149.76
566272,23150,IVORY SWEETHEART SOAP DISH,1,11-09-2011 13:51,2.49,14487.0,United Kingdom,2011-11-09,2.49
546737,21530,DAIRY MAID TOASTRACK,6,16-03-2011 11:52,2.95,13358.0,United Kingdom,2011-03-16,17.700000000000003
568699,21755,LOVE BUILDING BLOCK WORD,3,28-09-2011 14:58,6.25,12352.0,Norway,2011-09-28,18.75
562173,22372,AIRLINE BAG VINTAGE WORLD CHAMPION ,1,03-08-2011 12:12,4.25,14530.0,United Kingdom,2011-03-08,4.25
537638,10002,INFLATABLE POLITICAL GLOBE ,5,07-12-2010 15:28,1.66,,United Kingdom,2010-07-12,8.299999999999999
559477,22302,COFFEE MUG PEARS  DESIGN,18,08-07-2011 13:44,2.55,14315.0,United Kingdom,2011-08-07,45.9
567928,85099F,JUMBO BAG STRAWBERRY,10,22-09-2011 17:31,2.08,12380.0,Belgium,2011-09-22,20.8
566560,23190,BUNDLE OF 3 SCHOOL EXERCISE BOOKS  ,4,13-09-2011 12:09,1.65,17092.0,United Kingdom,2011-09-13,6.6
560453,21060,PARTY INVITES BALLOON GIRL,12,19-07-2011 09:52,0.85,13209.0,United Kingdom,2011-07-19,10.2
556813,21248,DOOR HANGER  MUM + DADS ROOM,1,14-06-2011 17:28,3.29,,United Kingdom,2011-06-14,3.29
540821,21787,RAIN PONCHO RETROSPOT,1,11-01-2011 13:16,1.66,,United Kingdom,2011-11-01,1.66
538370,72818,CHRISTMAS DECOUPAGE CANDLE,12,12-12-2010 11:06,0.85,16923.0,United Kingdom,2010-12-12,10.2
575930,22447,PIN CUSHION BABUSHKA BLUE,1,11-11-2011 17:58,6.63,,United Kingdom,2011-11-11,6.63
577174,20622,VIP PASSPORT COVER ,1,18-11-2011 10:58,2.1,17841.0,United Kingdom,2011-11-18,2.1
546084,22860,EASTER TIN CHICKS PINK DAISY,6,09-03-2011 11:28,1.65,14112.0,United Kingdom,2011-09-03,9.899999999999999
541571,21086,SET/6 RED SPOTTY PAPER CUPS,4,19-01-2011 12:38,0.65,12841.0,United Kingdom,2011-01-19,2.6
578305,35004B,SET OF 3 BLACK FLYING DUCKS,12,23-11-2011 15:44,4.65,14088.0,United Kingdom,2011-11-23,55.800000000000004
571716,22581,WOOD STOCKING CHRISTMAS SCANDISPOT,4,18-10-2011 17:05,0.83,,United Kingdom,2011-10-18,3.32
580615,84947,ANTIQUE SILVER TEA GLASS ENGRAVED,12,05-12-2011 12:05,1.25,16873.0,United Kingdom,2011-05-12,15.0
547327,21559,STRAWBERRY LUNCH BOX WITH CUTLERY,6,22-03-2011 11:28,2.55,12681.0,France,2011-03-22,15.299999999999999
540995,21847,GREEN  DIAMANTE PEN IN GIFT BOX,3,13-01-2011 09:30,1.63,,United Kingdom,2011-01-13,4.89
568095,84926E,FLOWERS TILE COASTER,24,23-09-2011 14:49,0.29,14911.0,EIRE,2011-09-23,6.959999999999999
549716,22457,NATURAL SLATE HEART CHALKBOARD ,6,11-04-2011 14:43,2.95,14628.0,United Kingdom,2011-11-04,17.700000000000003
574559,23284,DOORMAT KEEP CALM AND COME IN,1,04-11-2011 15:50,8.25,14056.0,United Kingdom,2011-04-11,8.25
571180,23074,EMBOSSED HEART TRINKET BOX,12,14-10-2011 10:47,2.08,15498.0,United Kingdom,2011-10-14,24.96
578270,22193,RED DINER WALL CLOCK,1,23-11-2011 13:39,16.63,14096.0,United Kingdom,2011-11-23,16.63
567184,20751,FUNKY WASHING UP GLOVES ASSORTED,1,18-09-2011 15:41,2.1,16033.0,United Kingdom,2011-09-18,2.1
575930,85039A,SET/4 RED MINI ROSE CANDLE IN BOWL,2,11-11-2011 17:58,1.63,,United Kingdom,2011-11-11,3.26
551339,21876,POTTERING MUG,1,27-04-2011 17:18,3.29,,United Kingdom,2011-04-27,3.29
542422,22508,DOORSTOP RETROSPOT HEART,1,27-01-2011 19:33,3.75,14702.0,United Kingdom,2011-01-27,3.75
575602,22942,CHRISTMAS LIGHTS 10 SANTAS ,1,10-11-2011 12:27,8.5,17059.0,United Kingdom,2011-10-11,8.5
577029,23397,FOOT STOOL HOME SWEET HOME ,1,17-11-2011 12:59,9.95,15563.0,United Kingdom,2011-11-17,9.95
545333,21382,SET/4 SPRING FLOWER DECORATION,1,01-03-2011 16:22,5.79,,United Kingdom,2011-01-03,5.79
570388,23526,WALL ART DOG LICENCE ,4,10-10-2011 12:37,5.95,14911.0,EIRE,2011-10-10,23.8
576889,23240,SET OF 4 KNICK KNACK TINS DOILY ,10,16-11-2011 17:24,4.15,12748.0,United Kingdom,2011-11-16,41.5
537434,90214B,"LETTER ""B"" BLING KEY RING",1,06-12-2010 16:57,0.85,,United Kingdom,2010-06-12,0.85
540278,21931,JUMBO STORAGE BAG SUKI,1,06-01-2011 12:31,1.95,15719.0,United Kingdom,2011-06-01,1.95
537240,35599B,BLACK CHRISTMAS TREE 120CM,4,06-12-2010 10:08,5.91,,United Kingdom,2010-06-12,23.64
550148,22722,SET OF 6 SPICE TINS PANTRY DESIGN,1,14-04-2011 14:36,3.95,16882.0,United Kingdom,2011-04-14,3.95
561371,23080,RED METAL BOX TOP SECRET,2,26-07-2011 16:25,8.25,,United Kingdom,2011-07-26,16.5
540352,21650,ASSORTED TUTTI FRUTTI BRACELET,3,06-01-2011 14:27,0.43,,United Kingdom,2011-06-01,1.29
540551,21803,CHRISTMAS TREE STAR DECORATION,4,10-01-2011 09:43,0.43,,United Kingdom,2011-10-01,1.72
557442,22536,MAGIC DRAWING SLATE PURDEY,4,20-06-2011 12:53,0.42,14808.0,United Kingdom,2011-06-20,1.68
544565,22957,SET 3 PAPER VINTAGE CHICK PAPER EGG,6,21-02-2011 12:53,2.95,18055.0,United Kingdom,2011-02-21,17.700000000000003
538520,21826,EIGHT PIECE DINOSAUR SET,2,12-12-2010 16:21,1.25,,United Kingdom,2010-12-12,2.5
581583,20725,LUNCH BAG RED RETROSPOT,40,09-12-2011 12:23,1.45,13777.0,United Kingdom,2011-09-12,58.0
579268,22597,MUSICAL ZINC HEART DECORATION ,72,29-11-2011 09:47,0.29,14321.0,United Kingdom,2011-11-29,20.88
573029,21616,4 PEAR BOTANICAL DINNER CANDLES,1,27-10-2011 13:33,1.25,14971.0,United Kingdom,2011-10-27,1.25
574280,22355,CHARLOTTE BAG SUKI DESIGN,30,03-11-2011 14:47,0.85,13408.0,United Kingdom,2011-03-11,25.5
560538,21907,I'M ON HOLIDAY METAL SIGN,12,19-07-2011 12:19,2.1,16128.0,United Kingdom,2011-07-19,25.200000000000003
556243,22088,PAPER BUNTING COLOURED LACE,1,09-06-2011 16:07,5.79,,United Kingdom,2011-09-06,5.79
547830,21791,VINTAGE HEADS AND TAILS CARD GAME ,2,25-03-2011 15:50,2.46,,United Kingdom,2011-03-25,4.92
555851,22555,PLASTERS IN TIN STRONGMAN,2,07-06-2011 13:37,1.65,13050.0,United Kingdom,2011-07-06,3.3
567153,23298,SPOTTY BUNTING,4,16-09-2011 16:25,4.95,14056.0,United Kingdom,2011-09-16,19.8
565434,21212,PACK OF 72 RETROSPOT CAKE CASES,2,04-09-2011 13:35,0.55,12867.0,United Kingdom,2011-04-09,1.1
560285,23342,MINT DINER WALL CLOCK,2,18-07-2011 09:21,8.5,14944.0,United Kingdom,2011-07-18,17.0
537224,22867,HAND WARMER BIRD DESIGN,6,05-12-2010 16:24,2.1,13174.0,United Kingdom,2010-05-12,12.600000000000001
574941,23329,DECORATIVE WICKER HEART LARGE,40,07-11-2011 17:42,3.95,,United Kingdom,2011-07-11,158.0
579909,23199,JUMBO BAG APPLES,1,01-12-2011 08:51,2.08,,United Kingdom,2011-01-12,2.08
579694,21232,STRAWBERRY CERAMIC TRINKET POT,20,30-11-2011 14:11,2.46,,United Kingdom,2011-11-30,49.2
554808,21165,BEWARE OF THE CAT METAL SIGN ,1,26-05-2011 13:01,1.69,17059.0,United Kingdom,2011-05-26,1.69
572704,22554,PLASTERS IN TIN WOODLAND ANIMALS,1,25-10-2011 14:39,3.29,,United Kingdom,2011-10-25,3.29
541104,21991,BOHEMIAN COLLAGE STATIONERY SET,1,13-01-2011 14:29,2.46,,United Kingdom,2011-01-13,2.46
578947,22138,BAKING SET 9 PIECE RETROSPOT ,2,27-11-2011 13:49,4.95,14547.0,United Kingdom,2011-11-27,9.9
559902,22077,6 RIBBONS RUSTIC CHARM,1,13-07-2011 13:14,1.65,14502.0,United Kingdom,2011-07-13,1.65
557427,47566,PARTY BUNTING,12,20-06-2011 12:14,4.95,12429.0,Denmark,2011-06-20,59.400000000000006
577532,44234,ASSORTED CIRCULAR MOBILE,9,20-11-2011 14:01,0.21,16666.0,United Kingdom,2011-11-20,1.89
564141,21504,SKULLS GREETING CARD,12,23-08-2011 11:47,0.42,17841.0,United Kingdom,2011-08-23,5.04
576137,23084,RABBIT NIGHT LIGHT,24,14-11-2011 10:45,1.79,15482.0,United Kingdom,2011-11-14,42.96
541592,21896,POTTING SHED TWINE,1,19-01-2011 15:08,4.13,,United Kingdom,2011-01-19,4.13
542646,22840,ROUND CAKE TIN VINTAGE RED,1,31-01-2011 11:42,7.95,17220.0,United Kingdom,2011-01-31,7.95
556111,23148,MINIATURE ANTIQUE ROSE HOOK IVORY,12,09-06-2011 09:16,0.83,13004.0,United Kingdom,2011-09-06,9.959999999999999
549978,21754,HOME BUILDING BLOCK WORD,6,13-04-2011 15:00,5.95,14834.0,United Kingdom,2011-04-13,35.7
557019,23201,JUMBO BAG ALPHABET,1,16-06-2011 12:45,2.08,15907.0,United Kingdom,2011-06-16,2.08
541015,21411,GINGHAM HEART  DOORSTOP RED,3,13-01-2011 11:57,4.25,16315.0,United Kingdom,2011-01-13,12.75
575054,22568,FELTCRAFT CUSHION OWL,4,08-11-2011 12:18,3.75,16945.0,United Kingdom,2011-08-11,15.0
556721,21129,SILVER FISHING GNOME ,7,14-06-2011 11:23,6.95,15218.0,United Kingdom,2011-06-14,48.65
555119,22147,FELTCRAFT BUTTERFLY HEARTS,1,31-05-2011 15:22,1.45,15163.0,United Kingdom,2011-05-31,1.45
552867,23298,SPOTTY BUNTING,50,12-05-2011 08:36,4.15,15513.0,United Kingdom,2011-12-05,207.50000000000003
577520,23100,SILVER BELLS TABLE DECORATION,1,20-11-2011 13:20,1.25,14553.0,United Kingdom,2011-11-20,1.25
542898,22795,SWEETHEART RECIPE BOOK STAND,1,01-02-2011 14:01,6.75,16110.0,United Kingdom,2011-01-02,6.75
537638,21934,SKULL SHOULDER BAG,3,07-12-2010 15:28,3.36,,United Kingdom,2010-07-12,10.08
572758,22580,ADVENT CALENDAR GINGHAM SACK,2,25-10-2011 18:39,4.13,,United Kingdom,2011-10-25,8.26
553946,22983,CARD BILLBOARD FONT,12,20-05-2011 10:48,0.42,15601.0,United Kingdom,2011-05-20,5.04
575952,21328,BALLOONS  WRITING SET ,2,13-11-2011 11:55,1.65,16015.0,United Kingdom,2011-11-13,3.3
568671,23312,VINTAGE CHRISTMAS GIFT SACK,8,28-09-2011 13:13,4.15,13139.0,United Kingdom,2011-09-28,33.2
574074,22673,FRENCH GARDEN SIGN BLUE METAL,1,02-11-2011 15:33,2.46,,United Kingdom,2011-02-11,2.46
562420,22077,6 RIBBONS RUSTIC CHARM,1,04-08-2011 16:38,3.29,,United Kingdom,2011-04-08,3.29
537447,22568,FELTCRAFT CUSHION OWL,8,07-12-2010 09:21,3.75,13963.0,United Kingdom,2010-07-12,30.0
555150,21246,RED RETROSPOT BIG BOWL,1,31-05-2011 15:53,4.13,,United Kingdom,2011-05-31,4.13
581414,22722,SET OF 6 SPICE TINS PANTRY DESIGN,1,08-12-2011 14:39,3.95,14730.0,United Kingdom,2011-08-12,3.95
577506,23035,DRAWER KNOB CERAMIC IVORY,18,20-11-2011 12:40,1.45,13212.0,United Kingdom,2011-11-20,26.099999999999998
536592,22324,BLUE POLKADOT KIDS BAG,1,01-12-2010 17:06,4.21,,United Kingdom,2010-01-12,4.21
550123,23207,LUNCH BAG ALPHABET DESIGN,6,14-04-2011 12:39,1.65,,United Kingdom,2011-04-14,9.899999999999999
578026,23486,ANTIQUE HEART SHELF UNIT,1,22-11-2011 13:29,16.65,17659.0,United Kingdom,2011-11-22,16.65
541965,20828,GLITTER BUTTERFLY CLIPS,18,24-01-2011 13:27,2.55,12625.0,Germany,2011-01-24,45.9
560434,84969,BOX OF 6 ASSORTED COLOUR TEASPOONS,3,18-07-2011 15:56,3.29,,United Kingdom,2011-07-18,9.870000000000001
580640,22075,6 RIBBONS ELEGANT CHRISTMAS ,3,05-12-2011 12:51,0.39,16910.0,United Kingdom,2011-05-12,1.17
559923,21504,SKULLS GREETING CARD,1,13-07-2011 16:07,0.83,,United Kingdom,2011-07-13,0.83
542530,21355,TOAST ITS - I LOVE YOU ,12,28-01-2011 13:08,1.25,15365.0,United Kingdom,2011-01-28,15.0
539421,22969,HOMEMADE JAM SCENTED CANDLES,24,17-12-2010 14:21,1.45,14016.0,EIRE,2010-12-17,34.8
579141,22249,DECORATION WHITE CHICK MAGIC GARDEN,3,28-11-2011 13:06,0.85,17019.0,United Kingdom,2011-11-28,2.55
565648,23194,GYMKHANA TREASURE BOOK BOX,1,05-09-2011 16:22,2.25,18196.0,United Kingdom,2011-05-09,2.25
541137,20971,PINK BLUE FELT CRAFT TRINKET BOX,24,14-01-2011 10:39,1.06,13777.0,United Kingdom,2011-01-14,25.44
537241,84032A,CHARLIE+LOLA PINK HOT WATER BOTTLE,6,06-12-2010 10:18,2.95,14293.0,United Kingdom,2010-06-12,17.700000000000003
567076,85071C,"CHARLIE+LOLA""EXTREMELY BUSY"" SIGN",24,16-09-2011 12:27,0.39,15505.0,United Kingdom,2011-09-16,9.36
577332,23311,VINTAGE CHRISTMAS STOCKING ,6,18-11-2011 14:25,2.55,13013.0,United Kingdom,2011-11-18,15.299999999999999
547667,23193,BUFFALO BILL TREASURE BOOK BOX,8,24-03-2011 13:25,2.25,16700.0,United Kingdom,2011-03-24,18.0
557645,85099B,JUMBO BAG RED RETROSPOT,2,21-06-2011 17:08,4.13,,United Kingdom,2011-06-21,8.26
541696,21504,SKULLS GREETING CARD,1,20-01-2011 18:08,0.83,,United Kingdom,2011-01-20,0.83
559163,85099F,JUMBO BAG STRAWBERRY,1,06-07-2011 16:33,4.13,,United Kingdom,2011-06-07,4.13
574368,22171,3 HOOK PHOTO SHELF ANTIQUE WHITE,2,04-11-2011 10:59,8.5,13004.0,United Kingdom,2011-04-11,17.0
546751,22567,20 DOLLY PEGS RETROSPOT,4,16-03-2011 12:45,1.25,13668.0,United Kingdom,2011-03-16,5.0
571098,21114,LAVENDER SCENTED FABRIC HEART,15,13-10-2011 15:38,1.25,17841.0,United Kingdom,2011-10-13,18.75
552254,23298,SPOTTY BUNTING,6,08-05-2011 10:21,4.95,16168.0,United Kingdom,2011-08-05,29.700000000000003
538827,70007,HI TEC ALPINE HAND WARMER,60,14-12-2010 12:59,0.42,14298.0,United Kingdom,2010-12-14,25.2
541266,22896,PEG BAG APPLES DESIGN,9,16-01-2011 16:25,2.55,15673.0,United Kingdom,2011-01-16,22.95
553488,79051A,SMOKEY GREY COLOUR D.O.F. GLASS,6,17-05-2011 12:40,0.29,18043.0,United Kingdom,2011-05-17,1.7399999999999998
562907,21669,BLUE STRIPE CERAMIC DRAWER KNOB,12,10-08-2011 12:44,1.25,14116.0,United Kingdom,2011-10-08,15.0
568947,79302M,"ART LIGHTS,FUNK MONKEY",6,29-09-2011 15:04,2.95,14696.0,United Kingdom,2011-09-29,17.700000000000003
575187,21497,FANCY FONTS BIRTHDAY WRAP,25,09-11-2011 09:06,0.42,16759.0,United Kingdom,2011-09-11,10.5
548007,82494L,WOODEN FRAME ANTIQUE WHITE ,6,29-03-2011 10:51,2.95,13769.0,United Kingdom,2011-03-29,17.700000000000003
550015,22138,BAKING SET 9 PIECE RETROSPOT ,3,14-04-2011 10:54,4.95,17735.0,United Kingdom,2011-04-14,14.850000000000001
567943,23407,SET OF 2 TRAYS HOME SWEET HOME,2,22-09-2011 19:33,9.95,14702.0,United Kingdom,2011-09-22,19.9
566935,48116,DOORMAT MULTICOLOUR STRIPE,400,15-09-2011 15:35,4.58,18102.0,United Kingdom,2011-09-15,1832.0
571183,23014,GLASS APOTHECARY BOTTLE ELIXIR,1,14-10-2011 11:08,3.95,14796.0,United Kingdom,2011-10-14,3.95
575207,22142,CHRISTMAS CRAFT WHITE FAIRY ,12,09-11-2011 10:27,1.45,18172.0,United Kingdom,2011-09-11,17.4
560915,22303,COFFEE MUG APPLES DESIGN,6,21-07-2011 18:19,2.55,13313.0,United Kingdom,2011-07-21,15.299999999999999
552289,21212,PACK OF 72 RETROSPOT CAKE CASES,1,08-05-2011 13:24,0.55,17869.0,United Kingdom,2011-08-05,0.55
541869,22908,PACK OF 20 NAPKINS RED APPLES,6,24-01-2011 09:35,1.63,,United Kingdom,2011-01-24,9.78
543165,21034,REX CASH+CARRY JUMBO SHOPPER,1,03-02-2011 19:58,0.95,13230.0,United Kingdom,2011-03-02,0.95
563062,22659,LUNCH BOX I LOVE LONDON,2,11-08-2011 15:25,1.95,17811.0,United Kingdom,2011-11-08,3.9
576381,82494L,WOODEN FRAME ANTIQUE WHITE ,6,15-11-2011 09:26,2.95,12839.0,United Kingdom,2011-11-15,17.700000000000003
563182,23322,LARGE WHITE HEART OF WICKER,6,12-08-2011 14:33,2.95,17122.0,United Kingdom,2011-12-08,17.700000000000003
552658,23202,JUMBO BAG VINTAGE LEAF,10,10-05-2011 14:57,2.08,14534.0,United Kingdom,2011-10-05,20.8
545085,22470,HEART OF WICKER LARGE,4,28-02-2011 11:19,2.95,15039.0,United Kingdom,2011-02-28,11.8
578293,22667,RECIPE BOX RETROSPOT ,6,23-11-2011 14:36,2.95,15640.0,United Kingdom,2011-11-23,17.700000000000003
539434,10002,INFLATABLE POLITICAL GLOBE ,1,17-12-2010 14:41,1.66,,United Kingdom,2010-12-17,1.66
538368,22532,MAGIC DRAWING SLATE LEAP FROG ,1,12-12-2010 10:57,0.42,15503.0,United Kingdom,2010-12-12,0.42
553638,22846,BREAD BIN DINER STYLE RED ,1,18-05-2011 10:56,16.95,14180.0,United Kingdom,2011-05-18,16.95
573387,21770,OPEN CLOSED METAL SIGN,1,30-10-2011 14:33,4.95,15054.0,United Kingdom,2011-10-30,4.95
559782,23028,DRAWER KNOB CRACKLE GLAZE BLUE,6,12-07-2011 11:55,1.65,12722.0,France,2011-12-07,9.899999999999999
545082,18097C,WHITE TALL PORCELAIN T-LIGHT HOLDER,6,28-02-2011 10:37,2.55,16992.0,United Kingdom,2011-02-28,15.299999999999999
565129,21411,GINGHAM HEART  DOORSTOP RED,1,01-09-2011 12:41,4.25,15719.0,United Kingdom,2011-01-09,4.25
564565,23226,FILIGREE HEART DAISY WHITE,24,26-08-2011 10:50,1.25,14911.0,EIRE,2011-08-26,30.0
548194,22222,CAKE PLATE LOVEBIRD WHITE,1,29-03-2011 15:30,9.96,,United Kingdom,2011-03-29,9.96
556542,21122,SET/10 PINK POLKADOT PARTY CANDLES,3,13-06-2011 12:52,1.25,14719.0,United Kingdom,2011-06-13,3.75
546255,22668,PINK BABY BUNTING,5,10-03-2011 14:56,2.95,13468.0,United Kingdom,2011-10-03,14.75
556237,85099B,JUMBO BAG RED RETROSPOT,8,09-06-2011 15:34,4.13,,United Kingdom,2011-09-06,33.04
539391,22619,SET OF 6 SOLDIER SKITTLES,4,17-12-2010 11:51,3.75,12417.0,Belgium,2010-12-17,15.0
573137,22630,DOLLY GIRL LUNCH BOX,1,27-10-2011 17:15,4.13,,United Kingdom,2011-10-27,4.13
560826,22697,GREEN REGENCY TEACUP AND SAUCER,6,21-07-2011 11:30,2.95,18073.0,United Kingdom,2011-07-21,17.700000000000003
578071,23329,DECORATIVE WICKER HEART LARGE,24,22-11-2011 15:52,1.65,13599.0,United Kingdom,2011-11-22,39.599999999999994
569897,82484,WOOD BLACK BOARD ANT WHITE FINISH,1,06-10-2011 16:01,7.95,17813.0,United Kingdom,2011-06-10,7.95
539050,84836,ZINC METAL HEART DECORATION,12,15-12-2010 16:21,1.25,12577.0,France,2010-12-15,15.0
574701,23399,HOME SWEET HOME HANGING HEART,3,06-11-2011 13:54,0.85,15426.0,United Kingdom,2011-06-11,2.55
569222,22150,3 STRIPEY MICE FELTCRAFT,2,02-10-2011 13:46,1.95,15906.0,United Kingdom,2011-02-10,3.9
578344,23514,EMBROIDERED RIBBON REEL SALLY ,1,24-11-2011 09:21,4.13,,United Kingdom,2011-11-24,4.13
539958,22247,BUNNY DECORATION MAGIC GARDEN,11,23-12-2010 13:26,0.81,,United Kingdom,2010-12-23,8.91
569323,23412,HEART MIRROR ANTIQUE WHITE,2,03-10-2011 12:32,7.5,16912.0,United Kingdom,2011-03-10,15.0
572669,22865,HAND WARMER OWL DESIGN,3,25-10-2011 13:10,2.1,16549.0,United Kingdom,2011-10-25,6.300000000000001
544337,85123A,WHITE HANGING HEART T-LIGHT HOLDER,6,18-02-2011 08:34,2.95,13425.0,United Kingdom,2011-02-18,17.700000000000003
576392,21926,RED/CREAM STRIPE CUSHION COVER ,12,15-11-2011 10:17,1.25,15105.0,United Kingdom,2011-11-15,15.0
553014,20728,LUNCH BAG CARS BLUE,4,12-05-2011 18:49,1.65,13451.0,United Kingdom,2011-12-05,6.6
566448,22192,BLUE DINER WALL CLOCK,2,12-09-2011 16:06,8.5,14897.0,United Kingdom,2011-12-09,17.0
542284,22860,EASTER TIN CHICKS PINK DAISY,6,27-01-2011 10:56,1.65,17311.0,United Kingdom,2011-01-27,9.899999999999999
570223,21624,VINTAGE UNION JACK DOORSTOP,3,09-10-2011 13:11,5.95,15787.0,United Kingdom,2011-09-10,17.85
554096,51014C,"FEATHER PEN,COAL BLACK",12,22-05-2011 12:51,0.85,14921.0,United Kingdom,2011-05-22,10.2
537196,21624,VINTAGE UNION JACK DOORSTOP,1,05-12-2010 13:55,5.95,15426.0,United Kingdom,2010-05-12,5.95
564837,84637,KITCHEN FLOWER POTS WALL PLAQUE,3,30-08-2011 12:40,4.96,,United Kingdom,2011-08-30,14.879999999999999
578347,22375,AIRLINE BAG VINTAGE JET SET BROWN,1,24-11-2011 09:26,8.29,,United Kingdom,2011-11-24,8.29
573020,22697,GREEN REGENCY TEACUP AND SAUCER,6,27-10-2011 12:37,2.95,14842.0,United Kingdom,2011-10-27,17.700000000000003
568211,21314,SMALL GLASS HEART TRINKET POT,8,25-09-2011 15:59,2.1,13429.0,United Kingdom,2011-09-25,16.8
573413,20767,BLUE PAISLEY JOURNAL ,1,30-10-2011 16:12,2.55,15444.0,United Kingdom,2011-10-30,2.55
566184,22827,RUSTIC  SEVENTEEN DRAWER SIDEBOARD,1,09-09-2011 13:01,165.0,16723.0,United Kingdom,2011-09-09,165.0
561258,21922,UNION STRIPE WITH FRINGE  HAMMOCK,12,26-07-2011 12:03,6.95,15513.0,United Kingdom,2011-07-26,83.4
567792,22947,WOODEN ADVENT CALENDAR RED,2,22-09-2011 11:40,16.95,17581.0,United Kingdom,2011-09-22,33.9
563382,21621,VINTAGE UNION JACK BUNTING,2,16-08-2011 10:50,8.5,18221.0,United Kingdom,2011-08-16,17.0
573585,22668,PINK BABY BUNTING,1,31-10-2011 14:41,5.79,,United Kingdom,2011-10-31,5.79
554337,23174,REGENCY SUGAR BOWL GREEN,4,23-05-2011 17:25,4.15,17920.0,United Kingdom,2011-05-23,16.6
577315,21866,UNION JACK FLAG LUGGAGE TAG,1,18-11-2011 13:25,1.25,17811.0,United Kingdom,2011-11-18,1.25
563022,23323,WHITE WICKER STAR ,3,11-08-2011 13:34,2.1,17248.0,United Kingdom,2011-11-08,6.300000000000001
573294,23145,ZINC T-LIGHT HOLDER STAR LARGE,36,28-10-2011 15:32,0.95,14397.0,United Kingdom,2011-10-28,34.199999999999996
562781,22227,HANGING HEART MIRROR DECORATION ,24,09-08-2011 13:10,0.65,14334.0,United Kingdom,2011-09-08,15.600000000000001
553527,22916,HERB MARKER THYME,12,17-05-2011 14:57,0.65,15123.0,United Kingdom,2011-05-17,7.800000000000001
561662,POST,POSTAGE,2,28-07-2011 16:28,15.0,12407.0,Belgium,2011-07-28,30.0
580366,23396,LE JARDIN BOTANIQUE CUSHION COVER,1,02-12-2011 16:38,4.58,,United Kingdom,2011-02-12,4.58
545416,85114C,RED ENCHANTED FOREST PLACEMAT,10,02-03-2011 13:35,1.65,17770.0,United Kingdom,2011-02-03,16.5
540352,21844,RED RETROSPOT MUG,2,06-01-2011 14:27,5.91,,United Kingdom,2011-06-01,11.82
542111,22840,ROUND CAKE TIN VINTAGE RED,2,25-01-2011 13:55,7.95,14341.0,United Kingdom,2011-01-25,15.9
559807,22978,PANTRY ROLLING PIN,2,12-07-2011 14:48,3.75,17841.0,United Kingdom,2011-12-07,7.5
573420,22904,CALENDAR PAPER CUT DESIGN,12,31-10-2011 09:48,2.95,18223.0,United Kingdom,2011-10-31,35.400000000000006
561244,82551,LAUNDRY 15C METAL SIGN,12,26-07-2011 11:24,1.45,13865.0,United Kingdom,2011-07-26,17.4
577594,22698,PINK REGENCY TEACUP AND SAUCER,1,20-11-2011 16:07,2.95,13142.0,United Kingdom,2011-11-20,2.95
557324,22227,HANGING HEART MIRROR DECORATION ,1,20-06-2011 09:41,1.25,,United Kingdom,2011-06-20,1.25
546031,21706,FOLDING UMBRELLA RED/WHITE POLKADOT,4,09-03-2011 09:11,4.95,13267.0,United Kingdom,2011-09-03,19.8
545668,20679,EDWARDIAN PARASOL RED,6,04-03-2011 17:02,5.95,14031.0,United Kingdom,2011-04-03,35.7
568668,22866,HAND WARMER SCOTTY DOG DESIGN,5,28-09-2011 13:00,2.1,15750.0,United Kingdom,2011-09-28,10.5
554491,22322,BIRD DECORATION GREEN POLKADOT,3,24-05-2011 13:50,0.85,14606.0,United Kingdom,2011-05-24,2.55
561371,84661B,BLACK SQUARE TABLE CLOCK,1,26-07-2011 16:25,4.96,,United Kingdom,2011-07-26,4.96
552687,84380,SET OF 3 BUTTERFLY COOKIE CUTTERS,1,10-05-2011 15:09,3.29,,United Kingdom,2011-10-05,3.29
576249,22138,BAKING SET 9 PIECE RETROSPOT ,1,14-11-2011 13:47,4.95,17811.0,United Kingdom,2011-11-14,4.95
536544,20973,12 PENCIL SMALL TUBE WOODLAND,1,01-12-2010 14:32,1.28,,United Kingdom,2010-01-12,1.28
572918,23581,JUMBO BAG PAISLEY PARK,2,26-10-2011 16:43,2.08,14379.0,United Kingdom,2011-10-26,4.16
541497,85071C,"CHARLIE+LOLA""EXTREMELY BUSY"" SIGN",2,18-01-2011 15:19,0.83,,United Kingdom,2011-01-18,1.66
558240,20828,GLITTER BUTTERFLY CLIPS,3,27-06-2011 15:27,4.96,,United Kingdom,2011-06-27,14.879999999999999
543507,21239,PINK  POLKADOT CUP,8,09-02-2011 10:49,0.85,15039.0,United Kingdom,2011-09-02,6.8
551982,21933,PINK VINTAGE PAISLEY PICNIC BAG,2,05-05-2011 13:56,1.65,15023.0,United Kingdom,2011-05-05,3.3
569983,85049E,SCANDINAVIAN REDS RIBBONS,5,06-10-2011 19:49,1.25,17231.0,United Kingdom,2011-06-10,6.25
579124,23369,SET 36 COLOUR PENCILS LOVE LONDON,1,28-11-2011 12:14,1.25,15721.0,United Kingdom,2011-11-28,1.25
573155,23089,GLASS BON BON JAR,12,28-10-2011 08:34,1.95,13632.0,United Kingdom,2011-10-28,23.4
550408,21931,JUMBO STORAGE BAG SUKI,10,18-04-2011 11:59,2.08,16746.0,United Kingdom,2011-04-18,20.8
581113,85099B,JUMBO BAG RED RETROSPOT,10,07-12-2011 12:19,2.08,14534.0,United Kingdom,2011-07-12,20.8
575924,23499,SET 12 VINTAGE DOILY CHALK ,24,11-11-2011 17:13,0.42,17069.0,United Kingdom,2011-11-11,10.08
540458,22090,PAPER BUNTING RETROSPOT,6,07-01-2011 12:28,2.95,12501.0,Germany,2011-07-01,17.700000000000003
544467,22558,CLOTHES PEGS RETROSPOT PACK 24 ,2,20-02-2011 15:51,1.49,14502.0,United Kingdom,2011-02-20,2.98
544077,21389,IVORY HANGING DECORATION  BIRD,6,15-02-2011 15:04,0.85,14825.0,United Kingdom,2011-02-15,5.1
579600,23209,LUNCH BAG VINTAGE DOILY ,10,30-11-2011 12:00,1.65,13647.0,United Kingdom,2011-11-30,16.5
547969,21238,RED RETROSPOT CUP,4,28-03-2011 16:27,0.85,17238.0,United Kingdom,2011-03-28,3.4
567699,23165,LARGE CERAMIC TOP STORAGE JAR,12,22-09-2011 09:16,1.65,17466.0,United Kingdom,2011-09-22,19.799999999999997
554714,20750,RED RETROSPOT MINI CASES,1,26-05-2011 10:44,16.63,,United Kingdom,2011-05-26,16.63
544201,35004B,SET OF 3 BLACK FLYING DUCKS,1,17-02-2011 10:11,12.46,,United Kingdom,2011-02-17,12.46
553890,21401,BLUE PUDDING SPOON,3,19-05-2011 16:32,0.42,,United Kingdom,2011-05-19,1.26
543370,22207,FRYING PAN UNION FLAG,4,07-02-2011 14:51,4.25,12359.0,Cyprus,2011-07-02,17.0
565846,21539,RED RETROSPOT BUTTER DISH,1,07-09-2011 12:41,4.95,14606.0,United Kingdom,2011-07-09,4.95
580272,23090,VINTAGE GLASS T-LIGHT HOLDER,12,02-12-2011 12:52,0.83,15547.0,United Kingdom,2011-02-12,9.959999999999999
539464,21730,GLASS STAR FROSTED T-LIGHT HOLDER,2,19-12-2010 11:35,4.95,17913.0,United Kingdom,2010-12-19,9.9
575634,22110,BIRD HOUSE HOT WATER BOTTLE,6,10-11-2011 13:44,2.55,13266.0,United Kingdom,2011-10-11,15.299999999999999
574863,21992,VINTAGE PAISLEY STATIONERY SET,3,07-11-2011 12:29,1.25,15719.0,United Kingdom,2011-07-11,3.75
554842,22514,CHILDS GARDEN SPADE BLUE,6,26-05-2011 18:17,2.1,14740.0,United Kingdom,2011-05-26,12.600000000000001
553768,21931,JUMBO STORAGE BAG SUKI,5,19-05-2011 10:47,4.13,,United Kingdom,2011-05-19,20.65
550458,84970S,HANGING HEART ZINC T-LIGHT HOLDER,2,18-04-2011 13:13,2.08,,United Kingdom,2011-04-18,4.16
564322,84818,DANISH ROSE PHOTO FRAME,120,24-08-2011 13:23,0.79,13694.0,United Kingdom,2011-08-24,94.80000000000001
539160,22355,CHARLOTTE BAG SUKI DESIGN,10,16-12-2010 11:43,0.85,16746.0,United Kingdom,2010-12-16,8.5
540350,22963,JAM JAR WITH GREEN LID,1,06-01-2011 14:14,0.85,18283.0,United Kingdom,2011-06-01,0.85
562608,21167,WHITE SAGE INCENSE,75,08-08-2011 11:45,0.21,15502.0,United Kingdom,2011-08-08,15.75
554989,22561,WOODEN SCHOOL COLOURING SET,4,29-05-2011 13:50,1.65,15897.0,United Kingdom,2011-05-29,6.6
581492,22064,PINK DOUGHNUT TRINKET POT ,1,09-12-2011 10:03,3.29,,United Kingdom,2011-09-12,3.29
550521,22969,HOMEMADE JAM SCENTED CANDLES,24,19-04-2011 09:49,1.45,13647.0,United Kingdom,2011-04-19,34.8
561048,84997D,CHILDRENS CUTLERY POLKADOT PINK,72,24-07-2011 12:51,3.75,12939.0,United Kingdom,2011-07-24,270.0
544837,22087,PAPER BUNTING WHITE LACE,1,24-02-2011 10:29,2.95,15910.0,United Kingdom,2011-02-24,2.95
543099,22900, SET 2 TEA TOWELS I LOVE LONDON ,100,03-02-2011 12:00,2.55,16684.0,United Kingdom,2011-03-02,254.99999999999997
578757,85199S,SMALL HANGING IVORY/RED WOOD BIRD,1,25-11-2011 11:41,0.42,12748.0,United Kingdom,2011-11-25,0.42
569700,23215,JINGLE BELL HEART ANTIQUE SILVER,1,05-10-2011 15:56,4.13,,United Kingdom,2011-05-10,4.13
542252,84559b,3D SHEET OF CAT STICKERS,1,26-01-2011 16:01,1.66,,United Kingdom,2011-01-26,1.66
578833,22328,ROUND SNACK BOXES SET OF 4 FRUITS ,1,25-11-2011 15:23,4.13,,United Kingdom,2011-11-25,4.13
566590,21507,ELEPHANT BIRTHDAY CARD ,12,13-09-2011 14:51,0.42,14032.0,United Kingdom,2011-09-13,5.04
541496,21424,WOODLAND STORAGE BOX LARGE ,1,18-01-2011 15:00,6.63,,United Kingdom,2011-01-18,6.63
574093,23076,ICE CREAM SUNDAE LIP GLOSS,24,03-11-2011 09:43,1.25,12437.0,France,2011-03-11,30.0
537346,21801,CHRISTMAS TREE DECORATION WITH BELL,36,06-12-2010 12:21,0.42,15301.0,United Kingdom,2010-06-12,15.12
574826,21977,PACK OF 60 PINK PAISLEY CAKE CASES,1,07-11-2011 10:58,0.55,15870.0,United Kingdom,2011-07-11,0.55
575647,22910,PAPER CHAIN KIT VINTAGE CHRISTMAS,10,10-11-2011 14:16,2.95,16440.0,United Kingdom,2011-10-11,29.5
537135,22384,LUNCH BAG PINK POLKADOT,2,05-12-2010 12:35,1.65,17059.0,United Kingdom,2010-05-12,3.3
574677,23329,DECORATIVE WICKER HEART LARGE,4,06-11-2011 12:32,1.65,16445.0,United Kingdom,2011-06-11,6.6
553381,22619,SET OF 6 SOLDIER SKITTLES,4,16-05-2011 15:34,3.75,13456.0,United Kingdom,2011-05-16,15.0
561651,20618,QUEEN OF THE SKIES PASSPORT COVER ,1,28-07-2011 15:36,1.63,,United Kingdom,2011-07-28,1.63
556241,15058B,PINK POLKADOT GARDEN PARASOL,2,09-06-2011 16:04,7.95,12597.0,Spain,2011-09-06,15.9
567882,22548,HEADS AND TAILS SPORTING FUN,72,22-09-2011 15:03,1.06,12906.0,United Kingdom,2011-09-22,76.32000000000001
557621,84879,ASSORTED COLOUR BIRD ORNAMENT,8,21-06-2011 14:00,1.69,12444.0,Norway,2011-06-21,13.52
568912,22361,GLASS JAR DAISY FRESH COTTON WOOL,2,29-09-2011 13:45,2.95,17528.0,United Kingdom,2011-09-29,5.9
563195,22260,FELT EGG COSY BLUE RABBIT ,1,12-08-2011 16:36,1.63,,United Kingdom,2011-12-08,1.63
561205,21993,FLORAL FOLK STATIONERY SET,12,25-07-2011 15:48,1.25,17693.0,United Kingdom,2011-07-25,15.0
564817,23322,LARGE WHITE HEART OF WICKER,3,30-08-2011 12:02,2.95,,United Kingdom,2011-08-30,8.850000000000001
565232,85032C,CURIOUS IMAGES GIFT WRAP SET,1,02-09-2011 09:30,1.63,,United Kingdom,2011-02-09,1.63
546133,22029,SPACEBOY BIRTHDAY CARD,12,09-03-2011 15:20,0.42,14291.0,United Kingdom,2011-09-03,5.04
551558,23147,SINGLE ANTIQUE ROSE HOOK IVORY,1,03-05-2011 10:41,1.45,17841.0,United Kingdom,2011-03-05,1.45
574478,23350,ROLL WRAP VINTAGE SPOT ,1,04-11-2011 12:27,1.25,17203.0,United Kingdom,2011-04-11,1.25
536596,22900, SET 2 TEA TOWELS I LOVE LONDON ,1,01-12-2010 17:29,2.95,,United Kingdom,2010-01-12,2.95
576625,23581,JUMBO BAG PAISLEY PARK,4,15-11-2011 17:20,2.08,15571.0,United Kingdom,2011-11-15,8.32
545898,21324,HANGING MEDINA LANTERN SMALL,4,07-03-2011 17:23,2.95,15869.0,United Kingdom,2011-07-03,11.8
559693,20897,VINTAGE NOTEBOOK PARIS DAYS,1,11-07-2011 16:21,2.46,,United Kingdom,2011-11-07,2.46
559704,21935,SUKI  SHOULDER BAG,10,12-07-2011 09:54,1.65,12669.0,France,2011-12-07,16.5
578786,22154,ANGEL DECORATION 3 BUTTONS ,10,25-11-2011 12:02,0.42,13184.0,United Kingdom,2011-11-25,4.2
541870,82484,WOOD BLACK BOARD ANT WHITE FINISH,1,24-01-2011 09:39,13.29,,United Kingdom,2011-01-24,13.29
562779,22385,JUMBO BAG SPACEBOY DESIGN,1,09-08-2011 12:58,2.08,17841.0,United Kingdom,2011-09-08,2.08
542320,22423,REGENCY CAKESTAND 3 TIER,6,27-01-2011 11:15,12.75,14040.0,United Kingdom,2011-01-27,76.5
546884,22686,FRENCH BLUE METAL DOOR SIGN No,2,17-03-2011 18:08,2.46,,United Kingdom,2011-03-17,4.92
578818,23569,TRADTIONAL ALPHABET STAMP SET,2,25-11-2011 13:47,4.95,17920.0,United Kingdom,2011-11-25,9.9
575583,22546,MINI JIGSAW PURDEY,2,10-11-2011 11:55,0.42,14456.0,United Kingdom,2011-10-11,0.84
544201,10002,INFLATABLE POLITICAL GLOBE ,1,17-02-2011 10:11,1.63,,United Kingdom,2011-02-17,1.63
571286,23101,SILVER STARS TABLE DECORATION,4,16-10-2011 14:35,0.83,14547.0,United Kingdom,2011-10-16,3.32
555232,21891,TRADITIONAL WOODEN SKIPPING ROPE,30,01-06-2011 12:33,1.45,14597.0,United Kingdom,2011-01-06,43.5
550651,22429,ENAMEL MEASURING JUG CREAM,1,19-04-2011 16:52,4.25,15436.0,United Kingdom,2011-04-19,4.25
558709,20754,RETROSPOT RED WASHING UP GLOVES,2,01-07-2011 13:02,2.1,17338.0,United Kingdom,2011-01-07,4.2
569202,21212,PACK OF 72 RETROSPOT CAKE CASES,1,30-09-2011 17:22,1.25,,United Kingdom,2011-09-30,1.25
574678,23111,PARISIENNE SEWING BOX,2,06-11-2011 12:36,12.5,13365.0,United Kingdom,2011-06-11,25.0
547911,85099B,JUMBO BAG RED RETROSPOT,10,28-03-2011 12:25,1.95,14127.0,United Kingdom,2011-03-28,19.5
536831,21929,JUMBO BAG PINK VINTAGE PAISLEY,100,02-12-2010 17:40,1.65,16029.0,United Kingdom,2010-02-12,165.0
569570,23245,SET OF 3 REGENCY CAKE TINS,240,05-10-2011 10:06,4.15,16684.0,United Kingdom,2011-05-10,996.0000000000001
572280,23470,CARD HOLDER LOVE BIRD LARGE ,3,23-10-2011 11:05,6.25,16007.0,United Kingdom,2011-10-23,18.75
580632,21428,SET3 BOOK BOX GREEN GINGHAM FLOWER ,3,05-12-2011 12:16,4.25,16360.0,United Kingdom,2011-05-12,12.75
542266,22457,NATURAL SLATE HEART CHALKBOARD ,2,26-01-2011 17:37,2.95,16918.0,United Kingdom,2011-01-26,5.9
576840,22995,TRAVEL CARD WALLET SUKI,2,16-11-2011 15:23,0.83,,United Kingdom,2011-11-16,1.66
574316,48129,DOORMAT TOPIARY,4,03-11-2011 18:45,8.25,17351.0,United Kingdom,2011-03-11,33.0
569871,23541,"WALL ART ,PUDDINGS ",6,06-10-2011 15:04,7.45,13089.0,United Kingdom,2011-06-10,44.7
550471,21218,RED SPOTTY BISCUIT TIN,1,18-04-2011 13:52,8.29,,United Kingdom,2011-04-18,8.29
541596,85172,HYACINTH BULB T-LIGHT CANDLES,32,19-01-2011 16:19,0.42,17602.0,United Kingdom,2011-01-19,13.44
540026,22215,CAKE STAND WHITE TWO TIER LACE,1,04-01-2011 13:25,16.98,,United Kingdom,2011-04-01,16.98
574536,22951,60 CAKE CASES DOLLY GIRL DESIGN,1,04-11-2011 14:35,0.55,15707.0,United Kingdom,2011-04-11,0.55
547879,15034,PAPER POCKET TRAVELING FAN ,24,27-03-2011 16:03,0.14,12877.0,United Kingdom,2011-03-27,3.3600000000000003
566061,82486,3 DRAWER ANTIQUE WHITE WOOD CABINET,4,08-09-2011 15:36,8.95,13267.0,United Kingdom,2011-08-09,35.8
580396,22472,TV DINNER TRAY DOLLY GIRL,1,04-12-2011 11:00,1.95,13838.0,United Kingdom,2011-04-12,1.95
541417,84992,72 SWEETHEART FAIRY CAKE CASES,4,17-01-2011 16:23,0.55,16033.0,United Kingdom,2011-01-17,2.2
561195,22417,PACK OF 60 SPACEBOY CAKE CASES,2,25-07-2011 13:57,0.55,14796.0,United Kingdom,2011-07-25,1.1
572718,22578,WOODEN STAR CHRISTMAS SCANDINAVIAN,24,25-10-2011 14:56,0.29,15656.0,United Kingdom,2011-10-25,6.959999999999999
568585,21935,SUKI  SHOULDER BAG,10,28-09-2011 10:14,1.65,17370.0,United Kingdom,2011-09-28,16.5
543777,22224,WHITE LOVEBIRD LANTERN,3,11-02-2011 16:20,2.95,15406.0,United Kingdom,2011-11-02,8.850000000000001
557790,22314,OFFICE MUG WARMER CHOC+BLUE,2,22-06-2011 16:33,2.95,14099.0,United Kingdom,2011-06-22,5.9
562153,22659,LUNCH BOX I LOVE LONDON,24,03-08-2011 11:21,1.65,14088.0,United Kingdom,2011-03-08,39.599999999999994
560580,48188,DOORMAT WELCOME PUPPIES,24,19-07-2011 15:23,6.75,14088.0,United Kingdom,2011-07-19,162.0
580115,22411,JUMBO SHOPPER VINTAGE RED PAISLEY,1,01-12-2011 16:22,4.13,,United Kingdom,2011-01-12,4.13
577698,23365,SET 12 COLOUR PENCILS LOVE LONDON,24,21-11-2011 12:05,0.65,14963.0,United Kingdom,2011-11-21,15.600000000000001
574949,23475,WOODLAND SMALL PINK FELT HEART,12,08-11-2011 09:12,0.83,14360.0,United Kingdom,2011-08-11,9.959999999999999
538097,72760B,VINTAGE CREAM 3 BASKET CAKE STAND,4,09-12-2010 14:56,9.95,15192.0,United Kingdom,2010-09-12,39.8
540248,22500,SET OF 2 TINS JARDIN DE PROVENCE,4,05-01-2011 15:57,4.95,15034.0,United Kingdom,2011-05-01,19.8
574883,22816,CARD MOTORBIKE SANTA,12,07-11-2011 13:56,0.42,14623.0,United Kingdom,2011-07-11,5.04
544778,21175,GIN + TONIC DIET METAL SIGN,1,23-02-2011 12:03,2.55,14978.0,United Kingdom,2011-02-23,2.55
560992,47566,PARTY BUNTING,4,22-07-2011 13:31,4.95,18161.0,United Kingdom,2011-07-22,19.8
553879,85099C,JUMBO  BAG BAROQUE BLACK WHITE,10,19-05-2011 15:15,2.08,15791.0,United Kingdom,2011-05-19,20.8
558441,21679,SKULLS  STICKERS,1,29-06-2011 12:59,0.85,14606.0,United Kingdom,2011-06-29,0.85
564835,22076,6 RIBBONS EMPIRE  ,1,30-08-2011 12:31,1.25,,United Kingdom,2011-08-30,1.25
539435,POST,POSTAGE,1,17-12-2010 14:46,18.0,12691.0,France,2010-12-17,18.0
541127,21166,COOK WITH WINE METAL SIGN ,1,14-01-2011 10:11,4.13,,United Kingdom,2011-01-14,4.13
546009,22374,AIRLINE BAG VINTAGE JET SET RED,4,08-03-2011 15:45,4.25,16426.0,United Kingdom,2011-08-03,17.0
569383,22902,TOTE BAG I LOVE LONDON,12,03-10-2011 16:46,2.1,15159.0,United Kingdom,2011-03-10,25.200000000000003
553005,21088,SET/6 FRUIT SALAD PAPER CUPS,6,12-05-2011 16:29,0.19,14651.0,United Kingdom,2011-12-05,1.1400000000000001
537051,22727,ALARM CLOCK BAKELIKE RED ,2,05-12-2010 11:12,3.75,15708.0,United Kingdom,2010-05-12,7.5
581134,21034,REX CASH+CARRY JUMBO SHOPPER,1,07-12-2011 13:12,0.95,16368.0,United Kingdom,2011-07-12,0.95
538153,22784,LANTERN CREAM GAZEBO ,1,09-12-2010 16:31,11.02,,United Kingdom,2010-09-12,11.02
573585,85039B,S/4 IVORY MINI ROSE CANDLE IN BOWL,6,31-10-2011 14:41,1.63,,United Kingdom,2011-10-31,9.78
568709,22907,PACK OF 20 NAPKINS PANTRY DESIGN,2,28-09-2011 15:42,0.85,15036.0,United Kingdom,2011-09-28,1.7
574941,21791,VINTAGE HEADS AND TAILS CARD GAME ,210,07-11-2011 17:42,2.95,,United Kingdom,2011-07-11,619.5
561066,15036,ASSORTED COLOURS SILK FAN,12,24-07-2011 14:21,0.83,16710.0,United Kingdom,2011-07-24,9.959999999999999
567851,23242,TREASURE TIN BUFFALO BILL ,6,22-09-2011 13:20,2.08,15067.0,United Kingdom,2011-09-22,12.48
545186,84659A,WHITE TRAVEL ALARM CLOCK,2,28-02-2011 15:05,2.55,17841.0,United Kingdom,2011-02-28,5.1
537421,22573,STAR WOODEN CHRISTMAS DECORATION,5,06-12-2010 15:25,0.85,17218.0,United Kingdom,2010-06-12,4.25
541864,48185,DOORMAT FAIRY CAKE,10,23-01-2011 16:17,6.75,13798.0,United Kingdom,2011-01-23,67.5
567901,21872,GLAMOROUS  MUG,1,22-09-2011 16:28,3.29,,United Kingdom,2011-09-22,3.29
568873,23209,LUNCH BAG VINTAGE DOILY ,20,29-09-2011 12:15,1.65,14188.0,United Kingdom,2011-09-29,33.0
553863,23154,SET OF 4 JAM JAR MAGNETS,6,19-05-2011 14:05,2.08,13418.0,United Kingdom,2011-05-19,12.48
579470,21098,CHRISTMAS TOILET ROLL,4,29-11-2011 15:06,1.25,16549.0,United Kingdom,2011-11-29,5.0
578347,22386,JUMBO BAG PINK POLKADOT,4,24-11-2011 09:26,4.13,,United Kingdom,2011-11-24,16.52
569110,22727,ALARM CLOCK BAKELIKE RED ,8,30-09-2011 12:44,3.75,17675.0,United Kingdom,2011-09-30,30.0
575137,23583,LUNCH BAG PAISLEY PARK  ,10,08-11-2011 15:13,1.65,13090.0,United Kingdom,2011-08-11,16.5
574941,23503,PLAYING CARDS KEEP CALM & CARRY ON,109,07-11-2011 17:42,2.95,,United Kingdom,2011-07-11,321.55
564378,22214,CANDLE PLATE LACE WHITE,6,25-08-2011 10:26,2.55,12417.0,Belgium,2011-08-25,15.299999999999999
545059,85152,HAND OVER THE CHOCOLATE   SIGN ,4,27-02-2011 13:04,2.1,14157.0,United Kingdom,2011-02-27,8.4
558992,84945,MULTI COLOUR SILVER T-LIGHT HOLDER,12,05-07-2011 11:36,0.85,14223.0,United Kingdom,2011-05-07,10.2
549196,21175,GIN + TONIC DIET METAL SIGN,12,07-04-2011 10:33,2.55,14911.0,EIRE,2011-07-04,30.599999999999998
546036,20725,LUNCH BAG RED RETROSPOT,10,09-03-2011 09:52,1.65,14645.0,United Kingdom,2011-09-03,16.5
553540,22984,CARD GINGHAM ROSE ,72,17-05-2011 15:32,0.36,17511.0,United Kingdom,2011-05-17,25.919999999999998
559144,20914,SET/5 RED RETROSPOT LID GLASS BOWLS,6,06-07-2011 14:17,2.95,12921.0,United Kingdom,2011-06-07,17.700000000000003
581434,23194,GYMKHANA TREASURE BOOK BOX,8,08-12-2011 16:10,2.25,13599.0,United Kingdom,2011-08-12,18.0
560926,22467,GUMBALL COAT RACK,1,22-07-2011 09:20,4.96,,United Kingdom,2011-07-22,4.96
573286,22110,BIRD HOUSE HOT WATER BOTTLE,2,28-10-2011 14:38,2.55,,Switzerland,2011-10-28,5.1
566219,22866,HAND WARMER SCOTTY DOG DESIGN,12,09-09-2011 15:51,2.1,17426.0,United Kingdom,2011-09-09,25.200000000000003
579508,23344,JUMBO BAG 50'S CHRISTMAS ,3,29-11-2011 16:33,4.13,,United Kingdom,2011-11-29,12.39
538248,22902,TOTE BAG I LOVE LONDON,2,10-12-2010 12:14,2.1,18116.0,United Kingdom,2010-10-12,4.2
566561,21915,RED  HARMONICA IN BOX ,12,13-09-2011 12:13,1.25,18145.0,United Kingdom,2011-09-13,15.0
553125,23169,CLASSIC GLASS SWEET JAR,6,13-05-2011 12:13,4.15,17139.0,United Kingdom,2011-05-13,24.900000000000002
559691,21907,I'M ON HOLIDAY METAL SIGN,12,11-07-2011 15:52,2.1,13089.0,United Kingdom,2011-11-07,25.200000000000003
575700,23284,DOORMAT KEEP CALM AND COME IN,4,10-11-2011 16:58,8.25,15111.0,United Kingdom,2011-10-11,33.0
581010,21914,BLUE HARMONICA IN BOX ,12,07-12-2011 09:18,1.25,17503.0,United Kingdom,2011-07-12,15.0
544778,22699,ROSES REGENCY TEACUP AND SAUCER ,2,23-02-2011 12:03,2.95,14978.0,United Kingdom,2011-02-23,5.9
574950,22195,LARGE HEART MEASURING SPOONS,1,08-11-2011 09:29,3.29,,United Kingdom,2011-08-11,3.29
571709,20972,PINK CREAM FELT CRAFT TRINKET BOX ,12,18-10-2011 15:52,1.25,16463.0,United Kingdom,2011-10-18,15.0
580677,48187,DOORMAT NEW ENGLAND,1,05-12-2011 14:40,8.25,16200.0,United Kingdom,2011-05-12,8.25
547019,21975,PACK OF 60 DINOSAUR CAKE CASES,4,18-03-2011 14:54,0.55,17841.0,United Kingdom,2011-03-18,2.2
576933,23480,MINI LIGHTS WOODLAND MUSHROOMS,4,17-11-2011 11:29,3.75,15529.0,United Kingdom,2011-11-17,15.0
561113,20717,STRAWBERRY SHOPPER BAG,5,25-07-2011 12:09,1.25,17841.0,United Kingdom,2011-07-25,6.25
553930,84997D,CHILDRENS CUTLERY POLKADOT PINK,4,20-05-2011 10:22,4.15,13178.0,United Kingdom,2011-05-20,16.6
565840,22024,RAINY LADIES BIRTHDAY CARD,1,07-09-2011 12:02,0.83,,United Kingdom,2011-07-09,0.83
546769,21385,IVORY HANGING DECORATION  HEART,24,16-03-2011 14:57,0.85,17504.0,United Kingdom,2011-03-16,20.4
536544,22432,WATERING CAN PINK BUNNY,1,01-12-2010 14:32,4.21,,United Kingdom,2010-01-12,4.21
562011,21155,RED RETROSPOT PEG BAG,3,01-08-2011 13:54,2.55,16745.0,United Kingdom,2011-01-08,7.6499999999999995
573381,22910,PAPER CHAIN KIT VINTAGE CHRISTMAS,1,30-10-2011 14:05,2.95,17590.0,United Kingdom,2011-10-30,2.95
565426,20992,JAZZ HEARTS PURSE NOTEBOOK,6,04-09-2011 12:41,0.39,12851.0,United Kingdom,2011-04-09,2.34
569220,21098,CHRISTMAS TOILET ROLL,1,02-10-2011 13:26,1.25,16007.0,United Kingdom,2011-02-10,1.25
565748,23171,REGENCY TEA PLATE GREEN ,48,06-09-2011 12:38,1.45,14156.0,EIRE,2011-06-09,69.6
560926,22703,PINK CAT BOWL,2,22-07-2011 09:20,1.63,,United Kingdom,2011-07-22,3.26
571039,20914,SET/5 RED RETROSPOT LID GLASS BOWLS,2,13-10-2011 12:59,2.95,16121.0,United Kingdom,2011-10-13,5.9
540482,22646,CERAMIC STRAWBERRY CAKE MONEY BANK,2,07-01-2011 15:48,1.45,14672.0,United Kingdom,2011-07-01,2.9
538198,22809,SET OF 6 T-LIGHTS SANTA,6,10-12-2010 11:01,2.95,17827.0,United Kingdom,2010-10-12,17.700000000000003
577078,84923,PINK BUTTERFLY HANDBAG W BOBBLES,1,17-11-2011 15:17,4.13,,United Kingdom,2011-11-17,4.13
546636,22966,GINGERBREAD MAN COOKIE CUTTER,1,15-03-2011 12:19,1.25,14534.0,United Kingdom,2011-03-15,1.25
565612,22556,PLASTERS IN TIN CIRCUS PARADE ,12,05-09-2011 15:17,1.65,12616.0,France,2011-05-09,19.799999999999997
576245,22554,PLASTERS IN TIN WOODLAND ANIMALS,12,14-11-2011 13:40,1.65,12553.0,France,2011-11-14,19.799999999999997
580729,23294,SET OF 6 SNACK LOAF BAKING CASES,6,05-12-2011 17:24,2.46,,United Kingdom,2011-05-12,14.76
539628,84077,WORLD WAR 2 GLIDERS ASSTD DESIGNS,48,20-12-2010 14:49,0.29,18097.0,United Kingdom,2010-12-20,13.919999999999998
539472,20655,QUEEN OF SKIES LUGGAGE TAG,1,19-12-2010 14:23,1.25,15581.0,United Kingdom,2010-12-19,1.25
574561,22741,FUNKY DIVA PEN,1,04-11-2011 15:52,1.63,,United Kingdom,2011-04-11,1.63
541262,85206A,CREAM FELT EASTER EGG BASKET,3,16-01-2011 15:50,1.65,18069.0,United Kingdom,2011-01-16,4.949999999999999
540418,84923,PINK BUTTERFLY HANDBAG W BOBBLES,4,07-01-2011 11:04,4.21,,United Kingdom,2011-07-01,16.84
577720,79321,CHILLI LIGHTS,96,21-11-2011 12:21,4.95,16013.0,United Kingdom,2011-11-21,475.20000000000005
545579,22288,HANGING METAL RABBIT DECORATION,24,04-03-2011 08:10,1.25,17508.0,Greece,2011-04-03,30.0
577160,21876,POTTERING MUG,12,18-11-2011 10:05,1.65,16134.0,United Kingdom,2011-11-18,19.799999999999997
565455,85053,FRENCH ENAMEL CANDLEHOLDER,1,04-09-2011 16:09,2.1,,United Kingdom,2011-04-09,2.1
575735,23367,SET 12 COLOUR PENCILS SPACEBOY ,16,11-11-2011 08:46,0.65,14156.0,EIRE,2011-11-11,10.4
579171,23562,SET OF 6 RIBBONS PERFECTLY PRETTY  ,1,28-11-2011 14:30,2.89,13030.0,United Kingdom,2011-11-28,2.89
560773,85061W,WHITE JEWELLED HEART DECORATION,1,20-07-2011 16:17,1.63,,United Kingdom,2011-07-20,1.63
569662,84945,MULTI COLOUR SILVER T-LIGHT HOLDER,12,05-10-2011 13:19,0.85,15244.0,United Kingdom,2011-05-10,10.2
571006,23329,DECORATIVE WICKER HEART LARGE,12,13-10-2011 12:06,1.65,17063.0,United Kingdom,2011-10-13,19.799999999999997
580678,21819,GLITTER CHRISTMAS STAR ,11,05-12-2011 14:49,0.39,18015.0,United Kingdom,2011-05-12,4.29
570703,23183,MOTHER'S KITCHEN SPOON REST ,6,12-10-2011 09:50,3.75,14911.0,EIRE,2011-12-10,22.5
566976,23158,SET OF 5 LUCKY CAT MAGNETS ,12,16-09-2011 09:27,2.08,15382.0,United Kingdom,2011-09-16,24.96
553210,84077,WORLD WAR 2 GLIDERS ASSTD DESIGNS,48,16-05-2011 09:40,0.29,14016.0,EIRE,2011-05-16,13.919999999999998
576837,23349,ROLL WRAP VINTAGE CHRISTMAS,6,16-11-2011 15:16,2.46,,United Kingdom,2011-11-16,14.76
561383,22630,DOLLY GIRL LUNCH BOX,12,27-07-2011 08:35,1.95,13730.0,United Kingdom,2011-07-27,23.4
580647,21535,RED RETROSPOT SMALL MILK JUG,2,05-12-2011 13:14,2.55,14083.0,United Kingdom,2011-05-12,5.1
540239,22326,ROUND SNACK BOXES SET OF4 WOODLAND ,6,05-01-2011 14:48,2.95,12682.0,France,2011-05-01,17.700000000000003
579162,23083,SET 6 PAPER TABLE LANTERN STARS ,1,28-11-2011 13:58,3.75,16393.0,United Kingdom,2011-11-28,3.75
552681,22171,3 HOOK PHOTO SHELF ANTIQUE WHITE,2,10-05-2011 15:08,16.63,,United Kingdom,2011-10-05,33.26
554630,21877,HOME SWEET HOME MUG,6,25-05-2011 11:34,1.25,13268.0,United Kingdom,2011-05-25,7.5
572835,23456,MEDIUM PARLOUR PICTURE FRAME ,18,26-10-2011 11:49,3.75,17428.0,United Kingdom,2011-10-26,67.5
549578,22728,ALARM CLOCK BAKELIKE PINK,4,11-04-2011 08:49,3.75,17340.0,United Kingdom,2011-11-04,15.0
573901,20723,STRAWBERRY CHARLOTTE BAG,10,01-11-2011 14:49,0.85,14191.0,United Kingdom,2011-01-11,8.5
573841,22493,PAINT YOUR OWN CANVAS SET,2,01-11-2011 11:39,1.65,14995.0,United Kingdom,2011-01-11,3.3
538035,22909,SET OF 20 VINTAGE CHRISTMAS NAPKINS,1,09-12-2010 13:03,0.85,16065.0,United Kingdom,2010-09-12,0.85
562587,84879,ASSORTED COLOUR BIRD ORNAMENT,160,07-08-2011 14:34,1.45,15640.0,United Kingdom,2011-07-08,232.0
556085,22630,DOLLY GIRL LUNCH BOX,1,08-06-2011 15:23,2.46,,United Kingdom,2011-08-06,2.46
560701,20727,LUNCH BAG  BLACK SKULL.,1,20-07-2011 12:45,1.65,16729.0,United Kingdom,2011-07-20,1.65
580729,23504,PLAYING CARDS JUBILEE UNION JACK,1,05-12-2011 17:24,2.46,,United Kingdom,2011-05-12,2.46
537638,35809A,ENAMEL PINK TEA CONTAINER,1,07-12-2010 15:28,4.21,,United Kingdom,2010-07-12,4.21
556258,21088,SET/6 FRUIT SALAD PAPER CUPS,24,09-06-2011 17:48,0.19,12694.0,France,2011-09-06,4.5600000000000005
559032,23230,WRAP ALPHABET DESIGN,25,05-07-2011 14:53,0.42,17511.0,United Kingdom,2011-05-07,10.5
555418,23099,FRENCH CARRIAGE LANTERN,4,03-06-2011 10:19,6.65,15498.0,United Kingdom,2011-03-06,26.6
569020,23503,PLAYING CARDS KEEP CALM & CARRY ON,12,30-09-2011 09:39,1.25,15321.0,United Kingdom,2011-09-30,15.0
569668,85123A,WHITE HANGING HEART T-LIGHT HOLDER,6,05-10-2011 13:47,2.95,16040.0,United Kingdom,2011-05-10,17.700000000000003
564565,22196,SMALL HEART MEASURING SPOONS,12,26-08-2011 10:50,0.85,14911.0,EIRE,2011-08-26,10.2
560018,22915,ASSORTED BOTTLE TOP  MAGNETS ,12,14-07-2011 12:52,0.42,15987.0,United Kingdom,2011-07-14,5.04
543467,21071,VINTAGE BILLBOARD DRINK ME MUG,1,08-02-2011 14:35,2.46,,United Kingdom,2011-08-02,2.46
576329,22422,TOOTHPASTE TUBE PEN,2,14-11-2011 15:22,1.25,,United Kingdom,2011-11-14,2.5
550325,22115,METAL SIGN EMPIRE TEA,6,17-04-2011 13:04,2.95,15745.0,United Kingdom,2011-04-17,17.700000000000003
539607,21080,SET/20 RED RETROSPOT PAPER NAPKINS ,24,20-12-2010 14:10,0.85,12681.0,France,2010-12-20,20.4
555383,22326,ROUND SNACK BOXES SET OF4 WOODLAND ,3,02-06-2011 15:13,2.95,12517.0,Germany,2011-02-06,8.850000000000001
569897,22759,SET OF 3 NOTEBOOKS IN PARCEL,1,06-10-2011 16:01,1.65,17813.0,United Kingdom,2011-06-10,1.65
546429,21563,RED HEART SHAPE LOVE BUCKET ,1,13-03-2011 15:25,2.95,17611.0,United Kingdom,2011-03-13,2.95
579508,35953,FOLKART STAR CHRISTMAS DECORATIONS,24,29-11-2011 16:33,0.61,,United Kingdom,2011-11-29,14.64
574491,22492,MINI PAINT SET VINTAGE ,36,04-11-2011 13:05,0.65,16318.0,United Kingdom,2011-04-11,23.400000000000002
564818,22129,PARTY CONES CANDY DECORATION,3,30-08-2011 12:10,2.46,,United Kingdom,2011-08-30,7.38
569336,22818,CARD CHRISTMAS VILLAGE,24,03-10-2011 14:05,0.42,15088.0,United Kingdom,2011-03-10,10.08
576617,23177,TREASURE ISLAND BOOK BOX,1,15-11-2011 16:57,4.58,,United Kingdom,2011-11-15,4.58
543631,85017C,ENVELOPE 50 CURIOUS IMAGES,1,10-02-2011 16:17,0.85,14081.0,United Kingdom,2011-10-02,0.85
546891,21931,JUMBO STORAGE BAG SUKI,2,17-03-2011 18:18,4.13,,United Kingdom,2011-03-17,8.26
565850,22470,HEART OF WICKER LARGE,2,07-09-2011 12:55,2.95,14530.0,United Kingdom,2011-07-09,5.9
580367,23434,3 RAFFIA RIBBONS 50'S CHRISTMAS ,5,02-12-2011 16:39,0.83,,United Kingdom,2011-02-12,4.1499999999999995
575867,21948,SET OF 6 CAKE CHOPSTICKS,1,11-11-2011 12:44,1.25,15034.0,United Kingdom,2011-11-11,1.25
539250,85184C,S/4 VALENTINE DECOUPAGE HEART BOX,24,16-12-2010 13:44,1.25,15157.0,United Kingdom,2010-12-16,30.0
577768,22631,CIRCUS PARADE LUNCH BOX ,2,21-11-2011 15:18,4.13,,United Kingdom,2011-11-21,8.26
551284,23204,CHARLOTTE BAG APPLES DESIGN,6,27-04-2011 14:05,0.85,15005.0,United Kingdom,2011-04-27,5.1
549257,21531,RED RETROSPOT SUGAR JAM BOWL,1,07-04-2011 12:29,2.55,14465.0,United Kingdom,2011-07-04,2.55
560886,23284,DOORMAT KEEP CALM AND COME IN,100,21-07-2011 16:27,6.75,16041.0,United Kingdom,2011-07-21,675.0
559330,23147,SINGLE ANTIQUE ROSE HOOK IVORY,12,07-07-2011 15:44,1.45,17696.0,United Kingdom,2011-07-07,17.4
540126,21111,"SWISS ROLL TOWEL, CHOCOLATE  SPOTS",96,05-01-2011 10:45,1.25,13798.0,United Kingdom,2011-05-01,120.0
567475,23307,SET OF 60 PANTRY DESIGN CAKE CASES ,1,20-09-2011 13:11,0.55,16360.0,United Kingdom,2011-09-20,0.55
554382,21498,RED RETROSPOT WRAP ,25,24-05-2011 11:55,0.42,17365.0,United Kingdom,2011-05-24,10.5
541886,20685,DOORMAT RED RETROSPOT,2,24-01-2011 11:21,7.95,15039.0,United Kingdom,2011-01-24,15.9
564380,22161,HEART DECORATION RUSTIC HANGING ,24,25-08-2011 10:39,0.19,14314.0,United Kingdom,2011-08-25,4.5600000000000005
579508,22114,HOT WATER BOTTLE TEA AND SYMPATHY,3,29-11-2011 16:33,8.29,,United Kingdom,2011-11-29,24.869999999999997
540181,22584,PACK OF 6 PANNETONE GIFT BOXES,24,05-01-2011 13:09,2.55,13199.0,United Kingdom,2011-05-01,61.199999999999996
550278,21238,RED RETROSPOT CUP,2,15-04-2011 13:15,1.63,,United Kingdom,2011-04-15,3.26
561073,22558,CLOTHES PEGS RETROSPOT PACK 24 ,48,24-07-2011 15:46,1.45,13408.0,United Kingdom,2011-07-24,69.6
560368,21927,BLUE/CREAM STRIPE CUSHION COVER ,2,18-07-2011 12:25,1.25,17841.0,United Kingdom,2011-07-18,2.5
568167,22767,TRIPLE PHOTO FRAME CORNICE ,2,25-09-2011 12:45,9.95,15706.0,United Kingdom,2011-09-25,19.9
567671,23282,FOLDING BUTTERFLY MIRROR IVORY ,1,21-09-2011 15:34,2.46,,United Kingdom,2011-09-21,2.46
572704,21479,WHITE SKULL HOT WATER BOTTLE ,14,25-10-2011 14:39,9.13,,United Kingdom,2011-10-25,127.82000000000001
574882,79066K,RETRO MOD TRAY,12,07-11-2011 13:45,0.85,13599.0,United Kingdom,2011-07-11,10.2
547563,22616,PACK OF 12 LONDON TISSUES ,24,24-03-2011 08:56,0.29,15651.0,United Kingdom,2011-03-24,6.959999999999999
544476,22891,TEA FOR ONE POLKADOT,1,21-02-2011 09:58,4.25,14796.0,United Kingdom,2011-02-21,4.25
550987,21716,BOYS VINTAGE TIN SEASIDE BUCKET,2,21-04-2011 18:10,4.96,,United Kingdom,2011-04-21,9.92
569487,22978,PANTRY ROLLING PIN,6,04-10-2011 12:55,3.75,13351.0,United Kingdom,2011-04-10,22.5
552769,22212,FOUR HOOK  WHITE LOVEBIRDS,2,11-05-2011 11:47,2.1,16241.0,United Kingdom,2011-11-05,4.2
538881,84559b,3D SHEET OF CAT STICKERS,1,14-12-2010 15:54,1.69,,United Kingdom,2010-12-14,1.69
570462,90063A,WHITE VINT ART DECO CRYSTAL NECKLAC,1,10-10-2011 15:48,8.5,,United Kingdom,2011-10-10,8.5
563231,22768,FAMILY PHOTO FRAME CORNICE,1,14-08-2011 15:42,9.95,14658.0,United Kingdom,2011-08-14,9.95
544434,82580,BATHROOM METAL SIGN,1,18-02-2011 16:12,1.25,,United Kingdom,2011-02-18,1.25
571098,22807,SET OF 6 T-LIGHTS TOADSTOOLS,6,13-10-2011 15:38,2.95,17841.0,United Kingdom,2011-10-13,17.700000000000003
573335,85049E,SCANDINAVIAN REDS RIBBONS,2,30-10-2011 11:35,1.25,15059.0,United Kingdom,2011-10-30,2.5
555110,21917,SET 12 KIDS  WHITE CHALK STICKS,20,31-05-2011 14:34,0.42,17841.0,United Kingdom,2011-05-31,8.4
547651,22292,HANGING CHICK  YELLOW DECORATION,1,24-03-2011 12:11,1.45,16904.0,United Kingdom,2011-03-24,1.45
553941,22469,HEART OF WICKER SMALL,40,20-05-2011 10:37,1.45,14334.0,United Kingdom,2011-05-20,58.0
556267,85204,HANGING WOOD AND FELT FLOWER,480,09-06-2011 19:33,0.12,13694.0,United Kingdom,2011-09-06,57.599999999999994
552949,21786,POLKADOT RAIN HAT ,3,12-05-2011 12:01,0.42,16033.0,United Kingdom,2011-12-05,1.26
579170,22617,BAKING SET SPACEBOY DESIGN,1,28-11-2011 14:26,4.95,17811.0,United Kingdom,2011-11-28,4.95
562955,85123a,WHITE HANGING HEART T-LIGHT HOLDER,11,11-08-2011 10:14,6.63,,United Kingdom,2011-11-08,72.92999999999999
542528,22037,ROBOT BIRTHDAY CARD,12,28-01-2011 13:04,0.42,13141.0,United Kingdom,2011-01-28,5.04
541854,22356,CHARLOTTE BAG PINK POLKADOT,1,23-01-2011 14:58,0.85,18283.0,United Kingdom,2011-01-23,0.85
548621,79160,HEART SHAPE WIRELESS DOORBELL,2,01-04-2011 11:54,2.1,16960.0,United Kingdom,2011-01-04,4.2
581147,21174,POTTERING IN THE SHED METAL SIGN,1,07-12-2011 14:01,2.08,16426.0,United Kingdom,2011-07-12,2.08
579187,23367,SET 12 COLOUR PENCILS SPACEBOY ,1,28-11-2011 15:31,1.25,,United Kingdom,2011-11-28,1.25
580730,23349,ROLL WRAP VINTAGE CHRISTMAS,9,05-12-2011 17:28,2.46,,United Kingdom,2011-05-12,22.14
551174,21289,LARGE STRIPES CHOCOLATE GIFT BAG,1,26-04-2011 17:02,1.25,,United Kingdom,2011-04-26,1.25
538177,21871,SAVE THE PLANET MUG,1,10-12-2010 09:51,3.36,,United Kingdom,2010-10-12,3.36
545691,22553,PLASTERS IN TIN SKULLS,3,06-03-2011 12:52,1.65,14161.0,United Kingdom,2011-06-03,4.949999999999999
550288,21121,SET/10 RED POLKADOT PARTY CANDLES,2,15-04-2011 14:21,1.25,17367.0,United Kingdom,2011-04-15,2.5
578067,22277,COSMETIC BAG VINTAGE ROSE PAISLEY,1,22-11-2011 15:43,4.13,,United Kingdom,2011-11-22,4.13
571121,17129F,BLUE GLASS GEMS IN BAG,24,14-10-2011 09:21,0.64,18228.0,United Kingdom,2011-10-14,15.36
576603,22549,PICTURE DOMINOES,12,15-11-2011 15:22,1.45,14911.0,EIRE,2011-11-15,17.4
569246,23309,SET OF 60 I LOVE LONDON CAKE CASES ,1,03-10-2011 09:57,1.25,14096.0,United Kingdom,2011-03-10,1.25
575964,22383,LUNCH BAG SUKI DESIGN ,1,13-11-2011 12:31,1.65,15021.0,United Kingdom,2011-11-13,1.65
543474,85099F,JUMBO BAG STRAWBERRY,6,08-02-2011 15:09,1.95,14415.0,United Kingdom,2011-08-02,11.7
547362,20985,HEART CALCULATOR,100,22-03-2011 12:33,1.06,13694.0,United Kingdom,2011-03-22,106.0
558475,84249A,"GREETING CARD,SQUARE, DOUGHNUTS",1,29-06-2011 15:58,0.83,,United Kingdom,2011-06-29,0.83
555499,22605,WOODEN CROQUET GARDEN SET,1,03-06-2011 15:31,14.95,15812.0,United Kingdom,2011-03-06,14.95
574043,22596,CHRISTMAS STAR WISH LIST CHALKBOARD,5,02-11-2011 13:13,1.25,16367.0,United Kingdom,2011-02-11,6.25
566930,23199,JUMBO BAG APPLES,10,15-09-2011 15:26,2.08,15417.0,United Kingdom,2011-09-15,20.8
568061,20712,JUMBO BAG WOODLAND ANIMALS,1,23-09-2011 13:12,2.08,16910.0,United Kingdom,2011-09-23,2.08
568161,22734,SET OF 6 RIBBONS VINTAGE CHRISTMAS,2,25-09-2011 12:31,2.89,15860.0,United Kingdom,2011-09-25,5.78
541371,22262,FELT EGG COSY CHICKEN,6,17-01-2011 14:51,0.85,13983.0,United Kingdom,2011-01-17,5.1
536943,22469,HEART OF WICKER SMALL,2,03-12-2010 12:11,1.65,17884.0,United Kingdom,2010-03-12,3.3
579470,21166,COOK WITH WINE METAL SIGN ,6,29-11-2011 15:06,2.08,16549.0,United Kingdom,2011-11-29,12.48
550632,22083,PAPER CHAIN KIT RETROSPOT,1,19-04-2011 14:56,2.95,16907.0,United Kingdom,2011-04-19,2.95
550914,37449,CERAMIC CAKE STAND + HANGING CAKES,8,21-04-2011 13:29,8.5,17061.0,United Kingdom,2011-04-21,68.0
548740,20914,SET/5 RED RETROSPOT LID GLASS BOWLS,6,04-04-2011 11:34,2.95,13319.0,United Kingdom,2011-04-04,17.700000000000003
555947,22138,BAKING SET 9 PIECE RETROSPOT ,24,08-06-2011 10:45,4.25,14911.0,EIRE,2011-08-06,102.0
574680,22379,RECYCLING BAG RETROSPOT ,10,06-11-2011 12:40,2.1,15078.0,United Kingdom,2011-06-11,21.0
576587,21891,TRADITIONAL WOODEN SKIPPING ROPE,20,15-11-2011 14:23,1.45,18123.0,United Kingdom,2011-11-15,29.0
547788,22355,CHARLOTTE BAG SUKI DESIGN,2,25-03-2011 12:00,1.63,,United Kingdom,2011-03-25,3.26
561882,21790,VINTAGE SNAP CARDS,12,31-07-2011 12:52,0.85,13388.0,United Kingdom,2011-07-31,10.2
557958,23301,GARDENERS KNEELING PAD KEEP CALM ,2,23-06-2011 19:27,1.65,16161.0,United Kingdom,2011-06-23,3.3
567185,85099B,JUMBO BAG RED RETROSPOT,1,18-09-2011 15:55,2.08,16370.0,United Kingdom,2011-09-18,2.08
559816,22499,WOODEN UNION JACK BUNTING,5,12-07-2011 16:11,4.96,,United Kingdom,2011-12-07,24.8
559692,23005,TRAVEL CARD WALLET I LOVE LONDON,1,11-07-2011 15:52,0.42,,United Kingdom,2011-11-07,0.42
573130,21137,BLACK RECORD COVER FRAME,5,27-10-2011 16:41,3.75,13969.0,United Kingdom,2011-10-27,18.75
576329,21286,RETROSPOT CANDLE  LARGE,1,14-11-2011 15:22,4.96,,United Kingdom,2011-11-14,4.96
560360,23323,WHITE WICKER STAR ,18,18-07-2011 11:55,2.1,12744.0,Singapore,2011-07-18,37.800000000000004
578011,22910,PAPER CHAIN KIT VINTAGE CHRISTMAS,6,22-11-2011 12:52,2.95,15150.0,United Kingdom,2011-11-22,17.700000000000003
546678,21058,PARTY INVITES WOODLAND,12,15-03-2011 16:39,0.85,12681.0,France,2011-03-15,10.2
561217,22070,SMALL RED RETROSPOT MUG IN BOX ,1,25-07-2011 17:09,7.46,,United Kingdom,2011-07-25,7.46
543467,84596E,SMALL LICORICE DES PINK BOWL,1,08-02-2011 14:35,2.46,,United Kingdom,2011-08-02,2.46
580367,22988,SOLDIERS EGG CUP ,3,02-12-2011 16:39,2.46,,United Kingdom,2011-02-12,7.38
544179,22913,RED COAT RACK PARIS FASHION,9,16-02-2011 14:44,4.95,17422.0,United Kingdom,2011-02-16,44.550000000000004
571065,23235,STORAGE TIN VINTAGE LEAF,6,13-10-2011 14:59,2.89,12613.0,Germany,2011-10-13,17.34
543586,22619,SET OF 6 SOLDIER SKITTLES,4,10-02-2011 11:16,3.75,15809.0,United Kingdom,2011-10-02,15.0
547877,21673,WHITE SPOT BLUE CERAMIC DRAWER KNOB,2,27-03-2011 15:46,1.25,14573.0,United Kingdom,2011-03-27,2.5
581439,21739,COSY SLIPPER SHOES SMALL GREEN,1,08-12-2011 16:30,2.46,,United Kingdom,2011-08-12,2.46
558441,84558A,3D DOG PICTURE PLAYING CARDS,1,29-06-2011 12:59,2.95,14606.0,United Kingdom,2011-06-29,2.95
567482,22493,PAINT YOUR OWN CANVAS SET,5,20-09-2011 13:42,1.65,16464.0,United Kingdom,2011-09-20,8.25
575700,23424,GINGHAM RECIPE BOOK BOX,4,10-11-2011 16:58,4.95,15111.0,United Kingdom,2011-10-11,19.8
571797,21774,DECORATIVE CATS BATHROOM BOTTLE,1,19-10-2011 11:41,2.46,,United Kingdom,2011-10-19,2.46
570229,20914,SET/5 RED RETROSPOT LID GLASS BOWLS,1,09-10-2011 13:30,2.95,15756.0,United Kingdom,2011-09-10,2.95
563686,48116,DOORMAT MULTICOLOUR STRIPE,10,18-08-2011 12:30,6.75,13098.0,United Kingdom,2011-08-18,67.5
550701,47566,PARTY BUNTING,8,20-04-2011 10:48,4.95,14905.0,United Kingdom,2011-04-20,39.6
541835,22766,PHOTO FRAME CORNICE,4,23-01-2011 10:15,2.95,17243.0,United Kingdom,2011-01-23,11.8
576213,23376,PACK OF 12 VINTAGE CHRISTMAS TISSUE,12,14-11-2011 12:47,0.39,18117.0,United Kingdom,2011-11-14,4.68
576172,23355,HOT WATER BOTTLE KEEP CALM,24,14-11-2011 11:00,4.15,15482.0,United Kingdom,2011-11-14,99.60000000000001
555924,22395,PAPERWEIGHT VINTAGE PAISLEY,1,07-06-2011 17:12,4.96,,United Kingdom,2011-07-06,4.96
581450,22598,CHRISTMAS MUSICAL ZINC TREE,4,08-12-2011 17:54,0.29,16794.0,United Kingdom,2011-08-12,1.16
559169,22985,WRAP BILLBOARD FONTS DESIGN,50,06-07-2011 17:25,0.42,16722.0,United Kingdom,2011-06-07,21.0
539105,22086,PAPER CHAIN KIT 50'S CHRISTMAS ,6,16-12-2010 10:43,2.95,14825.0,United Kingdom,2010-12-16,17.700000000000003
552872,23283,DOORMAT VINTAGE LEAVES DESIGN ,10,12-05-2011 09:09,6.75,16985.0,United Kingdom,2011-12-05,67.5
564353,22303,COFFEE MUG APPLES DESIGN,6,24-08-2011 15:08,2.55,15764.0,United Kingdom,2011-08-24,15.299999999999999
579439,20914,SET/5 RED RETROSPOT LID GLASS BOWLS,32,29-11-2011 13:29,2.55,13426.0,United Kingdom,2011-11-29,81.6
548502,84029G,KNITTED UNION FLAG HOT WATER BOTTLE,2,31-03-2011 14:17,8.29,,United Kingdom,2011-03-31,16.58
579196,22083,PAPER CHAIN KIT RETROSPOT,2,28-11-2011 15:54,5.79,14096.0,United Kingdom,2011-11-28,11.58
546888,22227,HANGING HEART MIRROR DECORATION ,2,17-03-2011 18:15,1.25,,United Kingdom,2011-03-17,2.5
563943,23200,JUMBO BAG PEARS,20,22-08-2011 10:04,2.08,13139.0,United Kingdom,2011-08-22,41.6
567303,23217,LAUREL HEART ANTIQUE SILVER,12,19-09-2011 13:20,1.25,17613.0,United Kingdom,2011-09-19,15.0
560445,23192,BUNDLE OF 3 ALPHABET EXERCISE BOOKS,48,19-07-2011 09:08,1.45,14156.0,EIRE,2011-07-19,69.6
548674,90070,RUBY GLASS CLUSTER BRACELET,1,01-04-2011 16:38,5.95,,United Kingdom,2011-01-04,5.95
574555,23331,DECORATIVE WICKER HEART SMALL,10,04-11-2011 15:29,0.63,16426.0,United Kingdom,2011-04-11,6.3
558635,21523,DOORMAT FANCY FONT HOME SWEET HOME,1,30-06-2011 19:52,7.95,16498.0,United Kingdom,2011-06-30,7.95
563013,21429,RED GINGHAM ROSE JEWELLERY BOX,8,11-08-2011 12:01,1.95,12993.0,United Kingdom,2011-11-08,15.6
581219,22814,CARD PARTY GAMES ,10,08-12-2011 09:28,0.42,,United Kingdom,2011-08-12,4.2
572194,21619,4 VANILLA BOTANICAL CANDLES,1,21-10-2011 11:43,1.25,17832.0,United Kingdom,2011-10-21,1.25
546388,84997d,CHILDRENS CUTLERY POLKADOT PINK,3,11-03-2011 13:42,8.29,,United Kingdom,2011-11-03,24.869999999999997
580983,85032B,BLOSSOM IMAGES GIFT WRAP SET,1,06-12-2011 16:26,1.63,,United Kingdom,2011-06-12,1.63
558864,48187,DOORMAT NEW ENGLAND,2,04-07-2011 12:38,7.95,,EIRE,2011-04-07,15.9
562934,22644,CERAMIC CHERRY CAKE MONEY BANK,1,10-08-2011 16:56,3.29,,United Kingdom,2011-10-08,3.29
571034,23174,REGENCY SUGAR BOWL GREEN,4,13-10-2011 12:47,4.15,12359.0,Cyprus,2011-10-13,16.6
581182,23302,KNEELING MAT HOUSEWORK  DESIGN,24,07-12-2011 15:56,0.79,12783.0,Portugal,2011-07-12,18.96
569670,21587,COSY HOUR GIANT TUBE MATCHES,1,05-10-2011 13:47,2.55,14730.0,United Kingdom,2011-05-10,2.55
565541,22402,MAGNETS PACK OF 4 VINTAGE COLLAGE,2,05-09-2011 12:00,0.39,14159.0,United Kingdom,2011-05-09,0.78
577531,21948,SET OF 6 CAKE CHOPSTICKS,1,20-11-2011 13:58,2.46,,United Kingdom,2011-11-20,2.46
556089,84997a,CHILDRENS CUTLERY POLKADOT GREEN ,1,08-06-2011 15:25,8.29,,United Kingdom,2011-08-06,8.29
547772,72799E,IVORY PILLAR CANDLE SILVER FLOCK,1,25-03-2011 11:34,2.95,17979.0,United Kingdom,2011-03-25,2.95
544691,22960,JAM MAKING SET WITH JARS,6,23-02-2011 09:09,4.25,13804.0,United Kingdom,2011-02-23,25.5
572872,23298,SPOTTY BUNTING,2,26-10-2011 13:27,4.95,15320.0,United Kingdom,2011-10-26,9.9
551966,23298,SPOTTY BUNTING,2,05-05-2011 13:14,4.95,15356.0,United Kingdom,2011-05-05,9.9
541240,21213,PACK OF 72 SKULL CAKE CASES,1,16-01-2011 11:07,0.55,16206.0,United Kingdom,2011-01-16,0.55
557875,23203,JUMBO BAG DOILEY PATTERNS,10,23-06-2011 13:09,2.08,13300.0,United Kingdom,2011-06-23,20.8
580117,22632,HAND WARMER RED RETROSPOT,12,01-12-2011 16:28,2.1,14655.0,United Kingdom,2011-01-12,25.200000000000003
570656,72131,COLUMBIAN CANDLE RECTANGLE,48,11-10-2011 14:10,1.65,16120.0,United Kingdom,2011-11-10,79.19999999999999
570650,21218,RED SPOTTY BISCUIT TIN,1,11-10-2011 13:13,3.75,13263.0,United Kingdom,2011-11-10,3.75
536544,47580,TEA TIME DES TEA COSY,1,01-12-2010 14:32,5.06,,United Kingdom,2010-01-12,5.06
544824,21217,RED RETROSPOT ROUND CAKE TINS,1,24-02-2011 09:32,9.95,17139.0,United Kingdom,2011-02-24,9.95
540157,84997C,BLUE 3 PIECE POLKADOT CUTLERY SET,2,05-01-2011 11:41,3.75,15311.0,United Kingdom,2011-05-01,7.5
544792,22726,ALARM CLOCK BAKELIKE GREEN,8,23-02-2011 12:37,3.75,18172.0,United Kingdom,2011-02-23,30.0
563195,84510E,SET OF 4 GREEN CAROUSEL COASTERS,2,12-08-2011 16:36,2.46,,United Kingdom,2011-12-08,4.92
579676,84970L,SINGLE HEART ZINC T-LIGHT HOLDER,12,30-11-2011 13:13,1.25,17502.0,United Kingdom,2011-11-30,15.0
538508,84375,SET OF 20 KIDS COOKIE CUTTERS,4,12-12-2010 13:32,2.1,15998.0,United Kingdom,2010-12-12,8.4
562596,21933,PINK VINTAGE PAISLEY PICNIC BAG,10,08-08-2011 09:22,1.65,16145.0,United Kingdom,2011-08-08,16.5
556958,22627,MINT KITCHEN SCALES,2,16-06-2011 09:15,8.5,17490.0,United Kingdom,2011-06-16,17.0
571987,23080,RED METAL BOX TOP SECRET,2,20-10-2011 10:47,8.25,17007.0,United Kingdom,2011-10-20,16.5
554372,23170,REGENCY TEA PLATE ROSES ,12,24-05-2011 10:50,1.65,13842.0,United Kingdom,2011-05-24,19.799999999999997
559550,21217,RED RETROSPOT ROUND CAKE TINS,2,10-07-2011 15:38,9.95,17757.0,United Kingdom,2011-10-07,19.9
580730,47563A,RETRO LONGBOARD IRONING BOARD COVER,3,05-12-2011 17:28,3.29,,United Kingdom,2011-05-12,9.870000000000001
548191,22766,PHOTO FRAME CORNICE,1,29-03-2011 15:20,5.79,,United Kingdom,2011-03-29,5.79
572897,22385,JUMBO BAG SPACEBOY DESIGN,3,26-10-2011 14:42,4.13,,United Kingdom,2011-10-26,12.39
536592,22428,ENAMEL FIRE BUCKET CREAM,1,01-12-2010 17:06,14.43,,United Kingdom,2010-01-12,14.43
574901,23543,WALL ART KEEP CALM ,2,07-11-2011 15:15,8.25,17158.0,United Kingdom,2011-07-11,16.5
559816,20719,WOODLAND CHARLOTTE BAG,2,12-07-2011 16:11,1.63,,United Kingdom,2011-12-07,3.26
559174,21932,SCANDINAVIAN PAISLEY PICNIC BAG,10,07-07-2011 10:04,1.65,18263.0,United Kingdom,2011-07-07,16.5
559055,21189,WHITE HONEYCOMB PAPER GARLAND ,3,05-07-2011 17:09,3.29,,United Kingdom,2011-05-07,9.870000000000001
539750,21989,PACK OF 20 SKULL PAPER NAPKINS,2,21-12-2010 15:40,2.51,,United Kingdom,2010-12-21,5.02
539351,20712,JUMBO BAG WOODLAND ANIMALS,10,17-12-2010 11:23,1.95,12551.0,Spain,2010-12-17,19.5
575875,79321,CHILLI LIGHTS,1,11-11-2011 13:06,12.46,,United Kingdom,2011-11-11,12.46
558704,21519,GIN & TONIC DIET GREETING CARD ,12,01-07-2011 12:50,0.42,17505.0,United Kingdom,2011-01-07,5.04
542794,84969,BOX OF 6 ASSORTED COLOUR TEASPOONS,1,01-02-2011 10:56,3.29,,United Kingdom,2011-01-02,3.29
579187,48111,DOORMAT 3 SMILEY CATS,1,28-11-2011 15:31,15.79,,United Kingdom,2011-11-28,15.79
575491,22142,CHRISTMAS CRAFT WHITE FAIRY ,3,09-11-2011 17:47,1.45,15531.0,United Kingdom,2011-09-11,4.35
552288,85123A,WHITE HANGING HEART T-LIGHT HOLDER,12,08-05-2011 13:20,2.95,13313.0,United Kingdom,2011-08-05,35.400000000000006
557299,20972,PINK CREAM FELT CRAFT TRINKET BOX ,12,19-06-2011 13:56,1.25,13047.0,United Kingdom,2011-06-19,15.0
575986,21563,RED HEART SHAPE LOVE BUCKET ,6,13-11-2011 14:11,2.95,13018.0,United Kingdom,2011-11-13,17.700000000000003
552493,15058A,BLUE POLKADOT GARDEN PARASOL,3,09-05-2011 16:21,10.79,,United Kingdom,2011-09-05,32.37
538149,82600,NO SINGING METAL SIGN,1,09-12-2010 16:27,4.21,,United Kingdom,2010-09-12,4.21
574898,22553,PLASTERS IN TIN SKULLS,6,07-11-2011 15:07,1.65,16242.0,United Kingdom,2011-07-11,9.899999999999999
571017,21123,SET/10 IVORY POLKADOT PARTY CANDLES,24,13-10-2011 12:17,1.25,15116.0,United Kingdom,2011-10-13,30.0
560036,23165,LARGE CERAMIC TOP STORAGE JAR,12,14-07-2011 13:51,1.65,14911.0,EIRE,2011-07-14,19.799999999999997
568063,23344,JUMBO BAG 50'S CHRISTMAS ,10,23-09-2011 13:24,2.08,15981.0,United Kingdom,2011-09-23,20.8
538418,72807C,SET/3 VANILLA SCENTED CANDLE IN BOX,2,12-12-2010 12:00,4.25,17372.0,United Kingdom,2010-12-12,8.5
547492,84991,60 TEATIME FAIRY CAKE CASES,24,23-03-2011 12:06,0.55,12604.0,France,2011-03-23,13.200000000000001
546782,48194,DOORMAT HEARTS,4,17-03-2011 09:13,7.95,15291.0,United Kingdom,2011-03-17,31.8
541695,22136,LOVE HEART SOCK HANGER,1,20-01-2011 18:01,3.29,,United Kingdom,2011-01-20,3.29
567153,23346,SPACEBOY BEAKER,1,16-09-2011 16:25,1.25,14056.0,United Kingdom,2011-09-16,1.25
546972,21976,PACK OF 60 MUSHROOM CAKE CASES,1,18-03-2011 12:04,2.08,,United Kingdom,2011-03-18,2.08
573006,23298,SPOTTY BUNTING,10,27-10-2011 12:16,4.95,16232.0,United Kingdom,2011-10-27,49.5
550001,21084,SET/6 COLLAGE PAPER CUPS,24,14-04-2011 09:28,0.19,17704.0,United Kingdom,2011-04-14,4.5600000000000005
579270,23492,VINTAGE JINGLE BELLS WREATH,2,29-11-2011 09:50,8.25,15783.0,United Kingdom,2011-11-29,16.5
568782,22083,PAPER CHAIN KIT RETROSPOT,6,29-09-2011 08:53,2.95,13985.0,United Kingdom,2011-09-29,17.700000000000003
570598,23535,BICYCLE SAFTEY WALL ART,4,11-10-2011 11:55,5.95,14175.0,United Kingdom,2011-11-10,23.8
561371,85035B,CHOCOLATE 3 WICK MORRIS BOX CANDLE,1,26-07-2011 16:25,8.29,,United Kingdom,2011-07-26,8.29
575875,22064,PINK DOUGHNUT TRINKET POT ,1,11-11-2011 13:06,3.29,,United Kingdom,2011-11-11,3.29
559862,21498,RED RETROSPOT WRAP ,50,13-07-2011 10:30,0.42,12782.0,Portugal,2011-07-13,21.0
540979,21623,VINTAGE UNION JACK MEMOBOARD,2,12-01-2011 15:06,9.95,15727.0,United Kingdom,2011-12-01,19.9
544937,85099C,JUMBO  BAG BAROQUE BLACK WHITE,10,25-02-2011 10:09,1.95,12839.0,United Kingdom,2011-02-25,19.5
570167,23355,HOT WATER BOTTLE KEEP CALM,8,07-10-2011 14:04,4.95,15615.0,United Kingdom,2011-07-10,39.6
539240,21879,HEARTS GIFT TAPE,12,16-12-2010 13:15,0.65,15194.0,United Kingdom,2010-12-16,7.800000000000001
578344,22816,CARD MOTORBIKE SANTA,5,24-11-2011 09:21,0.42,,United Kingdom,2011-11-24,2.1
568064,23319,BOX OF 6 MINI 50'S CRACKERS,6,23-09-2011 13:42,2.49,14880.0,United Kingdom,2011-09-23,14.940000000000001
580735,23203,JUMBO BAG VINTAGE DOILY ,10,06-12-2011 08:52,2.08,17728.0,United Kingdom,2011-06-12,20.8
541111,21974,SET OF 36 PAISLEY FLOWER DOILIES,12,13-01-2011 15:13,1.45,15687.0,United Kingdom,2011-01-13,17.4
564752,22654,DELUXE SEWING KIT ,12,30-08-2011 10:07,5.95,16126.0,United Kingdom,2011-08-30,71.4
549007,21318,GLASS CHALICE BLUE SMALL ,36,05-04-2011 14:38,0.39,17470.0,United Kingdom,2011-05-04,14.040000000000001
565931,22630,DOLLY GIRL LUNCH BOX,12,08-09-2011 10:35,1.95,12683.0,France,2011-08-09,23.4
571846,23321,SMALL WHITE HEART OF WICKER,1,19-10-2011 12:35,1.65,17841.0,United Kingdom,2011-10-19,1.65
575491,21711,FOLDING UMBRELLA WHITE/RED POLKADOT,1,09-11-2011 17:47,4.95,15531.0,United Kingdom,2011-09-11,4.95
563538,47422,ASSORTED MONKEY SUCTION CUP HOOK,3,17-08-2011 11:48,0.42,17841.0,United Kingdom,2011-08-17,1.26
550638,22620,4 TRADITIONAL SPINNING TOPS,3,19-04-2011 15:44,2.46,,United Kingdom,2011-04-19,7.38
552835,22707,WRAP MONSTER FUN ,25,11-05-2011 14:17,0.42,17664.0,United Kingdom,2011-11-05,10.5
559317,22674,FRENCH TOILET SIGN BLUE METAL,2,07-07-2011 14:03,1.25,17611.0,United Kingdom,2011-07-07,2.5
547705,20914,SET/5 RED RETROSPOT LID GLASS BOWLS,5,24-03-2011 18:20,2.95,14056.0,United Kingdom,2011-03-24,14.75
542058,17013D,ORIGAMI ROSE INCENSE IN TUBE,96,25-01-2011 11:59,0.42,15601.0,United Kingdom,2011-01-25,40.32
560712,85099F,JUMBO BAG STRAWBERRY,2,20-07-2011 13:06,2.08,14456.0,United Kingdom,2011-07-20,4.16
558700,21244,BLUE POLKADOT PLATE ,1,01-07-2011 12:33,1.69,17920.0,United Kingdom,2011-01-07,1.69
560393,21731,RED TOADSTOOL LED NIGHT LIGHT,4,18-07-2011 13:33,1.65,14808.0,United Kingdom,2011-07-18,6.6
576872,23203,JUMBO BAG VINTAGE DOILY ,10,16-11-2011 16:26,2.08,13238.0,United Kingdom,2011-11-16,20.8
574951,22784,LANTERN CREAM GAZEBO ,3,08-11-2011 09:44,4.95,15763.0,United Kingdom,2011-08-11,14.850000000000001
578357,17012C,ORIGAMI LAVENDER INCENSE/CANDL SET ,18,24-11-2011 10:24,0.85,17228.0,United Kingdom,2011-11-24,15.299999999999999
575046,85152,HAND OVER THE CHOCOLATE   SIGN ,4,08-11-2011 12:09,2.1,15039.0,United Kingdom,2011-08-11,8.4
538854,22745,POPPY'S PLAYHOUSE BEDROOM ,6,14-12-2010 13:44,2.1,13102.0,United Kingdom,2010-12-14,12.600000000000001
571219,22121,NOEL WOODEN BLOCK LETTERS ,3,14-10-2011 13:35,5.95,15601.0,United Kingdom,2011-10-14,17.85
567459,23331,DECORATIVE WICKER HEART SMALL,48,20-09-2011 12:21,0.63,14221.0,United Kingdom,2011-09-20,30.240000000000002
558418,21787,RAIN PONCHO RETROSPOT,48,29-06-2011 11:35,0.85,12901.0,United Kingdom,2011-06-29,40.8
567692,23546,WRAP PAISLEY PARK ,25,21-09-2011 17:05,0.42,17997.0,United Kingdom,2011-09-21,10.5
540026,22378,WALL TIDY RETROSPOT ,13,04-01-2011 13:25,1.66,,United Kingdom,2011-04-01,21.58
561885,72800C,4 PINK DINNER CANDLE SILVER FLOCK,1,31-07-2011 13:13,2.55,15532.0,United Kingdom,2011-07-31,2.55
558075,22869,NUMBER TILE COTTAGE GARDEN 1,1,24-06-2011 17:07,1.95,17858.0,United Kingdom,2011-06-24,1.95
538508,21743,STAR PORTABLE TABLE LIGHT ,4,12-12-2010 13:32,2.95,15998.0,United Kingdom,2010-12-12,11.8
547697,84378,SET OF 3 HEART COOKIE CUTTERS,12,24-03-2011 16:23,1.25,14348.0,United Kingdom,2011-03-24,15.0
579986,15056N,EDWARDIAN PARASOL NATURAL,12,01-12-2011 11:18,4.95,13777.0,United Kingdom,2011-01-12,59.400000000000006
539256,21518,BANK ACCOUNT  GREETING  CARD ,12,16-12-2010 14:27,0.42,15601.0,United Kingdom,2010-12-16,5.04
568346,20725,LUNCH BAG RED RETROSPOT,3,26-09-2011 15:28,4.13,14096.0,United Kingdom,2011-09-26,12.39
550138,22980,PANTRY SCRUBBING BRUSH,1,14-04-2011 14:02,1.65,12841.0,United Kingdom,2011-04-14,1.65
578858,22405,MONEY BOX POCKET MONEY DESIGN,6,27-11-2011 11:22,1.25,18145.0,United Kingdom,2011-11-27,7.5
567673,21192,WHITE BELL HONEYCOMB PAPER ,6,21-09-2011 15:43,3.29,,United Kingdom,2011-09-21,19.740000000000002
548708,23233,WRAP POPPIES  DESIGN,25,03-04-2011 12:41,0.42,13269.0,United Kingdom,2011-03-04,10.5
572238,23435,3 RAFFIA RIBBONS VINTAGE CHRISTMAS,10,21-10-2011 14:50,0.79,15819.0,United Kingdom,2011-10-21,7.9
581477,22457,NATURAL SLATE HEART CHALKBOARD ,6,09-12-2011 08:59,2.95,13426.0,United Kingdom,2011-09-12,17.700000000000003
578519,22690,DOORMAT HOME SWEET HOME BLUE ,1,24-11-2011 13:56,8.25,14591.0,United Kingdom,2011-11-24,8.25
565928,22557,PLASTERS IN TIN VINTAGE PAISLEY ,12,08-09-2011 10:09,1.65,,EIRE,2011-08-09,19.799999999999997
542105,22956,36 FOIL HEART CAKE CASES,6,25-01-2011 13:35,2.1,12854.0,United Kingdom,2011-01-25,12.600000000000001
538453,22750,FELTCRAFT PRINCESS LOLA DOLL,1,12-12-2010 12:26,3.75,16779.0,United Kingdom,2010-12-12,3.75
546866,22295,HEART FILIGREE DOVE LARGE,1,17-03-2011 15:47,1.65,14462.0,United Kingdom,2011-03-17,1.65
556288,22027,TEA PARTY BIRTHDAY CARD,12,10-06-2011 09:23,0.42,13426.0,United Kingdom,2011-10-06,5.04
556886,22138,BAKING SET 9 PIECE RETROSPOT ,3,15-06-2011 12:34,4.95,12624.0,France,2011-06-15,14.850000000000001
551775,22993,SET OF 4 PANTRY JELLY MOULDS,12,04-05-2011 11:21,1.25,12886.0,United Kingdom,2011-04-05,15.0
544810,22189,CREAM HEART CARD HOLDER,8,23-02-2011 15:53,3.95,17675.0,United Kingdom,2011-02-23,31.6
558731,22645,CERAMIC HEART FAIRY CAKE MONEY BANK,12,01-07-2011 14:53,1.45,13285.0,United Kingdom,2011-01-07,17.4
547565,22083,PAPER CHAIN KIT RETROSPOT,6,24-03-2011 09:21,2.95,13035.0,United Kingdom,2011-03-24,17.700000000000003
559538,82552,WASHROOM METAL SIGN,2,10-07-2011 12:25,1.45,16880.0,United Kingdom,2011-10-07,2.9
538449,22314,OFFICE MUG WARMER CHOC+BLUE,5,12-12-2010 12:24,2.95,17085.0,United Kingdom,2010-12-12,14.75
566967,20679,EDWARDIAN PARASOL RED,3,15-09-2011 18:05,5.95,16746.0,United Kingdom,2011-09-15,17.85
553202,22699,ROSES REGENCY TEACUP AND SAUCER ,1,15-05-2011 16:02,2.95,15854.0,United Kingdom,2011-05-15,2.95
581214,22969,HOMEMADE JAM SCENTED CANDLES,60,08-12-2011 08:32,1.45,14251.0,United Kingdom,2011-08-12,87.0
574864,85152,HAND OVER THE CHOCOLATE   SIGN ,4,07-11-2011 12:29,2.1,14387.0,United Kingdom,2011-07-11,8.4
560870,22616,PACK OF 12 LONDON TISSUES ,24,21-07-2011 14:34,0.29,13157.0,United Kingdom,2011-07-21,6.959999999999999
571119,84029E,RED WOOLLY HOTTIE WHITE HEART.,2,14-10-2011 09:04,9.13,,United Kingdom,2011-10-14,18.26
571082,21126,SET OF 6 GIRLS CELEBRATION CANDLES,1,13-10-2011 15:25,1.25,,United Kingdom,2011-10-13,1.25
571709,21892,TRADITIONAL WOODEN CATCH CUP GAME ,12,18-10-2011 15:52,1.25,16463.0,United Kingdom,2011-10-18,15.0
550206,21033,JUMBO BAG CHARLIE AND LOLA TOYS,1,15-04-2011 10:38,4.13,,United Kingdom,2011-04-15,4.13
549569,22179,SET 10 LIGHTS NIGHT OWL,1,10-04-2011 15:15,6.75,15547.0,United Kingdom,2011-10-04,6.75
580677,21314,SMALL GLASS HEART TRINKET POT,1,05-12-2011 14:40,2.1,16200.0,United Kingdom,2011-05-12,2.1
545559,82600,NO SINGING METAL SIGN,1,03-03-2011 15:31,2.1,15005.0,United Kingdom,2011-03-03,2.1
561209,22539,MINI JIGSAW DOLLY GIRL,1,25-07-2011 16:57,0.83,,United Kingdom,2011-07-25,0.83
580730,21314,SMALL GLASS HEART TRINKET POT,3,05-12-2011 17:28,4.13,,United Kingdom,2011-05-12,12.39
536876,22760,"TRAY, BREAKFAST IN BED",2,03-12-2010 11:36,25.49,,United Kingdom,2010-03-12,50.98
545447,22083,PAPER CHAIN KIT RETROSPOT,6,02-03-2011 16:34,2.95,17426.0,United Kingdom,2011-02-03,17.700000000000003
562537,21243,PINK  POLKADOT PLATE ,8,05-08-2011 15:02,1.69,12517.0,Germany,2011-05-08,13.52
541410,82483,WOOD 2 DRAWER CABINET WHITE FINISH,6,17-01-2011 16:06,5.95,13089.0,United Kingdom,2011-01-17,35.7
553535,21213,PACK OF 72 SKULL CAKE CASES,24,17-05-2011 15:17,0.55,,EIRE,2011-05-17,13.200000000000001
560601,22723,SET OF 6 HERB TINS SKETCHBOOK,1,19-07-2011 17:17,3.95,16764.0,United Kingdom,2011-07-19,3.95
580055,21930,JUMBO STORAGE BAG SKULLS,40,01-12-2011 13:12,1.79,14298.0,United Kingdom,2011-01-12,71.6
549154,22084,PAPER CHAIN KIT EMPIRE,12,06-04-2011 16:47,2.95,17690.0,United Kingdom,2011-06-04,35.400000000000006
543822,22965,3 TRADITIONAl BISCUIT CUTTERS  SET,12,14-02-2011 09:24,2.1,12507.0,Spain,2011-02-14,25.200000000000003
567939,22577,WOODEN HEART CHRISTMAS SCANDINAVIAN,24,22-09-2011 18:15,0.29,16715.0,United Kingdom,2011-09-22,6.959999999999999
572055,20914,SET/5 RED RETROSPOT LID GLASS BOWLS,1,20-10-2011 12:34,2.95,17346.0,United Kingdom,2011-10-20,2.95
575049,22630,DOLLY GIRL LUNCH BOX,12,08-11-2011 12:13,1.95,12721.0,France,2011-08-11,23.4
570113,16225,RATTLE SNAKE EGGS,1,07-10-2011 12:31,1.25,15874.0,United Kingdom,2011-07-10,1.25
547882,85093,CANDY SPOT EGG WARMER HARE,48,28-03-2011 07:53,0.39,14911.0,EIRE,2011-03-28,18.72
541855,21896,POTTING SHED TWINE,2,23-01-2011 14:59,2.1,13742.0,United Kingdom,2011-01-23,4.2
572087,21987,PACK OF 6 SKULL PAPER CUPS,12,20-10-2011 14:30,0.65,12683.0,France,2011-10-20,7.800000000000001
548968,21469,POLKA DOT RAFFIA FOOD COVER,12,05-04-2011 10:58,3.75,12744.0,Singapore,2011-05-04,45.0
579069,21588,RETROSPOT GIANT TUBE MATCHES,12,28-11-2011 10:31,2.55,14911.0,EIRE,2011-11-28,30.599999999999998
553660,62043B,BLUE CHECK BAG W HANDLE 34X20CM,5,18-05-2011 11:58,0.83,14620.0,United Kingdom,2011-05-18,4.1499999999999995
567472,20679,EDWARDIAN PARASOL RED,2,20-09-2011 12:47,5.95,15039.0,United Kingdom,2011-09-20,11.9
580107,22586,FELTCRAFT HAIRBAND PINK AND BLUE,12,01-12-2011 15:32,0.85,15948.0,United Kingdom,2011-01-12,10.2
564060,22483,RED GINGHAM TEDDY BEAR ,2,22-08-2011 14:37,2.95,17073.0,United Kingdom,2011-08-22,5.9
548338,35809A,ENAMEL PINK TEA CONTAINER,12,30-03-2011 14:08,0.83,16558.0,United Kingdom,2011-03-30,9.959999999999999
546117,84306,S/3 PINK SQUARE PLANTERS ROSES,1,09-03-2011 13:56,10.95,16771.0,United Kingdom,2011-09-03,10.95
578121,22865,HAND WARMER OWL DESIGN,12,23-11-2011 10:23,2.1,14547.0,United Kingdom,2011-11-23,25.200000000000003
557324,84907,PINK YELLOW PATCH CUSHION COVER,1,20-06-2011 09:41,5.79,,United Kingdom,2011-06-20,5.79
545464,21935,SUKI  SHOULDER BAG,1,03-03-2011 09:10,3.29,,United Kingdom,2011-03-03,3.29
537224,22144,CHRISTMAS CRAFT LITTLE FRIENDS,3,05-12-2010 16:24,2.1,13174.0,United Kingdom,2010-05-12,6.300000000000001
557322,22986,GINGHAM ROSE WRAP,25,20-06-2011 09:04,0.42,17444.0,Canada,2011-06-20,10.5
549847,22222,CAKE PLATE LOVEBIRD WHITE,3,12-04-2011 14:43,4.95,15358.0,United Kingdom,2011-12-04,14.850000000000001
551385,22722,SET OF 6 SPICE TINS PANTRY DESIGN,3,28-04-2011 11:38,3.95,16814.0,United Kingdom,2011-04-28,11.850000000000001
555551,22456,NATURAL SLATE CHALKBOARD LARGE ,6,05-06-2011 13:32,4.95,14696.0,United Kingdom,2011-05-06,29.700000000000003
545695,22357,KINGS CHOICE BISCUIT TIN,4,06-03-2011 14:15,4.25,17050.0,United Kingdom,2011-06-03,17.0
545530,21670,BLUE SPOT CERAMIC DRAWER KNOB,24,03-03-2011 13:45,1.25,17416.0,United Kingdom,2011-03-03,30.0
547374,21891,TRADITIONAL WOODEN SKIPPING ROPE,1,22-03-2011 13:54,1.25,16110.0,United Kingdom,2011-03-22,1.25
557305,22167, OVAL WALL MIRROR DIAMANTE ,1,19-06-2011 14:42,9.95,13568.0,United Kingdom,2011-06-19,9.95
551840,48185,DOORMAT FAIRY CAKE,10,04-05-2011 13:36,6.75,15144.0,United Kingdom,2011-04-05,67.5
554978,21240,BLUE POLKADOT CUP,8,29-05-2011 11:05,0.85,16889.0,United Kingdom,2011-05-29,6.8
571694,85049A,TRADITIONAL CHRISTMAS RIBBONS,12,18-10-2011 14:44,1.25,13308.0,United Kingdom,2011-10-18,15.0
558475,90209C,PINK ENAMEL+GLASS HAIR COMB,4,29-06-2011 15:58,2.07,,United Kingdom,2011-06-29,8.28
539338,22536,MAGIC DRAWING SLATE PURDEY,192,17-12-2010 10:54,0.42,17404.0,Sweden,2010-12-17,80.64
568212,21990,MODERN FLORAL STATIONERY SET,1,25-09-2011 16:05,1.25,15154.0,United Kingdom,2011-09-25,1.25
556527,21936,RED RETROSPOT PICNIC BAG,2,13-06-2011 11:33,2.95,16205.0,United Kingdom,2011-06-13,5.9
569036,23234,BISCUIT TIN VINTAGE CHRISTMAS,6,30-09-2011 10:44,2.89,18217.0,United Kingdom,2011-09-30,17.34
536833,22576,SWALLOW WOODEN CHRISTMAS DECORATION,12,02-12-2010 17:48,0.85,18239.0,United Kingdom,2010-02-12,10.2
542419,22561,WOODEN SCHOOL COLOURING SET,1,27-01-2011 17:41,1.65,14662.0,United Kingdom,2011-01-27,1.65
546891,85123A,WHITE HANGING HEART T-LIGHT HOLDER,1,17-03-2011 18:18,5.79,,United Kingdom,2011-03-17,5.79
538209,85049D,BRIGHT BLUES RIBBONS ,1,10-12-2010 11:42,1.25,12748.0,United Kingdom,2010-10-12,1.25
539637,22842,BISCUIT TIN VINTAGE RED,2,20-12-2010 15:22,6.75,14083.0,United Kingdom,2010-12-20,13.5
540646,20832,RED FLOCK LOVE HEART PHOTO FRAME,12,10-01-2011 14:32,0.81,,United Kingdom,2011-10-01,9.72
569246,23284,DOORMAT KEEP CALM AND COME IN,2,03-10-2011 09:57,16.63,14096.0,United Kingdom,2011-03-10,33.26
551315,84580,MOUSE TOY WITH PINK T-SHIRT,4,27-04-2011 15:08,3.75,17725.0,United Kingdom,2011-04-27,15.0
567462,21535,RED RETROSPOT SMALL MILK JUG,1,20-09-2011 12:35,2.55,14446.0,United Kingdom,2011-09-20,2.55
556819,23249,VINTAGE RED ENAMEL TRIM PLATE,12,15-06-2011 10:21,1.65,12682.0,France,2011-06-15,19.799999999999997
569007,22851,SET 20 NAPKINS FAIRY CAKES DESIGN ,12,29-09-2011 18:51,0.85,17552.0,United Kingdom,2011-09-29,10.2
568517,21935,SUKI  SHOULDER BAG,1,27-09-2011 12:52,1.65,14456.0,United Kingdom,2011-09-27,1.65
577768,23346,SPACEBOY BEAKER,2,21-11-2011 15:18,2.46,,United Kingdom,2011-11-21,4.92
538008,22909,SET OF 20 VINTAGE CHRISTMAS NAPKINS,12,09-12-2010 12:17,0.85,12683.0,France,2010-09-12,10.2
555651,23079,TOADSTOOL BEDSIDE LIGHT ,1,06-06-2011 14:02,8.95,17361.0,United Kingdom,2011-06-06,8.95
578844,22559,SEASIDE FLYING DISC,1,25-11-2011 16:14,2.46,,United Kingdom,2011-11-25,2.46
562890,21500,PINK POLKADOT WRAP ,25,10-08-2011 12:11,0.42,14191.0,United Kingdom,2011-10-08,10.5
565784,22625,RED KITCHEN SCALES,4,06-09-2011 16:02,8.5,15089.0,United Kingdom,2011-06-09,34.0
561043,23146,TRIPLE HOOK ANTIQUE IVORY ROSE,2,24-07-2011 12:20,3.29,15708.0,United Kingdom,2011-07-24,6.58
556917,22545,MINI JIGSAW BUNNIES,240,15-06-2011 13:37,0.36,12415.0,Australia,2011-06-15,86.39999999999999
576631,21137,BLACK RECORD COVER FRAME,16,16-11-2011 08:53,3.75,16626.0,United Kingdom,2011-11-16,60.0
562688,85135C,RED DRAGONFLY HELICOPTER,1,08-08-2011 13:53,7.95,13869.0,United Kingdom,2011-08-08,7.95
569488,20726,LUNCH BAG WOODLAND,6,04-10-2011 13:10,1.65,16440.0,United Kingdom,2011-04-10,9.899999999999999
553148,21251,DINOSAUR HEIGHT CHART STICKER SET,6,13-05-2011 14:09,2.95,,Hong Kong,2011-05-13,17.700000000000003
565383,22897,OVEN MITT APPLES DESIGN,1,02-09-2011 15:45,3.29,14096.0,United Kingdom,2011-02-09,3.29
579472,47591D,PINK FAIRY CAKE CHILDRENS APRON,1,29-11-2011 15:09,1.95,13521.0,United Kingdom,2011-11-29,1.95
562024,21930,JUMBO STORAGE BAG SKULLS,1,01-08-2011 16:07,4.13,,United Kingdom,2011-01-08,4.13
568208,23319,BOX OF 6 MINI 50'S CRACKERS,6,25-09-2011 15:35,2.49,12783.0,Portugal,2011-09-25,14.940000000000001
537823,90173,PAIR BUTTERFLY HAIR CLIPS,2,08-12-2010 14:25,3.81,,United Kingdom,2010-08-12,7.62
565769,23333,IVORY WICKER HEART MEDIUM,12,06-09-2011 14:32,1.25,16175.0,United Kingdom,2011-06-09,15.0
570273,23252,VINTAGE RED ENAMEL TRIM JUG ,4,10-10-2011 10:51,3.75,13373.0,United Kingdom,2011-10-10,15.0
537045,22156,HEART DECORATION WITH PEARLS ,4,05-12-2010 10:54,0.85,15038.0,United Kingdom,2010-05-12,3.4
541794,22384,LUNCH BAG PINK POLKADOT,2,21-01-2011 13:21,1.65,17238.0,United Kingdom,2011-01-21,3.3
573083,23557,LANDMARK FRAME BAKER STREET ,2,27-10-2011 14:22,12.5,13735.0,United Kingdom,2011-10-27,25.0
570427,23243,SET OF TEA COFFEE SUGAR TINS PANTRY,4,10-10-2011 13:56,4.95,17462.0,United Kingdom,2011-10-10,19.8
537395,20974,12 PENCILS SMALL TUBE SKULL,3,06-12-2010 14:05,0.65,15356.0,United Kingdom,2010-06-12,1.9500000000000002
575918,23178,JAM CLOCK MAGNET,6,11-11-2011 16:58,2.89,17191.0,United Kingdom,2011-11-11,17.34
563928,84997D,CHILDRENS CUTLERY POLKADOT PINK,1,21-08-2011 15:17,4.15,17059.0,United Kingdom,2011-08-21,4.15
547396,22666,RECIPE BOX PANTRY YELLOW DESIGN,1,22-03-2011 16:54,6.63,,United Kingdom,2011-03-22,6.63
544204,21876,POTTERING MUG,1,17-02-2011 10:30,3.29,,United Kingdom,2011-02-17,3.29
571056,20724,RED RETROSPOT CHARLOTTE BAG,10,13-10-2011 14:10,0.85,15367.0,United Kingdom,2011-10-13,8.5
568135,21843,RED RETROSPOT CAKE STAND,2,23-09-2011 17:04,8.29,,United Kingdom,2011-09-23,16.58
540813,85123A,WHITE HANGING HEART T-LIGHT HOLDER,2,11-01-2011 12:41,2.95,14669.0,United Kingdom,2011-11-01,5.9
575931,22423,REGENCY CAKESTAND 3 TIER,1,13-11-2011 10:35,12.75,16560.0,United Kingdom,2011-11-13,12.75
562893,22467,GUMBALL COAT RACK,6,10-08-2011 12:25,2.55,17442.0,United Kingdom,2011-10-08,15.299999999999999
559052,90029,NEW BAROQUE SMALL NECKLACE BLACK,1,05-07-2011 16:53,8.32,,United Kingdom,2011-05-07,8.32
568719,84692,BOX OF 24 COCKTAIL PARASOLS,3,28-09-2011 16:19,0.83,,United Kingdom,2011-09-28,2.4899999999999998
570852,48138,DOORMAT UNION FLAG,10,12-10-2011 14:48,7.08,13078.0,United Kingdom,2011-12-10,70.8
575138,75049L,LARGE CIRCULAR MIRROR MOBILE,3,08-11-2011 15:24,2.46,,United Kingdom,2011-08-11,7.38
544323,21326,AGED GLASS SILVER T-LIGHT HOLDER,32,17-02-2011 15:51,1.63,,United Kingdom,2011-02-17,52.16
561195,21213,PACK OF 72 SKULL CAKE CASES,4,25-07-2011 13:57,0.55,14796.0,United Kingdom,2011-07-25,2.2
541264,22508,DOORSTOP RETROSPOT HEART,2,16-01-2011 16:10,3.75,17064.0,United Kingdom,2011-01-16,7.5
558068,22801,ANTIQUE GLASS PEDESTAL BOWL,1,24-06-2011 15:51,7.46,,United Kingdom,2011-06-24,7.46
554376,21174,POTTERING IN THE SHED METAL SIGN,2,24-05-2011 11:31,2.08,15719.0,United Kingdom,2011-05-24,4.16
551887,22380,TOY TIDY SPACEBOY  ,5,05-05-2011 09:29,2.1,12593.0,France,2011-05-05,10.5
554158,21213,PACK OF 72 SKULL CAKE CASES,12,23-05-2011 11:44,0.55,15563.0,United Kingdom,2011-05-23,6.6000000000000005
541108,84947,ANTIQUE SILVER TEA GLASS ENGRAVED,72,13-01-2011 15:01,1.06,13199.0,United Kingdom,2011-01-13,76.32000000000001
553487,84836,ZINC METAL HEART DECORATION,2,17-05-2011 12:38,1.25,13246.0,United Kingdom,2011-05-17,2.5
553389,21621,VINTAGE UNION JACK BUNTING,2,16-05-2011 16:37,16.63,,United Kingdom,2011-05-16,33.26
549561,22890,NOVELTY BISCUITS CAKE STAND 3 TIER,2,10-04-2011 13:36,9.95,13570.0,United Kingdom,2011-10-04,19.9
538507,85114C,RED ENCHANTED FOREST PLACEMAT,1,12-12-2010 13:26,1.65,15547.0,United Kingdom,2010-12-12,1.65
552279,23208,LUNCH BAG VINTAGE LEAF DESIGN,10,08-05-2011 12:38,1.65,15117.0,United Kingdom,2011-08-05,16.5
564972,85049G,CHOCOLATE BOX RIBBONS ,12,31-08-2011 15:30,1.25,12621.0,Germany,2011-08-31,15.0
549947,21625,VINTAGE UNION JACK APRON,3,13-04-2011 12:47,6.95,18260.0,United Kingdom,2011-04-13,20.85
564039,22326,ROUND SNACK BOXES SET OF4 WOODLAND ,24,22-08-2011 12:40,2.95,12645.0,Germany,2011-08-22,70.80000000000001
557640,23298,SPOTTY BUNTING,15,21-06-2011 16:24,10.79,,United Kingdom,2011-06-21,161.85
539437,22456,NATURAL SLATE CHALKBOARD LARGE ,1,17-12-2010 14:54,10.17,,United Kingdom,2010-12-17,10.17
577483,23481,PEARLISED IVORY HEART SMALL ,1,20-11-2011 11:50,1.25,14502.0,United Kingdom,2011-11-20,1.25
581451,23583,LUNCH BAG PAISLEY PARK  ,10,08-12-2011 17:57,1.65,17144.0,United Kingdom,2011-08-12,16.5
571697,22613,PACK OF 20 SPACEBOY NAPKINS,12,18-10-2011 14:49,0.85,12759.0,Netherlands,2011-10-18,10.2
540458,10125,MINI FUNKY DESIGN TAPES,20,07-01-2011 12:28,0.42,12501.0,Germany,2011-07-01,8.4
537153,22633,HAND WARMER UNION JACK,1,05-12-2010 13:03,2.1,16718.0,United Kingdom,2010-05-12,2.1
540014,22379,RECYCLING BAG RETROSPOT ,2,04-01-2011 11:34,2.1,14606.0,United Kingdom,2011-04-01,4.2
551547,23205,CHARLOTTE BAG VINTAGE ALPHABET ,5,03-05-2011 09:44,1.63,,United Kingdom,2011-03-05,8.149999999999999
567890,23208,LUNCH BAG VINTAGE LEAF DESIGN,10,22-09-2011 15:40,1.65,14125.0,United Kingdom,2011-09-22,16.5
558099,84821,DANISH ROSE DELUXE COASTER,24,26-06-2011 13:45,0.85,17593.0,United Kingdom,2011-06-26,20.4
580136,22221,CAKE STAND LOVEBIRD 2 TIER PINK,1,01-12-2011 19:42,9.95,17841.0,United Kingdom,2011-01-12,9.95
571117,22603,CHRISTMAS RETROSPOT TREE WOOD,12,13-10-2011 17:51,0.85,16224.0,United Kingdom,2011-10-13,10.2
566520,22426,ENAMEL WASH BOWL CREAM,4,13-09-2011 11:26,3.75,17757.0,United Kingdom,2011-09-13,15.0
570428,23313,VINTAGE CHRISTMAS BUNTING,4,10-10-2011 14:02,4.95,15553.0,United Kingdom,2011-10-10,19.8
552007,22979,PANTRY WASHING UP BRUSH,12,05-05-2011 16:56,1.45,13269.0,United Kingdom,2011-05-05,17.4
561369,84596B,SMALL DOLLY MIX DESIGN ORANGE BOWL,1,26-07-2011 16:22,0.83,,United Kingdom,2011-07-26,0.83
547937,22498,WOODEN REGATTA BUNTING,1,28-03-2011 14:27,5.95,15068.0,United Kingdom,2011-03-28,5.95
565092,23245,SET OF 3 REGENCY CAKE TINS,4,01-09-2011 10:36,4.95,14092.0,United Kingdom,2011-01-09,19.8
549241,85132C,CHARLIE AND LOLA FIGURES TINS,6,07-04-2011 11:40,1.95,15719.0,United Kingdom,2011-07-04,11.7
580729,23129,HEART SHAPED HOLLY WREATH,1,05-12-2011 17:24,8.29,,United Kingdom,2011-05-12,8.29
555924,22371,AIRLINE BAG VINTAGE TOKYO 78,1,07-06-2011 17:12,8.29,,United Kingdom,2011-07-06,8.29
560115,21770,OPEN CLOSED METAL SIGN,1,15-07-2011 10:05,4.95,17841.0,United Kingdom,2011-07-15,4.95
580289,21165,BEWARE OF THE CAT METAL SIGN ,48,02-12-2011 13:32,1.45,15856.0,United Kingdom,2011-02-12,69.6
538917,82552,WASHROOM METAL SIGN,2,15-12-2010 10:57,1.45,17449.0,United Kingdom,2010-12-15,2.9
555510,21901,"KEY FOB , BACK DOOR ",1,03-06-2011 17:09,1.63,,United Kingdom,2011-03-06,1.63
542932,22558,CLOTHES PEGS RETROSPOT PACK 24 ,24,02-02-2011 10:54,1.49,13089.0,United Kingdom,2011-02-02,35.76
571125,22996,TRAVEL CARD WALLET VINTAGE TICKET,240,14-10-2011 09:48,0.42,16394.0,United Kingdom,2011-10-14,100.8
561679,21830,ASSORTED CREEPY CRAWLIES,24,28-07-2011 18:56,0.42,15245.0,United Kingdom,2011-07-28,10.08
541422,35965,FOLKART HEART NAPKIN RINGS,1,17-01-2011 17:48,3.29,,United Kingdom,2011-01-17,3.29
563549,21179,NO JUNK MAIL METAL SIGN,2,17-08-2011 12:34,3.29,,United Kingdom,2011-08-17,6.58
575985,22554,PLASTERS IN TIN WOODLAND ANIMALS,1,13-11-2011 14:09,1.65,17841.0,United Kingdom,2011-11-13,1.65
542538,22921,HERB MARKER CHIVES ,12,28-01-2011 13:54,0.65,15079.0,United Kingdom,2011-01-28,7.800000000000001
536569,21147,JINGLE BELLS TREE DECORATION,2,01-12-2010 15:35,2.1,16274.0,United Kingdom,2010-01-12,4.2
574949,22712,CARD DOLLY GIRL ,12,08-11-2011 09:12,0.42,14360.0,United Kingdom,2011-08-11,5.04
542533,22781,GUMBALL MAGAZINE RACK,12,28-01-2011 13:18,6.75,16019.0,United Kingdom,2011-01-28,81.0
555249,23101,SILVER STARS TABLE DECORATION,2,01-06-2011 14:57,0.83,17472.0,United Kingdom,2011-01-06,1.66
562150,85185B,PINK HORSE SOCK PUPPET,6,03-08-2011 10:49,2.95,14132.0,United Kingdom,2011-03-08,17.700000000000003
569555,22940,FELTCRAFT CHRISTMAS FAIRY,4,05-10-2011 08:17,4.25,17728.0,United Kingdom,2011-05-10,17.0
558122,23284,DOORMAT KEEP CALM AND COME IN,4,27-06-2011 09:35,7.95,16570.0,United Kingdom,2011-06-27,31.8
559368,23199,JUMBO BAG APPLES,10,08-07-2011 09:38,2.08,17031.0,United Kingdom,2011-08-07,20.8
543915,21116,OWL DOORSTOP,3,14-02-2011 13:21,4.95,13717.0,United Kingdom,2011-02-14,14.850000000000001
570721,21014,SWISS CHALET TREE DECORATION ,24,12-10-2011 10:51,0.29,13842.0,United Kingdom,2011-12-10,6.959999999999999
576463,23370,SET 36 COLOURING PENCILS DOILY,2,15-11-2011 11:37,1.25,17974.0,United Kingdom,2011-11-15,2.5
570273,20969,RED FLORAL FELTCRAFT SHOULDER BAG,4,10-10-2011 10:51,3.75,13373.0,United Kingdom,2011-10-10,15.0
567378,21733,RED HANGING HEART T-LIGHT HOLDER,6,20-09-2011 10:01,2.95,14911.0,EIRE,2011-09-20,17.700000000000003
567912,22560,TRADITIONAL MODELLING CLAY,4,22-09-2011 17:07,1.25,15555.0,United Kingdom,2011-09-22,5.0
536982,22727,ALARM CLOCK BAKELIKE RED ,3,03-12-2010 14:27,8.47,,United Kingdom,2010-03-12,25.410000000000004
539437,22042,CHRISTMAS CARD SINGING ANGEL,1,17-12-2010 14:54,0.43,,United Kingdom,2010-12-17,0.43
565766,22219,LOVEBIRD HANGING DECORATION WHITE ,6,06-09-2011 14:23,0.85,17841.0,United Kingdom,2011-06-09,5.1
540984,21556,CERAMIC STRAWBERRY MONEY BOX,1,12-01-2011 15:44,2.55,14167.0,United Kingdom,2011-12-01,2.55
536876,21949,SET OF 6 STRAWBERRY CHOPSTICKS,1,03-12-2010 11:36,2.51,,United Kingdom,2010-03-12,2.51
551842,21038,SET/4 MODERN VINTAGE COTTON NAPKINS,1,04-05-2011 13:52,0.79,16678.0,United Kingdom,2011-04-05,0.79
556578,20728,LUNCH BAG CARS BLUE,10,13-06-2011 14:13,1.65,12472.0,Germany,2011-06-13,16.5
561067,84946,ANTIQUE SILVER T-LIGHT GLASS,36,24-07-2011 14:26,1.25,14397.0,United Kingdom,2011-07-24,45.0
568187,85123A,WHITE HANGING HEART T-LIGHT HOLDER,32,25-09-2011 14:32,2.55,13408.0,United Kingdom,2011-09-25,81.6
561209,22951,60 CAKE CASES DOLLY GIRL DESIGN,2,25-07-2011 16:57,1.25,,United Kingdom,2011-07-25,2.5
564191,23061,VINTAGE EMBOSSED HEART,1,23-08-2011 16:16,1.25,17315.0,United Kingdom,2011-08-23,1.25
568344,22992,REVOLVER WOODEN RULER ,12,26-09-2011 15:23,1.95,16531.0,United Kingdom,2011-09-26,23.4
575333,23529,DOLLY GIRL WALL ART,6,09-11-2011 13:54,3.75,13209.0,United Kingdom,2011-09-11,22.5
538566,21908,CHOCOLATE THIS WAY METAL SIGN,1,13-12-2010 11:21,4.21,,United Kingdom,2010-12-13,4.21
569799,22144,CHRISTMAS CRAFT LITTLE FRIENDS,6,06-10-2011 11:47,2.1,13602.0,United Kingdom,2011-06-10,12.600000000000001
571545,23661,MILK MAIDS MUG ,1,17-10-2011 16:59,1.65,,United Kingdom,2011-10-17,1.65
579301,23355,HOT WATER BOTTLE KEEP CALM,1,29-11-2011 11:32,4.95,18118.0,United Kingdom,2011-11-29,4.95
573576,22262,FELT EGG COSY CHICKEN,3,31-10-2011 14:09,1.63,14096.0,United Kingdom,2011-10-31,4.89
572651,23382,BOX OF 6 CHRISTMAS CAKE DECORATIONS,8,25-10-2011 12:06,3.75,17350.0,United Kingdom,2011-10-25,30.0
537200,22110,BIRD HOUSE HOT WATER BOTTLE,1,05-12-2010 14:17,2.55,15867.0,United Kingdom,2010-05-12,2.55
543306,21561,DINOSAUR LUNCH BOX WITH CUTLERY,1,07-02-2011 11:56,2.55,16686.0,United Kingdom,2011-07-02,2.55
560483,21892,TRADITIONAL WOODEN CATCH CUP GAME ,12,19-07-2011 10:49,1.25,12955.0,United Kingdom,2011-07-19,15.0
540994,22907,PACK OF 20 NAPKINS PANTRY DESIGN,12,13-01-2011 09:29,0.85,13089.0,United Kingdom,2011-01-13,10.2
573291,22469,HEART OF WICKER SMALL,12,28-10-2011 14:51,1.65,16554.0,United Kingdom,2011-10-28,19.799999999999997
543600,20665,RED RETROSPOT PURSE ,2,10-02-2011 13:19,2.95,18168.0,United Kingdom,2011-10-02,5.9
547063,85186A,EASTER BUNNY GARLAND OF FLOWERS,7,20-03-2011 13:33,0.42,14769.0,United Kingdom,2011-03-20,2.94
577495,22598,CHRISTMAS MUSICAL ZINC TREE,5,20-11-2011 12:20,0.29,14704.0,United Kingdom,2011-11-20,1.45
561669,23295,SET OF 12 MINI LOAF BAKING CASES,128,28-07-2011 17:09,0.72,12507.0,Spain,2011-07-28,92.16
548522,22693,GROW A FLYTRAP OR SUNFLOWER IN TIN,42,31-03-2011 16:43,1.25,,United Kingdom,2011-03-31,52.5
572216,84836,ZINC METAL HEART DECORATION,4,21-10-2011 12:56,1.25,16015.0,United Kingdom,2011-10-21,5.0
550640,71279,PINK GLASS CANDLEHOLDER,2,19-04-2011 15:51,2.95,,United Kingdom,2011-04-19,5.9
560891,22094,RED RETROSPOT TISSUE BOX,36,21-07-2011 17:02,0.39,15106.0,United Kingdom,2011-07-21,14.040000000000001
550320,22361,GLASS JAR DAISY FRESH COTTON WOOL,1,17-04-2011 12:37,2.95,12748.0,United Kingdom,2011-04-17,2.95
555572,22631,CIRCUS PARADE LUNCH BOX ,12,05-06-2011 15:37,1.95,12449.0,Belgium,2011-05-06,23.4
540848,22983,CARD BILLBOARD FONT,1,12-01-2011 09:26,0.85,,United Kingdom,2011-12-01,0.85
544069,22328,ROUND SNACK BOXES SET OF 4 FRUITS ,6,15-02-2011 14:17,2.95,12616.0,France,2011-02-15,17.700000000000003
571328,22733,3D TRADITIONAL CHRISTMAS STICKERS,18,17-10-2011 11:27,1.25,12473.0,Germany,2011-10-17,22.5
556056,85059,FRENCH ENAMEL WATER BASIN,1,08-06-2011 13:35,3.75,17841.0,United Kingdom,2011-08-06,3.75
567672,21915,RED  HARMONICA IN BOX ,6,21-09-2011 15:39,1.25,16085.0,United Kingdom,2011-09-21,7.5
575051,22197,POPCORN HOLDER,4,08-11-2011 12:14,0.85,15957.0,United Kingdom,2011-08-11,3.4
575176,21253,SET OF PICTURE FRAME  STICKERS,1,08-11-2011 18:29,5.79,,United Kingdom,2011-08-11,5.79
572127,51014C,"FEATHER PEN,COAL BLACK",24,21-10-2011 09:20,0.39,14911.0,EIRE,2011-10-21,9.36
581450,23227,FILIGREE HEART BUTTERFLY WHITE ,4,08-12-2011 17:54,1.25,16794.0,United Kingdom,2011-08-12,5.0
545468,22149,FELTCRAFT 6 FLOWER FRIENDS,6,03-03-2011 09:41,2.1,16571.0,United Kingdom,2011-03-03,12.600000000000001
546306,22720,SET OF 3 CAKE TINS PANTRY DESIGN ,1,10-03-2011 16:16,10.79,,United Kingdom,2011-10-03,10.79
570871,22545,MINI JIGSAW BUNNIES,1,12-10-2011 16:36,0.83,,United Kingdom,2011-12-10,0.83
557954,48184,DOORMAT ENGLISH ROSE ,1,23-06-2011 18:44,7.95,15023.0,United Kingdom,2011-06-23,7.95
579261,21619,4 VANILLA BOTANICAL CANDLES,12,29-11-2011 09:10,1.25,13429.0,United Kingdom,2011-11-29,15.0
572558,20750,RED RETROSPOT MINI CASES,3,25-10-2011 08:26,7.95,14286.0,United Kingdom,2011-10-25,23.85
544920,22841,ROUND CAKE TIN VINTAGE GREEN,2,24-02-2011 16:31,7.95,13081.0,United Kingdom,2011-02-24,15.9
559629,21174,POTTERING IN THE SHED METAL SIGN,5,11-07-2011 11:58,2.08,14690.0,United Kingdom,2011-11-07,10.4
578028,84596B,SMALL DOLLY MIX DESIGN ORANGE BOWL,2,22-11-2011 13:30,0.42,17371.0,United Kingdom,2011-11-22,0.84
557009,22268,DECORATION SITTING BUNNY,48,16-06-2011 11:38,0.19,14321.0,United Kingdom,2011-06-16,9.120000000000001
572513,85152,HAND OVER THE CHOCOLATE   SIGN ,1,24-10-2011 14:36,2.1,16728.0,United Kingdom,2011-10-24,2.1
575628,22115,METAL SIGN EMPIRE TEA,1,10-11-2011 13:31,0.79,12844.0,United Kingdom,2011-10-11,0.79
578067,23165,LARGE CERAMIC TOP STORAGE JAR,1,22-11-2011 15:43,3.29,,United Kingdom,2011-11-22,3.29
574714,22904,CALENDAR PAPER CUT DESIGN,3,06-11-2011 14:29,2.95,15427.0,United Kingdom,2011-06-11,8.850000000000001
548669,22584,PACK OF 6 PANNETONE GIFT BOXES,36,01-04-2011 15:13,2.55,15691.0,United Kingdom,2011-01-04,91.8
573924,23333,IVORY WICKER HEART MEDIUM,12,02-11-2011 09:45,1.25,15065.0,United Kingdom,2011-02-11,15.0
565224,22352,LUNCH BOX WITH CUTLERY RETROSPOT ,2,01-09-2011 19:11,2.55,14713.0,United Kingdom,2011-01-09,5.1
581492,21976,PACK OF 60 MUSHROOM CAKE CASES,3,09-12-2011 10:03,1.25,,United Kingdom,2011-09-12,3.75
566043,23332,IVORY WICKER HEART LARGE,12,08-09-2011 13:54,1.65,13769.0,United Kingdom,2011-08-09,19.799999999999997
576063,22698,PINK REGENCY TEACUP AND SAUCER,24,13-11-2011 15:37,2.55,15502.0,United Kingdom,2011-11-13,61.199999999999996
581238,22179,SET 10 NIGHT OWL LIGHTS,2,08-12-2011 10:53,13.29,,United Kingdom,2011-08-12,26.58
556805,23306,SET OF 36 DOILIES PANTRY DESIGN,24,14-06-2011 15:15,1.45,15125.0,United Kingdom,2011-06-14,34.8
539595,22664,TOY TIDY DOLLY GIRL DESIGN,1,20-12-2010 13:43,4.21,,United Kingdom,2010-12-20,4.21
568082,23021,GLASS BONNE JAM JAR,4,23-09-2011 14:38,4.15,14944.0,United Kingdom,2011-09-23,16.6
561222,21829,DINOSAUR KEYRINGS ASSORTED,36,26-07-2011 09:27,0.21,13588.0,United Kingdom,2011-07-26,7.56
580831,22467,GUMBALL COAT RACK,6,06-12-2011 11:39,2.55,14418.0,United Kingdom,2011-06-12,15.299999999999999
555644,21930,JUMBO STORAGE BAG SKULLS,1,06-06-2011 13:24,2.08,16520.0,United Kingdom,2011-06-06,2.08
568205,22730,ALARM CLOCK BAKELIKE IVORY,8,25-09-2011 15:30,3.75,18066.0,United Kingdom,2011-09-25,30.0
547623,21902,"KEY FOB , FRONT  DOOR ",24,24-03-2011 11:29,0.65,15641.0,United Kingdom,2011-03-24,15.600000000000001
574099,23389,SPACEBOY MINI BACKPACK,4,03-11-2011 10:05,4.15,12808.0,Portugal,2011-03-11,16.6
568787,90199C,5 STRAND GLASS NECKLACE CRYSTAL,2,29-09-2011 09:19,6.35,13741.0,United Kingdom,2011-09-29,12.7
546738,20676,RED RETROSPOT BOWL,72,16-03-2011 11:57,1.06,16422.0,United Kingdom,2011-03-16,76.32000000000001
560580,22063,CERAMIC BOWL WITH STRAWBERRY DESIGN,42,19-07-2011 15:23,2.55,14088.0,United Kingdom,2011-07-19,107.1
570488,21947,SET OF 6 HEART CHOPSTICKS,2,10-10-2011 17:12,2.46,14096.0,United Kingdom,2011-10-10,4.92
552692,22617,BAKING SET SPACEBOY DESIGN,3,10-05-2011 15:19,4.95,13990.0,United Kingdom,2011-10-05,14.850000000000001
567853,22441,GROW YOUR OWN BASIL IN ENAMEL MUG,6,22-09-2011 13:31,2.1,15484.0,United Kingdom,2011-09-22,12.600000000000001
576062,21070,VINTAGE BILLBOARD MUG ,6,13-11-2011 15:30,1.25,12867.0,United Kingdom,2011-11-13,7.5
549746,23230,WRAP ALPHABET DESIGN,200,12-04-2011 10:38,0.34,15251.0,United Kingdom,2011-12-04,68.0
559529,22431,WATERING CAN BLUE ELEPHANT,3,10-07-2011 12:03,1.95,14808.0,United Kingdom,2011-10-07,5.85
574051,23308,SET OF 60 VINTAGE LEAF CAKE CASES ,1,02-11-2011 13:46,0.55,14102.0,United Kingdom,2011-02-11,0.55
572830,21181,PLEASE ONE PERSON METAL SIGN,2,26-10-2011 11:36,2.1,16208.0,United Kingdom,2011-10-26,4.2
537237,21934,SKULL SHOULDER BAG,6,06-12-2010 09:58,3.36,,United Kingdom,2010-06-12,20.16
580482,23512,EMBROIDERED RIBBON REEL ROSIE,1,04-12-2011 12:44,2.08,16033.0,United Kingdom,2011-04-12,2.08
541421,21790,VINTAGE SNAP CARDS,2,17-01-2011 17:44,1.63,,United Kingdom,2011-01-17,3.26
581439,23295,SET OF 12 MINI LOAF BAKING CASES,1,08-12-2011 16:30,2.46,,United Kingdom,2011-08-12,2.46
580657,23247,BISCUIT TIN 50'S CHRISTMAS,6,05-12-2011 13:43,2.89,14696.0,United Kingdom,2011-05-12,17.34
578943,22196,SMALL HEART MEASURING SPOONS,4,27-11-2011 13:35,0.85,15009.0,United Kingdom,2011-11-27,3.4
567461,20719,WOODLAND CHARLOTTE BAG,16,20-09-2011 12:31,2.46,,United Kingdom,2011-09-20,39.36
574950,23331,DECORATIVE WICKER HEART SMALL,6,08-11-2011 09:29,1.25,,United Kingdom,2011-08-11,7.5
577165,22469,HEART OF WICKER SMALL,12,18-11-2011 10:27,1.65,13171.0,United Kingdom,2011-11-18,19.799999999999997
545215,22855,FINE WICKER HEART ,1,28-02-2011 16:47,2.46,,United Kingdom,2011-02-28,2.46
554664,22178,VICTORIAN GLASS HANGING T-LIGHT,24,25-05-2011 14:40,1.25,14397.0,United Kingdom,2011-05-25,30.0
555405,23231,WRAP DOILEY DESIGN,25,02-06-2011 19:17,0.42,17531.0,United Kingdom,2011-02-06,10.5
559816,11001,ASSTD DESIGN RACING CAR PEN,5,12-07-2011 16:11,0.83,,United Kingdom,2011-12-07,4.1499999999999995
565541,21242,RED RETROSPOT PLATE ,12,05-09-2011 12:00,1.69,14159.0,United Kingdom,2011-05-09,20.28
580058,23200,JUMBO BAG PEARS,10,01-12-2011 13:19,2.08,14367.0,United Kingdom,2011-01-12,20.8
545345,22839,3 TIER CAKE TIN GREEN AND CREAM,1,02-03-2011 09:33,14.95,14180.0,United Kingdom,2011-02-03,14.95
539978,21879,HEARTS GIFT TAPE,24,23-12-2010 14:06,0.19,13165.0,United Kingdom,2010-12-23,4.5600000000000005
547918,21754,HOME BUILDING BLOCK WORD,3,28-03-2011 12:49,5.95,15249.0,United Kingdom,2011-03-28,17.85
553897,22470,HEART OF WICKER LARGE,6,19-05-2011 17:23,2.95,14911.0,EIRE,2011-05-19,17.700000000000003
576339,21822,GLITTER CHRISTMAS TREE WITH BELLS,2,14-11-2011 15:27,4.13,14096.0,United Kingdom,2011-11-14,8.26
554494,79000,MOROCCAN TEA GLASS,10,24-05-2011 14:00,0.85,16327.0,United Kingdom,2011-05-24,8.5
553507,23131,MISTLETOE HEART WREATH CREAM,2,17-05-2011 13:35,4.15,17220.0,United Kingdom,2011-05-17,8.3
563476,23206,LUNCH BAG APPLE DESIGN,20,16-08-2011 15:22,1.65,17682.0,United Kingdom,2011-08-16,33.0
559824,22445,PENCIL CASE LIFE IS BEAUTIFUL,1,12-07-2011 17:23,2.95,17576.0,United Kingdom,2011-12-07,2.95
563195,84598,BOYS ALPHABET IRON ON PATCHES,5,12-08-2011 16:36,0.42,,United Kingdom,2011-12-08,2.1
545075,84970S,HANGING HEART ZINC T-LIGHT HOLDER,12,28-02-2011 09:33,0.85,14211.0,United Kingdom,2011-02-28,10.2
538566,22609,PENS ASSORTED SPACEBALL,2,13-12-2010 11:21,1.66,,United Kingdom,2010-12-13,3.32
555112,21494,ROTATING LEAVES T-LIGHT HOLDER,12,31-05-2011 14:48,1.25,17725.0,United Kingdom,2011-05-31,15.0
536532,21520,BOOZE & WOMEN GREETING CARD ,12,01-12-2010 13:24,0.42,12433.0,Norway,2010-01-12,5.04
580513,23371,SET 36 COLOUR PENCILS SPACEBOY ,1,04-12-2011 13:59,1.25,14456.0,United Kingdom,2011-04-12,1.25
578065,23084,RABBIT NIGHT LIGHT,32,22-11-2011 15:41,4.13,,United Kingdom,2011-11-22,132.16
543553,84836,ZINC METAL HEART DECORATION,36,10-02-2011 10:08,1.25,16359.0,United Kingdom,2011-10-02,45.0
541500,21156,RETROSPOT CHILDRENS APRON,6,18-01-2011 15:25,1.95,18041.0,United Kingdom,2011-01-18,11.7
575875,23109,PACK OF SIX LED TEA LIGHTS,1,11-11-2011 13:06,5.79,,United Kingdom,2011-11-11,5.79
556303,21891,TRADITIONAL WOODEN SKIPPING ROPE,12,10-06-2011 10:26,1.45,17064.0,United Kingdom,2011-10-06,17.4
579938,22699,ROSES REGENCY TEACUP AND SAUCER ,6,01-12-2011 10:18,2.95,14146.0,United Kingdom,2011-01-12,17.700000000000003
570214,23082,SET 6 PAPER TABLE LANTERN HEARTS ,1,09-10-2011 11:50,3.75,12748.0,United Kingdom,2011-09-10,3.75
573599,23157,SET OF 6 NATIVITY MAGNETS ,120,31-10-2011 15:20,1.85,17924.0,United Kingdom,2011-10-31,222.0
548614,21239,PINK  POLKADOT CUP,2,01-04-2011 11:47,0.85,14419.0,United Kingdom,2011-01-04,1.7
566605,22804,CANDLEHOLDER PINK HANGING HEART,2,13-09-2011 16:27,2.95,13263.0,United Kingdom,2011-09-13,5.9
568781,23160,REGENCY TEA SPOON,120,29-09-2011 08:28,1.04,14952.0,United Kingdom,2011-09-29,124.80000000000001
545447,22745,POPPY'S PLAYHOUSE BEDROOM ,6,02-03-2011 16:34,2.1,17426.0,United Kingdom,2011-02-03,12.600000000000001
578347,22384,LUNCH BAG PINK POLKADOT,1,24-11-2011 09:26,4.13,,United Kingdom,2011-11-24,4.13
564172,22645,CERAMIC HEART FAIRY CAKE MONEY BANK,4,23-08-2011 14:19,1.45,16033.0,United Kingdom,2011-08-23,5.8
544666,22171,3 HOOK PHOTO SHELF ANTIQUE WHITE,1,22-02-2011 15:00,8.5,16907.0,United Kingdom,2011-02-22,8.5
548312,22784,LANTERN CREAM GAZEBO ,2,30-03-2011 12:12,4.95,16059.0,United Kingdom,2011-03-30,9.9
567096,22694,WICKER STAR ,4,16-09-2011 13:13,2.1,15099.0,United Kingdom,2011-09-16,8.4
537237,22924,FRIDGE MAGNETS LA VIE EN ROSE,1,06-12-2010 09:58,11.02,,United Kingdom,2010-06-12,11.02
569565,20727,LUNCH BAG  BLACK SKULL.,10,05-10-2011 09:52,1.65,16722.0,United Kingdom,2011-05-10,16.5
563709,22077,6 RIBBONS RUSTIC CHARM,3,18-08-2011 15:17,1.65,15472.0,United Kingdom,2011-08-18,4.949999999999999
561917,23080,RED METAL BOX TOP SECRET,1,01-08-2011 11:57,8.25,16904.0,United Kingdom,2011-01-08,8.25
564553,23328,SET 6 SCHOOL MILK BOTTLES IN CRATE,2,25-08-2011 18:45,3.75,18200.0,United Kingdom,2011-08-25,7.5
561393,21977,PACK OF 60 PINK PAISLEY CAKE CASES,24,27-07-2011 10:10,0.55,18241.0,United Kingdom,2011-07-27,13.200000000000001
559938,82494L,WOODEN FRAME ANTIQUE WHITE ,1,14-07-2011 10:15,2.95,17315.0,United Kingdom,2011-07-14,2.95
576378,22379,RECYCLING BAG RETROSPOT ,5,15-11-2011 09:15,2.1,15628.0,United Kingdom,2011-11-15,10.5
541262,10002,INFLATABLE POLITICAL GLOBE ,6,16-01-2011 15:50,0.85,18069.0,United Kingdom,2011-01-16,5.1
540352,82613B,"METAL SIGN,CUPCAKE SINGLE HOOK",9,06-01-2011 14:27,0.85,,United Kingdom,2011-06-01,7.6499999999999995
547649,22558,CLOTHES PEGS RETROSPOT PACK 24 ,5,24-03-2011 12:02,1.49,18118.0,United Kingdom,2011-03-24,7.45
550750,21559,STRAWBERRY LUNCH BOX WITH CUTLERY,6,20-04-2011 11:45,2.55,13632.0,United Kingdom,2011-04-20,15.299999999999999
578999,21034,REX CASH+CARRY JUMBO SHOPPER,1,27-11-2011 16:08,0.95,17595.0,United Kingdom,2011-11-27,0.95
566624,84882,GREEN WIRE STANDING CANDLE HOLDER,4,14-09-2011 09:36,3.75,17315.0,United Kingdom,2011-09-14,15.0
574040,22835,HOT WATER BOTTLE I AM SO POORLY,1,02-11-2011 13:01,4.95,14974.0,United Kingdom,2011-02-11,4.95
552514,22090,PAPER BUNTING RETROSPOT,2,09-05-2011 16:30,5.79,,United Kingdom,2011-09-05,11.58
560107,21929,JUMBO BAG PINK VINTAGE PAISLEY,10,15-07-2011 08:09,2.08,12928.0,United Kingdom,2011-07-15,20.8
565971,23344,JUMBO BAG 50'S CHRISTMAS ,3,08-09-2011 11:27,2.08,13571.0,United Kingdom,2011-08-09,6.24
550660,48138,DOORMAT UNION FLAG,10,20-04-2011 09:03,6.75,15179.0,United Kingdom,2011-04-20,67.5
545713,22746,POPPY'S PLAYHOUSE LIVINGROOM ,1,07-03-2011 10:12,3.29,,United Kingdom,2011-07-03,3.29
550470,22024,RAINY LADIES BIRTHDAY CARD,2,18-04-2011 13:49,0.83,,United Kingdom,2011-04-18,1.66
568241,47504K,ENGLISH ROSE GARDEN SECATEURS,12,26-09-2011 12:10,0.79,15218.0,United Kingdom,2011-09-26,9.48
564565,22556,PLASTERS IN TIN CIRCUS PARADE ,12,26-08-2011 10:50,1.65,14911.0,EIRE,2011-08-26,19.799999999999997
544286,22606,WOODEN SKITTLES GARDEN SET,2,17-02-2011 12:29,15.95,13151.0,United Kingdom,2011-02-17,31.9
557480,20735,BLACK MINI TAPE MEASURE ,1,20-06-2011 14:10,1.63,,United Kingdom,2011-06-20,1.63
542085,22037,ROBOT BIRTHDAY CARD,12,25-01-2011 12:33,0.42,14534.0,United Kingdom,2011-01-25,5.04
580983,23296,SET OF 6 TEA TIME BAKING CASES,1,06-12-2011 16:26,3.29,,United Kingdom,2011-06-12,3.29
581219,84568,GIRLS ALPHABET IRON ON PATCHES ,6,08-12-2011 09:28,0.42,,United Kingdom,2011-08-12,2.52
562598,22690,DOORMAT HOME SWEET HOME BLUE ,2,08-08-2011 10:00,7.95,15152.0,United Kingdom,2011-08-08,15.9
546427,22068,BLACK PIRATE TREASURE CHEST,1,13-03-2011 14:29,1.65,14606.0,United Kingdom,2011-03-13,1.65
557888,23091,ZINC HERB GARDEN CONTAINER,1,23-06-2011 13:51,6.25,14656.0,United Kingdom,2011-06-23,6.25
556258,22236,CAKE STAND 3 TIER MAGIC GARDEN,2,09-06-2011 17:48,12.75,12694.0,France,2011-09-06,25.5
560926,21946,PARTY TIME DESIGN FLANNEL,1,22-07-2011 09:20,0.83,,United Kingdom,2011-07-22,0.83
553544,22219,LOVEBIRD HANGING DECORATION WHITE ,6,17-05-2011 15:36,1.63,,United Kingdom,2011-05-17,9.78
552180,22620,4 TRADITIONAL SPINNING TOPS,12,06-05-2011 13:35,1.45,18235.0,United Kingdom,2011-06-05,17.4
543096,20725,LUNCH BAG RED RETROSPOT,1,03-02-2011 11:39,1.65,14044.0,United Kingdom,2011-03-02,1.65
578833,22379,RECYCLING BAG RETROSPOT ,2,25-11-2011 15:23,4.96,,United Kingdom,2011-11-25,9.92
554968,22429,ENAMEL MEASURING JUG CREAM,1,27-05-2011 16:24,4.25,17961.0,United Kingdom,2011-05-27,4.25
556728,20713,JUMBO BAG OWLS,1,14-06-2011 11:36,2.08,15719.0,United Kingdom,2011-06-14,2.08
559506,85086A,CANDY SPOT HEART DECORATION,3,08-07-2011 15:17,0.83,,United Kingdom,2011-08-07,2.4899999999999998
579465,23400,SHELF WITH 4 HOOKS HOME SWEET HOME,2,29-11-2011 14:53,6.25,15790.0,United Kingdom,2011-11-29,12.5
549567,46776B,WOVEN BERRIES CUSHION COVER ,2,10-04-2011 15:07,4.95,13632.0,United Kingdom,2011-10-04,9.9
548718,21908,CHOCOLATE THIS WAY METAL SIGN,144,04-04-2011 08:50,1.85,14156.0,EIRE,2011-04-04,266.40000000000003
576065,84859A,SILVER DISCO HANDBAG,2,13-11-2011 15:42,1.95,15005.0,United Kingdom,2011-11-13,3.9
554817,23173,REGENCY TEAPOT ROSES ,2,26-05-2011 14:08,9.95,15622.0,United Kingdom,2011-05-26,19.9
548894,21731,RED TOADSTOOL LED NIGHT LIGHT,3,04-04-2011 16:01,3.29,,United Kingdom,2011-04-04,9.870000000000001
574684,23317,BLUE REFECTORY CLOCK ,2,06-11-2011 12:56,9.95,17581.0,United Kingdom,2011-06-11,19.9
553158,37370,RETRO COFFEE MUGS ASSORTED,12,13-05-2011 15:24,1.25,14194.0,United Kingdom,2011-05-13,15.0
546857,21980,PACK OF 12 RED RETROSPOT TISSUES ,12,17-03-2011 14:19,0.29,12937.0,United Kingdom,2011-03-17,3.4799999999999995
555633,22727,ALARM CLOCK BAKELIKE RED ,2,06-06-2011 12:22,3.75,14534.0,United Kingdom,2011-06-06,7.5
546392,84510A,SET OF 4 ENGLISH ROSE COASTERS,1,11-03-2011 14:15,1.25,14587.0,United Kingdom,2011-11-03,1.25
569716,23328,SET 6 SCHOOL MILK BOTTLES IN CRATE,4,06-10-2011 08:17,3.75,15804.0,United Kingdom,2011-06-10,15.0
569246,22457,NATURAL SLATE HEART CHALKBOARD ,7,03-10-2011 09:57,5.79,14096.0,United Kingdom,2011-03-10,40.53
576865,22953,BIRTHDAY PARTY CORDON BARRIER TAPE,1,16-11-2011 16:08,1.25,12748.0,United Kingdom,2011-11-16,1.25
564757,21993,FLORAL FOLK STATIONERY SET,5,30-08-2011 10:36,2.46,,United Kingdom,2011-08-30,12.3
536592,22262,FELT EGG COSY CHICKEN,3,01-12-2010 17:06,1.66,,United Kingdom,2010-01-12,4.9799999999999995
543909,48184,DOORMAT ENGLISH ROSE ,1,14-02-2011 12:32,14.13,,United Kingdom,2011-02-14,14.13
578290,23553,LANDMARK FRAME CAMDEN TOWN ,3,23-11-2011 14:07,12.5,13644.0,United Kingdom,2011-11-23,37.5
546787,84879,ASSORTED COLOUR BIRD ORNAMENT,48,17-03-2011 10:01,1.69,14035.0,United Kingdom,2011-03-17,81.12
563688,21981,PACK OF 12 WOODLAND TISSUES ,24,18-08-2011 12:41,0.29,16767.0,United Kingdom,2011-08-18,6.959999999999999
560276,22424,ENAMEL BREAD BIN CREAM,1,17-07-2011 15:11,12.75,14606.0,United Kingdom,2011-07-17,12.75
549586,22382,LUNCH BAG SPACEBOY DESIGN ,3,11-04-2011 10:00,4.96,,United Kingdom,2011-11-04,14.879999999999999
545304,22619,SET OF 6 SOLDIER SKITTLES,4,01-03-2011 12:51,3.75,16212.0,United Kingdom,2011-01-03,15.0
576055,23359,SET OF 12 T-LIGHTS VINTAGE DOILY,12,13-11-2011 15:02,1.95,15449.0,United Kingdom,2011-11-13,23.4
568991,22942,CHRISTMAS LIGHTS 10 SANTAS ,3,29-09-2011 16:44,8.5,18204.0,United Kingdom,2011-09-29,25.5
546884,22456,NATURAL SLATE CHALKBOARD LARGE ,1,17-03-2011 18:08,9.96,,United Kingdom,2011-03-17,9.96
546549,22742,MAKE YOUR OWN PLAYTIME CARD KIT,1,14-03-2011 16:46,2.95,17799.0,United Kingdom,2011-03-14,2.95
554084,22423,REGENCY CAKESTAND 3 TIER,2,22-05-2011 11:52,12.75,12909.0,United Kingdom,2011-05-22,25.5
552231,23299,FOOD COVER WITH BEADS SET 2 ,2,06-05-2011 15:47,3.75,17364.0,United Kingdom,2011-06-05,7.5
569326,23108,SET OF 10 LED DOLLY LIGHTS,2,03-10-2011 12:47,6.25,14360.0,United Kingdom,2011-03-10,12.5
574703,21809,CHRISTMAS HANGING TREE WITH BELL,1,06-11-2011 13:59,0.39,15426.0,United Kingdom,2011-06-11,0.39
570404,21930,JUMBO STORAGE BAG SKULLS,1,10-10-2011 12:50,2.08,16395.0,United Kingdom,2011-10-10,2.08
581492,85039B,S/4 IVORY MINI ROSE CANDLE IN BOWL,4,09-12-2011 10:03,1.63,,United Kingdom,2011-09-12,6.52
563909,22487,WHITE WOOD GARDEN PLANT LADDER,1,21-08-2011 12:36,9.95,15701.0,United Kingdom,2011-08-21,9.95
577217,23265,SET OF 3 WOODEN TREE DECORATIONS,2,18-11-2011 11:53,1.25,17324.0,United Kingdom,2011-11-18,2.5
578140,20724,RED RETROSPOT CHARLOTTE BAG,200,23-11-2011 10:58,0.72,14646.0,Netherlands,2011-11-23,144.0
544839,85099B,JUMBO BAG RED RETROSPOT,10,24-02-2011 10:50,1.95,14841.0,United Kingdom,2011-02-24,19.5
579345,22530,MAGIC DRAWING SLATE DOLLY GIRL ,24,29-11-2011 11:46,0.42,12727.0,France,2011-11-29,10.08
540352,85071D,CHARLIE+LOLA MY ROOM DOOR SIGN,1,06-01-2011 14:27,0.85,,United Kingdom,2011-06-01,0.85
549959,22635,CHILDS BREAKFAST SET DOLLY GIRL ,2,13-04-2011 13:47,9.95,16097.0,United Kingdom,2011-04-13,19.9
537381,22112,CHOCOLATE HOT WATER BOTTLE,3,06-12-2010 13:13,4.95,14667.0,United Kingdom,2010-06-12,14.850000000000001
546158,21790,VINTAGE SNAP CARDS,12,10-03-2011 09:30,0.85,13899.0,United Kingdom,2011-10-03,10.2
537237,84813,SET OF 4 DIAMOND NAPKIN RINGS,1,06-12-2010 09:58,25.49,,United Kingdom,2010-06-12,25.49
552536,21742,LARGE ROUND WICKER PLATTER ,2,10-05-2011 10:00,5.95,14209.0,United Kingdom,2011-10-05,11.9
567074,23388,WOODLAND MINI BACKPACK,4,16-09-2011 12:22,4.15,17068.0,United Kingdom,2011-09-16,16.6
571908,84946,ANTIQUE SILVER T-LIGHT GLASS,72,19-10-2011 14:56,1.06,15803.0,United Kingdom,2011-10-19,76.32000000000001
556812,21086,SET/6 RED SPOTTY PAPER CUPS,2,14-06-2011 17:25,1.63,,United Kingdom,2011-06-14,3.26
577010,22545,MINI JIGSAW BUNNIES,10,17-11-2011 12:11,0.42,15506.0,United Kingdom,2011-11-17,4.2
562955,22844,VINTAGE CREAM DOG FOOD CONTAINER,8,11-08-2011 10:14,16.63,,United Kingdom,2011-11-08,133.04
552000,23148,MINIATURE ANTIQUE ROSE HOOK IVORY,3,05-05-2011 15:56,2.46,,United Kingdom,2011-05-05,7.38
567899,22910,PAPER CHAIN KIT VINTAGE CHRISTMAS,6,22-09-2011 16:26,2.95,14911.0,EIRE,2011-09-22,17.700000000000003
539737,22100,SKULLS SQUARE TISSUE BOX,1,21-12-2010 15:19,2.51,,United Kingdom,2010-12-21,2.51
558620,22276,WASH BAG VINTAGE ROSE PAISLEY,1,30-06-2011 16:39,2.55,15584.0,United Kingdom,2011-06-30,2.55
579777,23532,WALL ART WORK REST AND PLAY  ,1,30-11-2011 15:13,10.79,,United Kingdom,2011-11-30,10.79
555343,22845,VINTAGE CREAM CAT FOOD CONTAINER,1,02-06-2011 11:42,6.35,15918.0,United Kingdom,2011-02-06,6.35
570426,22341,LOVE GARLAND PAINTED ZINC ,12,10-10-2011 13:55,1.65,13352.0,United Kingdom,2011-10-10,19.799999999999997
573300,20914,SET/5 RED RETROSPOT LID GLASS BOWLS,2,28-10-2011 16:10,2.95,16049.0,United Kingdom,2011-10-28,5.9
541223,21556,CERAMIC STRAWBERRY MONEY BOX,2,14-01-2011 14:39,2.55,17954.0,United Kingdom,2011-01-14,5.1
569653,47310M,SMALL POP BOX FUNKY MONKEY,12,05-10-2011 12:52,1.25,12451.0,Switzerland,2011-05-10,15.0
576329,22505,MEMO BOARD COTTAGE DESIGN,1,14-11-2011 15:22,10.79,,United Kingdom,2011-11-14,10.79
538148,22199,FRYING PAN RED RETROSPOT,2,09-12-2010 16:26,8.47,,United Kingdom,2010-09-12,16.94
574840,20914,SET/5 RED RETROSPOT LID GLASS BOWLS,1,07-11-2011 11:41,2.95,12748.0,United Kingdom,2011-07-11,2.95
576362,22467,GUMBALL COAT RACK,12,14-11-2011 17:11,2.55,14755.0,United Kingdom,2011-11-14,30.599999999999998
574561,22494,EMERGENCY FIRST AID TIN ,1,04-11-2011 15:52,2.46,,United Kingdom,2011-04-11,2.46
560434,23140,TRIPLE WIRE HOOK IVORY HEART,1,18-07-2011 15:56,4.13,,United Kingdom,2011-07-18,4.13
548373,79190D,RETRO PLASTIC DAISY TRAY,1,30-03-2011 16:34,0.83,,United Kingdom,2011-03-30,0.83
543547,22977,DOLLY GIRL CHILDRENS EGG CUP,12,09-02-2011 16:57,1.25,17358.0,United Kingdom,2011-09-02,15.0
541869,85099C,JUMBO  BAG BAROQUE BLACK WHITE,1,24-01-2011 09:35,4.13,,United Kingdom,2011-01-24,4.13
580118,22773,GREEN DRAWER KNOB ACRYLIC EDWARDIAN,12,01-12-2011 16:31,1.25,16011.0,United Kingdom,2011-01-12,15.0
573585,21181,PLEASE ONE PERSON METAL SIGN,2,31-10-2011 14:41,4.13,,United Kingdom,2011-10-31,8.26
546678,21239,PINK  POLKADOT CUP,8,15-03-2011 16:39,0.85,12681.0,France,2011-03-15,6.8
547030,85049G,CHOCOLATE BOX RIBBONS ,12,20-03-2011 10:17,1.25,12948.0,United Kingdom,2011-03-20,15.0
551532,82482,WOODEN PICTURE FRAME WHITE FINISH,6,01-05-2011 14:17,2.55,16554.0,United Kingdom,2011-01-05,15.299999999999999
555396,82583,HOT BATHS METAL SIGN,12,02-06-2011 17:23,2.1,16529.0,United Kingdom,2011-02-06,25.200000000000003
562427,23050,RECYCLED ACAPULCO MAT GREEN,1,04-08-2011 17:19,8.25,17267.0,United Kingdom,2011-04-08,8.25
548670,21908,CHOCOLATE THIS WAY METAL SIGN,2,01-04-2011 15:37,2.1,15356.0,United Kingdom,2011-01-04,4.2
579187,85099F,JUMBO BAG STRAWBERRY,2,28-11-2011 15:31,4.13,,United Kingdom,2011-11-28,8.26
552057,23144,ZINC T-LIGHT HOLDER STARS SMALL,24,06-05-2011 10:34,0.83,17504.0,United Kingdom,2011-06-05,19.919999999999998
559163,22279,POCKET BAG BLUE PAISLEY RED SPOT,2,06-07-2011 16:33,0.83,,United Kingdom,2011-06-07,1.66
539010,82494L,WOODEN FRAME ANTIQUE WHITE ,4,15-12-2010 13:24,2.95,15005.0,United Kingdom,2010-12-15,11.8
554560,47566,PARTY BUNTING,8,25-05-2011 10:35,4.95,13317.0,United Kingdom,2011-05-25,39.6
574863,84029G,KNITTED UNION FLAG HOT WATER BOTTLE,1,07-11-2011 12:29,4.25,15719.0,United Kingdom,2011-07-11,4.25
561094,22037,ROBOT BIRTHDAY CARD,12,25-07-2011 10:04,0.42,12474.0,Germany,2011-07-25,5.04
541424,20727,LUNCH BAG  BLACK SKULL.,2,17-01-2011 17:57,4.13,,United Kingdom,2011-01-17,8.26
565129,21908,CHOCOLATE THIS WAY METAL SIGN,2,01-09-2011 12:41,2.1,15719.0,United Kingdom,2011-01-09,4.2
564754,21913,VINTAGE SEASIDE JIGSAW PUZZLES,1,30-08-2011 10:29,7.46,,United Kingdom,2011-08-30,7.46
559163,85095,THREE CANVAS LUGGAGE TAGS,1,06-07-2011 16:33,0.83,,United Kingdom,2011-06-07,0.83
562049,23152,IVORY SWEETHEART WIRE LETTER RACK ,4,02-08-2011 11:33,3.75,14133.0,United Kingdom,2011-02-08,15.0
537126,22501,PICNIC BASKET WICKER LARGE,2,05-12-2010 12:13,9.95,18118.0,United Kingdom,2010-05-12,19.9
580727,35970,ZINC FOLKART SLEIGH BELLS,8,05-12-2011 17:17,4.13,14096.0,United Kingdom,2011-05-12,33.04
566087,84792,ENCHANTED BIRD COATHANGER 5 HOOK,8,09-09-2011 10:24,4.65,13319.0,United Kingdom,2011-09-09,37.2
570282,23118,PARISIENNE JEWELLERY DRAWER ,6,10-10-2011 11:20,7.5,13473.0,United Kingdom,2011-10-10,45.0
571284,20802,SMALL GLASS SUNDAE DISH CLEAR,1,16-10-2011 14:07,1.65,14562.0,United Kingdom,2011-10-16,1.65
570246,23302,KNEELING MAT HOUSEWORK  DESIGN,1,09-10-2011 16:22,1.65,16921.0,United Kingdom,2011-09-10,1.65
551193,21982,PACK OF 12 SUKI TISSUES ,12,27-04-2011 11:05,0.29,17954.0,United Kingdom,2011-04-27,3.4799999999999995
538507,35961,FOLKART ZINC HEART CHRISTMAS DEC,24,12-12-2010 13:26,0.85,15547.0,United Kingdom,2010-12-12,20.4
545470,22967,SET 3 SONG BIRD PAPER EGGS ASSORTED,3,03-03-2011 10:26,2.95,14483.0,United Kingdom,2011-03-03,8.850000000000001
578270,22631,CIRCUS PARADE LUNCH BOX ,1,23-11-2011 13:39,4.13,14096.0,United Kingdom,2011-11-23,4.13
576911,48129,DOORMAT TOPIARY,1,17-11-2011 10:01,8.25,17461.0,United Kingdom,2011-11-17,8.25
571554,20728,LUNCH BAG CARS BLUE,8,18-10-2011 09:13,4.96,,United Kingdom,2011-10-18,39.68
572285,21391,FRENCH LAVENDER SCENT HEART,3,23-10-2011 12:16,0.75,14698.0,United Kingdom,2011-10-23,2.25
572544,22493,PAINT YOUR OWN CANVAS SET,3,24-10-2011 16:34,1.65,16023.0,United Kingdom,2011-10-24,4.949999999999999
540691,21673,WHITE SPOT BLUE CERAMIC DRAWER KNOB,12,11-01-2011 08:50,1.49,17450.0,United Kingdom,2011-11-01,17.88
579093,22662,LUNCH BAG DOLLY GIRL DESIGN,10,28-11-2011 10:54,1.65,13081.0,United Kingdom,2011-11-28,16.5
568472,22112,CHOCOLATE HOT WATER BOTTLE,3,27-09-2011 11:50,4.95,12517.0,Germany,2011-09-27,14.850000000000001
552684,22468,BABUSHKA LIGHTS STRING OF 10,1,10-05-2011 15:09,13.29,,United Kingdom,2011-10-05,13.29
537434,85017A,ENVELOPE 50 ROMANTIC IMAGES,1,06-12-2010 16:57,0.85,,United Kingdom,2010-06-12,0.85
554362,22628,PICNIC BOXES SET OF 3 RETROSPOT ,4,24-05-2011 10:17,4.95,17811.0,United Kingdom,2011-05-24,19.8
560145,47566,PARTY BUNTING,4,15-07-2011 11:04,4.95,13381.0,United Kingdom,2011-07-15,19.8
580730,22795,SWEETHEART RECIPE BOOK STAND,3,05-12-2011 17:28,13.29,,United Kingdom,2011-05-12,39.87
567093,23085,ANTIQUE SILVER BAUBLE LAMP  ,12,16-09-2011 12:50,8.25,17144.0,United Kingdom,2011-09-16,99.0
579885,23198,PANTRY MAGNETIC  SHOPPING LIST,4,30-11-2011 17:37,1.45,15444.0,United Kingdom,2011-11-30,5.8
562854,84929,ASSTD FRUIT+FLOWERS FRIDGE MAGNETS,24,10-08-2011 10:15,0.19,16133.0,United Kingdom,2011-10-08,4.5600000000000005
550636,22430,ENAMEL WATERING CAN CREAM,1,19-04-2011 15:37,9.96,,United Kingdom,2011-04-19,9.96
580956,22917,HERB MARKER ROSEMARY,2,06-12-2011 14:23,0.65,17841.0,United Kingdom,2011-06-12,1.3
566929,22809,SET OF 6 T-LIGHTS SANTA,36,15-09-2011 15:21,2.55,17428.0,United Kingdom,2011-09-15,91.8
566787,23339,EGG FRYING PAN BLUE ,1,15-09-2011 10:31,4.13,,United Kingdom,2011-09-15,4.13
564198,22466,FAIRY TALE COTTAGE NIGHTLIGHT,5,23-08-2011 17:18,1.95,14418.0,United Kingdom,2011-08-23,9.75
537808,22083,PAPER CHAIN KIT RETROSPOT,40,08-12-2010 13:23,2.55,15311.0,United Kingdom,2010-08-12,102.0
573145,21754,HOME BUILDING BLOCK WORD,3,27-10-2011 18:02,6.25,18219.0,United Kingdom,2011-10-27,18.75
548315,84945,MULTI COLOUR SILVER T-LIGHT HOLDER,12,30-03-2011 12:34,0.85,16019.0,United Kingdom,2011-03-30,10.2
544177,22720,SET OF 3 CAKE TINS PANTRY DESIGN ,4,16-02-2011 14:27,4.95,13001.0,United Kingdom,2011-02-16,19.8
543273,21609,SET 12 LAVENDER  BOTANICAL T-LIGHTS,2,06-02-2011 11:29,2.95,16456.0,United Kingdom,2011-06-02,5.9
545081,22084,PAPER CHAIN KIT EMPIRE,6,28-02-2011 10:35,2.95,16057.0,United Kingdom,2011-02-28,17.700000000000003
555277,21080,SET/20 RED RETROSPOT PAPER NAPKINS ,1,01-06-2011 17:30,1.63,,United Kingdom,2011-01-06,1.63
571054,23266,SET OF 3 WOODEN STOCKING DECORATION,1,13-10-2011 13:58,1.25,14234.0,United Kingdom,2011-10-13,1.25
537155,20674,GREEN POLKADOT BOWL,1,05-12-2010 13:05,1.25,12748.0,United Kingdom,2010-05-12,1.25
540551,84923,PINK BUTTERFLY HANDBAG W BOBBLES,1,10-01-2011 09:43,4.21,,United Kingdom,2011-10-01,4.21
541827,21027,NINJA RABBIT PINK,11,21-01-2011 17:05,0.83,,United Kingdom,2011-01-21,9.129999999999999
573891,21558,SKULL LUNCH BOX WITH CUTLERY ,6,01-11-2011 13:56,2.55,12682.0,France,2011-01-11,15.299999999999999
550446,22393,PAPERWEIGHT VINTAGE COLLAGE,6,18-04-2011 12:36,2.55,13871.0,United Kingdom,2011-04-18,15.299999999999999
552281,21034,REX CASH+CARRY JUMBO SHOPPER,2,08-05-2011 12:42,0.95,15704.0,United Kingdom,2011-08-05,1.9
554016,84968F,SET OF 16 VINTAGE SKY BLUE CUTLERY,1,20-05-2011 13:14,12.75,13243.0,United Kingdom,2011-05-20,12.75
573866,22301,COFFEE MUG CAT + BIRD DESIGN,6,01-11-2011 12:06,2.55,17495.0,United Kingdom,2011-01-11,15.299999999999999
561642,22970,LONDON BUS COFFEE MUG,6,28-07-2011 15:04,2.55,17965.0,United Kingdom,2011-07-28,15.299999999999999
542710,20972,PINK CREAM FELT CRAFT TRINKET BOX ,24,31-01-2011 13:17,1.25,14776.0,United Kingdom,2011-01-31,30.0
556915,84378,SET OF 3 HEART COOKIE CUTTERS,1,15-06-2011 13:35,1.25,15036.0,United Kingdom,2011-06-15,1.25
559678,22384,LUNCH BAG PINK POLKADOT,2,11-07-2011 14:43,1.65,16033.0,United Kingdom,2011-11-07,3.3
580501,21742,LARGE ROUND WICKER PLATTER ,1,04-12-2011 13:00,5.95,14546.0,United Kingdom,2011-04-12,5.95
570871,22483,RED GINGHAM TEDDY BEAR ,3,12-10-2011 16:36,5.79,,United Kingdom,2011-12-10,17.37
548192,23052,RECYCLED ACAPULCO MAT TURQUOISE,1,29-03-2011 15:22,8.25,17364.0,United Kingdom,2011-03-29,8.25
546563,22745,POPPY'S PLAYHOUSE BEDROOM ,6,15-03-2011 10:49,2.1,15047.0,United Kingdom,2011-03-15,12.600000000000001
545523,22291,HANGING CHICK CREAM DECORATION,3,03-03-2011 12:41,1.45,14524.0,United Kingdom,2011-03-03,4.35
551085,47590A,BLUE HAPPY BIRTHDAY BUNTING,3,26-04-2011 12:29,5.45,14854.0,United Kingdom,2011-04-26,16.35
554985,21747,SMALL SKULL WINDMILL,12,29-05-2011 12:26,1.25,12426.0,Germany,2011-05-29,15.0
543172,22278,OVERNIGHT BAG VINTAGE ROSE PAISLEY,1,04-02-2011 09:11,10.79,,United Kingdom,2011-04-02,10.79
569123,23168,CLASSIC CAFE SUGAR DISPENSER,1,30-09-2011 13:09,1.25,12748.0,United Kingdom,2011-09-30,1.25
540553,22366,DOORMAT AIRMAIL ,2,10-01-2011 09:48,7.95,12500.0,Germany,2011-10-01,15.9
573420,23351,ROLL WRAP 50'S CHRISTMAS,12,31-10-2011 09:48,1.25,18223.0,United Kingdom,2011-10-31,15.0
546498,72127,COLUMBIAN CANDLE ROUND ,2,14-03-2011 11:44,1.25,15493.0,United Kingdom,2011-03-14,2.5
581439,23328,SET 6 SCHOOL MILK BOTTLES IN CRATE,10,08-12-2011 16:30,7.46,,United Kingdom,2011-08-12,74.6
560291,20713,JUMBO BAG OWLS,1,18-07-2011 10:17,4.13,,United Kingdom,2011-07-18,4.13
570501,23191,BUNDLE OF 3 RETRO NOTE BOOKS,12,11-10-2011 09:23,1.65,14857.0,United Kingdom,2011-11-10,19.799999999999997
546991,22396,MAGNETS PACK OF 4 RETRO PHOTO,6,18-03-2011 13:08,1.25,12748.0,United Kingdom,2011-03-18,7.5
575138,23354,6 GIFT TAGS 50'S CHRISTMAS ,1,08-11-2011 15:24,1.63,,United Kingdom,2011-08-11,1.63
558475,47585A,PINK FAIRY CAKE CUSHION COVER,17,29-06-2011 15:58,4.13,,United Kingdom,2011-06-29,70.21
577106,20712,JUMBO BAG WOODLAND ANIMALS,1,17-11-2011 17:18,2.08,14456.0,United Kingdom,2011-11-17,2.08
551158,21975,PACK OF 60 DINOSAUR CAKE CASES,3,26-04-2011 15:00,0.55,16823.0,United Kingdom,2011-04-26,1.6500000000000001
569015,22310,IVORY KNITTED MUG COSY ,6,30-09-2011 09:20,1.65,13575.0,United Kingdom,2011-09-30,9.899999999999999
542217,21201,TROPICAL  HONEYCOMB PAPER GARLAND ,1,26-01-2011 12:36,2.55,14606.0,United Kingdom,2011-01-26,2.55
567507,23089,GLASS BON BON JAR,1,20-09-2011 14:46,3.29,,United Kingdom,2011-09-20,3.29
577472,23300,GARDENERS KNEELING PAD CUP OF TEA ,12,20-11-2011 11:28,1.65,14503.0,United Kingdom,2011-11-20,19.799999999999997
556503,23162,REGENCY TEA STRAINER,4,13-06-2011 08:44,3.75,13517.0,United Kingdom,2011-06-13,15.0
548373,82578,KITCHEN METAL SIGN,2,30-03-2011 16:34,1.25,,United Kingdom,2011-03-30,2.5
575132,20724,RED RETROSPOT CHARLOTTE BAG,10,08-11-2011 14:44,0.85,18177.0,United Kingdom,2011-08-11,8.5
580290,21820,GLITTER HEART GARLAND WITH BELLS ,1,02-12-2011 13:35,3.75,17221.0,United Kingdom,2011-02-12,3.75
568712,23191,BUNDLE OF 3 RETRO NOTE BOOKS,1,28-09-2011 15:50,1.65,17841.0,United Kingdom,2011-09-28,1.65
580319,22640,SET OF 4 NAPKIN CHARMS 3 KEYS ,32,02-12-2011 15:39,0.79,15078.0,United Kingdom,2011-02-12,25.28
544286,21622,VINTAGE UNION JACK CUSHION COVER,7,17-02-2011 12:29,4.95,13151.0,United Kingdom,2011-02-17,34.65
567128,82486,3 DRAWER ANTIQUE WHITE WOOD CABINET,4,16-09-2011 14:04,8.95,18055.0,United Kingdom,2011-09-16,35.8
580730,23330,DECORATIVE WICKER HEART MEDIUM,1,05-12-2011 17:28,2.46,,United Kingdom,2011-05-12,2.46
551291,21900,"KEY FOB , SHED",48,27-04-2011 14:26,0.53,14298.0,United Kingdom,2011-04-27,25.44
546008,22792,FLUTED ANTIQUE CANDLE HOLDER,48,08-03-2011 15:43,1.63,,United Kingdom,2011-08-03,78.24
570197,23028,DRAWER KNOB CRACKLE GLAZE BLUE,1,07-10-2011 15:45,1.65,13755.0,United Kingdom,2011-07-10,1.65
578783,21428,SET3 BOOK BOX GREEN GINGHAM FLOWER ,3,25-11-2011 11:58,4.25,12748.0,United Kingdom,2011-11-25,12.75
575176,22076,6 RIBBONS EMPIRE  ,1,08-11-2011 18:29,1.25,,United Kingdom,2011-08-11,1.25
570715,23267,SET OF 4 SANTA PLACE SETTINGS,24,12-10-2011 10:23,1.25,18287.0,United Kingdom,2011-12-10,30.0
542503,21154,RED RETROSPOT OVEN GLOVE ,10,28-01-2011 11:58,1.25,16327.0,United Kingdom,2011-01-28,12.5
580908,21124,SET/10 BLUE POLKADOT PARTY CANDLES,2,06-12-2011 13:20,1.25,16495.0,United Kingdom,2011-06-12,2.5
580115,23496,PANTRY KITCHEN THERMOMETER ,1,01-12-2011 16:22,2.46,,United Kingdom,2011-01-12,2.46
546950,22500,SET OF 2 TINS JARDIN DE PROVENCE,1,18-03-2011 11:24,4.95,16511.0,United Kingdom,2011-03-18,4.95
560090,20752,BLUE POLKADOT WASHING UP GLOVES,1,14-07-2011 16:46,2.46,,United Kingdom,2011-07-14,2.46
559459,22385,JUMBO BAG SPACEBOY DESIGN,100,08-07-2011 12:53,1.79,15311.0,United Kingdom,2011-08-07,179.0
573345,22946,WOODEN ADVENT CALENDAR CREAM,2,30-10-2011 12:14,16.95,17609.0,United Kingdom,2011-10-30,33.9
571671,22155,STAR DECORATION RUSTIC,24,18-10-2011 13:15,0.42,16940.0,United Kingdom,2011-10-18,10.08
580188,23571,TRADITIONAL NAUGHTS & CROSSES,5,02-12-2011 12:02,1.65,16440.0,United Kingdom,2011-02-12,8.25
578140,22557,PLASTERS IN TIN VINTAGE PAISLEY ,96,23-11-2011 10:58,1.45,14646.0,Netherlands,2011-11-23,139.2
568651,22326,ROUND SNACK BOXES SET OF4 WOODLAND ,6,28-09-2011 12:04,2.95,12362.0,Belgium,2011-09-28,17.700000000000003
556243,20901,VINTAGE KEEPSAKE BOX PINK FLOWER,3,09-06-2011 16:07,4.13,,United Kingdom,2011-09-06,12.39
544666,71053,WHITE METAL LANTERN,1,22-02-2011 15:00,3.75,16907.0,United Kingdom,2011-02-22,3.75
551950,21506,"FANCY FONT BIRTHDAY CARD, ",12,05-05-2011 11:38,0.42,14911.0,EIRE,2011-05-05,5.04
575298,23217,LAUREL HEART ANTIQUE SILVER,2,09-11-2011 12:29,1.25,17841.0,United Kingdom,2011-09-11,2.5
569331,22768,FAMILY PHOTO FRAME CORNICE,2,03-10-2011 13:39,9.95,16875.0,United Kingdom,2011-03-10,19.9
566190,85203,HANGING WOOD AND FELT BUTTERFLY ,10,09-09-2011 13:20,0.42,12748.0,United Kingdom,2011-09-09,4.2
540552,21314,SMALL GLASS HEART TRINKET POT,8,10-01-2011 09:44,2.1,16350.0,United Kingdom,2011-10-01,16.8
572242,22591,CARDHOLDER GINGHAM CHRISTMAS TREE,6,21-10-2011 15:36,3.25,15677.0,United Kingdom,2011-10-21,19.5
562558,22380,TOY TIDY SPACEBOY  ,2,05-08-2011 16:43,2.1,13451.0,United Kingdom,2011-05-08,4.2
576554,84792,ENCHANTED BIRD COATHANGER 5 HOOK,4,15-11-2011 12:57,4.65,13066.0,United Kingdom,2011-11-15,18.6
549682,22960,JAM MAKING SET WITH JARS,6,11-04-2011 13:22,4.25,12596.0,Spain,2011-11-04,25.5
569003,23029,DRAWER KNOB CRACKLE GLAZE GREEN,6,29-09-2011 18:13,1.65,13364.0,United Kingdom,2011-09-29,9.899999999999999
559774,20727,LUNCH BAG  BLACK SKULL.,3,12-07-2011 11:37,1.65,18122.0,United Kingdom,2011-12-07,4.949999999999999
575477,21976,PACK OF 60 MUSHROOM CAKE CASES,1,09-11-2011 16:14,1.25,,United Kingdom,2011-09-11,1.25
575731,22469,HEART OF WICKER SMALL,2,10-11-2011 20:01,1.65,13230.0,United Kingdom,2011-10-11,3.3
574194,21755,LOVE BUILDING BLOCK WORD,6,03-11-2011 11:58,6.25,15227.0,United Kingdom,2011-03-11,37.5
580305,22154,ANGEL DECORATION 3 BUTTONS ,2,02-12-2011 14:26,0.42,12970.0,United Kingdom,2011-02-12,0.84
568874,48188,DOORMAT WELCOME PUPPIES,1,29-09-2011 12:16,8.25,14524.0,United Kingdom,2011-09-29,8.25
571184,23332,IVORY WICKER HEART LARGE,10,14-10-2011 11:09,1.65,15478.0,United Kingdom,2011-10-14,16.5
546922,82552,WASHROOM METAL SIGN,12,18-03-2011 09:59,1.45,14110.0,United Kingdom,2011-03-18,17.4
543899,22503,CABIN BAG VINTAGE PAISLEY,6,14-02-2011 12:11,24.95,,EIRE,2011-02-14,149.7
571441,10135,COLOURING PENCILS BROWN TUBE,1,17-10-2011 13:31,2.46,14096.0,United Kingdom,2011-10-17,2.46
570593,23435,3 RAFFIA RIBBONS VINTAGE CHRISTMAS,10,11-10-2011 11:38,0.79,18180.0,United Kingdom,2011-11-10,7.9
572069,21914,BLUE HARMONICA IN BOX ,12,20-10-2011 13:24,1.25,14911.0,EIRE,2011-10-20,15.0
575138,23245,SET OF 3 REGENCY CAKE TINS,6,08-11-2011 15:24,10.79,,United Kingdom,2011-08-11,64.74
547547,22629,SPACEBOY LUNCH BOX ,1,23-03-2011 15:30,4.13,,United Kingdom,2011-03-23,4.13
544323,22318,FIVE HEART HANGING DECORATION,1,17-02-2011 15:51,5.79,,United Kingdom,2011-02-17,5.79
541138,85099B,JUMBO BAG RED RETROSPOT,10,14-01-2011 10:42,1.95,12553.0,France,2011-01-14,19.5
566060,22428,ENAMEL FIRE BUCKET CREAM,1,08-09-2011 15:27,14.13,,United Kingdom,2011-08-09,14.13
568170,21034,REX CASH+CARRY JUMBO SHOPPER,1,25-09-2011 13:08,0.95,16931.0,United Kingdom,2011-09-25,0.95
574560,23367,SET 12 COLOUR PENCILS SPACEBOY ,16,04-11-2011 15:51,0.65,17703.0,United Kingdom,2011-04-11,10.4
546118,21745,GAOLERS KEYS DECORATIVE GARDEN ,4,09-03-2011 14:14,3.75,13078.0,United Kingdom,2011-09-03,15.0
579499,20728,LUNCH BAG CARS BLUE,10,29-11-2011 15:59,1.65,17682.0,United Kingdom,2011-11-29,16.5
558196,23066,SMALL DECO JEWELLERY STAND,2,27-06-2011 12:38,8.25,16033.0,United Kingdom,2011-06-27,16.5
562574,21326,AGED GLASS SILVER T-LIGHT HOLDER,24,07-08-2011 12:42,0.65,14903.0,United Kingdom,2011-07-08,15.600000000000001
562113,22639,SET OF 4 NAPKIN CHARMS HEARTS,2,02-08-2011 16:11,4.96,,United Kingdom,2011-02-08,9.92
571441,22757,LARGE RED BABUSHKA NOTEBOOK ,1,17-10-2011 13:31,2.46,14096.0,United Kingdom,2011-10-17,2.46
576329,22646,CERAMIC STRAWBERRY CAKE MONEY BANK,1,14-11-2011 15:22,3.29,,United Kingdom,2011-11-14,3.29
542241,82599,FANNY'S REST STOPMETAL SIGN,1,26-01-2011 14:51,2.1,16409.0,United Kingdom,2011-01-26,2.1
570457,23190,BUNDLE OF 3 SCHOOL EXERCISE BOOKS  ,1,10-10-2011 15:39,1.65,13666.0,United Kingdom,2011-10-10,1.65
578620,23320,GIANT 50'S CHRISTMAS CRACKER,1,24-11-2011 15:21,2.89,17247.0,United Kingdom,2011-11-24,2.89
569338,22685,FRENCH BLUE METAL DOOR SIGN 0,10,03-10-2011 14:18,1.25,16013.0,United Kingdom,2011-03-10,12.5
569521,22867,HAND WARMER BIRD DESIGN,24,04-10-2011 14:33,2.1,16474.0,United Kingdom,2011-04-10,50.400000000000006
579792,23210,WHITE ROCKING HORSE HAND PAINTED,24,30-11-2011 15:43,1.25,12714.0,France,2011-11-30,30.0
576837,23202,JUMBO BAG VINTAGE LEAF,4,16-11-2011 15:16,4.13,,United Kingdom,2011-11-16,16.52
571883,23270,SET OF 2 CERAMIC PAINTED HEARTS ,5,19-10-2011 13:58,1.45,14704.0,United Kingdom,2011-10-19,7.25
560727,22197,POPCORN HOLDER,12,20-07-2011 14:33,0.85,13571.0,United Kingdom,2011-07-20,10.2
544089,21640,ASSORTED TUTTI FRUTTI  FOB NOTEBOOK,2,15-02-2011 17:51,1.63,,United Kingdom,2011-02-15,3.26
577803,22492,MINI PAINT SET VINTAGE ,1,21-11-2011 17:28,0.65,,United Kingdom,2011-11-21,0.65
544177,85123A,WHITE HANGING HEART T-LIGHT HOLDER,12,16-02-2011 14:27,2.95,13001.0,United Kingdom,2011-02-16,35.400000000000006
575896,23296,SET OF 6 TEA TIME BAKING CASES,8,11-11-2011 14:52,1.25,12480.0,Germany,2011-11-11,10.0
578513,22120,WELCOME  WOODEN BLOCK LETTERS,3,24-11-2011 13:32,9.95,16609.0,United Kingdom,2011-11-24,29.849999999999998
569046,84755,COLOUR GLASS T-LIGHT HOLDER HANGING,16,30-09-2011 10:48,0.65,14422.0,United Kingdom,2011-09-30,10.4
563442,23173,REGENCY TEAPOT ROSES ,2,16-08-2011 13:25,9.95,17637.0,United Kingdom,2011-08-16,19.9
557626,20931,BLUE POT PLANT CANDLE ,12,21-06-2011 14:29,2.95,14175.0,United Kingdom,2011-06-21,35.400000000000006
540415,20914,SET/5 RED RETROSPOT LID GLASS BOWLS,4,07-01-2011 10:47,2.95,16889.0,United Kingdom,2011-07-01,11.8
570690,23370,SET 36 COLOURING PENCILS DOILY,1,11-10-2011 16:37,2.46,,United Kingdom,2011-11-10,2.46
